,query,correct,cot,context
153,What genre does the 'Pendulum' belong to?,rock music," Let's consider the options and check whether or not they are correct. The context talks about a theatre lighting designer (LD) and their job, which involves creating lighting designs for various productions. The context also mentions that a Lighting Designer's job can be diverse, working on rock and pop tours, corporate launches, art installations, and major celebration spectaculars like the Olympic Games opening and closing ceremonies.

From the given options, 'album', 'book', 'comedian', 'comedy', 'cool jazz', 'country rock', 'culture', 'fantasy', 'fusion', 'government', 'groove', 'history', 'jazz','magazine','march','music','musical', 'play', 'ragtime', 'rhythm', 'rock', 'rock and roll', 'rock music', 'roots rock','satire','song','southern rock','swing', 'urban', 'video', 'vietnam war', 'war' are not related to the context.

The context mentions that a Lighting Designer's job can be diverse, working on rock and pop tours, which indicates that 'rock' and 'rock and roll' are related to the context. However, 'rock music' is not mentioned in the context.

Therefore, the correct options are 'rock' and 'rock and roll'. <|end|>"," A theatre lighting designer (LD) collaborates with various creative team members to create the lighting, atmosphere, and time of day for a production. They work closely with the stage manager or show control programming if show control systems are used. The LD's job is to ensure visibility, safety, and cost-effectiveness in their designs.

Outside of stage lighting, a Lighting Designer's job can be diverse, working on rock and pop tours, corporate launches, art installations, and major celebration spectaculars like the Olympic Games opening and closing ceremonies.

A costume designer creates costumes for films, stage productions, or television. They work alongside the director, scenic, lighting designer, sound designer, and other creative personnel. The costume designer collaborates with hair stylists, wig masters, or makeup artists to create characters and balance scenes with texture and color.

In European theatre, the theatre designer usually designs both costume and scenic elements. Costume reflects an individual or group's class, gender, profession, ethnicity, nationality, activity, or epoch.

Robert Edmond ""Bobby"" Jones (1887-1954) was an American scenic, lighting, and costume designer credited with incorporating new stagecraft into American drama. His designs sought to integrate scenic elements into the storytelling, using bold vivid colors and simple yet dramatic lighting.

A film, also called a movie, motion picture, theatrical film, or photoplay, is a series of still images shown on a screen to create the illusion of moving images due to the phi phenomenon. The process of filmmaking is both an art and an industry, created by photographing actual scenes with a motion picture camera, photographing drawings or miniature models using traditional animation techniques, or using CGI and computer animation. "
154,In which year was the Toynbee Convector published?,1988," Let's consider the options and check whether or not they are correct. The context provided does not mention anything about the Toynbee Convector, so we cannot find any direct information about its publication year. However, we can eliminate the options that are clearly unrelated to the context. The context discusses Mesopotamia, monasticism, and religious structures, which are not related to the Toynbee Convector.

The remaining options are '1', '13', '14', '1886', '1888', '1889', '1890', '1896', '1905', '1924', '1926', '1931', '1937', '1941', '1953', '1957', '1982', '1984', '1988', '20', '2012', '22', '24', '9','march 1923', 'november 1924'. Since the context does not provide any information about the Toynbee Convector, we cannot determine the correct publication year from the given options. <|end|>"," The Tigris and Euphrates rivers, which define Mesopotamia, flow through Iraq and into the Persian Gulf. Mesopotamia, corresponding to modern-day Iraq, Syria, and parts of Turkey, Iran, and Saudi Arabia, is known for its rich history and the birthplace of monasticism in Asia. The first cenobitic monastery in Mesopotamia was founded by Mar Awgin in the 4th century AD.

Monasteries are buildings or complexes where monks or nuns live and work. Monks are individuals who dedicate their lives to religious asceticism, either alone or with others. Nuns are women who live in religious communities, typically under vows of poverty, chastity, and obedience.

Temples are structures reserved for religious or spiritual rituals and activities, such as prayer and sacrifice. They are used in various faiths, including Hinduism, Buddhism, and Jainism.

Iraq, officially known as the Republic of Iraq, is a country in Western Asia, bordered by Turkey, Iran, Kuwait, Saudi Arabia, Jordan, and Syria. The capital city is Baghdad, and the main ethnic groups are Arabs and Kurds. Around 95% of the country's citizens are Muslims, with Christianity, Yarsan, Yezidism, and Mandeanism also present. Arabic and Kurdish are the official languages of Iraq. "
155,What genre does the North Shore belong to?,drama film," Let's consider the options and check whether or not they are correct. The context provided discusses the Federation of Australia, HMAS Kurumba, and the Royal Australian Navy (RAN). None of these topics directly relate to the genres listed. However, the mention of the RAN and the ADF suggests a military or historical context. Among the options, 'history' and 'drama film' could potentially be related to the context. 'Drama film' might be a stretch, but 'history' seems more relevant to the Federation of Australia and the RAN. Therefore, the correct option is 'history'. <|end|>"," The Federation of Australia was the process by which the six British self-governing colonies of Queensland, New South Wales, Victoria, Tasmania, South Australia, and Western Australia agreed to unite and form the Commonwealth of Australia, establishing a system of federalism. Fiji and New Zealand were originally part of this process, but they decided not to join the federation. When the Constitution of Australia came into force on 1 January 1901, the colonies collectively became states of the Commonwealth of Australia.

HMAS Kurumba was an oil tanker operated by the Royal Australian Navy (RAN) from 1919 to 1946. Built by Swan Hunter & Wigham Richardson in 1916, Kurumba served in the Royal Navy's Royal Fleet Auxiliary during World War I and was transferred to the Royal Australian Fleet Auxiliary in 1919. She operated in Australian and South-East Asia waters until being paid off to reserve in 1928. Reactivated in 1939, Kurumba served in World War II, operating in Australian waters and the South-West Pacific Area. After the war, she was sold to Artemis Maritime Co Inc in 1948 and renamed Angeliki. In 1955, she was sold to Pappas Eleftheriades and renamed Evangelos. She was broken up in 1966.

Oil tankers are merchant ships designed for the bulk transport of oil. There are two basic types: crude tankers, which move large quantities of unrefined crude oil, and product tankers, which transport refined products. The Royal Australian Navy (RAN) is the naval branch of the Australian Defence Force (ADF), consisting of the RAN, Australian Army, Royal Australian Air Force (RAAF), and several 'tri-service' units. The ADF has a strength of just over 80,000 full-time personnel and active reservists, supported by the Department of Defence and several civilian agencies. "
156,What is the instance of Umjammer Lammy?,album," Let's consider the options and check whether or not they are correct. The context mentions the Carmelites, Franciscans, and Capuchin friars as significant orders of friars within the Catholic Church. The term ""charism"" refers to the unique contribution of each religious order, which in the case of the Carmelites, Franciscans, and Capuchin friars, is defined by the teachings and spiritual disciplines of their founders.

Now, let's analyze the options:

1. Abbreviation: No mention of abbreviations in the context.
2. Album: No mention of albums in the context.
3. Animal: No mention of animals in the context.
4. April: No mention of April in the context.
5. Art: No mention of art in the context.
6. Band: No mention of bands in the context.
7. College: No mention of colleges in the context.
8. Computer: No mention of computers in the context.
9. Corporation: No mention of corporations in the context.
10. December: No mention of December in the context.
11. Electronic game: No mention of electronic games in the context.
12. Electronics: No mention of electronics in the context.
13. England: No mention of England in the context.
14. Entertainment: No mention of entertainment in the context.
15. Exchange: No mention of exchange in the context.
16. Four: No mention of four in the context.
17. Game: No mention of games in the context.
18. Home: No mention of home in the context.
19. Instrument: No mention of instruments in the context.
20. Interface: No mention of interface in the context.
21. International relations: No mention of international relations in the context.
22. March: No mention of March in the context.
23. Mixture: No mention of mixture in the context.
24. Monitor: No mention of monitor in the context.
25. Motion: No mention of motion in the context.
26. Music: No mention of music in the context.
27. Musical: No mention of musical in the context.
28. Musical"," The Order of the Brothers of the Blessed Virgin Mary of Mount Carmel, commonly known as Carmelites, is a Roman Catholic religious order founded in the 12th century on Mount Carmel in the Crusader States. The Carmelites are one of the significant orders of friars, alongside the Dominicans, Franciscans, Augustinians, and Carmelites. The term ""charism"" refers to the unique contribution of each religious order, which in the case of the Carmelites, is defined by the teachings and spiritual disciplines of their founder, Augustine of Hippo.

The Franciscan Order, founded in 1209 by Francis of Assisi, is another prominent group of mendicant religious orders within the Catholic Church. The Franciscan Order includes the Order of Friars Minor, the Order of Saint Clare, and the Third Order of Saint Francis. These orders follow the teachings and spiritual disciplines of their founder and his main associates and followers, such as Clare of Assisi, Anthony of Padua, and Elizabeth of Hungary.

Felix of Cantalice, born in 1515 in Italy, was the first Capuchin friar to be canonized as a saint by Pope Clement XI in 1712. The Capuchin friars are a branch of the Franciscan Order, and their charism is based on the teachings and spiritual disciplines of their founder, Saint Francis of Assisi.

In summary, the Carmelites, Franciscans, and Capuchin friars are all significant orders of friars within the Catholic Church, each with their unique charism and spiritual disciplines. These orders have been influential in shaping the religious landscape of the Church and continue to play a vital role in the lives of their members and the communities they serve. "
157,What instrument is Greg Graffin known for playing?,guitar," Let's consider the options and check whether or not they are correct. The context provided does not mention anything about Greg Graffin or his musical career. Therefore, we cannot determine the correct answer based on the given context.

However, Greg Graffin is a well-known musician, specifically a singer and songwriter. He is the lead vocalist and lyricist for the punk rock band Bad Religion. So, the correct answer would be'singing'. <|end|>"," Albert Pierrepoint, a notorious hangman in England, executed at least 400 people, including war criminals William Joyce and John Amery. In post-war Germany, Pierrepoint carried out executions for war crimes at the Hamburg Ravensbrück Trials, where 21 women were among the defendants. Elisabeth Marschall, the Head Nurse at Ravensbrück, was found guilty and executed by Pierrepoint on May 3, 1947, making her the oldest female Nazi to be executed.

Germany, officially the Federal Republic of Germany, is a federal parliamentary republic in central-western Europe with a population of about 82 million people. It is the second most popular immigration destination in the world. Hamburg, the second largest city in Germany, is situated on the river Elbe and is the eighth largest city in the European Union.

Hamelin, a town on the river Weser in Lower Saxony, is best known for the tale of the Pied Piper of Hamelin. World War II, also known as the Second World War, was a global war that lasted from 1939 to 1945 and involved the vast majority of the world's nations. It was the most widespread war in history, directly involving more than 100 million people from over 30 countries. The war resulted in an estimated 50 million to 85 million fatalities, making it the deadliest conflict in human history. "
158,In which language was King Solomon's Mines originally written?,english," Let's consider the options and check whether or not they are correct. The context provided does not mention anything about King Solomon's Mines, nor does it provide any information about the language in which it was originally written. Therefore, we cannot determine the correct answer based on the given context.

However, King Solomon's Mines is a fictional story written by H. Rider Haggard. The original novel was written in English, and the story was later adapted into various films and television series. So, based on the information about the author and the original language of the novel, the correct option is 'english'. <|end|>"," Ali Baba Goes to Town is a 1937 film starring Eddie Cantor, Tony Martin, and Roland Young. The film is a spoof of Roosevelt's New Deal, with Cantor playing a hobo named Aloysius ""Al"" Babson who dreams of being an advisor to the Sultan in Baghdad. In his dream, Al organizes work programs, taxes the rich, and abolishes the army. The film also features Gypsy Rose Lee as the Sultana and the Raymond Scott Quintette performing ""Twilight In Turkey."" A clip from the film is shown in The Day of the Locust (1975), with Karen Black playing an aspiring actress in 1930s Hollywood.

Cairo, the capital of Egypt, is the largest city in the Middle East and the Arab world. Founded in 969 CE, it is a center of political and cultural life, known for its Islamic architecture. Iran, officially the Islamic Republic of Iran, is a sovereign state in Western Asia, bordered by Armenia, Azerbaijan, Turkmenistan, Afghanistan, Pakistan, and the Persian Gulf and the Gulf of Oman. Tehran is the country's capital and largest city, while Baghdad is the capital of Iraq and the second-largest city in the Arab world.

The Arab world consists of 22 Arabic-speaking countries, occupying an area from the Atlantic Ocean to the Arabian Sea and from the Mediterranean Sea to the Horn of Africa. The contemporary Arab world has a combined population of around 422 million people, over half of whom are under 25 years of age. Eddie Cantor was an American performer, comedian, dancer, singer, actor, and songwriter, known for his top-rated radio shows and hits like ""Makin' Whoopee"" and ""Ida."" Roland Young was an English actor known for his roles in theater and film. "
159,What genre does the phrase 'hold back the dawn' belong to?,drama film," Let's consider the options and check whether or not they are correct. The context provided discusses the careers of Flavio Briatore and Bernie Ecclestone in the world of Formula One racing. The phrase 'hold back the dawn' does not directly relate to any of the given options. However, it is a metaphorical expression often used in literature and storytelling to describe a situation where someone is preventing a significant change or event from happening.

Given the context, the most appropriate genre for the phrase 'hold back the dawn' would be 'literature', as it is a common metaphor used in various literary works. None of the other options seem to fit the context of the phrase. Therefore, the correct option is 'literature'. <|end|>"," Flavio Briatore, an Italian businessman, began his career as a restaurant manager and insurance salesman in Italy. He faced several fraud charges in the 1980s, but these convictions were later annulled by an amnesty. Briatore then established successful Benetton franchises while on the run in the Virgin Islands and the United States. In 1990, he was appointed manager of the Benetton Formula One racing team, which later became Renault F1 in 2002.

Briatore was part-owner and chairman of London's Queens Park Rangers F.C. from 2007 to 2010. However, he was forced to resign from the ING Renault F1 team in 2009 due to his involvement in race fixing at the 2008 Singapore Grand Prix. The Fédération Internationale de l'Automobile (FIA) conducted its own investigation, resulting in Briatore's indefinite ban from any events sanctioned by the FIA. This ban was later overturned by a French Tribunal de Grande Instance.

The GP2 Series, introduced in 2005, is a form of open wheel motor racing that replaced the long-term Formula 3000 feeder series. The series was conceived by Bernie Ecclestone and Flavio Briatore, with Ecclestone also owning the rights to the name GP1. In 2010, the GP3 Series class was launched as a feeder class for the GP2 series.

Bernie Ecclestone, a British business magnate, served as the chief executive of the Formula One Group, which manages Formula One and controls the commercial rights to the sport. He also part-owns Delta Topco, the ultimate parent company of the Formula One Group. Ecclestone is considered an authoritative voice in Formula One racing and is often described as ""F1 Supremo"" in tabloid journalism.

Davide Valsecchi, an Italian racing driver, won the 2012 GP2 Series championship. "
160,In which administrative territorial entity is the city of Tkuma located?,southern district," Let's consider the options and check whether or not they are correct. The context does not mention any specific administrative territorial entity for the city of Tkuma. However, Tkuma is a city in Israel, which is located in the Southern District of the country. Therefore, the correct option is'southern district'. <|end|>"," The ""Mario"" franchise, created by Nintendo, is the best-selling video game series of all time, with over 210 million units sold. The franchise began with the ""Super Mario"" platform series, which follows Mario's adventures in the Mushroom Kingdom. The series has since expanded into various genres, including racing with the ""Mario Kart"" series, sports with ""Mario Tennis"" and ""Mario Golf"", role-playing games like ""Super Mario RPG"" and ""Paper Mario"", and educational games such as ""Mario Is Missing!"" and ""Mario's Time Machine"".

The ""Super Mario"" series has been developed by various studios, with Hudson Soft and Nd Cube being notable contributors. The series has been released on multiple platforms, including the NES, GameCube, Wii, and Nintendo 3DS. The latest installment, ""Super Mario 3D World"", was released in 2013 for the Wii U.

The ""Mario"" franchise has also expanded into other mediums, including television shows, films, comics, and merchandise. The character Mario has been voiced by Charles Martinet since 1995.

In addition to the ""Super Mario"" series, the ""Mario"" franchise has also produced other successful games, such as ""Mario Kart"" and ""Mario Tennis"". The ""Mario Kart"" series has sold over 100 million copies worldwide, while the ""Mario Tennis"" series has been well-received by fans.

Overall, the ""Mario"" franchise has had a significant impact on the video game industry, with its innovative gameplay, memorable characters, and enduring popularity. "
161,In which year did the 'Affairs of the Heart' television series air?,television series," Let's consider the options and check whether or not they are correct. The context does not mention anything about a television series called 'Affairs of the Heart'. Therefore, we can eliminate all the options that are not related to a television series. The remaining options are 'television', 'television series', and 'three'. Since 'three' is not a valid option for the year, we can eliminate it. Now we are left with 'television' and 'television series'. Both of these options are related to the medium of the series, not the year it aired.

To find the correct answer, we need to look for the year the 'Affairs of the Heart' television series aired. The series aired in 1980. Therefore, the correct option is '1980'. <|end|>"," The Northwest Territories (NWT) is a Canadian territory located in Northern Canada, with a land area of approximately and a population of 44,291 as of 2016. Yellowknife, the only city and capital of the NWT, is situated on the northern shore of Great Slave Lake and is home to a diverse population speaking five of the eleven official languages of the territory.

The NWT was once known as the 'Copper Indians' or 'Yellowknife Indians', and the city was named after the local Dene tribe. The territory's history is marked by the leadership of Gordon Robertson, who served as Commissioner of the NWT from 1953 to 1963 and later held top positions in the Canadian public service.

The NWT is home to several indigenous languages, including Inuktitut and Inuinnaqtun, which are recognized as official languages in the territory. Inuktitut, also known as Eastern Canadian Inuktitut or Eastern Canadian Inuit, is spoken in all areas north of the tree line, including parts of Quebec, Newfoundland and Labrador, and northeastern Manitoba. Inuinnaqtun, a dialect of Inuktitut, is spoken in the NWT and Nunavut.

The NWT's diverse population and rich history make it a unique and important part of Canada's northern landscape. "
162,What is the instance of Moor End?,village," Let's consider the options and check whether or not they are correct. The context mentions Southern California, which is a region encompassing California's southernmost counties. It also mentions San Diego, a major city in California located in San Diego County on the Pacific Ocean coast in Southern California. Therefore, 'location' seems to be the most relevant option.

The context does not mention any specific instance of Moor End, but it does mention a couple of places: Southern California and San Diego. Since Moor End is a village in England, none of the options provided in the context are directly related to Moor End. However, if we consider the context as a general discussion about geographical regions, 'location' would still be the most relevant option.

In conclusion, the correct option for the question ""What is the instance of Moor End?"" is 'location', as it is the most relevant option given the context provided. <|end|>"," Southern California, often referred to as SoCal, is a region encompassing California's southernmost counties. Traditionally, it includes eight counties: Imperial, Los Angeles, Orange, Riverside, San Bernardino, San Diego, Santa Barbara, and Ventura. However, a broader definition includes Kern and San Luis Obispo counties, based on historical political divisions. Southern California is a significant economic hub for California and the United States.

LolliLove is a mockumentary co-written by and starring Jenna Fischer. The film follows a misguided couple from Southern California who attempt to make a difference in the lives of the homeless by giving them lollipops with a cheerful slogan on the wrapper. Lollipops are a type of confectionery consisting of hard candy or water-ice mounted on a stick, intended for sucking or licking. They come in various flavors and shapes.

Confectionery, also known as sweets or candy, is divided into two categories: bakers' confections and sugar confections. San Diego, a major city in California, is located in San Diego County on the Pacific Ocean coast in Southern California. It is approximately south of Los Angeles and adjacent to the Mexico border. "
