,query,correct,cot,synthesis,context
246,In which location did Eddy Chandler pass away?,los angeles," The context provided does not contain any information about Eddy Chandler's death location. The context is focused on Ullevi Stadium, IFK Göteborg, and Gothenburg, Sweden. Therefore, none of the options given are correct based on the context provided. <|end|>",not clear given the context," Ullevi Stadium, also known as Nya Ullevi, is a versatile multi-purpose stadium located in Gothenburg, Sweden. Originally constructed for the 1958 FIFA World Cup, Ullevi has since hosted numerous significant sporting events, including the World Allround Speed Skating Championships, the 1995 World Championships in Athletics, and the 2006 European Athletics Championships. The stadium has also been the venue for the UEFA Cup Winners' Cup finals in 1983 and 1990, the UEFA Euro 1992 final, and the UEFA Cup final in 2004.

IFK Göteborg, a prominent Swedish football club, has played its home games at Ullevi since 2009. The club, founded in 1904, is the only Nordic country club to have won a pan-European competition, with victories in the UEFA Cup in 1982 and 1987. The club's colors, blue and white, are shared with the sports society Idrottsföreningen Kamraterna (IFK), from which the club originated.

Magnus Johansson, a former footballer for IFK Göteborg, Brann, and Västra Frölunda, is a notable figure in the club's history.

The new Gamla Ullevi Stadium, which opened in 2009, replaced the city's previous main football stadium. The construction of the new stadium was met with controversy due to its cost, the perceived low standard of the finished stadium, and the name of the stadium.

Gothenburg, the second-largest city in Sweden and the fifth-largest in the Nordic countries, is home to the new Ullevi Stadium. With a population of approximately 550,000 in the urban area and 990,000 inhabitants in the metropolitan area, Gothenburg is a vibrant city located on the west coast of Sweden by the Kattegat. "
247,In which administrative territorial entity is Tuse Church located?,holbæk municipality," The context provided does not contain any information about Tuse Church's location. However, based on general knowledge, Tuse Church is located in Holbæk Municipality, Denmark. Therefore, the correct option is 'holbæk municipality'. <|end|>",holbæk municipality," A boat is a watercraft designed for various purposes on water, ranging from small vessels on inland waterways to large ships on the open sea. Boats are distinguished from ships based on size, shape, and cargo or passenger capacity. Aircraft, on the other hand, are machines that fly by gaining support from the air, using static lift or dynamic lift from airfoils or jet engines. Aircraft carriers are warships that serve as seagoing airbases, equipped with facilities for deploying and recovering aircraft. Naval warfare involves combat in and on the sea, ocean, or other major bodies of water. A propeller is a type of fan that transmits power by converting rotational motion into thrust, while a pressure difference is produced between the forward and rear surfaces of the airfoil-shaped blade. Marine propellers, also known as screw propellers, are characterized by their high propulsive efficiency and ability to throw thrust in any direction at any time. Steamboats are boats propelled primarily by steam power, using either propellers or paddlewheels. The United States Armed Forces consist of the Army, Marine Corps, Navy, Air Force, and Coast Guard, with the President of the United States as the military's overall head. The National Security Act of 1947 created the modern U.S. military framework, merging the Department of War and the Department of the Navy into the National Military Establishment, headed by the Secretary of Defense. The United States has seven federal uniformed services that commission officers as defined by Title 10 of the United States Code. A reserve fleet is a collection of naval vessels that are fully equipped for service but not currently needed, and thus partially or fully decommissioned. Steamships are ocean-faring vessels propelled by steam engines that typically drive propellers or paddlewheels. The United States Navy is the naval warfare service branch of the United States Armed Forces, with the largest combined battle fleet tonnage in the world. The U.S. Navy has the world's largest aircraft carrier fleet and more than 3,700 aircraft in active service. The third USS Vixen was a steamboat in the United States Navy during the Mexican-American War. "
248,What is the record label associated with 'Chasing Time: The Bedlam Sessions'?,warner music group," The context provided does not contain any information about the record label associated with 'Chasing Time: The Bedlam Sessions'. However, based on external knowledge, 'Chasing Time: The Bedlam Sessions' is an album by the British band Editors. The record label associated with this album is 'Kitchenware Records'. None of the options provided in the context match this information. <|end|>",not clear given the context," Johns Hopkins University, founded in 1876 by philanthropist Johns Hopkins, is an American private research university in Baltimore, Maryland. It was the first research university in the United States, integrating teaching and research. The university's first president, Daniel Coit Gilman, revolutionized higher education in the U.S. by adopting the concept of a graduate school from Germany's Heidelberg University.

John Auer, an American physiologist and pharmacologist, was a graduate of Johns Hopkins School of Medicine and worked closely with physiologist Samuel James Meltzer at the Rockefeller Institute for Medical Research. Auer is known for his research on the correlation between bronchial asthma and foreign substances, the effects of magnesium on tetany, and the first account of allergic inflammations caused by exposure to xylene, known as Auer's phenomena.

The Johns Hopkins University School of Medicine, located in Baltimore, Maryland, is the academic medical teaching and research arm of Johns Hopkins University. It has consistently been among the nation's top medical schools in the number of research grants awarded by the National Institutes of Health. The school's major teaching hospital, the Johns Hopkins Hospital, was ranked the #1 hospital in the United States for 22 years by ""U.S. News & World Report"". The hospital and school are the founding institutions of modern American medicine and the birthplace of numerous medical traditions, including rounds, residents, housestaff, neurosurgery, cardiac surgery, pediatrics, and child psychiatry.

Lake Ontario, one of the five Great Lakes of North America, is surrounded by the Canadian province of Ontario and the American state of New York. The lake's primary inlet is the Niagara River from Lake Erie, and its outlet to the Atlantic Ocean via the St. Lawrence River. The lake was named for the Huron (Wyandot) language word ""ontarío,"" meaning Lake of Shining Waters. "
249,Which political party was Franz Pfeffer von Salomon a member of?,sturmabteilung," The context provided does not contain any information about Franz Pfeffer von Salomon or his political affiliations. The context is focused on the Xbox 360, Microsoft, and the consumer electronics industry. To answer the question, we need to look outside the context provided.

Franz Pfeffer von Salomon was a member of the National Socialist German Workers' Party (NSDAP), commonly known as the Nazi Party. He was appointed as the leader of the Sturmabteilung (SA), the Nazi Party's paramilitary organization, in 1930.

Therefore, the correct option is 'the national'. <|end|>",the national," The Xbox 360, developed by Microsoft, is a home video game console that succeeded the original Xbox. Released in 2005, it competed with Sony's PlayStation 3 and Nintendo's Wii during the seventh generation of video game consoles. The Xbox 360 was unveiled on MTV and later detailed at E3.

Microsoft Studios, a subsidiary of Microsoft, is responsible for the development and publishing of games for the Xbox, Xbox 360, Xbox One, and other platforms. The studio was established in 2002 and has developed several popular games, including the Fable series and the Xbox 360 game Fable II.

Fable II is an action role-playing open world video game developed by Lionhead Studios and published by Microsoft Game Studios for Xbox 360. It is the sequel to Fable and Fable: The Lost Chapters, and was released in October 2008. The game takes place in the fictional land of Albion, five hundred years after the original Fable's setting. Players can choose to be either male or female and explore a colonial era resembling the time of highwaymen or the Enlightenment.

The Xbox 360 and Fable II are part of the broader consumer electronics industry, which includes devices used for entertainment, communications, and home-office activities. Microsoft, a major player in this industry, also produces the Windows operating system, which is used in various consumer electronics devices.

In addition to gaming, Microsoft is involved in other sectors of the consumer electronics industry, such as professional audio and medical business. The company's subsidiary, Sony Corporation, is another major player in the industry, with business operations in electronics, motion pictures, music, and financial services.

Overall, the Xbox 360 and Fable II are part of the larger consumer electronics industry, which encompasses various sectors and companies, including Microsoft and Sony. "
250,What is the parent taxon of Acanthopelma?,theraphosidae," To determine the parent taxon of Acanthopelma, we need to analyze the given options and identify which one is a taxonomic rank that encompasses Acanthopelma. The context provided does not directly relate to taxonomy or biology, so we must rely on our knowledge of the subject.

Acanthopelma is a genus of tarantulas, which are a type of spider. The parent taxon of Acanthopelma would be the family that includes this genus. Among the given options, 'theraphosidae' is the only one that represents a taxonomic rank, specifically a family. The Theraphosidae family is commonly known as the family of tarantulas.

Therefore, the correct option is 'theraphosidae'. <|end|>",theraphosidae," Magdala, an ancient city in Galilee, is mentioned in the Jewish Talmud and the Christian New Testament. The New Testament, a significant part of Christian scripture, discusses Jesus' teachings and his relationship with Mary Magdalene. The Old Testament, the first section of the Christian Bible, is based on the Hebrew Bible and varies in canon among different Christian Churches.

Mary Magdalene, a key figure in Christianity, is said to have been a follower of Jesus and witnessed his crucifixion and resurrection. She is mentioned at least 12 times in the four Gospels, more than most of the apostles.

Music, an art form and cultural activity, uses sound and silence, and its common elements include pitch, rhythm, dynamics, and timbre. It can be performed with various instruments and vocal techniques, and its definition varies among ancient Greek and Indian philosophers.

Vivian Stanshall, an English musician, songwriter, and author, is best known for his work with the Bonzo Dog Doo-Dah Band and his exploration of the British upper classes in ""Sir Henry at Rawlinson End."" He was also the widow of Ki Longfellow, an American novelist and playwright known for her novel ""The Secret Magdalene."" Longfellow's work explores the divine feminine and challenges traditional views of events chronicled in the New Testament. "
251,What is the parent taxon of the eastern olivaceous warbler?,hippolais," The context provided does not contain any information about the eastern olivaceous warbler or its parent taxon. To answer the question, we need to rely on external knowledge. The eastern olivaceous warbler (Iduna pallida) is a small passerine bird. The parent taxon of the eastern olivaceous warbler is the family Acrocephalidae. Therefore, the correct option is 'acrocephalidae'. <|end|>",acrocephalidae," Laurie Anderson, an American avant-garde artist, composer, musician, and film director, has been a prominent figure in the art world since the 1970s. Initially trained in violin and sculpting, Anderson's work has spanned performance art, pop music, and multimedia projects. She gained widespread recognition in 1981 when her single ""O Superman"" reached number two on the UK pop charts. Anderson also starred in and directed the 1986 concert film ""Home of the Brave.""

The avant-garde, characterized by nontraditional, aesthetic innovation, and initial unacceptability, often offers a critique of the relationship between producer and consumer. Karen Bernstein, a Canadian voice actress, is best known for voicing Sailor Mercury in the American dubbing of the first two seasons of ""Sailor Moon."" The manga series was adapted into an anime series, which was broadcast in Japan from 1992 to 1997 and has since been licensed for English language release in North America and Australia/New Zealand.

""Atomic Ed and the Black Hole"" is a documentary released in 2001 by filmmaker Ellen Spiro. The documentary, produced for HBO's Cinemax Reel Life Series, features Laurie Anderson's song ""Big Science"" in its soundtrack. The film follows Ed Grothus, a machinist turned atomic junk collector, who has amassed a collection of non-radioactive high-tech nuclear waste discarded from the Los Alamos National Laboratory. His collection reveals and preserves the history of government waste that was literally thrown in a trash heap.

Performance art, a form of fine art, involves presenting a performance to an audience within a fine art context. It can be scripted or unscripted, random or carefully planned, and may involve audience participation. Performance art can take place anywhere, in any venue or setting, and can last for any length of time. The actions of an individual or group at a particular place and time constitute the work. "
252,What is the 'black box' in the context of the given options?,sony music australia," The context provided does not mention or imply anything about a 'black box.' However, considering the given options, we can deduce that the 'black box' is most likely related to the music industry. Among the options,'record' and 'label' are the most relevant to the music industry. A 'black box' in the music industry context could refer to a record label or a record company.

A record label is a brand or trademark associated with the marketing of music recordings and music videos. A record company is a company that is in the business of marketing music videos and recordings. The term 'black box' could be used metaphorically to describe the mysterious or secretive nature of the inner workings of a record label or company.

Given the context and the options, the most appropriate answer would be'record' or 'label.' However, without more specific information, it is difficult to determine which of the two options is the correct answer. <|end|>",record," The United Kingdom (UK), comprising England, Scotland, Wales, and Northern Ireland, is a sovereign country in Western Europe with a population of 65.1 million and an area of 242,422 square kilometers. The UK has a rich history, with London being a major settlement for over two millennia and the capital of England and the UK. The country has a diverse geography, including the White Cliffs of Dover, the English Channel, and the Celtic Sea. The UK's coastline is the 12th longest in the world, and it has a significant maritime history, with major ports like Southampton and Dover. The UK is also a member of the European Union, which has developed a single market and common policies on various sectors. The UK's political structure includes the Mayor of London and the London Assembly, which scrutinizes the Mayor's activities and has the power to amend the annual budget and reject draft strategies. The UK's ceremonial counties include Middlesex, Hertfordshire, and Surrey, with county towns like Maidstone and Winchester. The UK's technology sector includes products like the AirPort Extreme, a wireless router and NAS from Apple Inc. The UK's maritime history includes the Port of Dover, the world's busiest passenger port, and the Strait of Dover, the narrowest part of the English Channel. The UK's culture includes historic sites like Canterbury Cathedral and the White Cliffs of Dover. "
253,What type of item is a 'list of case closed volumes'?,book," The context provided does not directly address the question about the 'list of case closed volumes.' However, we can infer the most likely answer by analyzing the given options and their relevance to the context.

The context discusses various aspects of music, including the violin, Americana, and Bruce Springsteen. It also mentions the Rock and Roll Hall of Fame and Museum. None of these topics directly relate to a 'list of case closed volumes.'

Now, let's examine the options:

1. 'Book' - A 'list of case closed volumes' could be a book, as it is a collection of information or stories.
2. 'Manga' - Manga is a style of Japanese comic books and graphic novels. The context does not mention anything related to manga.
3. 'Term' - A 'list of case closed volumes' could be a term used in a specific field or context, but the context does not provide any information to support this.
4. 'Word' - A 'list of case closed volumes' is not a single word, so this option is not correct.

Based on the options and the context, the most likely answer is 'book,' as it is the only option that could reasonably encompass a 'list of case closed volumes.' <|end|>",book," The violin, a small and high-pitched instrument in the violin family, is a versatile and significant instrument in various musical genres. It typically has four strings tuned in perfect fifths and is played by drawing a bow across its strings or plucking them with the fingers. The violin is prominent in Western classical music, folk music, country music, bluegrass music, and jazz. It has also been incorporated into non-Western music cultures, such as Indian and Iranian music.

Soozie Tyrell, born on May 4, 1957, is an American violinist and vocalist, best known for her work with Bruce Springsteen in the E Street Band and The Sessions Band. The Sessions Band, an American musical group, has recorded and toured with Springsteen since 1997.

Americana refers to artifacts related to the history, geography, folklore, and cultural heritage of the United States. It encompasses a wide range of materials, including paintings, license plates, household objects, flags, and statues. The term is often used to describe the theme of a museum or collection, or goods for sale.

Bruce Springsteen, born on September 23, 1949, is an American singer-songwriter and the lead member of the E Street Band. Nicknamed ""The Boss,"" Springsteen is known for his poetic lyrics, working-class and sometimes political sentiments, and lengthy and energetic stage performances. He was inducted into the Rock and Roll Hall of Fame in 2014.

The Rock and Roll Hall of Fame and Museum, located in downtown Cleveland, Ohio, was established in 1983 to recognize and archive the history of the best-known and most influential artists, producers, engineers, and other notable figures in rock and roll. Since opening in 1995, the museum has hosted more than 10 million visitors and had a cumulative economic impact estimated at more than $1.8 billion. The E Street Band, Springsteen's primary backing band since 1972, was inducted into the Rock and Roll Hall of Fame in 2014. "
254,What is the instance of a'schoolgirl'?,song," Let's analyze the options and the context to find the correct instance of a'schoolgirl'. The context provided discusses the American rock band Green River, their debut album ""Rehab Doll,"" and the Seattle music scene. None of the options directly relate to a'schoolgirl'. However, we can infer that the context is about the music industry, specifically the grunge movement.

Since none of the options are relevant to the context, we can conclude that the question is not applicable to the given context. <|end|>",not clear given the context," Green River, an American rock band from Seattle, Washington, released their debut studio album ""Rehab Doll"" in June 1988 through Sub Pop Records. The album, which is considered the first grunge record, features the song ""Swallow My Pride,"" written by frontman Mark Arm and guitarist Steve Turner. The song was originally recorded for the band's debut EP ""Come on Down"" in 1985.

The Pacific Ocean, the largest oceanic division, is bounded by the Arctic Ocean in the north, the Southern Ocean in the south, and the continents of Asia and Australia in the west, and the Americas in the east. Seattle, a seaport city in King County, Washington, is situated on an isthmus between Puget Sound and Lake Washington, and is the largest city in the Pacific Northwest region of North America.

Homestead Records, a Long Island, New York-based sublabel of Dutch East India Trading, played a significant role in launching the post-hardcore and noise rock genres. The label was founded in 1984 by Sam Berger, who recommended Gerard Cosloy to take over the label after he left to work with Midnight Records. Cosloy signed many notable acts, including Green River.

Sub Pop Records, founded by Bruce Pavitt in 1986, gained fame in the late 1980s for signing Nirvana, Soundgarden, Mudhoney, and other bands from the Seattle alternative rock scene. The label's last release was Ivo Perelman's ""Cama de terra"" in 1996.

In summary, Green River's ""Rehab Doll"" album, released in 1988, is considered the first grunge record, featuring the song ""Swallow My Pride."" The album was released through Sub Pop Records, a label that played a significant role in launching the grunge movement. Seattle, the city where Green River originated, is a major gateway for trade with Asia and is the largest city in the Pacific Northwest region of North America. "
255,What sport does the Harlequin Ladies Football Club participate in?,rugby union team," The context provided does not contain any information about the Harlequin Ladies Football Club or the sport they participate in. The context is focused on the history and development of the Bowater company and its subsequent businesses. Therefore, based on the given context, we cannot determine the sport that the Harlequin Ladies Football Club participates in. <|end|>",not clear given the context," William Vansittart Bowater (15 March 1838 – 28 April 1907) was a British entrepreneur who founded Bowater, a company that grew to become one of the world's largest producers of newspaper print. Today, Bowater has been divided into various market-leading paper-based products businesses, including Rexam, a British-based American-owned multinational consumer packaging company. Rexam, headquartered in London, is a leading manufacturer of beverage cans with 55 plants in over 20 countries across Asia, Europe, North America, and South America.

In June 2016, Rexam was acquired by the American company Ball Corporation, which is best known for its early production of glass jars, lids, and related products used for home canning. Founded in Buffalo, New York, in 1880 as the Wooden Jacket Can Company, the Ball Corporation has expanded and diversified into other business ventures, including aerospace technology, and became the world's largest manufacturer of recyclable metal beverage and food containers.

Bowater's post-World War II expansion and a 30-year period of consolidation led to the formation of a number of globally leading worldwide paper products companies. These companies continue to build on the legacy of William Vansittart Bowater and his pioneering work in the pulp and paper industry. "
