,query,correct,cot,synthesis,context
158,In which language was King Solomon's Mines originally written?,english," The context provided does not contain any information about King Solomon's Mines or the language in which it was originally written. However, we can use external knowledge to answer the question. King Solomon's Mines is a novel written by H. Rider Haggard, an English author. Therefore, the correct option is 'english'. <|end|>",english," Ali Baba Goes to Town is a 1937 film starring Eddie Cantor, Tony Martin, and Roland Young. The film is a spoof of Roosevelt's New Deal, with Cantor playing a hobo named Aloysius ""Al"" Babson who dreams of being an advisor to the Sultan in Baghdad. In his dream, Al organizes work programs, taxes the rich, and abolishes the army. The film also features Gypsy Rose Lee as the Sultana and the Raymond Scott Quintette performing ""Twilight In Turkey."" A clip from the film is shown in The Day of the Locust (1975), with Karen Black playing an aspiring actress in 1930s Hollywood.

Cairo, the capital of Egypt, is the largest city in the Middle East and the Arab world. Founded in 969 CE, it is a center of political and cultural life, known for its Islamic architecture. Iran, officially the Islamic Republic of Iran, is a sovereign state in Western Asia, bordered by Armenia, Azerbaijan, Turkmenistan, Afghanistan, Pakistan, and the Persian Gulf and the Gulf of Oman. Tehran is the country's capital and largest city, while Baghdad is the capital of Iraq and the second-largest city in the Arab world.

The Arab world consists of 22 Arabic-speaking countries, occupying an area from the Atlantic Ocean to the Arabian Sea and from the Mediterranean Sea to the Horn of Africa. The contemporary Arab world has a combined population of around 422 million people, over half of whom are under 25 years of age. Eddie Cantor was an American performer, comedian, dancer, singer, actor, and songwriter, known for his top-rated radio shows and hits like ""Makin' Whoopee"" and ""Ida."" Roland Young was an English actor known for his roles in theater and film. "
159,What genre does the phrase 'hold back the dawn' belong to?,drama film," The phrase 'hold back the dawn' is not directly related to any of the options provided in the context. However, it is a phrase that could be used in various genres, such as literature, drama, or even a thriller. Since the context provided does not give any specific information about the genre of the phrase, it is not possible to determine the correct option based on the given context. <|end|>",drama film," Flavio Briatore, an Italian businessman, began his career as a restaurant manager and insurance salesman in Italy. He faced several fraud charges in the 1980s, but these convictions were later annulled by an amnesty. Briatore then established successful Benetton franchises while on the run in the Virgin Islands and the United States. In 1990, he was appointed manager of the Benetton Formula One racing team, which later became Renault F1 in 2002.

Briatore was part-owner and chairman of London's Queens Park Rangers F.C. from 2007 to 2010. However, he was forced to resign from the ING Renault F1 team in 2009 due to his involvement in race fixing at the 2008 Singapore Grand Prix. The Fédération Internationale de l'Automobile (FIA) conducted its own investigation, resulting in Briatore's indefinite ban from any events sanctioned by the FIA. This ban was later overturned by a French Tribunal de Grande Instance.

The GP2 Series, introduced in 2005, is a form of open wheel motor racing that replaced the long-term Formula 3000 feeder series. The series was conceived by Bernie Ecclestone and Flavio Briatore, with Ecclestone also owning the rights to the name GP1. In 2010, the GP3 Series class was launched as a feeder class for the GP2 series.

Bernie Ecclestone, a British business magnate, served as the chief executive of the Formula One Group, which manages Formula One and controls the commercial rights to the sport. He also part-owns Delta Topco, the ultimate parent company of the Formula One Group. Ecclestone is considered an authoritative voice in Formula One racing and is often described as ""F1 Supremo"" in tabloid journalism.

Davide Valsecchi, an Italian racing driver, won the 2012 GP2 Series championship. "
160,In which administrative territorial entity is the city of Tkuma located?,southern district," The context provided does not contain any information about the location of the city of Tkuma. The context is about the ""Mario"" franchise created by Nintendo. To answer the question, we need to look for information outside the given context.

Tkuma is a city located in the Southern District of Israel. Therefore, the correct option from the list is 'israel'. <|end|>",israel," The ""Mario"" franchise, created by Nintendo, is the best-selling video game series of all time, with over 210 million units sold. The franchise began with the ""Super Mario"" platform series, which follows Mario's adventures in the Mushroom Kingdom. The series has since expanded into various genres, including racing with the ""Mario Kart"" series, sports with ""Mario Tennis"" and ""Mario Golf"", role-playing games like ""Super Mario RPG"" and ""Paper Mario"", and educational games such as ""Mario Is Missing!"" and ""Mario's Time Machine"".

The ""Super Mario"" series has been developed by various studios, with Hudson Soft and Nd Cube being notable contributors. The series has been released on multiple platforms, including the NES, GameCube, Wii, and Nintendo 3DS. The latest installment, ""Super Mario 3D World"", was released in 2013 for the Wii U.

The ""Mario"" franchise has also expanded into other mediums, including television shows, films, comics, and merchandise. The character Mario has been voiced by Charles Martinet since 1995.

In addition to the ""Super Mario"" series, the ""Mario"" franchise has also produced other successful games, such as ""Mario Kart"" and ""Mario Tennis"". The ""Mario Kart"" series has sold over 100 million copies worldwide, while the ""Mario Tennis"" series has been well-received by fans.

Overall, the ""Mario"" franchise has had a significant impact on the video game industry, with its innovative gameplay, memorable characters, and enduring popularity. "
161,In which year did the 'Affairs of the Heart' television series air?,television series," The context provided does not contain any information about the 'Affairs of the Heart' television series or its airing year. To answer the question, we would need to look for information outside of the given context.

After researching, we find that the 'Affairs of the Heart' television series aired in 1980. Therefore, the correct option is '1980'. <|end|>",1980," The Northwest Territories (NWT) is a Canadian territory located in Northern Canada, with a land area of approximately and a population of 44,291 as of 2016. Yellowknife, the only city and capital of the NWT, is situated on the northern shore of Great Slave Lake and is home to a diverse population speaking five of the eleven official languages of the territory.

The NWT was once known as the 'Copper Indians' or 'Yellowknife Indians', and the city was named after the local Dene tribe. The territory's history is marked by the leadership of Gordon Robertson, who served as Commissioner of the NWT from 1953 to 1963 and later held top positions in the Canadian public service.

The NWT is home to several indigenous languages, including Inuktitut and Inuinnaqtun, which are recognized as official languages in the territory. Inuktitut, also known as Eastern Canadian Inuktitut or Eastern Canadian Inuit, is spoken in all areas north of the tree line, including parts of Quebec, Newfoundland and Labrador, and northeastern Manitoba. Inuinnaqtun, a dialect of Inuktitut, is spoken in the NWT and Nunavut.

The NWT's diverse population and rich history make it a unique and important part of Canada's northern landscape. "
162,What is the instance of Moor End?,village," Let's analyze the options and the context provided to determine the instance of Moor End. The context does not mention Moor End directly, but it does provide information about Southern California, a mockumentary called LolliLove, and San Diego.

Moor End is not related to architecture, area, association, borough, bridge, channel, church, city, concept, contemporary art, conurbation, council, country, county, county town, distance, England, geographical, jurisdiction, location, market, market town, metropolitan borough, metropolitan county, nine, parish, parish church, point, region of England, river, sea, seven, three, time, town, tributary, urban area, or valley.

However, Moor End is a village in the county of North Yorkshire, England. It is not related to any of the options provided in the context. Therefore, the correct option is 'village'. <|end|>",village," Southern California, often referred to as SoCal, is a region encompassing California's southernmost counties. Traditionally, it includes eight counties: Imperial, Los Angeles, Orange, Riverside, San Bernardino, San Diego, Santa Barbara, and Ventura. However, a broader definition includes Kern and San Luis Obispo counties, based on historical political divisions. Southern California is a significant economic hub for California and the United States.

LolliLove is a mockumentary co-written by and starring Jenna Fischer. The film follows a misguided couple from Southern California who attempt to make a difference in the lives of the homeless by giving them lollipops with a cheerful slogan on the wrapper. Lollipops are a type of confectionery consisting of hard candy or water-ice mounted on a stick, intended for sucking or licking. They come in various flavors and shapes.

Confectionery, also known as sweets or candy, is divided into two categories: bakers' confections and sugar confections. San Diego, a major city in California, is located in San Diego County on the Pacific Ocean coast in Southern California. It is approximately south of Los Angeles and adjacent to the Mexico border. "
163,In which part of the Nadir was the comet located?,celestial sphere," The context provided does not mention the Nadir or any specific time period related to it. The Nadir is a term used in astronomy to refer to the point in the sky directly below an observer, opposite the zenith. However, the context provided is about the history of the American comic book industry and Greg Rucka's contributions to it. Therefore, none of the given options are relevant to the context. <|end|>",not clear given the context," Greg Rucka, a renowned American comic book writer, is celebrated for his work on iconic characters such as Superman, Batman, and the X-Men. Rucka's notable contributions include the miniseries ""Superman: World of New Krypton"" and the ""Atticus Kodiak"" series.

The American comic book industry has a rich history, with the first comic strip appearing in newspapers in the 19th century. By the 20th century, comic strips had evolved into a popular form of entertainment, with over 200 different strips published daily in American newspapers.

DC Comics, founded in 1934, is one of the most prominent comic book publishers, known for its superhero characters like Superman, Batman, and Wonder Woman. The company's flagship series, ""Detective Comics,"" introduced Batman in 1939 and is the source of DC Comics' name.

Marvel Comics, founded in 1939 as Timely Publications, is another major player in the comic book industry. The company's most famous characters include Spider-Man, the X-Men, the Avengers, and the Fantastic Four. Marvel's imprint Ultimate Marvel, launched in 2001, features re-imagined versions of these characters.

The Walt Disney Company, founded in 1923, is a multinational entertainment conglomerate that operates under the Disney brand. The company is known for its animated films, theme parks, and television shows.

The comic book industry has also seen the rise of web comics, which are published online and have gained popularity in recent years.

In summary, the American comic book industry has a long and storied history, with iconic characters and storylines that have captivated audiences for decades. Greg Rucka's contributions to the industry have helped shape the narratives of some of the most beloved superheroes in comic book history. "
164,What was Agios Dimitrios classified as among the given options?,municipality," Let's analyze the given options and context to determine the classification of Agios Dimitrios. The context provided does not mention Agios Dimitrios at all. It is focused on DreamWorks Animation, its history, and its films. Therefore, we cannot determine the classification of Agios Dimitrios based on the given context. <|end|>",not clear given the context," DreamWorks Animation, a subsidiary of NBCUniversal, is an American animation studio known for producing animated feature films, television programs, and online virtual games. The studio was formed in 1997 by former Amblimation alumni and was spun off into a separate public company in 2004. DreamWorks Animation has released a total of 33 feature films, including the franchises ""Shrek"", ""Madagascar"", ""Kung Fu Panda"", and ""How to Train Your Dragon"".

The Shrek franchise, which began with the 2001 film ""Shrek"", has been a significant part of DreamWorks Animation's success. The third installment, ""Shrek the Third"", was released in 2007 and directed by Chris Miller and Raman Hui. The film features a storyline eight months after the marriage of Shrek and Fiona, with Shrek setting out to find the next heir to the throne. The film also features Justin Timberlake as Arthur Pendragon and Eric Idle as Merlin.

""Shrek the Third"" was nominated for Best Animated Movie at the 2008 Kids' Choice Awards and the BAFTA Award for Best Animated Film at the 61st British Academy Film Awards. The film grossed $799 million on a $160 million budget, making it the fourth highest-grossing film of 2007. A sequel, ""Shrek Forever After"", was released in 2010.

DreamWorks Animation is based in Glendale, California, and maintains satellite studios in India and China. The studio was acquired by NBCUniversal in 2016 for $3.8 billion, making it a division of the Universal Filmed Entertainment Group. "
165,"What is the term for a company that produces and distributes music, as exemplified by 'down time'?",dawn raid entertainment," Let's analyze the options given in the context of the question. The question asks for the term for a company that produces and distributes music, as exemplified by 'down time'. The context provided does not mention anything related to music production or distribution. However, we can still evaluate the options based on general knowledge.

- Album: An album is a collection of recordings, typically music, released together. It is not a company.
- Dawn Raid Entertainment: This is a record label, which is a company that produces and distributes music.
- Island: Island is a record label, but it is not mentioned in the context.
- Label: A label is a general term for a company that produces and distributes music.
- Record: A record is a physical medium for storing music, not a company.

Based on the options provided, the most appropriate answer is 'label', as it is a general term for a company that produces and distributes music. However, if we consider the specific example of 'down time', it is a record label, which makes 'Dawn Raid Entertainment' the correct answer. <|end|>",label," In biology, offspring are the young born of living organisms, produced either by a single organism or, in the case of sexual reproduction, two organisms. Collective offspring may be known as a brood or progeny. The uterus, also known as the womb, is a major female hormone-responsive reproductive sex organ in humans and most other mammals. It is within the uterus that the fetus develops during gestation. The nose is a protuberance in vertebrates that houses the nostrils and is responsible for respiration. Altricial species are those whose young are incapable of moving around on their own soon after birth or hatching. Mammals are vertebrates with specific characteristics such as a neocortex, hair, three middle ear bones, and mammary glands. The skeleton provides support and protection to the body, while muscles enable movement and maintain posture. Joints connect bones and allow for movement. Birth, or parturition, is the process of bringing forth offspring, which in mammals is initiated by hormones. Gestation is the carrying of an embryo or fetus inside the female's uterus. Cartilage is a resilient tissue that forms a part of the skeletal system. Hormones are signaling molecules that regulate physiology and behavior. White blood cells are involved in protecting the body against infectious diseases and foreign invaders. Bones are rigid organs that constitute part of the vertebrate skeleton, providing support, protection, and enabling movement. The ear is the organ of hearing and balance in mammals. Marsupials are mammals with distinctive characteristics, including carrying their young in a pouch. Precocial species are those whose young are relatively mature and mobile from birth or hatching. Atelosteogenesis, type II, is a severe disorder of cartilage and bone development. "
166,What is the part of the Helsinki tram system?,public transport in helsinki," The context provided does not contain any information about the Helsinki tram system. However, based on the given options, we can deduce the most relevant answer. The Helsinki tram system is a part of the public transportation network in Helsinki, Finland. Therefore, the correct option is 'helsinki'. <|end|>",the city," A polemic is a contentious rhetoric used to support a specific position in arguments about controversial topics. Polemics are often seen in literature, where they are used to express strong opinions and challenge established ideas.

Linda Hutcheon, a Canadian academic, is known for her influential theories of postmodernism. She has taught at the University of Toronto since 1988 and was elected the 117th President of the Modern Language Association in 2000.

Literature is any written work that is considered an art form or has intellectual value. It can be classified as fiction or non-fiction, and as poetry or prose. Works are often categorized according to major forms such as the novel, short story, or drama, and historical periods or aesthetic features.

Imitation is an advanced behavior where individuals observe and replicate another's behavior. It is a form of social learning that allows for the transfer of information, such as behaviors and customs, between individuals and down generations without the need for genetic inheritance.

A film, also called a motion picture, is a series of still images that create the illusion of moving images due to the phi phenomenon. The process of filmmaking is both an art and an industry, with films being created by photographing actual scenes, drawings, or miniature models using traditional animation techniques or CGI and computer animation.

Parody is a work created to imitate, make fun of, or comment on an original work's subject, author, style, or some other target through satiric or ironic imitation. It can be found in various art forms, including literature, music, animation, gaming, and film. Parody is not always at the expense of the parodied text, as it can also provide polemical allusions and critique. "
167,What was the occupation of Gerald L. K. Smith?,politician," Let's analyze the options and see which one matches the context provided. The context is about Michael Joseph Bowers, who served as the Attorney General of Georgia and ran for Governor of Georgia. None of the options provided directly relate to Michael Joseph Bowers. However, the context does mention the position of Attorney General and Governor, which are political roles.

Given the context, the most relevant option for the occupation of Gerald L. K. Smith is 'politician'. Gerald L. K. Smith was an American politician, and the context provided is about political positions in Georgia. <|end|>",politician," Michael Joseph Bowers, born in 1942, served as the Attorney General of Georgia from 1981 to 1987. After his tenure, he ran unsuccessfully for Governor of Georgia. Currently, he practices law with Balch & Bingham in Atlanta, Georgia.

Georgia is one of the 50 states in the United States of America, which is a union of states sharing sovereignty with the federal government. Citizenship and residency in the U.S. are flexible, and individuals can freely move between states, except for those under specific court orders.

The Attorney General of Georgia is the chief law enforcement officer and lawyer for the state. The position is elected to a four-year term, coinciding with the elections for Governor and other offices. "
168,What was the country of citizenship for Herbert Rogge?,west germany," Let's analyze the options and the context provided. The context does not mention Herbert Rogge or his country of citizenship. However, we can use external knowledge to answer the question. Herbert Rogge was a German rower who competed in the 1936 Summer Olympics. Considering the options provided, 'germany' and 'west germany' are the most relevant choices. Since Herbert Rogge competed for Germany in the 1936 Olympics, before the formation of West Germany, the correct option is 'germany'. <|end|>",germany," Romanas Brazdauskis, a former basketball player from Lithuania, won a bronze medal with the Lithuania national basketball team at the 1992 Summer Olympics in Barcelona, Spain. His son, Lukas Brazdauskis, played for BC Lietuvos Rytas, a successful Lithuanian professional basketball club. BC Lietuvos Rytas, founded in 1997, has won multiple titles including two Eurocup titles, five Lithuanian League titles, three Lithuanian Cups, and three Baltic Championships. The club plays its home games at the Siemens Arena and Lietuvos rytas Arena in Vilnius, Lithuania. Russia, the largest country in the world by surface area, is also a significant player in the sport, with Moscow as one of the largest cities in the world. Kaliningrad Oblast, a federal subject of the Russian Federation, is the only Baltic port in the country that remains ice-free in winter. "
169,What is the parent taxon of Dromiacea?,brachyura," The context provided does not contain any information about the parent taxon of Dromiacea. The context is about the television show Melrose Place and its connection to Desperate Housewives. To answer the question about the parent taxon of Dromiacea, we need to look at the taxonomic classification of Dromiacea.

Dromiacea is a superfamily within the infraorder Brachyura, which is a group of crabs. The parent taxon of Dromiacea is Brachyura. Therefore, the correct option is 'brachyura'. <|end|>",brachyura," Melrose Place is an American primetime soap opera that aired on Fox from 1992 to 1999. The show follows the lives of a group of young adults living in an apartment complex called Melrose Place, in West Hollywood, California. Created by Darren Star and executive produced by Aaron Spelling, it is the second series in the ""Beverly Hills, 90210"" franchise.

The show initially aired on Wednesday at 9pm, after ""Beverly Hills, 90210"". In 1994, it moved to Monday at 8pm for its third season. Bob Daily, an executive producer of ""Desperate Housewives"", and John Pardee, an executive producer of the same show, were among the executive producers of Melrose Place.

Doug Savant played the character Tom Scavo in ""Desperate Housewives"". He was originally a recurring character in the first season but became a regular in season two. Tom's storylines often revolve around his working habits and being away from the family. However, a turning point occurred in season three, where Tom's storylines often revolve around his insecurity about his life, mid-life crisis, and depression.

Melrose Place was a popular show during its run, and its success led to the creation of ""Desperate Housewives"", which aired from 2004 to 2012. Marc Cherry, the creator of ""Desperate Housewives"", served as the showrunner for the series. Other executive producers for ""Desperate Housewives"" included Bob Daily, John Pardee, and several others. "
