,query,correct,cot,synthesis,context
78,In which administrative territorial entity is the Stair House located?,east ayrshire," The context provided does not contain any information about the Stair House or its location. Therefore, we cannot determine the correct answer from the given options based on the context. <|end|>",united kingdom," The document provides a comprehensive overview of American football, its rules, and its significance in the United States. American football, also known as gridiron, is a popular sport played by two teams of eleven players. The game is played on a rectangular field with goalposts at each end. The offense aims to advance the ball into the opposing team's end zone for a touchdown or kick the ball through the opponent's goalposts for a field goal. The defense, on the other hand, aims to stop the offense's advance and take control of the ball for themselves.

The document also highlights the importance of West Virginia University Institute of Technology, which is transitioning from Montgomery to Beckley, West Virginia. The university is governed by the WVU Board of Governors and is affiliated with West Virginia University.

Furthermore, the document discusses the Super Bowl, the annual championship game of the National Football League (NFL). The Chicago Bears, a professional American football team based in Chicago, Illinois, are mentioned as a notable team in the NFL. The document also provides information about the Cleveland Area Medical Center, a complex of hospitals in Charleston, West Virginia, and the Ohio River, which is the largest tributary of the Mississippi River in the United States.

In addition, the document mentions the Appalachian Mountain Range, which posed a significant barrier to land travel in less technologically advanced eras. The document also discusses the Los Angeles metropolitan area, which is the 18th largest metropolitan area in the world and the second-largest metropolitan area in the United States.

Lastly, the document provides information about the combined statistical area (CSA) concept, which is composed of adjacent metropolitan and micropolitan statistical areas in the United States and Puerto Rico that can demonstrate economic or social linkage. The document also mentions the Los Angeles Rams, a professional American football team based in the Los Angeles metropolitan area, and the Morgantown Personal Rapid Transit system, which is a transportation system in Morgantown, West Virginia. "
79,What was the occupation of Itakura Shigemune?,samurai," Let's analyze the options and the context provided. The context mentions Oliver Hardy, an American comic actor famous as one-half of Laurel and Hardy. It does not mention Itakura Shigemune, so we cannot determine his occupation from the given context. However, we can use external knowledge to answer the question.

Itakura Shigemune was a Japanese samurai and official during the Edo period. He served as a retainer of the Tokugawa shogunate and held various positions, including the governor of the Kii Province.

Based on external knowledge, the correct option is 'official' and'samurai'. <|end|>",official," Laurel and Hardy were a comedy duo composed of Englishman Stan Laurel and American Oliver Hardy. They became famous during the early Classical Hollywood era of American cinema, known for their slapstick comedy. Their signature tune, ""The Cuckoo Song,"" played over the opening credits of their films.

The term ""public opinion"" refers to the collective opinion of the people on an issue or problem. It has been considered important in politics since the 17th century.

The bowler hat, also known as a bob hat, bombín, or derby, is a hard felt hat with a rounded crown. It was created in 1849 and became popular with the working classes in the 19th century.

Oliver Hardy, born Oliver Norvell ""Babe"" Hardy, was an American comic actor famous as one-half of Laurel and Hardy. He appeared with his comedy partner Stan Laurel in 107 films, feature films, and cameo roles.

A featurette is a film usually of three reels in length, or about 2440 minutes in running time. It is longer than a two-reel short subject but shorter than a feature film. The term was commonly used from before the start of the sound era into the 1960s.

Comedy is a discourse or work intended to be humorous or amusing, often inducing laughter. The origins of the term can be traced back to Ancient Greece, where comic poets performed political satire at the theaters. The essential agon of comedy is a struggle between a relatively powerless youth and societal conventions that pose obstacles to his hopes.

""Outwitting Dad"" is a 1914 American comedy film that features Oliver Hardy's first onscreen appearance. ""Sailors, Beware!"" is a silent comedy short film starring Stan Laurel and Oliver Hardy prior to their official billing as the duo Laurel and Hardy. They appeared in a total of 107 films between 1921 and 1951. "
80,What is the taxon rank of Hexathele hochstetteri?,species," The context provided does not contain any information about the taxon rank of Hexathele hochstetteri. The information is about Ullevi Stadium, IFK Göteborg, and Gothenburg, which are unrelated to the taxon rank of Hexathele hochstetteri. To answer the question, we need to look at the taxonomic classification of Hexathele hochstetteri.

Hexathele hochstetteri is a species of tarantula in the family Hexathelidae. Therefore, the correct taxon rank for Hexathele hochstetteri is'species'. <|end|>",species," Ullevi Stadium, also known as Nya Ullevi, is a versatile multi-purpose stadium located in Gothenburg, Sweden. Originally constructed for the 1958 FIFA World Cup, Ullevi has since hosted numerous significant sporting events, including the World Allround Speed Skating Championships, the 1995 World Championships in Athletics, and the 2006 European Athletics Championships. The stadium has also been the venue for the UEFA Cup Winners' Cup finals in 1983 and 1990, the UEFA Euro 1992 final, and the UEFA Cup final in 2004.

IFK Göteborg, a prominent Swedish football club, has played its home games at Ullevi since 2009. The club, founded in 1904, is the only Nordic country club to have won a pan-European competition, with victories in the UEFA Cup in 1982 and 1987. The club's colors, blue and white, are shared with the sports society Idrottsföreningen Kamraterna (IFK), from which the club originated.

Magnus Johansson, a former footballer for IFK Göteborg, Brann, and Västra Frölunda, is a notable figure in the club's history.

The new Gamla Ullevi Stadium, which opened in 2009, replaced the city's previous main football stadium. The construction of the new stadium was met with controversy due to its cost, the perceived low standard of the finished stadium, and the name of the stadium.

Gothenburg, the second-largest city in Sweden and the fifth-largest in the Nordic countries, is home to the new Ullevi Stadium. With a population of approximately 550,000 in the urban area and 990,000 inhabitants in the metropolitan area, Gothenburg is a vibrant city located on the west coast of Sweden by the Kattegat. "
81,Which company is known for developing the 'bug'?,realtime associates," The context provided does not mention any of the companies listed in the options. However, the question asks about the development of the 'bug', which is a term often associated with software. Among the given options, Microsoft is the most likely to be associated with the development of a 'bug' in software. Therefore, the correct option is 'Microsoft'. <|end|>",microsoft," A boat is a watercraft designed for various purposes on water, ranging from small vessels on inland waterways to large ships on the open sea. Boats are distinguished from ships based on size, shape, and cargo or passenger capacity. Aircraft, on the other hand, are machines that fly by gaining support from the air, using static lift or dynamic lift from airfoils or jet engines. Aircraft carriers are warships that serve as seagoing airbases, equipped with facilities for deploying and recovering aircraft. Naval warfare involves combat in and on the sea, ocean, or other major bodies of water. A propeller is a type of fan that transmits power by converting rotational motion into thrust, while a pressure difference is produced between the forward and rear surfaces of the airfoil-shaped blade. Marine propellers, also known as screw propellers, are characterized by their high propulsive efficiency and ability to throw thrust in any direction at any time. Steamboats are boats propelled primarily by steam power, using either propellers or paddlewheels. The United States Armed Forces consist of the Army, Marine Corps, Navy, Air Force, and Coast Guard, with the President of the United States as the military's overall head. The National Security Act of 1947 created the modern U.S. military framework, merging the Department of War and the Department of the Navy into the National Military Establishment, headed by the Secretary of Defense. The United States has seven federal uniformed services that commission officers as defined by Title 10 of the United States Code. A reserve fleet is a collection of naval vessels that are fully equipped for service but not currently needed, and thus partially or fully decommissioned. Steamships are ocean-faring vessels propelled by steam engines that typically drive propellers or paddlewheels. The United States Navy is the naval warfare service branch of the United States Armed Forces, with the largest combined battle fleet tonnage in the world. The U.S. Navy has the world's largest aircraft carrier fleet and more than 3,700 aircraft in active service. The third USS Vixen was a steamboat in the United States Navy during the Mexican-American War. "
82,What platform did Master Chu and the Drunkard Hu belong to?,nintendo entertainment system," The context provided does not mention anything about Master Chu and the Drunkard Hu or any platform related to them. The information given is about Johns Hopkins University, John Auer, and Lake Ontario. Therefore, none of the options provided ('handheld', 'internet', 'nintendo entertainment system') can be determined as correct based on the context. <|end|>",not clear given the context," Johns Hopkins University, founded in 1876 by philanthropist Johns Hopkins, is an American private research university in Baltimore, Maryland. It was the first research university in the United States, integrating teaching and research. The university's first president, Daniel Coit Gilman, revolutionized higher education in the U.S. by adopting the concept of a graduate school from Germany's Heidelberg University.

John Auer, an American physiologist and pharmacologist, was a graduate of Johns Hopkins School of Medicine and worked closely with physiologist Samuel James Meltzer at the Rockefeller Institute for Medical Research. Auer is known for his research on the correlation between bronchial asthma and foreign substances, the effects of magnesium on tetany, and the first account of allergic inflammations caused by exposure to xylene, known as Auer's phenomena.

The Johns Hopkins University School of Medicine, located in Baltimore, Maryland, is the academic medical teaching and research arm of Johns Hopkins University. It has consistently been among the nation's top medical schools in the number of research grants awarded by the National Institutes of Health. The school's major teaching hospital, the Johns Hopkins Hospital, was ranked the #1 hospital in the United States for 22 years by ""U.S. News & World Report"". The hospital and school are the founding institutions of modern American medicine and the birthplace of numerous medical traditions, including rounds, residents, housestaff, neurosurgery, cardiac surgery, pediatrics, and child psychiatry.

Lake Ontario, one of the five Great Lakes of North America, is surrounded by the Canadian province of Ontario and the American state of New York. The lake's primary inlet is the Niagara River from Lake Erie, and its outlet to the Atlantic Ocean via the St. Lawrence River. The lake was named for the Huron (Wyandot) language word ""ontarío,"" meaning Lake of Shining Waters. "
83,What is the instance of 'waiting for Santa' related to?,film," Let's analyze the options and see which one is related to the context provided. The context discusses the Xbox 360, a home video game console developed by Microsoft, and Fable II, a game for the Xbox 360. The context does not mention 'waiting for Santa' in any way.

However, if we consider the broader context of the Xbox 360 and Fable II being part of the consumer electronics industry, we can infer that 'waiting for Santa' might be related to the holiday season when people often purchase and exchange gifts, including consumer electronics like video game consoles.

Therefore, the most relevant option from the list is 'festival', as the holiday season can be considered a festival or celebration during which people might be 'waiting for Santa' to bring them gifts. <|end|>",god," The Xbox 360, developed by Microsoft, is a home video game console that succeeded the original Xbox. Released in 2005, it competed with Sony's PlayStation 3 and Nintendo's Wii during the seventh generation of video game consoles. The Xbox 360 was unveiled on MTV and later detailed at E3.

Microsoft Studios, a subsidiary of Microsoft, is responsible for the development and publishing of games for the Xbox, Xbox 360, Xbox One, and other platforms. The studio was established in 2002 and has developed several popular games, including the Fable series and the Xbox 360 game Fable II.

Fable II is an action role-playing open world video game developed by Lionhead Studios and published by Microsoft Game Studios for Xbox 360. It is the sequel to Fable and Fable: The Lost Chapters, and was released in October 2008. The game takes place in the fictional land of Albion, five hundred years after the original Fable's setting. Players can choose to be either male or female and explore a colonial era resembling the time of highwaymen or the Enlightenment.

The Xbox 360 and Fable II are part of the broader consumer electronics industry, which includes devices used for entertainment, communications, and home-office activities. Microsoft, a major player in this industry, also produces the Windows operating system, which is used in various consumer electronics devices.

In addition to gaming, Microsoft is involved in other sectors of the consumer electronics industry, such as professional audio and medical business. The company's subsidiary, Sony Corporation, is another major player in the industry, with business operations in electronics, motion pictures, music, and financial services.

Overall, the Xbox 360 and Fable II are part of the larger consumer electronics industry, which encompasses various sectors and companies, including Microsoft and Sony. "
84,In which location was the headquarters of Pora situated?,kiev," The context provided does not contain any information about the headquarters of Pora. Therefore, we cannot determine the correct answer from the given options. <|end|>",not clear given the context," Magdala, an ancient city in Galilee, is mentioned in the Jewish Talmud and the Christian New Testament. The New Testament, a significant part of Christian scripture, discusses Jesus' teachings and his relationship with Mary Magdalene. The Old Testament, the first section of the Christian Bible, is based on the Hebrew Bible and varies in canon among different Christian Churches.

Mary Magdalene, a key figure in Christianity, is said to have been a follower of Jesus and witnessed his crucifixion and resurrection. She is mentioned at least 12 times in the four Gospels, more than most of the apostles.

Music, an art form and cultural activity, uses sound and silence, and its common elements include pitch, rhythm, dynamics, and timbre. It can be performed with various instruments and vocal techniques, and its definition varies among ancient Greek and Indian philosophers.

Vivian Stanshall, an English musician, songwriter, and author, is best known for his work with the Bonzo Dog Doo-Dah Band and his exploration of the British upper classes in ""Sir Henry at Rawlinson End."" He was also the widow of Ki Longfellow, an American novelist and playwright known for her novel ""The Secret Magdalene."" Longfellow's work explores the divine feminine and challenges traditional views of events chronicled in the New Testament. "
85,What position did Evgeni Malkin play on his team and what is his speciality?,centre," The context provided does not contain any information about Evgeni Malkin or his position and specialty in his team. The context is about Laurie Anderson, an American avant-garde artist, and other unrelated topics. To answer the question, we need to look for information outside the given context.

Evgeni Malkin is a professional ice hockey player who plays as a center for the New York Rangers in the National Hockey League (NHL). He is known for his exceptional playmaking abilities, scoring prowess, and overall offensive skills. <|end|>",center," Laurie Anderson, an American avant-garde artist, composer, musician, and film director, has been a prominent figure in the art world since the 1970s. Initially trained in violin and sculpting, Anderson's work has spanned performance art, pop music, and multimedia projects. She gained widespread recognition in 1981 when her single ""O Superman"" reached number two on the UK pop charts. Anderson also starred in and directed the 1986 concert film ""Home of the Brave.""

The avant-garde, characterized by nontraditional, aesthetic innovation, and initial unacceptability, often offers a critique of the relationship between producer and consumer. Karen Bernstein, a Canadian voice actress, is best known for voicing Sailor Mercury in the American dubbing of the first two seasons of ""Sailor Moon."" The manga series was adapted into an anime series, which was broadcast in Japan from 1992 to 1997 and has since been licensed for English language release in North America and Australia/New Zealand.

""Atomic Ed and the Black Hole"" is a documentary released in 2001 by filmmaker Ellen Spiro. The documentary, produced for HBO's Cinemax Reel Life Series, features Laurie Anderson's song ""Big Science"" in its soundtrack. The film follows Ed Grothus, a machinist turned atomic junk collector, who has amassed a collection of non-radioactive high-tech nuclear waste discarded from the Los Alamos National Laboratory. His collection reveals and preserves the history of government waste that was literally thrown in a trash heap.

Performance art, a form of fine art, involves presenting a performance to an audience within a fine art context. It can be scripted or unscripted, random or carefully planned, and may involve audience participation. Performance art can take place anywhere, in any venue or setting, and can last for any length of time. The actions of an individual or group at a particular place and time constitute the work. "
86,In which category does solo dance fall under?,performance," Let's analyze the options and see which one best fits the context of solo dance. The context provided is about the United Kingdom, its geography, history, and culture, but it does not mention anything about solo dance. However, we can still determine the most appropriate category for solo dance by understanding its nature.

Solo dance is a form of dance where an individual performs alone, without a partner or a group. It is a type of artistic expression that involves movement, rhythm, and often tells a story or conveys emotions.

Now, let's examine the options:

- Art: Solo dance is a form of artistic expression, so this could be a potential category.
- Belief: This option does not seem to fit the context of solo dance.
- Choreography: Choreography is the art of designing dance movements, which is related to solo dance but not the category itself.
- Cinematography: This option is related to the art of making motion pictures and does not fit the context of solo dance.
- Composition: This term is more commonly associated with music or writing, not solo dance.
- Culture: Solo dance can be a part of a culture, but it is not a category itself.
- Dance: This option seems to be the most appropriate category for solo dance, as it is a form of dance performed by an individual.
- Design: This option does not seem to fit the context of solo dance.
- Domain: This term is too broad and does not specifically relate to solo dance.
- Gymnastics: Gymnastics is a sport that involves physical exercises and performances, but it is not the same as solo dance.
- Human: This option is too broad and does not specifically relate to solo dance.
- Ice: This option is related to ice skating, which is a different form of dance.
- Ice skating: This option is related to a specific type of dance performed on ice, not solo dance in general.
- Knowledge: This option does not seem to fit the context of solo dance.
- Law: This option is unrelated to solo dance.
- Man: This option is too broad and does not specifically relate to solo dance.
- Material: This option does not seem to fit the context of solo dance.
- Member: This option is",dance," The United Kingdom (UK), comprising England, Scotland, Wales, and Northern Ireland, is a sovereign country in Western Europe with a population of 65.1 million and an area of 242,422 square kilometers. The UK has a rich history, with London being a major settlement for over two millennia and the capital of England and the UK. The country has a diverse geography, including the White Cliffs of Dover, the English Channel, and the Celtic Sea. The UK's coastline is the 12th longest in the world, and it has a significant maritime history, with major ports like Southampton and Dover. The UK is also a member of the European Union, which has developed a single market and common policies on various sectors. The UK's political structure includes the Mayor of London and the London Assembly, which scrutinizes the Mayor's activities and has the power to amend the annual budget and reject draft strategies. The UK's ceremonial counties include Middlesex, Hertfordshire, and Surrey, with county towns like Maidstone and Winchester. The UK's technology sector includes products like the AirPort Extreme, a wireless router and NAS from Apple Inc. The UK's maritime history includes the Port of Dover, the world's busiest passenger port, and the Strait of Dover, the narrowest part of the English Channel. The UK's culture includes historic sites like Canterbury Cathedral and the White Cliffs of Dover. "
