,Unnamed: 0,query,correct,thesis,pre-antithesis,antithesis,pre-synthesis,synthesis,context
209,209,What type of work is 'Fredegar Bollers'?,hobbit,pen," Let's consider the options and check whether or not they are correct. The context does not mention 'Fredegar Bollers' at all. It talks about Cop Shoot Cop, a band formed by David Ouimet and Tod Ashley, and Motherhead Bug, a band featuring Ouimet as the lead singer and trombone player. The context also discusses rock music and New York City. None of the options provided directly relate to 'Fredegar Bollers'. Therefore, the correct option is 'name', as it is the only option that could potentially refer to a person's name, which is the most likely context for 'Fredegar Bollers'. <|end|>",name," The correct option is 'name', as it is the only option that could potentially refer to a person's name, which is the most likely context for 'Fredegar Bollers'. The context does not mention 'Fredegar Bollers' at all, but it discusses Cop Shoot Cop, a band formed by David Ouimet and Tod Ashley, and Motherhead Bug, a band featuring Ouimet as the lead singer and trombone player. The context also talks about rock music and New York City. None of the other options provided directly relate to 'Fredegar Bollers'. <|end|>",name," Cop Shoot Cop was an industrial rock band formed in New York City in 1987 by David Ouimet and Tod Ashley. The band's unique sound featured twin bass guitars, found metal percussion, and no lead guitar. Ouimet, a musician and artist, grew up in a music-oriented household in Memphis, Tennessee, and developed an interest in editing. He moved to Rhode Island, where he formed a friendship with Ashley and Jon Spencer. In the early 1990s, Ouimet co-founded Cop Shoot Cop, playing sampler and keyboards. After leaving the band to form Motherhead Bug, Ouimet continued his musical career with Foetus and Swans.

Motherhead Bug, founded in 1989, was a rock band featuring Ouimet as the lead singer and trombone player. The band's music was characterized by Ouimet's illustrations of creepy, bipedal, fez-capped insect creatures, which appeared on their singles and album. Ouimet's career as an illustrator continued with Robert D. San Souci's Dare to be Scared series and Nancy Etchmendy's Cat in Glass and other Tales of the Unnatural.

Rock music, a genre that originated in the United States in the 1950s, has its roots in rock and roll, blues, rhythm and blues, and country music. It has evolved into various styles, particularly in the United Kingdom and the United States. The modern guitar, a six-string instrument, was preceded by the gittern, vihuela, four-course Renaissance guitar, and five-course baroque guitar.

New York City, the most populous city in the United States, is a global power city with a significant impact on commerce, finance, media, art, fashion, research, technology, education, and entertainment. It is the center of the New York metropolitan area, one of the most populous urban agglomerations in the world. Home to the United Nations, New York is an important center for international diplomacy and has been described as the cultural and financial capital of the world. "
211,211,What was the occupation of Anna Bonaiuto?,actor,emir," Let's consider the options and check whether or not they are correct. The context provided discusses a comedy film and mentions Akim Tamiroff, an Armenian actor who won the first Golden Globe Award for Best Supporting Actor and was nominated twice for the Academy Award for Best Supporting Actor. This information clearly indicates that Akim Tamiroff was an actor. The other options, 'emir' and'musician', are not mentioned in the context. Therefore, the correct option is 'actor'. <|end|>",actor," The correct option is 'actor', as the context mentions Akim Tamiroff, an Armenian actor who won the first Golden Globe Award for Best Supporting Actor and was nominated twice for the Academy Award for Best Supporting Actor. The other options, 'emir' and'musician', are not mentioned in the context. <|end|>",actor," ""Christmas in July"" is a 1940 comedy film directed by Preston Sturges, based on his 1931 play ""A Cup of Coffee."" Sturges, who sold the story to Paramount Pictures for $10, directed his first film and won the Academy Award for Writing Original Screenplay. The film stars Dick Powell and Ellen Drew, with Muriel Angelus also appearing.

The film's plot revolves around a wealthy man who decides to give away his fortune to charity during the summer months, when people are least likely to notice. However, his plan is thwarted by a group of scheming individuals who try to take advantage of his generosity.

The term ""comedy"" refers to any discourse or work intended to be humorous or amusing, often inducing laughter. The origins of comedy can be traced back to Ancient Greece, where comic poets performed political satire at the theaters. Greek comedy typically featured two opposing groups or societies in conflict, with the struggle often centered around a relatively powerless youth and societal conventions.

Akim Tamiroff, an Armenian actor, won the first Golden Globe Award for Best Supporting Actor and was nominated twice for the Academy Award for Best Supporting Actor. He appeared in at least 80 American motion pictures over a career spanning thirty-seven years. "
219,219,What is the original language of the work 'Pyramid'?,english,japanese," Let's consider the options and check whether or not they are correct. The context mentions that Del Rey Manga, a branch of Del Rey Books, collaborated with Japanese publisher Kodansha and published titles like ""Tsubasa Chronicle"" and ""xxxHolic"" in the UK. The term ""manga"" refers to Japanese comics and cartooning. This information suggests that the original language of the work 'Pyramid' could be Japanese. The other options, 'english' and 'russia', are not mentioned in the context. Therefore, the correct option is 'japanese'. <|end|>",japanese," The correct option is 'japanese', as the context mentions that Del Rey Manga, a branch of Del Rey Books, collaborated with Japanese publisher Kodansha and published titles like ""Tsubasa Chronicle"" and ""xxxHolic"" in the UK. The term ""manga"" refers to Japanese comics and cartooning, which indicates that the original language of the work 'Pyramid' could be Japanese. The other options, 'english' and 'russia', are not mentioned in the context. <|end|>",japanese," Del Rey Books, a branch of Ballantine Books, is a renowned imprint specializing in science fiction and fantasy books. Established in 1977 by authors Lester del Rey and his wife Judy-Lynn del Rey, the imprint has published notable works such as the ""Star Wars"" novels under the LucasBooks imprint and the ""Dragonriders of Pern"" series by Anne McCaffrey. Del Rey Books is part of Random House, a major U.S. publisher, and has a history of acquiring talents through conventions and professional contacts. The imprint also had a manga publishing branch, Del Rey Manga, which collaborated with Japanese publisher Kodansha. The term ""manga"" refers to Japanese comics and cartooning, and Del Rey Manga published titles like ""Tsubasa Chronicle"" and ""xxxHolic"" in the UK. The imprint's editor, Tricia Narwani, emphasized the importance of networking in discovering new talent. The White Dragon, a science fiction novel by Anne McCaffrey, completes the original Dragonriders trilogy in the Dragonriders of Pern series. The book was first published in 1978 and ranked number 23 among the ""All-Time Best Fantasy Novels"" in 1987. "
223,223,Who was the director of the Chicago production?,frank john urson,james cruze," Let's consider the options and check whether or not they are correct. The context does not mention any direct connection between the director of the Chicago production and the other options provided. However, it does mention that Joel Osteen succeeded his father, John Hillery Osteen, as the pastor of Lakewood Church in Houston, Texas. Since the question asks about the director of the Chicago production, none of the options provided are relevant to the context. Therefore, the correct answer cannot be determined from the given context. <|end|>",not clear given the context," Question: Who was the director of the Chicago production?
Options: james cruze
Candidate answer: None of the options provided are relevant to the context. The context does not mention any direct connection between the director of the Chicago production and the other options provided. Therefore, the correct answer cannot be determined from the given context.

Suggestion: ['edwin thanhouser', 'frank john urson', 'howard higgin', 'james cruze', 'paul iribe', 'variety', 'william garwood'] <|end|>",james cruze," Christianity is a monotheistic religion based on the life and teachings of Jesus Christ. It is the largest religion in the world, with over 2 billion followers. Christians believe in one God and follow the teachings of Jesus Christ, who they believe is the Son of God and the savior of humanity.

Lakewood Church is a nondenominational charismatic Christian megachurch located in Houston, Texas. It is the largest congregation in the United States, with an average attendance of about 52,000 people per week. The church is led by Joel Osteen, who is the son of John Hillery Osteen, the founder and first pastor of Lakewood Church.

Mexico is a federal republic in North America, bordered by the United States, Guatemala, Belize, the Caribbean Sea, and the Pacific Ocean. It is the most populous Spanish-speaking country in the world and the second most populous country in Latin America. Mexico is a federation comprising 31 states and a federal district that is also its capital and most populous city.

John Hillery Osteen founded Lakewood Church in Houston, Texas, in 1959. He served as the first pastor until his death in 1999. His son, Joel Osteen, succeeded him as pastor and continues to lead the church today.

Houston is the most populous city in Texas and the fourth-most populous city in the United States. It is located in Southeast Texas near the Gulf of Mexico and is the seat of Harris County. Houston is the principal city of the Houston metropolitan area, which is the fifth-most populated metropolitan area in the United States.

In summary, Christianity is a monotheistic religion based on the life and teachings of Jesus Christ, with over 2 billion followers worldwide. Lakewood Church in Houston, Texas, is the largest congregation in the United States, led by Joel Osteen, the son of John Hillery Osteen, the founder and first pastor of the church. Houston is the most populous city in Texas and the fourth-most populous city in the United States, and is the principal city of the Houston metropolitan area. "
230,230,What is the date of birth of Pat Kenny?,29 january 1948,1 january 1926," Let's consider the options and check whether or not they are correct. The context does not provide any information about Pat Kenny, so we cannot verify the candidate answer '1 January 1926' based on the given context. Therefore, we cannot determine the correct date of birth of Pat Kenny from the provided context. <|end|>",not clear given the context," The correct date of birth of Pat Kenny is '19 April 1958'. This information can be found in the given context, which states that Bashir won a bronze medal in the Asian Games in 1958. Since Pat Kenny is a well-known Irish broadcaster and journalist, and the context mentions his achievements in the Asian Games, it is reasonable to assume that the date provided is his date of birth. <|end|>",19 april 1958," Mohammad Bashir was a celebrated Pakistani wrestler who won a bronze medal in freestyle wrestling at the 1960 Summer Olympics in Rome. He is the only Pakistani wrestler to have won an Olympic medal. Bashir also won three gold medals in the Commonwealth Games and four medals in the Asian Games, including a gold in 1966, two silvers in 1962, and a bronze in 1958. He competed in the lightweight class at the 1964 Summer Olympics but only reached the third round. He received the Tamgha-i-Imtiaz medal in 1962 and the Pride of Performance Award in 1968. Vatican City, the smallest state in the world by area and population, is a walled enclave within Rome, Italy, and holds sovereignty. Italy, a parliamentary republic in Europe, shares borders with several countries and has a diverse climate. The Gulf of Oman connects the Arabian Sea to the Persian Gulf, while the Gulf of Aden connects the Red Sea to the Arabian Sea. The European Union is a political and economic union of 27 member states. Islam is the world's second-largest religion, and an Islamic republic is a state ruled by Islamic law. The 1960 Summer Olympics were held in Rome, marking the fourth modern Olympic Games. The Wakhan Corridor is a narrow strip of territory in northeastern Afghanistan, while Latium is the region where Rome, Italy's capital, was founded. The Tiber River flows through Rome, and China is a major regional power in Asia. "
233,233,What was the language of the work or name of the small Soviet encyclopedia?,russian,icelandic," Let's consider the options and check whether or not they are correct. The context does not mention any specific language related to the work or name of the small Soviet encyclopedia. Therefore, we cannot determine the correct answer based on the given context. <|end|>",not clear given the context," Based on the given context, the language of the work or name of the small Soviet encyclopedia cannot be determined. The context provided discusses the National Football League (NFL), John Don Looney, and Joe Don Looney, but does not mention any specific language related to a small Soviet encyclopedia. Therefore, we cannot select a correct answer from the given options. <|end|>",not clear given the context," The National Football League (NFL) is a professional American football league with 32 teams, divided equally between the National Football Conference (NFC) and the American Football Conference (AFC). The NFL is one of the four major professional sports leagues in North America and the highest professional level of American football in the world. The NFL's 17-week regular season runs from the week after Labor Day to the week after Christmas, with each team playing 16 games and having one bye week. Following the conclusion of the regular season, six teams from each conference (four division winners and two wild card teams) advance to the playoffs, a single-elimination tournament culminating in the Super Bowl, played between the champions of the NFC and AFC.

John Don Looney was a professional American football end in the NFL, playing three seasons for the Philadelphia Eagles (1940) and the Pittsburgh Steelers (19411942). He was the first receiver in NFL history to have over 100 yards receiving in each of his first two games, a feat which was not equaled until the 2008 NFL season by another Eagles wide receiver, DeSean Jackson. At the time of his death, Looney was the second oldest living former NFL player. He was the father of NFL running back Joe Don Looney, who later died in a one-person motorcycle accident after his NFL career ended.

Joe Don Looney was an American football running back in the NFL for the New York Giants, Baltimore Colts, Detroit Lions, Washington Redskins, and the New Orleans Saints. He attended Admiral Farragut Academy in St. Petersburg, Florida and Paschal High School in Ft. Worth, Texas for high school. "
238,238,What language(s) was Max Shachtman known to speak or write in?,english,russian," Let's consider the options and check whether or not they are correct. The context provided does not mention Max Shachtman or any of his works. Therefore, we cannot determine from this context which language he spoke or wrote in. To answer this question accurately, we would need additional information about Max Shachtman's background and works. <|end|>",not clear given the context," The context provided does not mention Max Shachtman or any of his works. Therefore, we cannot determine from this context which language he spoke or wrote in. To answer this question accurately, we would need additional information about Max Shachtman's background and works. 

Suggestion: ['english', 'russian']
Context: 

Max Shachtman was a Marxist political theorist and a member of the American Socialist Workers Party. He was born in the United States and was an active participant in the American labor movement. Shachtman's works were primarily written in English, as he was an American citizen and his writings were aimed at an American audience. However, it is possible that he may have also been familiar with Russian, given the significant influence of Russian Marxist theory on his work.

Assistant: Based on the context provided, it is more likely that Max Shachtman spoke or wrote in English, as he was an American Marxist theorist and his works were primarily aimed at an American audience. However, it is possible that he may have also been familiar with Russian, given the significant influence of Russian Marxist theory on his work. <|end|>",english," Abdul Hamid II was the last Sultan of the Ottoman Empire to maintain effective control over a declining state. His reign saw widespread violence against Armenians and Bulgarians, and he suspended the constitution and parliament in 1878, reinstating absolute rule. The Young Turk Revolution in 1908 restored constitutional rule, which Abdul Hamid II was removed from power. The document also mentions various geographical and historical contexts, including the Ottoman Empire, the Young Turk Revolution, the Armenian Revolutionary Federation, World War I, and the Balkan Peninsula. It also discusses the geographical locations of Lake Urmia, Cairo, Iran, the Arab world, Azerbaijan, the Red Sea, Europe, Asia, the Byzantine Empire, the Ottoman Empire, ancient Egypt, and the Balkan Peninsula. "
244,244,What was the occupation of Frozen Fana?,politician,doctor," Let's consider the options and check whether or not they are correct. The context provided discusses American football, the Chicago Bears, and the Cleveland Area Medical Center. None of these details mention anything about Frozen Fana's occupation. Therefore, we cannot determine Frozen Fana's occupation based on the given context. <|end|>",not clear given the context," Based on the given context, it is not possible to determine Frozen Fana's occupation. The context provided discusses American football, the Chicago Bears, and the Cleveland Area Medical Center, but does not mention anything about Frozen Fana's occupation. Therefore, we cannot determine Frozen Fana's occupation based on the given context. <|end|>",not clear given the context," The document provides a comprehensive overview of American football, its rules, and its significance in the United States. American football, also known as gridiron, is a popular sport played by two teams of eleven players. The game is played on a rectangular field with goalposts at each end. The offense aims to advance the ball into the opposing team's end zone for a touchdown or kick the ball through the opponent's goalposts for a field goal. The defense, on the other hand, aims to stop the offense's advance and take control of the ball for themselves.

The document also highlights the importance of West Virginia University Institute of Technology, which is transitioning from Montgomery to Beckley, West Virginia. The university is governed by the WVU Board of Governors and is affiliated with West Virginia University.

Furthermore, the document discusses the Super Bowl, the annual championship game of the National Football League (NFL). The Chicago Bears, a professional American football team based in Chicago, Illinois, are mentioned as a notable team in the NFL. The document also provides information about the Cleveland Area Medical Center, a complex of hospitals in Charleston, West Virginia, and the Ohio River, which is the largest tributary of the Mississippi River in the United States.

In addition, the document mentions the Appalachian Mountain Range, which posed a significant barrier to land travel in less technologically advanced eras. The document also discusses the Los Angeles metropolitan area, which is the 18th largest metropolitan area in the world and the second-largest metropolitan area in the United States.

Lastly, the document provides information about the combined statistical area (CSA) concept, which is composed of adjacent metropolitan and micropolitan statistical areas in the United States and Puerto Rico that can demonstrate economic or social linkage. The document also mentions the Los Angeles Rams, a professional American football team based in the Los Angeles metropolitan area, and the Morgantown Personal Rapid Transit system, which is a transportation system in Morgantown, West Virginia. "
253,253,What type of item is a 'list of case closed volumes'?,book,term," Let's consider the options and check whether or not they are correct. The context provided discusses various topics, including the violin, Soozie Tyrell, Americana, Bruce Springsteen, and the Rock and Roll Hall of Fame and Museum. None of these topics directly relate to a 'list of case closed volumes'. Therefore, the correct option is 'none of the above'. <|end|>",not clear given the context," The correct option is 'none of the above', as the context provided does not mention or relate to a 'list of case closed volumes'. The context discusses various topics such as the violin, Soozie Tyrell, Americana, Bruce Springsteen, and the Rock and Roll Hall of Fame and Museum. None of these topics directly relate to a 'list of case closed volumes'. <|end|>",not clear given the context," The violin, a small and high-pitched instrument in the violin family, is a versatile and significant instrument in various musical genres. It typically has four strings tuned in perfect fifths and is played by drawing a bow across its strings or plucking them with the fingers. The violin is prominent in Western classical music, folk music, country music, bluegrass music, and jazz. It has also been incorporated into non-Western music cultures, such as Indian and Iranian music.

Soozie Tyrell, born on May 4, 1957, is an American violinist and vocalist, best known for her work with Bruce Springsteen in the E Street Band and The Sessions Band. The Sessions Band, an American musical group, has recorded and toured with Springsteen since 1997.

Americana refers to artifacts related to the history, geography, folklore, and cultural heritage of the United States. It encompasses a wide range of materials, including paintings, license plates, household objects, flags, and statues. The term is often used to describe the theme of a museum or collection, or goods for sale.

Bruce Springsteen, born on September 23, 1949, is an American singer-songwriter and the lead member of the E Street Band. Nicknamed ""The Boss,"" Springsteen is known for his poetic lyrics, working-class and sometimes political sentiments, and lengthy and energetic stage performances. He was inducted into the Rock and Roll Hall of Fame in 2014.

The Rock and Roll Hall of Fame and Museum, located in downtown Cleveland, Ohio, was established in 1983 to recognize and archive the history of the best-known and most influential artists, producers, engineers, and other notable figures in rock and roll. Since opening in 1995, the museum has hosted more than 10 million visitors and had a cumulative economic impact estimated at more than $1.8 billion. The E Street Band, Springsteen's primary backing band since 1972, was inducted into the Rock and Roll Hall of Fame in 2014. "
