,Unnamed: 0,query,correct,thesis,pre-antithesis,antithesis,pre-synthesis,synthesis,context
61,61,Who was the director of photography for the film 'Alila'?,renato berta,locarno international film festival," Let's consider the options and check whether or not they are correct. The context does not mention any of the options directly, but it does provide information about a film called 'Alila'. The director of photography for a film is a specific role, and it's unlikely that the director of a film would be the same as a film festival. Therefore, we can eliminate 'berlin international film festival', 'locarno international film festival', 'rainer werner fassbinder', and'renato berta' as they are not related to the role of a director of photography.

The remaining option is 'amos gitai', which is a name and could potentially be the director of photography for the film 'Alila'. Since the context does not provide any information to disprove this option, it is the most likely correct answer. <|end|>",amos gitai," The correct answer is 'henri alekan'. The context provided does not mention any of the options directly, but it does provide information about a film called 'Alila'. The director of photography for a film is a specific role, and it's unlikely that the director of a film would be the same as a film festival. Therefore, we can eliminate 'berlin international film festival', 'locarno international film festival', 'rainer werner fassbinder', and'renato berta' as they are not related to the role of a director of photography.

The remaining option is 'amos gitai', which is a name and could potentially be the director of photography for the film 'Alila'. Since the context does not provide any information to disprove this option, it is the most likely correct answer. <|end|>",henri alekan," BBC Choice, launched on September 23, 1998, was the first British TV channel to broadcast exclusively in digital format. It was the BBC's second non-terrestrial channel launch, following the BBC News channel in 1997. BBC iPlayer, an internet streaming catchup television and radio service, is available on a wide range of devices and does not display commercial advertising. BBC Three, a digital publisher and broadcaster, launched on February 16, 2016, and was originally intended as a replacement for BBC Choice. It aimed to provide innovative programming to viewers aged 16 to 34.

Dan Clark, an English actor, comedian, writer, director, and singer, is best known for playing Don Danbury in the BBC Three sitcom ""How Not to Live Your Life."" The show, which aired from September 27, 2007, to December 22, 2011, follows a neurotic twenty-nine-year-old man trying to navigate life with bad instincts. The show gained a cult following and doubled its ratings each series. The third series garnered 1.5 million viewers and was the second most watched show on BBC iPlayer. However, the show was cancelled by BBC Three controller Zai Bennett after Danny Cohen's departure. "
65,65,What was the native language of Carlo Bertinazzi?,french,italian," Let's consider the options and check whether or not they are correct. The context provided does not mention anything about Carlo Bertinazzi's native language. The information given is about Los Angeles, ice hockey, the Ohio State Buckeyes, James Witherspoon, the Los Angeles Kings, New York City, and the National Hockey League (NHL). None of these details provide any insight into Bertinazzi's native language. Therefore, based on the given context, we cannot determine the correct answer. <|end|>",not clear given the context," Based on the given context, we cannot determine the native language of Carlo Bertinazzi. The information provided focuses on Los Angeles, ice hockey, the Ohio State Buckeyes, James Witherspoon, the Los Angeles Kings, New York City, and the National Hockey League (NHL). None of these details provide any insight into Bertinazzi's native language. Therefore, we cannot select the correct answer from the given options. <|end|>",not clear given the context," Los Angeles, known as the City of Angels, is the second-most populous city in the United States, with a diverse population and a significant role in the entertainment industry. The city is surrounded by mountains and has a Mediterranean climate. Ice hockey is a popular sport played on ice, with two teams of six players each, aiming to score goals by shooting a vulcanized rubber puck into the opponent's net. The goaltender, positioned in front of the net, plays a crucial role in preventing goals and is protected by special equipment.

The Ohio State Buckeyes represent The Ohio State University in various sports, including ice hockey, which competes in the Western Collegiate Hockey Association (WCHA). The team's mascot, Brutus Buckeye, is a student dressed in Buckeye colors with a headpiece resembling an Ohio Buckeye nut.

James Witherspoon, a retired Canadian professional ice hockey defenceman, played for the Ohio State Buckeyes and briefly for the Los Angeles Kings in the National Hockey League (NHL). The Los Angeles Kings are a professional ice hockey team based in Los Angeles, a member of the Pacific Division of the Western Conference of the NHL. The team was founded in 1967 and moved to the Staples Center in Downtown Los Angeles in 19992000.

New York City, the most populous city in the United States, is a global power city with a significant impact on commerce, finance, media, art, fashion, research, technology, education, and entertainment. It is the center of the New York metropolitan area and home to the United Nations headquarters. The National Hockey League (NHL) is a professional ice hockey league with 31 member clubs, considered the premier professional ice hockey league in the world. The Stanley Cup, the oldest professional sports trophy in North America, is awarded annually to the league playoff champion. "
67,67,What languages was Titus Pomponius Atticus known to speak or write in?,latin,latin," Let's consider the options and check whether or not they are correct. The context does not mention any languages that Titus Pomponius Atticus was known to speak or write in. However, Titus Pomponius Atticus was a Roman statesman, orator, and philosopher who lived during the 1st century BC. He was known for his extensive correspondence with other prominent figures of his time, including Cicero. Given his Roman background and the time period in which he lived, it is highly likely that he was fluent in Latin, which was the common language of the Roman Republic and the Roman Empire. Greek was also a widely spoken language in the Hellenistic world, and Atticus was known to be a philosopher, which suggests that he may have had knowledge of Greek. French, on the other hand, was not a prominent language during Atticus's lifetime.

Therefore, the correct options are 'greek' and 'latin'. The candidate answer 'latin' is a correct option, but it is not the only correct option. <|end|>",greek," Question: What languages was Titus Pomponius Atticus known to speak or write in?
Options: latin, greek, french
Candidate answer: Let's consider the options and check whether or not they are correct. The context does not mention any languages that Titus Pomponius Atticus was known to speak or write in. However, Titus Pomponius Atticus was a Roman statesman, orator, and philosopher who lived during the 1st century BC. He was known for his extensive correspondence with other prominent figures of his time, including Cicero. Given his Roman background and the time period in which he lived, it is highly likely that he was fluent in Latin, which was the common language of the Roman Republic and the Roman Empire. Greek was also a widely spoken language in the Hellenistic world, and Atticus was known to be a philosopher, which suggests that he may have had knowledge of Greek. French, on the other hand, was not a prominent language during Atticus's lifetime.

Therefore, the correct options are 'greek' and 'latin'. The candidate answer 'latin' is a correct option, but it is not the only correct option. <|end|>",greek," The National Football League (NFL) is a professional American football league with 32 teams, divided equally between the National Football Conference (NFC) and the American Football Conference (AFC). The NFL is one of the four major professional sports leagues in North America and the highest professional level of American football in the world. The NFL's 17-week regular season runs from the week after Labor Day to the week after Christmas, with each team playing 16 games and having one bye week. Following the conclusion of the regular season, six teams from each conference (four division winners and two wild card teams) advance to the playoffs, a single-elimination tournament culminating in the Super Bowl, played between the champions of the NFC and AFC.

John Don Looney was a professional American football end in the NFL, playing three seasons for the Philadelphia Eagles (1940) and the Pittsburgh Steelers (19411942). He was the first receiver in NFL history to have over 100 yards receiving in each of his first two games, a feat which was not equaled until the 2008 NFL season by another Eagles wide receiver, DeSean Jackson. At the time of his death, Looney was the second oldest living former NFL player. He was the father of NFL running back Joe Don Looney, who later died in a one-person motorcycle accident after his NFL career ended.

Joe Don Looney was an American football running back in the NFL for the New York Giants, Baltimore Colts, Detroit Lions, Washington Redskins, and the New Orleans Saints. He attended Admiral Farragut Academy in St. Petersburg, Florida and Paschal High School in Ft. Worth, Texas for high school. "
69,69,What is the original language of the work titled 'Nothing So Strange'?,english,english," Let's consider the options and check whether or not they are correct. The context provided discusses the history and location of the Louisiana IceGators, a team in the Southern Professional Hockey League (SPHL). The SPHL is based in Huntersville, North Carolina, and has teams primarily located in the southeastern United States, as well as Illinois and Indiana in the midwestern United States.

The question asks for the original language of the work titled 'Nothing So Strange'. Since the context does not mention anything about the work 'Nothing So Strange', we cannot determine the original language based on the given information.

However, we can analyze the options provided: 'basic' and 'english'. The term 'basic' is not a language, but rather a level of proficiency or simplicity. On the other hand, 'english' refers to the English language.

Given the context and the options, the most likely correct answer would be 'english', as it is a language and the only language-related option provided. <|end|>",english," The correct answer is 'english', as it is the only language-related option provided and the most likely correct answer based on the context. <|end|>",english," Professional ice hockey originated in the United States in 1904 and became prominent in Canada during the early 20th century. The sport has since expanded globally, with high-level professional hockey present in Germany, Russia, Sweden, the Czech Republic, Finland, and Switzerland. Other countries with professional hockey include Ukraine, the United Kingdom, Austria, Australia, and Japan.

The Louisiana IceGators, a team in the Southern Professional Hockey League (SPHL), began play in the 2009-10 season. The team, based in Lafayette, Louisiana, was originally founded in 1995 but folded in 2005. Local businessman Danny Smith revived the team, but in August 2010, he sold it to E.C. ""Chuck"" Anselmo, Jr., and E.C. ""Chuck"" Anselmo, III. The SPHL is a professional ice hockey league based in Huntersville, North Carolina, with teams primarily located in the southeastern United States, as well as Illinois and Indiana in the midwestern United States. "
71,71,What is the term for the Dutch colonial revival architectural style?,architectural style,roof," Let's consider the options and check whether or not they are correct. The context does not mention any specific architectural style or term related to the Dutch colonial revival. However, the term 'roof' is mentioned in the context as a'structural element'. Since the question asks for the term for the Dutch colonial revival architectural style, and none of the other options seem to fit, the correct option is'style'. <|end|>",style," The correct option is 'architectural style'. The context provided does not mention any specific architectural style or term related to the Dutch colonial revival. However, the term 'roof' is mentioned as a'structural element', which does not answer the question about the term for the Dutch colonial revival architectural style. Therefore, the correct option is 'architectural style', as it is the only option that fits the context of the question. <|end|>",architectural style," Leersum, Maarn, Amerongen, Doorn, and Driebergen-Rijsenburg are towns and hamlets in the Utrecht province of the Netherlands. They are part of the municipality of Utrechtse Heuvelrug, which was formed on January 1, 2006, by merging the former municipalities. Leersum is located about 7 km east of Doorn and 9 km west of Veenendaal. Maarn is about 10 km east of Zeist. Amerongen is a village on the border of the Utrecht Hill Ridge, about 7 km southwest of Veenendaal. Doorn is a town with 10,052 inhabitants as of January 1, 2008. The Netherlands is a densely populated country in Western Europe with a population of over 17 million people. The country's capital is Amsterdam, and the seat of government and parliament is in The Hague. Holland is an informal term used to refer to the whole of the Netherlands. Beerschoten is a hamlet in the municipality of Utrechtse Heuvelrug, located between Zeist and Driebergen-Rijsenburg. The hamlet grew around the estate Beerschoten - Willinkshof. "
74,74,What was the religious affiliation of Andrew Tsien Chih-ch'un?,catholic church,roman catholic," Let's consider the options and check whether or not they are correct. The context provided does not mention Andrew Tsien Chih-ch'un or his religious affiliation. Therefore, we cannot determine the correct answer based on the given context. <|end|>",not clear given the context," Question: What was the religious affiliation of Andrew Tsien Chih-ch'un?
Options: roman catholic
Candidate answer: We cannot determine the correct answer based on the given context.
Suggestion: ['catholic', 'catholic church', 'roman catholic']
Context: New Caledonia, a French collectivity in the Pacific, is part of Melanesia and lies east of Australia and New Caledonia. It includes Grande Terre, the Loyalty Islands, and other smaller islands. Vanuatu, a Pacific island nation, is located east of New Caledonia and north of Fiji. It is a volcanic archipelago with a population of over 270,000 people.

New Zealand, an island nation in the southwestern Pacific, comprises the North Island and the South Island, along with numerous smaller islands. It is situated east of Australia and south of New Caledonia, Fiji, and Tonga. New Zealand's capital is Wellington, and its largest city is Auckland.

Fiji, an island country in Melanesia, is located northeast of New Caledonia and southwest of New Zealand. It is an archipelago with a population of over 900,000 people. Tuvalu, a Polynesian island nation, is located midway between Hawaii and Australia. It comprises three reef islands and six true atolls, with a population of 10,640 people.

Tonga, a Polynesian sovereign state, is located northeast of Fiji and southwest of Tonga. It comprises 169 islands, with a population of over 103,000 people. The Kermadec Islands, part of New Zealand, are a subtropical island arc located northeast of New Zealand's North Island. They are uninhabited, except for the Raoul Island Station.

Assistant: The correct answer cannot be determined based on the given context. <|end|>",catholic," New Caledonia, a French collectivity in the Pacific, is part of Melanesia and lies east of Australia and New Caledonia. It includes Grande Terre, the Loyalty Islands, and other smaller islands. Vanuatu, a Pacific island nation, is located east of New Caledonia and north of Fiji. It is a volcanic archipelago with a population of over 270,000 people.

New Zealand, an island nation in the southwestern Pacific, comprises the North Island and the South Island, along with numerous smaller islands. It is situated east of Australia and south of New Caledonia, Fiji, and Tonga. New Zealand's capital is Wellington, and its largest city is Auckland.

Fiji, an island country in Melanesia, is located northeast of New Caledonia and southwest of New Zealand. It is an archipelago with a population of over 900,000 people. Tuvalu, a Polynesian island nation, is located midway between Hawaii and Australia. It comprises three reef islands and six true atolls, with a population of 10,640 people.

Tonga, a Polynesian sovereign state, is located northeast of Fiji and southwest of Tonga. It comprises 169 islands, with a population of over 103,000 people. The Kermadec Islands, part of New Zealand, are a subtropical island arc located northeast of New Zealand's North Island. They are uninhabited, except for the Raoul Island Station. "
75,75,In which language was 'Green Fire' originally written?,english,instrumental," Let's consider the options and check whether or not they are correct. The context does not mention anything about the language in which 'Green Fire' was originally written. The options provided are 'english', 'french', 'german', 'hungarian', 'instrumental', and 'latin'. The candidate answer 'instrumental' is not a language, but rather a category of music. Therefore, it is not a valid option.

Since the context does not provide any information about the language of 'Green Fire', we cannot determine the correct answer from the given options. <|end|>",english," The correct answer is not provided in the given options. The question asks for the language in which 'Green Fire' was originally written, but the context does not mention this information. Therefore, we cannot determine the correct answer from the given options. <|end|>",not clear given the context," Aigle, a historic town in Switzerland, is the capital of the district of Aigle in the canton of Vaud. It is also the location of the Union Cycliste Internationale (UCI), the governing body for international cycling competitions. The Tour de San Luis, a road cycling race held in Argentina, is part of the UCI America Tour. The race features an individual time trial and six stages, and is rated 2.1 by the UCI.

Norepinephrine, also known as noradrenaline, is a hormone and neurotransmitter that functions in the brain and body. It is produced in the kidneys and affects various parts of the body. The UCI, based in Aigle, oversees international cycling events, including the Tour de San Luis.

Mattia Gavazzi, an Italian road cyclist, competed in the Tour de San Luis in 2013 after a suspension for cocaine use. Cocaine is a powerful stimulant that affects the brain's reward pathway, leading to addiction. It is made from the leaves of the coca plant, which are grown in South America. The illegal market for cocaine is estimated to be between 100 and 500 billion USD annually.

Cocaine use is a significant global issue, with between 14 and 21 million people using the drug each year. The highest usage rates are in North America, followed by Europe and South America. Cocaine use directly resulted in 4,300 deaths in 2013, up from 2,400 in 1990. The coca plant has been used by Peruvians for centuries, and cocaine was first isolated from its leaves in 1860. Since 1961, the international Single Convention on Narcotic Drugs has required countries to criminalize recreational cocaine use. "
76,76,In which language was 'The Tell-Tale Heart' originally written?,english,irish," Let's consider the options and check whether or not they are correct. The context provided discusses various geographical locations and islands, but it does not mention anything about the language in which 'The Tell-Tale Heart' was originally written. Therefore, we cannot determine the correct answer based on the given context.

To find the correct answer, we need to know that 'The Tell-Tale Heart' is a short story written by Edgar Allan Poe. It was originally published in 1843 in the literary journal 'The Pioneer'. The story was written in English, as Edgar Allan Poe was an American author who wrote primarily in English.

So, the correct answer is 'english'. <|end|>",english," The correct answer is 'english'. The context provided discusses various geographical locations and islands, but it does not mention anything about the language in which 'The Tell-Tale Heart' was originally written. Therefore, we cannot determine the correct answer based on the given context.

To find the correct answer, we need to know that 'The Tell-Tale Heart' is a short story written by Edgar Allan Poe. It was originally published in 1843 in the literary journal 'The Pioneer'. The story was written in English, as Edgar Allan Poe was an American author who wrote primarily in English.

So, the correct answer is 'english'. <|end|>",english," Cinnamon Bay is a picturesque body of water and beach located on St. John Island, within the Virgin Islands National Park in the United States Virgin Islands. The park, established in 1956, covers approximately 60% of St. John Island, over 5,500 acres of adjacent ocean, and nearly all of Hassel Island. The Leeward Islands, a group of islands in the West Indies, are situated where the northeastern Caribbean Sea meets the western Atlantic Ocean. The Lesser Antilles, also known as the Caribbees, are a group of islands in the Caribbean Sea, forming a long, partly volcanic island arc between the Greater Antilles and the continent of South America. The Caribbean region consists of the Caribbean Sea, its islands, and the surrounding coasts. The United States Virgin Islands, officially the Virgin Islands of the United States, are a group of islands in the Caribbean that are an insular area of the United States. The islands are geographically part of the Virgin Islands archipelago and are located in the Leeward Islands of the Lesser Antilles. "
79,79,What was the occupation of Itakura Shigemune?,samurai,official," Let's consider the options and check whether or not they are correct. The context does not mention Itakura Shigemune's occupation. However, Itakura Shigemune was a Japanese daimyo (feudal lord) during the Sengoku period. Therefore, the correct option is'samurai'. <|end|>",samurai," The correct option is'samurai', as it aligns with the context provided. Itakura Shigemune was a Japanese daimyo during the Sengoku period, which means he was a feudal lord. The term'samurai' refers to the military nobility and officer caste of medieval and early-modern Japan. <|end|>",official," Laurel and Hardy were a comedy duo composed of Englishman Stan Laurel and American Oliver Hardy. They became famous during the early Classical Hollywood era of American cinema, known for their slapstick comedy. Their signature tune, ""The Cuckoo Song,"" played over the opening credits of their films.

The term ""public opinion"" refers to the collective opinion of the people on an issue or problem. It has been considered important in politics since the 17th century.

The bowler hat, also known as a bob hat, bombín, or derby, is a hard felt hat with a rounded crown. It was created in 1849 and became popular with the working classes in the 19th century.

Oliver Hardy, born Oliver Norvell ""Babe"" Hardy, was an American comic actor famous as one-half of Laurel and Hardy. He appeared with his comedy partner Stan Laurel in 107 films, feature films, and cameo roles.

A featurette is a film usually of three reels in length, or about 2440 minutes in running time. It is longer than a two-reel short subject but shorter than a feature film. The term was commonly used from before the start of the sound era into the 1960s.

Comedy is a discourse or work intended to be humorous or amusing, often inducing laughter. The origins of the term can be traced back to Ancient Greece, where comic poets performed political satire at the theaters. The essential agon of comedy is a struggle between a relatively powerless youth and societal conventions that pose obstacles to his hopes.

""Outwitting Dad"" is a 1914 American comedy film that features Oliver Hardy's first onscreen appearance. ""Sailors, Beware!"" is a silent comedy short film starring Stan Laurel and Oliver Hardy prior to their official billing as the duo Laurel and Hardy. They appeared in a total of 107 films between 1921 and 1951. "
