,Unnamed: 0,query,correct,thesis,pre-antithesis,antithesis,pre-synthesis,synthesis,context
1,1,What languages did John Osteen speak or write?,english,spanish," Let's consider the options and check whether or not they are correct. The context does not provide any information about John Osteen's languages. However, we know that he is a pastor at Lakewood Church in Houston, Texas, which is located in the United States. Given this information, it is reasonable to assume that English is the language he would most likely speak or write in, as it is the primary language spoken in the United States. The other options, such as Greek, Koine Greek, Nahuatl, and Spanish, are not mentioned in the context and are less likely to be the correct options. Therefore, the correct option is 'english'. <|end|>",english," Based on the context provided, the most correct answer to the question ""What languages did John Osteen speak or write?"" is 'english'. The context does not mention any other languages that John Osteen may have spoken or written. As the pastor of Lakewood Church in Houston, Texas, it is reasonable to assume that English would be the primary language he uses for communication with his congregation and in his writings. <|end|>",english," Christianity is a monotheistic religion based on the life and teachings of Jesus Christ. It is the largest religion in the world, with over 2 billion followers. Christians believe in one God and follow the teachings of Jesus Christ, who they believe is the Son of God and the savior of humanity.

Lakewood Church is a nondenominational charismatic Christian megachurch located in Houston, Texas. It is the largest congregation in the United States, with an average attendance of about 52,000 people per week. The church is led by Joel Osteen, who is the son of John Hillery Osteen, the founder and first pastor of Lakewood Church.

Mexico is a federal republic in North America, bordered by the United States, Guatemala, Belize, the Caribbean Sea, and the Pacific Ocean. It is the most populous Spanish-speaking country in the world and the second most populous country in Latin America. Mexico is a federation comprising 31 states and a federal district that is also its capital and most populous city.

John Hillery Osteen founded Lakewood Church in Houston, Texas, in 1959. He served as the first pastor until his death in 1999. His son, Joel Osteen, succeeded him as pastor and continues to lead the church today.

Houston is the most populous city in Texas and the fourth-most populous city in the United States. It is located in Southeast Texas near the Gulf of Mexico and is the seat of Harris County. Houston is the principal city of the Houston metropolitan area, which is the fifth-most populated metropolitan area in the United States.

In summary, Christianity is a monotheistic religion based on the life and teachings of Jesus Christ, with over 2 billion followers worldwide. Lakewood Church in Houston, Texas, is the largest congregation in the United States, led by Joel Osteen, the son of John Hillery Osteen, the founder and first pastor of the church. Houston is the most populous city in Texas and the fourth-most populous city in the United States, and is the principal city of the Houston metropolitan area. "
7,7,What was Thomas Pitt's role in the context of the given options?,fictional character,year," Let's consider the options and check whether or not they are correct. The context mentions Thomas Pitt as a character in Anne Perry's historical detective fiction series. He is a police inspector and later a superintendent. He is not mentioned as a crime, fiction, monk, mother, murder, name, or year. The context also mentions Anne Perry's literary work, but it does not specify that Thomas Pitt is a literary work. The context does not mention the number five, October, or the protagonist as a series.

Based on the context, the most correct answer for Thomas Pitt's role is 'character'. <|end|>",character," The most correct answer for Thomas Pitt's role in the given context is 'character'. The context clearly states that Thomas Pitt is a character in Anne Perry's historical detective fiction series. He is a police inspector and later a superintendent. The context does not mention him as a crime, fiction, monk, mother, murder, name, or year. While Anne Perry is an author and her literary work is mentioned, it does not specify that Thomas Pitt is a literary work. The context also does not mention the number five, October, or the protagonist as a series.

Suggestion: ['character', 'crime', 'fiction', 'fictional character', 'five', 'literary work','monk','mother','murder', 'name', 'october', 'protagonist','series', 'year']

Context: Anne Perry is an English author best known for her historical detective fiction series featuring Thomas Pitt and William Monk. Born Juliet Marion Hulme on October 28, 1938, Perry was convicted of murder at the age of fifteen. After serving her five-year sentence, she changed her name and began writing.

Thomas Pitt, the protagonist of Perry's series, is a police inspector from a working-class background in Victorian London. His father was a gamekeeper on a landed estate, and Pitt was educated alongside the son of the house. Pitt's father was wrongly accused of poaching game and transported to Australia, prompting Pitt to enter the police force.

At the beginning of the series, Pitt is a police inspector, but he is later promoted to superintendent. However, he is removed from his job after investigating the ""wrong people,"" i.e., those with sufficient influence and power. He joins the Special Branch, where he becomes an inspector and later a commander as Head of Special Branch.

Pitt's wife, Charlotte Ellison, is from an upper-class family. Her sister, Emily, is married to a viscount and a rising politician. Charlotte frequently uses Emily's connections to assist Pitt in his investigations. She relies on her maid, Gracie, to take care of her children, Jemima and Daniel, when Pitt is investigating a mystery",character," Anne Perry is an English author best known for her historical detective fiction series featuring Thomas Pitt and William Monk. Born Juliet Marion Hulme on October 28, 1938, Perry was convicted of murder at the age of fifteen. After serving her five-year sentence, she changed her name and began writing.

Thomas Pitt, the protagonist of Perry's series, is a police inspector from a working-class background in Victorian London. His father was a gamekeeper on a landed estate, and Pitt was educated alongside the son of the house. Pitt's father was wrongly accused of poaching game and transported to Australia, prompting Pitt to enter the police force.

At the beginning of the series, Pitt is a police inspector, but he is later promoted to superintendent. However, he is removed from his job after investigating the ""wrong people,"" i.e., those with sufficient influence and power. He joins the Special Branch, where he becomes an inspector and later a commander as Head of Special Branch.

Pitt's wife, Charlotte Ellison, is from an upper-class family. Her sister, Emily, is married to a viscount and a rising politician. Charlotte frequently uses Emily's connections to assist Pitt in his investigations. She relies on her maid, Gracie, to take care of her children, Jemima and Daniel, when Pitt is investigating a mystery.

Vespasia Cumming-Gould, the elderly aunt of Emily's first husband, becomes a friend to both Emily and Charlotte, easing their way into society. The first novel in the series, The Cater Street Hangman, was adapted for TV in 1998.

Inspector William Monk is another fictional character created by Anne Perry. He is the hero of a series of books, and like Pitt, he is a detective who investigates crimes, often murder. "
10,10,In which administrative territorial entity is the key center south tower located?,new york,north," Let's consider the options and check whether or not they are correct. The context clearly states that the Key Center North Tower and Key Center South Tower are located in Buffalo, New York. Therefore, 'buffalo' and 'new york' are both correct options. However, the question asks specifically about the Key Center South Tower, which is located in Buffalo. The other options, such as 'center', 'erie', 'erie county', 'fountain', 'north', and'south', do not directly refer to the location of the Key Center South Tower.

Considering the context and the specificity of the question, the most correct answer is 'buffalo', as it is the administrative territorial entity where the Key Center South Tower is located. <|end|>",buffalo," The correct answer is 'buffalo', as it is the administrative territorial entity where the Key Center South Tower is located. <|end|>",buffalo," The Key Center North Tower and Key Center South Tower are high-rise buildings located in Buffalo, New York. The Key Center North Tower, standing at 275 feet (85 m) and 17 stories tall, is the eighth tallest building in Buffalo. It is connected to the Key Center South Tower, which is four stories shorter and encompasses 18,800 square feet of retail space within a two-story glass atrium. Both buildings feature distinctive pyramid tops trimmed with bright green neon lighting, which illuminates at night.

In the summer, a large fountain and reflecting pool are located in front of the towers, while in the winter, the area serves as a free outdoor ice rink for the public. Buffalo, the city where these buildings are located, is the second-most populous city in New York state, with a population of 258,703 residents. The metropolitan area has a population of 1.13 million. The Key Center at Fountain Plaza complex, which includes both towers, is a prominent landmark in Buffalo. "
11,11,How did Joe Don Looney meet his demise?,accident,accident," Let's consider the options and check whether or not they are correct. The context does not provide any information about Joe Don Looney's death. However, it does mention that Joe Don Looney, the son of John Don Looney, died in a one-person motorcycle accident after his NFL career ended. This information suggests that the correct option is 'knockout', as it refers to the motorcycle accident that led to his demise. The candidate answer 'accident' is too vague and does not specifically refer to the motorcycle accident. Therefore, the correct option is 'knockout'. <|end|>",knockout," The correct option is 'knockout', as it specifically refers to the one-person motorcycle accident that led to Joe Don Looney's demise. The candidate answer 'accident' is too vague and does not provide the necessary specificity. <|end|>",knockout," The National Football League (NFL) is a professional American football league with 32 teams, divided equally between the National Football Conference (NFC) and the American Football Conference (AFC). The NFL is one of the four major professional sports leagues in North America and the highest professional level of American football in the world. The NFL's 17-week regular season runs from the week after Labor Day to the week after Christmas, with each team playing 16 games and having one bye week. Following the conclusion of the regular season, six teams from each conference (four division winners and two wild card teams) advance to the playoffs, a single-elimination tournament culminating in the Super Bowl, played between the champions of the NFC and AFC.

John Don Looney was a professional American football end in the NFL, playing three seasons for the Philadelphia Eagles (1940) and the Pittsburgh Steelers (19411942). He was the first receiver in NFL history to have over 100 yards receiving in each of his first two games, a feat which was not equaled until the 2008 NFL season by another Eagles wide receiver, DeSean Jackson. At the time of his death, Looney was the second oldest living former NFL player. He was the father of NFL running back Joe Don Looney, who later died in a one-person motorcycle accident after his NFL career ended.

Joe Don Looney was an American football running back in the NFL for the New York Giants, Baltimore Colts, Detroit Lions, Washington Redskins, and the New Orleans Saints. He attended Admiral Farragut Academy in St. Petersburg, Florida and Paschal High School in Ft. Worth, Texas for high school. "
13,13,What sport did the Louisiana IceGators play?,ice hockey,ice hockey," Let's consider the options and check whether or not they are correct. The context mentions that the Louisiana IceGators are a team in the Southern Professional Hockey League (SPHL), which is a professional ice hockey league. Therefore, the correct option is 'ice hockey'. <|end|>",ice hockey," The correct option is 'ice hockey', as the context clearly states that the Louisiana IceGators are a team in the Southern Professional Hockey League (SPHL), which is a professional ice hockey league. <|end|>",ice hockey," Professional ice hockey originated in the United States in 1904 and became prominent in Canada during the early 20th century. The sport has since expanded globally, with high-level professional hockey present in Germany, Russia, Sweden, the Czech Republic, Finland, and Switzerland. Other countries with professional hockey include Ukraine, the United Kingdom, Austria, Australia, and Japan.

The Louisiana IceGators, a team in the Southern Professional Hockey League (SPHL), began play in the 2009-10 season. The team, based in Lafayette, Louisiana, was originally founded in 1995 but folded in 2005. Local businessman Danny Smith revived the team, but in August 2010, he sold it to E.C. ""Chuck"" Anselmo, Jr., and E.C. ""Chuck"" Anselmo, III. The SPHL is a professional ice hockey league based in Huntersville, North Carolina, with teams primarily located in the southeastern United States, as well as Illinois and Indiana in the midwestern United States. "
15,15,What is Beerschoten classified as?,village,1," Let's consider the options and check whether or not they are correct. The context mentions that Beerschoten is a hamlet in the municipality of Utrechtse Heuvelrug, which is located between Zeist and Driebergen-Rijsenburg. It also states that the hamlet grew around the estate Beerschoten - Willinkshof. This information indicates that Beerschoten is not a capital, country, province, or seat of government. It is also not a hill, island, or town. The context does not mention anything about Beerschoten being a number or a part. Therefore, the correct option is 'hamlet'. <|end|>",hill," The correct option is 'hamlet', as the context clearly states that Beerschoten is a hamlet in the municipality of Utrechtse Heuvelrug. The other options provided do not match the information given in the context. <|end|>",1," Leersum, Maarn, Amerongen, Doorn, and Driebergen-Rijsenburg are towns and hamlets in the Utrecht province of the Netherlands. They are part of the municipality of Utrechtse Heuvelrug, which was formed on January 1, 2006, by merging the former municipalities. Leersum is located about 7 km east of Doorn and 9 km west of Veenendaal. Maarn is about 10 km east of Zeist. Amerongen is a village on the border of the Utrecht Hill Ridge, about 7 km southwest of Veenendaal. Doorn is a town with 10,052 inhabitants as of January 1, 2008. The Netherlands is a densely populated country in Western Europe with a population of over 17 million people. The country's capital is Amsterdam, and the seat of government and parliament is in The Hague. Holland is an informal term used to refer to the whole of the Netherlands. Beerschoten is a hamlet in the municipality of Utrechtse Heuvelrug, located between Zeist and Driebergen-Rijsenburg. The hamlet grew around the estate Beerschoten - Willinkshof. "
17,17,What was the main subject of the film 'Prom Night II' starring Mary Lou?,supernatural,film," Let's consider the options and check whether or not they are correct. The context mentions that ""Hello Mary Lou: Prom Night II"" featured the character of Mary Lou Maloney, a killer ghost. This indicates that the main subject of the film is related to the supernatural. The other options, such as 'actor', 'film', 'francis','mary', and 'television', are not directly related to the main subject of the film. Therefore, the correct option is'supernatural'. <|end|>",supernatural," The main subject of the film 'Prom Night II' starring Mary Lou is'supernatural'. The context provided discusses the character of Mary Lou Maloney, a killer ghost, which indicates that the film's main subject revolves around supernatural elements. The other options, such as 'actor', 'film', 'francis','mary', and 'television', do not directly relate to the main subject of the film. <|end|>",supernatural," Ricky Nelson (1940-1985) was an American actor, musician, and singer-songwriter. He starred in the television series ""The Adventures of Ozzie and Harriet"" (1952-1966) alongside his family and co-starred with John Wayne and Dean Martin in the western film ""Rio Bravo"" (1959). Nelson achieved significant success in music, with 53 songs reaching the Billboard Hot 100 between 1957 and 1973, including ""Poor Little Fool,"" the first #1 song on the newly created Hot 100 chart. He recorded 19 additional Top 10 hits and was inducted into the Rock and Roll Hall of Fame in 1987.

Gene Pitney (1940-2006) was an American singer-songwriter, musician, and sound engineer. He wrote the song ""Hello Mary Lou,"" which was first recorded by Johnny Duncan in 1960 and later by Ricky Nelson in 1961. The song became a hit and was featured in the 1987 film ""Hello Mary Lou: Prom Night II,"" which introduced the character of Mary Lou Maloney, a killer ghost who returned in the sequel ""Prom Night III: The Last Kiss"" (1989).

Both Ricky Nelson and Gene Pitney were influential figures in the music industry, with Nelson's success in both acting and music and Pitney's contributions as a songwriter and musician. Their careers spanned several decades and left a lasting impact on popular culture. "
20,20,In which location is Cinnamon Bay situated?,saint john,lesser antilles," Let's consider the options and check whether or not they are correct. The context states that Cinnamon Bay is located on St. John Island, which is part of the United States Virgin Islands. The United States Virgin Islands are geographically part of the Virgin Islands archipelago and are located in the Leeward Islands of the Lesser Antilles. Therefore, the correct option is 'Lesser Antilles'. <|end|>",lesser antilles," The correct option is 'Lesser Antilles'. The context provided clearly states that the United States Virgin Islands, where Cinnamon Bay is located, are part of the Lesser Antilles. The Lesser Antilles are a group of islands in the Caribbean Sea, forming a long, partly volcanic island arc between the Greater Antilles and the continent of South America. The United States Virgin Islands are geographically part of the Virgin Islands archipelago and are located in the Leeward Islands of the Lesser Antilles. Therefore, the correct option is 'Lesser Antilles'. <|end|>",saint john," Cinnamon Bay is a picturesque body of water and beach located on St. John Island, within the Virgin Islands National Park in the United States Virgin Islands. The park, established in 1956, covers approximately 60% of St. John Island, over 5,500 acres of adjacent ocean, and nearly all of Hassel Island. The Leeward Islands, a group of islands in the West Indies, are situated where the northeastern Caribbean Sea meets the western Atlantic Ocean. The Lesser Antilles, also known as the Caribbees, are a group of islands in the Caribbean Sea, forming a long, partly volcanic island arc between the Greater Antilles and the continent of South America. The Caribbean region consists of the Caribbean Sea, its islands, and the surrounding coasts. The United States Virgin Islands, officially the Virgin Islands of the United States, are a group of islands in the Caribbean that are an insular area of the United States. The islands are geographically part of the Virgin Islands archipelago and are located in the Leeward Islands of the Lesser Antilles. "
24,24,What is the place of birth of Magnus Johansson?,gothenburg,örgryte," Let's consider the options and check whether or not they are correct. The context mentions that Ullevi Stadium, which is located in Gothenburg, Sweden, has been the venue for various sporting events. It also states that IFK Göteborg, a football club, has played its home games at Ullevi since 2009. Since IFK Göteborg is a club from Gothenburg, it is reasonable to assume that Magnus Johansson, a former footballer for IFK Göteborg, was born in Gothenburg.

The options 'central', 'of', and'sweden' are too vague and do not provide specific information about Magnus Johansson's place of birth. The option 'örgryte' is a suburb of Gothenburg, and while it is possible that Magnus Johansson was born there, the context does not mention it specifically.

Based on the information provided, the most correct answer is 'gothenburg'. <|end|>",gothenburg," The correct answer is 'gothenburg'. The context provided discusses Ullevi Stadium, which is located in Gothenburg, Sweden. It also mentions IFK Göteborg, a football club from Gothenburg, and Magnus Johansson, a former footballer for IFK Göteborg. Therefore, it is reasonable to assume that Magnus Johansson was born in Gothenburg. The other options are either too vague or not mentioned in the context. <|end|>",gothenburg," Ullevi Stadium, also known as Nya Ullevi, is a versatile multi-purpose stadium located in Gothenburg, Sweden. Originally constructed for the 1958 FIFA World Cup, Ullevi has since hosted numerous significant sporting events, including the World Allround Speed Skating Championships, the 1995 World Championships in Athletics, and the 2006 European Athletics Championships. The stadium has also been the venue for the UEFA Cup Winners' Cup finals in 1983 and 1990, the UEFA Euro 1992 final, and the UEFA Cup final in 2004.

IFK Göteborg, a prominent Swedish football club, has played its home games at Ullevi since 2009. The club, founded in 1904, is the only Nordic country club to have won a pan-European competition, with victories in the UEFA Cup in 1982 and 1987. The club's colors, blue and white, are shared with the sports society Idrottsföreningen Kamraterna (IFK), from which the club originated.

Magnus Johansson, a former footballer for IFK Göteborg, Brann, and Västra Frölunda, is a notable figure in the club's history.

The new Gamla Ullevi Stadium, which opened in 2009, replaced the city's previous main football stadium. The construction of the new stadium was met with controversy due to its cost, the perceived low standard of the finished stadium, and the name of the stadium.

Gothenburg, the second-largest city in Sweden and the fifth-largest in the Nordic countries, is home to the new Ullevi Stadium. With a population of approximately 550,000 in the urban area and 990,000 inhabitants in the metropolitan area, Gothenburg is a vibrant city located on the west coast of Sweden by the Kattegat. "
33,33,What was the country of citizenship of William Vansittart Bowater?,united kingdom,london," Let's consider the options and check whether or not they are correct. The context clearly identifies William Vansittart Bowater as a British entrepreneur, thus 'british' is probably the correct option. 'American' and 'united kingdom' are not mentioned in the context, thus they are unlikely to be the correct options. 'London' is mentioned as the location of the company's headquarters, but it does not represent the country of citizenship of William Vansittart Bowater. Therefore, the correct option is 'british'. <|end|>",british," The correct option is 'british', as the context clearly identifies William Vansittart Bowater as a British entrepreneur. The other options, 'american', 'london', and 'united kingdom', are not mentioned in the context and do not represent his country of citizenship. <|end|>",british," William Vansittart Bowater (15 March 1838 – 28 April 1907) was a British entrepreneur who founded Bowater, a company that grew to become one of the world's largest producers of newspaper print. Today, Bowater has been divided into various market-leading paper-based products businesses, including Rexam, a British-based American-owned multinational consumer packaging company. Rexam, headquartered in London, is a leading manufacturer of beverage cans with 55 plants in over 20 countries across Asia, Europe, North America, and South America.

In June 2016, Rexam was acquired by the American company Ball Corporation, which is best known for its early production of glass jars, lids, and related products used for home canning. Founded in Buffalo, New York, in 1880 as the Wooden Jacket Can Company, the Ball Corporation has expanded and diversified into other business ventures, including aerospace technology, and became the world's largest manufacturer of recyclable metal beverage and food containers.

Bowater's post-World War II expansion and a 30-year period of consolidation led to the formation of a number of globally leading worldwide paper products companies. These companies continue to build on the legacy of William Vansittart Bowater and his pioneering work in the pulp and paper industry. "
