,Unnamed: 0,query,correct,thesis,pre-antithesis,antithesis,pre-synthesis,synthesis,context
133,133,What is the sport associated with the UCI BMX World Championships?,bicycle motocross,road bicycle racing," Let's consider the options and check whether or not they are correct. The context does not mention any specific sport associated with the UCI BMX World Championships. However, the UCI BMX World Championships are a series of international competitions in the sport of BMX cycling. Therefore, the correct option is 'cycling'. <|end|>",cycling," The correct option is 'cycling', as the UCI BMX World Championships are international competitions in the sport of BMX cycling. The context provided does not mention any specific sport associated with the UCI BMX World Championships, but the UCI BMX World Championships are a series of international competitions in the sport of BMX cycling. Therefore, the correct option is 'cycling'. <|end|>",cycling," The Meech Lake Accord, negotiated in 1987 by Prime Minister Brian Mulroney and the 10 provincial premiers, aimed to persuade Quebec to endorse the 1982 constitutional amendments by providing some decentralization of the Canadian federation. The Accord was ultimately rejected, leading to the formation of the Bloc Québécois, a federal political party devoted to Quebec nationalism and the promotion of Quebec sovereignty. Lucien Bouchard, the founder of the Bloc Québécois, served as the 27th Premier of Quebec from 1996 to 2001 and was a central figure in the 1995 Quebec referendum.

The Accord's rejection highlighted the tensions between Quebec and the rest of Canada, with Quebec nationalism asserting that the Québécois people are an independent nation. The Department of Canadian Heritage, responsible for policies and programs regarding the arts, culture, media, communications networks, official languages, status of women, sports, and multiculturalism, played a role in promoting Canadian identity and unity.

Canada, the second-largest country in the world, is a federal parliamentary democracy with a constitutional monarchy. Its capital is Ottawa, and its largest city is Toronto. Montreal, the second-most populous city in Canada, is known for its distinct four-season continental climate and its role as a cultural and economic hub.

The Bloc Québécois, founded by Lucien Bouchard, has been a significant force in Canadian politics, advocating for Quebec's interests and sovereignty. The party has had representation in the House of Commons since its formation in 1993.

In summary, the Meech Lake Accord and the Bloc Québécois represent the ongoing tensions between Quebec and the rest of Canada. The Accord's rejection and the formation of the Bloc Québécois highlight the importance of Quebec nationalism and the need for a balance between decentralization and unity in the Canadian federation. "
135,135,What was the occupation of Dimitar Berbatov?,association football player,association football player," Let's consider the options and check whether or not they are correct. The context mentions Oliver Hardy as an ""American comic actor famous as one-half of Laurel and Hardy."" This indicates that he was involved in comedy, but it does not specify his occupation. The option ""association football"" is not mentioned in the context and is irrelevant to the question. The option ""association football player"" is also not mentioned in the context. However, since Oliver Hardy was a comic actor, it is reasonable to assume that his occupation was related to entertainment. Therefore, neither of the given options is correct, but the closest option related to his occupation would be ""comedian"" or ""actor."" <|end|>",association football player," The correct option is ""comedian"" or ""actor,"" as Oliver Hardy was a comic actor famous as one-half of Laurel and Hardy. Although the given options do not directly match the context, the closest related occupation would be ""comedian"" or ""actor."" <|end|>",association football player," Laurel and Hardy were a comedy duo composed of Englishman Stan Laurel and American Oliver Hardy. They became famous during the early Classical Hollywood era of American cinema, known for their slapstick comedy. Their signature tune, ""The Cuckoo Song,"" played over the opening credits of their films.

The term ""public opinion"" refers to the collective opinion of the people on an issue or problem. It has been considered important in politics since the 17th century.

The bowler hat, also known as a bob hat, bombín, or derby, is a hard felt hat with a rounded crown. It was created in 1849 and became popular with the working classes in the 19th century.

Oliver Hardy, born Oliver Norvell ""Babe"" Hardy, was an American comic actor famous as one-half of Laurel and Hardy. He appeared with his comedy partner Stan Laurel in 107 films, feature films, and cameo roles.

A featurette is a film usually of three reels in length, or about 2440 minutes in running time. It is longer than a two-reel short subject but shorter than a feature film. The term was commonly used from before the start of the sound era into the 1960s.

Comedy is a discourse or work intended to be humorous or amusing, often inducing laughter. The origins of the term can be traced back to Ancient Greece, where comic poets performed political satire at the theaters. The essential agon of comedy is a struggle between a relatively powerless youth and societal conventions that pose obstacles to his hopes.

""Outwitting Dad"" is a 1914 American comedy film that features Oliver Hardy's first onscreen appearance. ""Sailors, Beware!"" is a silent comedy short film starring Stan Laurel and Oliver Hardy prior to their official billing as the duo Laurel and Hardy. They appeared in a total of 107 films between 1921 and 1951. "
136,136,What is the country of citizenship of Susan Hill?,united kingdom,panama," Let's consider the options and check whether or not they are correct. The context does not mention anything about Susan Hill's citizenship. However, it does mention that Gothenburg, where Ullevi Stadium is located, is the second-largest city in Sweden and the fifth-largest in the Nordic countries. This information suggests that Gothenburg is in Sweden, and Sweden is part of the United Kingdom. Therefore, the correct option is 'united kingdom'. <|end|>",united kingdom," The correct option is 'united kingdom'. The context provided mentions Gothenburg, which is located in Sweden. Sweden is a part of the United Kingdom, so it is reasonable to infer that Susan Hill, being associated with Gothenburg, would have citizenship in the United Kingdom. <|end|>",united kingdom," Ullevi Stadium, also known as Nya Ullevi, is a versatile multi-purpose stadium located in Gothenburg, Sweden. Originally constructed for the 1958 FIFA World Cup, Ullevi has since hosted numerous significant sporting events, including the World Allround Speed Skating Championships, the 1995 World Championships in Athletics, and the 2006 European Athletics Championships. The stadium has also been the venue for the UEFA Cup Winners' Cup finals in 1983 and 1990, the UEFA Euro 1992 final, and the UEFA Cup final in 2004.

IFK Göteborg, a prominent Swedish football club, has played its home games at Ullevi since 2009. The club, founded in 1904, is the only Nordic country club to have won a pan-European competition, with victories in the UEFA Cup in 1982 and 1987. The club's colors, blue and white, are shared with the sports society Idrottsföreningen Kamraterna (IFK), from which the club originated.

Magnus Johansson, a former footballer for IFK Göteborg, Brann, and Västra Frölunda, is a notable figure in the club's history.

The new Gamla Ullevi Stadium, which opened in 2009, replaced the city's previous main football stadium. The construction of the new stadium was met with controversy due to its cost, the perceived low standard of the finished stadium, and the name of the stadium.

Gothenburg, the second-largest city in Sweden and the fifth-largest in the Nordic countries, is home to the new Ullevi Stadium. With a population of approximately 550,000 in the urban area and 990,000 inhabitants in the metropolitan area, Gothenburg is a vibrant city located on the west coast of Sweden by the Kattegat. "
138,138,What languages did Idrissa Ouedraogo speak or write in?,french,mossi," Question: What languages did Idrissa Ouedraogo speak or write in?
Options: ['french','mossi']
Candidate answer: mossi
Context: Idrissa Ouedraogo was a Burkinabé film director, screenwriter, and actor. He was born in Ouagadougou, Burkina Faso, and is known for his work in the film industry, particularly in Burkina Faso.

Based on the context provided, it is clear that Idrissa Ouedraogo was from Burkina Faso, a country in West Africa where the Mossi language is widely spoken. French is also spoken in Burkina Faso, as it is the official language of the country. Therefore, it is likely that Idrissa Ouedraogo spoke and wrote in both French and Mossi.

However, since the context does not explicitly mention which language he spoke or wrote in, we cannot definitively choose between the two options. Both French and Mossi are plausible answers based on the information provided. <|end|>",mossi," Question: What languages did Idrissa Ouedraogo speak or write in?
Options: ['french','mossi']
Candidate answer: mossi
Context: Idrissa Ouedraogo was a Burkinabé film director, screenwriter, and actor. He was born in Ouagadougou, Burkina Faso, and is known for his work in the film industry, particularly in Burkina Faso.

Based on the context provided, it is clear that Idrissa Ouedraogo was from Burkina Faso, a country in West Africa where the Mossi language is widely spoken. French is also spoken in Burkina Faso, as it is the official language of the country. Therefore, it is likely that Idrissa Ouedraogo spoke and wrote in both French and Mossi.

However, since the context does not explicitly mention which language he spoke or wrote in, we cannot definitively choose between the two options. Both French and Mossi are plausible answers based on the information provided. 

Suggestion: ['french','mossi'] <|end|>",french," Johns Hopkins University, founded in 1876 by philanthropist Johns Hopkins, is an American private research university in Baltimore, Maryland. It was the first research university in the United States, integrating teaching and research. The university's first president, Daniel Coit Gilman, revolutionized higher education in the U.S. by adopting the concept of a graduate school from Germany's Heidelberg University.

John Auer, an American physiologist and pharmacologist, was a graduate of Johns Hopkins School of Medicine and worked closely with physiologist Samuel James Meltzer at the Rockefeller Institute for Medical Research. Auer is known for his research on the correlation between bronchial asthma and foreign substances, the effects of magnesium on tetany, and the first account of allergic inflammations caused by exposure to xylene, known as Auer's phenomena.

The Johns Hopkins University School of Medicine, located in Baltimore, Maryland, is the academic medical teaching and research arm of Johns Hopkins University. It has consistently been among the nation's top medical schools in the number of research grants awarded by the National Institutes of Health. The school's major teaching hospital, the Johns Hopkins Hospital, was ranked the #1 hospital in the United States for 22 years by ""U.S. News & World Report"". The hospital and school are the founding institutions of modern American medicine and the birthplace of numerous medical traditions, including rounds, residents, housestaff, neurosurgery, cardiac surgery, pediatrics, and child psychiatry.

Lake Ontario, one of the five Great Lakes of North America, is surrounded by the Canadian province of Ontario and the American state of New York. The lake's primary inlet is the Niagara River from Lake Erie, and its outlet to the Atlantic Ocean via the St. Lawrence River. The lake was named for the Huron (Wyandot) language word ""ontarío,"" meaning Lake of Shining Waters. "
140,140,In which genre does the concept of 'fear' play a key role?,book,three," Let's consider the options and check whether or not they are correct. The context does not mention the concept of 'fear' playing a key role in any of the given genres. The context discusses the historical and religious significance of Mary Magdalene, the art form of music, and the works of Vivian Stanshall and Ki Longfellow. None of these topics directly relate to the concept of 'fear' in any of the given genres. Therefore, the correct option is 'none of the above'. <|end|>",not clear given the context," The correct option is 'none of the above' since the context provided does not mention the concept of 'fear' playing a key role in any of the given genres. The context discusses the historical and religious significance of Mary Magdalene, the art form of music, and the works of Vivian Stanshall and Ki Longfellow. None of these topics directly relate to the concept of 'fear' in any of the given genres. <|end|>",not clear given the context," Magdala, an ancient city in Galilee, is mentioned in the Jewish Talmud and the Christian New Testament. The New Testament, a significant part of Christian scripture, discusses Jesus' teachings and his relationship with Mary Magdalene. The Old Testament, the first section of the Christian Bible, is based on the Hebrew Bible and varies in canon among different Christian Churches.

Mary Magdalene, a key figure in Christianity, is said to have been a follower of Jesus and witnessed his crucifixion and resurrection. She is mentioned at least 12 times in the four Gospels, more than most of the apostles.

Music, an art form and cultural activity, uses sound and silence, and its common elements include pitch, rhythm, dynamics, and timbre. It can be performed with various instruments and vocal techniques, and its definition varies among ancient Greek and Indian philosophers.

Vivian Stanshall, an English musician, songwriter, and author, is best known for his work with the Bonzo Dog Doo-Dah Band and his exploration of the British upper classes in ""Sir Henry at Rawlinson End."" He was also the widow of Ki Longfellow, an American novelist and playwright known for her novel ""The Secret Magdalene."" Longfellow's work explores the divine feminine and challenges traditional views of events chronicled in the New Testament. "
141,141,What languages was George Cubitt known to speak or write in?,english,serbian," Let's consider the options and check whether or not they are correct. The context does not mention George Cubitt at all, so we cannot determine from this context which languages he spoke or wrote in. Therefore, we cannot definitively choose an option based on the given context. <|end|>",not clear given the context," Question: What languages was George Cubitt known to speak or write in?
Options: serbian
Candidate answer: The context provided does not mention George Cubitt at all, so we cannot determine from this context which languages he spoke or wrote in. Therefore, we cannot definitively choose an option based on the given context.

Suggestion: ['english', 'greek','serbian']
Context: Laurie Anderson, an American avant-garde artist, composer, musician, and film director, has been a prominent figure in the art world since the 1970s. Initially trained in violin and sculpting, Anderson's work has spanned performance art, pop music, and multimedia projects. She gained widespread recognition in 1981 when her single ""O Superman"" reached number two on the UK pop charts. Anderson also starred in and directed the 1986 concert film ""Home of the Brave.""

The avant-garde, characterized by nontraditional, aesthetic innovation, and initial unacceptability, often offers a critique of the relationship between producer and consumer. Karen Bernstein, a Canadian voice actress, is best known for voicing Sailor Mercury in the American dubbing of the first two seasons of ""Sailor Moon."" The manga series was adapted into an anime series, which was broadcast in Japan from 1992 to 1997 and has since been licensed for English language release in North America and Australia/New Zealand.

""Atomic Ed and the Black Hole"" is a documentary released in 2001 by filmmaker Ellen Spiro. The documentary, produced for HBO's Cinemax Reel Life Series, features Laurie Anderson's song ""Big Science"" in its soundtrack. The film follows Ed Grothus, a machinist turned atomic junk collector, who has amassed a collection of non-radioactive high-tech nuclear waste discarded from the Los Alamos National Laboratory. His collection reveals and preserves the history of government waste that was literally thrown in a trash heap.

Performance art, a form of fine art, involves presenting a performance to an audience within a fine art context. It can be scripted or un",greek," Laurie Anderson, an American avant-garde artist, composer, musician, and film director, has been a prominent figure in the art world since the 1970s. Initially trained in violin and sculpting, Anderson's work has spanned performance art, pop music, and multimedia projects. She gained widespread recognition in 1981 when her single ""O Superman"" reached number two on the UK pop charts. Anderson also starred in and directed the 1986 concert film ""Home of the Brave.""

The avant-garde, characterized by nontraditional, aesthetic innovation, and initial unacceptability, often offers a critique of the relationship between producer and consumer. Karen Bernstein, a Canadian voice actress, is best known for voicing Sailor Mercury in the American dubbing of the first two seasons of ""Sailor Moon."" The manga series was adapted into an anime series, which was broadcast in Japan from 1992 to 1997 and has since been licensed for English language release in North America and Australia/New Zealand.

""Atomic Ed and the Black Hole"" is a documentary released in 2001 by filmmaker Ellen Spiro. The documentary, produced for HBO's Cinemax Reel Life Series, features Laurie Anderson's song ""Big Science"" in its soundtrack. The film follows Ed Grothus, a machinist turned atomic junk collector, who has amassed a collection of non-radioactive high-tech nuclear waste discarded from the Los Alamos National Laboratory. His collection reveals and preserves the history of government waste that was literally thrown in a trash heap.

Performance art, a form of fine art, involves presenting a performance to an audience within a fine art context. It can be scripted or unscripted, random or carefully planned, and may involve audience participation. Performance art can take place anywhere, in any venue or setting, and can last for any length of time. The actions of an individual or group at a particular place and time constitute the work. "
144,144,In which language were the original works that discuss 'fires were started' written?,english,latin," Let's consider the options and check whether or not they are correct. The context does not mention any specific language in which the original works discussing 'fires were started' were written. The information provided is about Green River, a rock band from Seattle, and their debut album ""Rehab Doll."" It also mentions the Pacific Ocean, Seattle, Homestead Records, and Sub Pop Records. None of these details provide any information about the language of the original works. Therefore, based on the given context, it is impossible to determine the correct language. <|end|>",not clear given the context," Based on the given context, it is impossible to determine the language in which the original works discussing 'fires were started' were written. The information provided focuses on Green River, a rock band from Seattle, and their debut album ""Rehab Doll."" It also mentions the Pacific Ocean, Seattle, Homestead Records, and Sub Pop Records. None of these details provide any information about the language of the original works. Therefore, the correct answer cannot be determined from the given context. <|end|>",not clear given the context," Green River, an American rock band from Seattle, Washington, released their debut studio album ""Rehab Doll"" in June 1988 through Sub Pop Records. The album, which is considered the first grunge record, features the song ""Swallow My Pride,"" written by frontman Mark Arm and guitarist Steve Turner. The song was originally recorded for the band's debut EP ""Come on Down"" in 1985.

The Pacific Ocean, the largest oceanic division, is bounded by the Arctic Ocean in the north, the Southern Ocean in the south, and the continents of Asia and Australia in the west, and the Americas in the east. Seattle, a seaport city in King County, Washington, is situated on an isthmus between Puget Sound and Lake Washington, and is the largest city in the Pacific Northwest region of North America.

Homestead Records, a Long Island, New York-based sublabel of Dutch East India Trading, played a significant role in launching the post-hardcore and noise rock genres. The label was founded in 1984 by Sam Berger, who recommended Gerard Cosloy to take over the label after he left to work with Midnight Records. Cosloy signed many notable acts, including Green River.

Sub Pop Records, founded by Bruce Pavitt in 1986, gained fame in the late 1980s for signing Nirvana, Soundgarden, Mudhoney, and other bands from the Seattle alternative rock scene. The label's last release was Ivo Perelman's ""Cama de terra"" in 1996.

In summary, Green River's ""Rehab Doll"" album, released in 1988, is considered the first grunge record, featuring the song ""Swallow My Pride."" The album was released through Sub Pop Records, a label that played a significant role in launching the grunge movement. Seattle, the city where Green River originated, is a major gateway for trade with Asia and is the largest city in the Pacific Northwest region of North America. "
147,147,In what year was Boca Juniors-Carolina founded?,2008,1913," Let's consider the options and check whether or not they are correct. The context provided does not mention anything about Boca Juniors-Carolina, as it discusses the second studio album by American rapper Krayzie Bone. Therefore, none of the options provided are relevant to the context given. The correct answer cannot be determined from the given context. <|end|>",not clear given the context," The correct answer is '2001', as the context provided discusses the release of Krayzie Bone's second studio album, Thug on da Line, which was released in 2001. The other options are not relevant to the context given. <|end|>",200," Thug on da Line is the second studio album by American rapper Krayzie Bone, released in 2001. The album features the single ""Hard Time Hustlin'"" with Sade and includes tracks with guest appearances from Eazy-E, Ice Cube, and Dr. Dre. The album also features Flesh-n-Bone, who was later convicted of assault and spent time in prison. The album was produced by L.T. Hutton, who has worked with various artists including Bone Thugs-N-Harmony and 2Pac. The album was released by Thugline Records, Ruthless Records, and Loud Records, with distribution from Columbia Records and Sony Music. The album reached number 13 on the U.S. Rap chart and number 61 on the U.S. R&B chart. "
149,149,In which location did Turar Ryskulov pass away?,moscow,yekaterinburg," Let's consider the options and check whether or not they are correct. The context does not mention Turar Ryskulov or any location related to his death. Therefore, we cannot determine the correct answer based on the given context. <|end|>",not clear given the context," Based on the given context, the correct answer is 'yekaterinburg'. The context does not mention Turar Ryskulov or any location related to his death. Therefore, we cannot determine the correct answer based on the given context. <|end|>",yekaterinburg," The European People's Party (EPP) is a transnational European political party composed of Christian democratic and liberal-conservative parties. Founded in 1976, it has expanded to include parties with centre-right perspectives. The EPP is a member of the International Democrat Union (IDU) and the Centrist Democrat International (CDI), which was renamed in 1982.

Christian democracy is a political ideology that emerged in 19th-century Europe, combining traditional Catholic beliefs with modern democratic ideas. It incorporates social teachings from various Christian denominations and has been influential in Europe and Latin America.

The Christian Democratic Movement (KDH) is a Christian democratic political party in Slovakia. It is a member of the EPP and observer of the CDI. The KDH was established in 1990 and has been led by Ján Fige since 2000. The party has been represented in the Slovak parliament and was part of the government coalition until 2006. In the 2012 parliamentary election, the KDH received 8.82% of the vote and 16 seats in the National Council. In the 2014 European elections, the KDH received 13.21% of the vote and elected 2 MEPs.

The IDU is an international alliance of centre-right political parties, chaired by John Key, former Prime Minister of New Zealand. It comprises 71 full and associate members from 63 countries. The CDI, now known as the Centrist Democrat International, is a global political group dedicated to promoting Christian democracy. Its members are primarily from Europe and Latin America. "
