,query,correct,thesis,pre-antithesis,antithesis,pre-synthesis,synthesis,context
0,The Oberoi family is part of a hotel company that has a head office in what city?,delhi,mumbai," Assistant: Let's analyze the options given and the context provided. The context states that 'The Oberoi Group is a hotel company with its head office in Delhi.' Therefore, the correct option is 'Delhi', not 'Mumbai'. The candidate answer 'Mumbai' is incorrect based on the context provided. <|end|>",delhi," The correct option is 'Delhi', as the context clearly states that The Oberoi Group, which is associated with the Oberoi family, has its head office in Delhi. The candidate answer 'Mumbai' is incorrect based on the given context. <|end|>",delhi,"The Oberoi family is an Indian family that is famous for its involvement in hotels, namely through The Oberoi Group. The Oberoi Group is a hotel company with its head office in Delhi."
1,"Musician and satirist Allie Goertz wrote a song about the ""The Simpsons"" character Milhouse, who Matt Groening named after who?",president richard nixon,president abraham lincoln," Assistant: Let's analyze the options and the context provided. The context states that Milhouse was named after President Richard Nixon's middle name. Therefore, the correct option is 'President Richard Nixon', not 'President Abraham Lincoln'. The candidate answer is incorrect based on the context provided. <|end|>",president richard nixon," The correct option is 'President Richard Nixon', as the context clearly states that Milhouse was named after President Richard Nixon's middle name. The candidate answer 'President Abraham Lincoln' is incorrect based on the context provided. <|end|>",president richard nixon,"She is co-host of Everything's Coming Up Podcast, a Simpsons-focused podcast along with Julia Prescott. Milhouse Mussolini van Houten is a fictional character featured in the animated television series ""The Simpsons"", voiced by Pamela Hayden, and created by Matt Groening who named the character after President Richard Nixon's middle name."
2, What nationality was James Henry Miller's wife?,american,british," Assistant: To answer this question, we need to find information about James Henry Miller's wife in the given context. The context mentions that James Henry Miller, also known as Ewan MacColl, was an English folk singer. However, it does not provide any information about his wife's nationality.

The context also mentions Margaret ""Peggy"" Seeger, an American folksinger, but it does not explicitly state that she was Ewan MacColl's wife.

Without additional information, we cannot determine the nationality of James Henry Miller's wife. <|end|>",american," Based on the context provided, we can infer that James Henry Miller, also known as Ewan MacColl, was an English folk singer. However, the context does not explicitly mention the nationality of his wife. It does mention Margaret ""Peggy"" Seeger, an American folksinger, but does not state that she was Ewan MacColl's wife.

To answer the question accurately, we would need additional information about Ewan MacColl's marital status and the nationality of his wife.

Without this information, we cannot determine the nationality of James Henry Miller's wife. <|end|>",american,"James Henry Miller (25 January 1915 – 22 October 1989), better known by his stage name Ewan MacColl, was an English folk singer, songwriter, communist, labour activist, actor, poet, playwright and record producer. Margaret ""Peggy"" Seeger (born June 17, 1935) is an American folksinger."
3,"Cadmium Chloride is slightly soluble in this chemical, it is also called what?",alcohol,sodium chloride," Assistant: Let's analyze the options given. The context states that Cadmium Chloride is'slightly soluble in alcohol'. This means that the correct answer should be 'alcohol'. However, the candidate answer is 'Sodium Chloride', which is not mentioned in the context at all. Therefore, the correct option is 'alcohol'. <|end|>",alcohol," The correct option is 'alcohol', as it is mentioned in the context that Cadmium Chloride is slightly soluble in alcohol. The candidate answer 'Sodium Chloride' is not mentioned in the context and is therefore incorrect. <|end|>",alcohol,"It is a hygroscopic solid that is highly soluble in water and slightly soluble in alcohol.
Also known are CdCl•HO and CdCl•5HO. Ethanol, also called alcohol, ethyl alcohol, and drinking alcohol, is a compound and simple alcohol with the chemical formula C2H5OH ."
4,Which genus of moth in the world's seventh-largest country contains only one species?,crambidae,lepidoptera," Assistant: To answer this question, we need to understand the context and the options provided. The context mentions 'Indogrammodes', which is a genus of moths belonging to the Crambidae family. A genus is a rank in the biological classification (taxonomy) that groups together species that share common characteristics. The context does not mention Lepidoptera, but it is important to note that Lepidoptera is not a genus, but an order that includes moths and butterflies.

Now, let's analyze the options. The first option, 'Crambidae', is a family of moths, not a genus. The second option, 'Lepidoptera', is an order that includes moths and butterflies, not a genus.

Since the context mentions 'Indogrammodes' as a genus of moths in the Crambidae family, and we are looking for a genus that contains only one species, the correct answer is not provided in the options. However, based on the information given, we can infer that 'Indogrammodes' is the genus of moths in the Crambidae family that contains only one species. <|end|>",crambidae," The correct answer is not provided in the options. However, based on the context, the genus of moths in the Crambidae family that contains only one species is 'Indogrammodes'. The options given are 'Crambidae' and 'Lepidoptera', which are not the correct genus. 'Crambidae' is the family of moths, and 'Lepidoptera' is the order that includes moths and butterflies. <|end|>",crambidae,India's Andaman and Nicobar Islands share a maritime border with Thailand and Indonesia. Indogrammodes is a genus of moths of the Crambidae family.
5,"Who was once considered the best kick boxer in the world, however he has been involved in a number of controversies relating to his ""unsportsmanlike conducts"" in the sport and crimes of violence outside of the ring.",badr hari,floyd mayweather jr.," Let's analyze the options and the context provided. The context talks about Badr Hari, a Moroccan-Dutch super heavyweight kickboxer, and his achievements in the sport. However, it does not mention any controversies or unsportsmanlike conducts related to him.

On the other hand, Floyd Mayweather Jr. is a professional boxer, not a kickboxer. Although he has had some controversies in his career, they are not related to kickboxing.

Therefore, based on the context provided, neither of the options seems to be the correct answer. However, if we consider the question outside the context, Badr Hari has been involved in several controversies related to unsportsmanlike conducts in kickboxing and crimes outside of the ring. So, the correct answer would be Badr Hari. <|end|>",badr hari," Based on the context provided, the correct answer is Badr Hari. The context highlights Badr Hari's achievements in kickboxing, including being a former K-1 Heavyweight champion and It's Showtime Heavyweight world champion. The context also mentions that he has been involved in controversies related to unsportsmanlike conducts in kickboxing and crimes outside of the ring.

Floyd Mayweather Jr., on the other hand, is a professional boxer and not a kickboxer. While he has had controversies in his career, they are not related to kickboxing.

Therefore, the correct answer is Badr Hari. <|end|>",badr hari,"Badr Hari (Arabic: بدر هاري‎ ‎ ; born 8 December 1984) is a Moroccan-Dutch super heavyweight kickboxer from Amsterdam, fighting out of Mike's Gym in Oostzaan.
He is a former K-1 Heavyweight champion (2007—2008), It's Showtime Heavyweight world champion (2009-2010) and ""K-1 World Grand Prix 2009"" finalist.
Fighters from around world on the roster include Badr Hari, Peter Aerts, Peter Graham, Dewey Cooper, Zabit Samedov.
It was considered as one of the biggest kickboxing and MMA promotion in Middle East.
<ref name=""Emirates 24/7""> </ref>"
6,"The Dutch-Belgian television series that ""House of Anubis"" was based on first aired in what year?",2006,2006," Assistant: Let's analyze the context to find the correct answer. The context states that ""Het Huis Anubis"" first aired in September 2006 and the last episode was broadcast on December 4, 2009. Therefore, the correct option is '2006'. <|end|>",2006," The correct option is '2006', as the context clearly states that ""Het Huis Anubis"" first aired in September 2006. <|end|>",2006,"House of Anubis is a mystery television series developed for Nickelodeon based on the Dutch-Belgian television series ""Het Huis Anubis"".
The show aired from 1 January 2011 to 17 June 2013. Het Huis Anubis (""The House of Anubis"") is a Belgian-Dutch children's television drama created by Studio 100 and Nickelodeon, airing in the Netherlands and Flanders.
It first aired in September 2006 and the last episode was broadcast on December 4, 2009."
7,What is the length of the track where the 2013 Liqui Moly Bathurst 12 Hour was staged?,6.213 km long,5.5 km long," Let's analyze the options and the context provided. The context states that the Mount Panorama Circuit, where the 2013 Liqui Moly Bathurst 12 Hour was held, is '6.213 km long'. Therefore, the correct option is '6.213 km long'. The candidate answer '5.5 km long' is not supported by the context. <|end|>",6.213 km long," The correct option is '6.213 km long', as it is supported by the context provided. The Mount Panorama Circuit, where the 2013 Liqui Moly Bathurst 12 Hour was held, is stated to be 6.213 km long. The candidate answer '5.5 km long' is not accurate according to the context. <|end|>",6.213 km long,"Mount Panorama Circuit is a motor racing track located in Bathurst, New South Wales, Australia.
It is situated on a hill with the dual official names of Mount Panorama and Wahluu and is best known as the home of the Bathurst 1000 motor race held each October, and the Bathurst 12 Hour event held each February.
The 6.213 km long track is technically a street circuit, and is a public road, with normal speed restrictions, when no racing events are being run, and there are many residences which can only be accessed from the circuit. The 2013 Liqui Moly Bathurst 12 Hour was an endurance race for a variety of GT and touring car classes, including: GT3 cars, GT4 cars, Group 3E Series Production Cars and Dubai 24 Hour cars."
8,"Fast Cars, Danger, Fire and Knives includes guest appearances from which hip hop record executive?",jaime meline,camu tao," Let's analyze the options and the context provided. The context mentions that 'Fast Cars, Danger, Fire and Knives' is an EP by Aesop Rock and that it features guest appearances from Camu Tao and Metro of S.A. Smash, as well as El-P. The candidate answer is 'Camu Tao', which is indeed mentioned in the context as a guest appearance on the EP. Therefore, the correct option is 'Camu Tao'. <|end|>",camu tao," The correct option is 'Camu Tao', as the context provided confirms that Camu Tao made a guest appearance on the EP 'Fast Cars, Danger, Fire and Knives' by Aesop Rock. <|end|>",camu tao,"Jaime Meline (born March 2, 1975), better known by his stage name El-P (shortened from El Producto), is an American hip hop recording artist, record producer, and record executive.
Originally a member of Company Flow, El-P has been a major driving force in alternative hip hop for more than two decades, producing for several notable rappers such as Aesop Rock, Mr. Lif, and Cage, among others. Fast Cars, Danger, Fire and Knives is an EP by American hip hop artist Aesop Rock.
Vocals are handled by Aesop Rock, with guest appearances from Camu Tao and Metro of S.A. Smash and Definitive Jux label head El-P."
9,"Gunmen from Laredo starred which narrator of ""Frontier""?",walter darwin coy,robert knapp," Assistant: Let's analyze the context provided. The context states that ""Gunmen from Laredo"" is a film that stars Robert Knapp, Maureen Hingert, and Walter Coy. The question asks for the narrator of ""Frontier"", not the star of ""Gunmen from Laredo"". However, the context does not provide any information about the narrator of ""Frontier"". Therefore, based on the given context, we cannot determine whether Robert Knapp or Walter Coy is the narrator of ""Frontier"". <|end|>",walter darwin coy," Based on the context provided, we can see that Walter Coy is one of the stars of ""Gunmen from Laredo"". However, the context does not mention anything about the narrator of ""Frontier"". Therefore, we cannot determine whether Robert Knapp or Walter Coy is the narrator of ""Frontier"" based on the given information. <|end|>",walter darwin coy,"Gunmen from Laredo is a 1959 American western film produced and directed by Wallace MacDonald, which stars Robert Knapp, Maureen Hingert, and Walter Coy. Walter Darwin Coy (January 31, 1909 – December 11, 1974) was an American stage, radio, film, and, principally, television actor, originally from Great Falls, Montana."
10,Where did the form of music played by Die Rhöner Säuwäntzt originate?,united states,united kingdom," Let's analyze the context provided. The context mentions that Skiffle is a music genre that originated in the United States in the first half of the 20th century and became popular again in the UK in the 1950s. Die Rhöner Säuwäntzt is a Skiffle-Blues band from Germany, which means they play a form of music that originated in the United States. Therefore, the correct option is 'United States'. <|end|>",united states," The correct option is 'United States', as the context provided indicates that Skiffle, the music genre played by Die Rhöner Säuwäntzt, originated in the United States in the first half of the 20th century. <|end|>",united states,"Skiffle is a music genre with jazz, blues, folk and American folk influences, usually using a combination of manufactured and homemade or improvised instruments.
Originating as a term in the United States in the first half of the 20th century, it became popular again in the UK in the 1950s, where it was associated with artists such as Lonnie Donegan, The Vipers Skiffle Group, Ken Colyer and Chas McDevitt.
Skiffle played a major part in beginning the careers of later eminent jazz, pop, blues, folk and rock musicians and has been seen as a critical stepping stone to the second British folk revival, blues boom and British Invasion of the US popular music scene. Die Rhöner Säuwäntzt are a Skiffle-Bluesband from Eichenzell-Lütter in Hessen, Germany.
The line-up consists of Martin Caba, Christoph Günther and Christoph Leipold playing Skiffle-Blues with lyrics based on Rhön Mountains dialect and other Hessian dialects varieties."
11,In which American football game was Malcolm Smith named Most Valuable player?,super bowl xlviii,super bowl xlvii," Assistant: Let's analyze the options and the context provided. The context states that Malcolm Smith was named the Most Valuable Player of Super Bowl XLVIII, where the Seattle Seahawks defeated the Denver Broncos. This information directly matches the first option, 'Super Bowl XLVIII'. The second option, 'Super Bowl XLVII', is not mentioned in the context. Therefore, the correct option is 'Super Bowl XLVIII'. <|end|>",super bowl xlviii," The correct option is 'Super Bowl XLVIII', as the context provided states that Malcolm Smith was named the Most Valuable Player of Super Bowl XLVIII, where the Seattle Seahawks defeated the Denver Broncos. <|end|>",super bowl xlviii,"Malcolm Xavier Smith (born July 5, 1989) is an American football linebacker for the San Francisco 49ers of the National Football League (NFL).
Smith was named the Most Valuable Player of Super Bowl XLVIII after they defeated the Denver Broncos. Super Bowl XLVIII was an American football game between the American Football Conference (AFC) champion Denver Broncos and National Football Conference (NFC) champion Seattle Seahawks to decide the National Football League (NFL) champion for the 2013 season."
12,"What U.S Highway gives access to Zilpo Road, and is also known as Midland Trail?",us 60,us 50," Assistant: Let's analyze the options and the context provided. The context states that Zilpo Road can be accessed by U.S. Highway 60, which is also known as the historic Midland Trail. Therefore, the correct option is 'US 60'. The option 'US 50' is not mentioned in the context, so it is unlikely to be the correct option. Hence, the correct answer is 'US 60'. <|end|>",us 60," The correct option is 'US 60', as it is mentioned in the context that Zilpo Road can be accessed by U.S. Highway 60, which is also known as the historic Midland Trail. The option 'US 50' is not mentioned in the context, so it is not the correct answer. <|end|>",us 60,"Zilpo Road is a National Forest Scenic Byway in the forested hills of eastern Kentucky, United States.
The nine mile byway starts south of Morehead, Kentucky and can be accessed by U.S. Highway 60.
It follows FSR 918, which is a two lane paved road suitable for all motor vehicles and is usually open throughout the year. Morehead is a home rule-class city located along US 60 (the historic Midland Trail) and Interstate 64 in Rowan County, Kentucky, in the United States.
It is the seat of its county."
13,"The 1988 American comedy film, The Great Outdoors, starred a four-time Academy Award nominee, who received a star on the Hollywood Walk of Fame in what year?",2006,2006," Assistant: Let's analyze the context provided. The context mentions that Annette Carol Bening, an American actress, received a star on the Hollywood Walk of Fame in 2006. The question asks about the year the star was received by the four-time Academy Award nominee who starred in the 1988 film, The Great Outdoors. Since Annette Carol Bening is the only person mentioned in the context and she received her star in 2006, the correct option is '2006'. <|end|>",2006," The correct option is '2006', as the context states that Annette Carol Bening, who starred in The Great Outdoors, received a star on the Hollywood Walk of Fame in 2006. <|end|>",2006,"Annette Carol Bening (born May 29, 1958) is an American actress.
In 2006, she received a star on the Hollywood Walk of Fame. The Great Outdoors is a 1988 American comedy film directed by Howard Deutch, and written and produced by John Hughes."
14,What are the names of the current members of  American heavy metal band who wrote the music for  Hurt Locker The Musical? ,"hetfield and ulrich, longtime lead guitarist kirk hammett, and bassist robert trujillo.",the music for hurt locker the musical," Assistant: The context provided does not mention any members of the American heavy metal band Metallica writing the music for ""Hurt Locker The Musical"". Instead, it states that the music was written by Stephen R. Schwartz, who is the real name of ""Hedwig"" songwriter Stephen Trask. Therefore, the correct answer is not among the options provided. <|end|>","hetfield and ulrich, longtime lead guitarist kirk hammett, and bassist robert trujillo."," The correct answer is not among the options provided. The context states that the music for ""Hurt Locker The Musical"" was written by Stephen R. Schwartz, also known as Stephen Trask, who is the songwriter for ""Hedwig and the Angry Inch"". Metallica, the American heavy metal band, is not mentioned as having written the music for this musical. <|end|>","hetfield and ulrich, longtime lead guitarist kirk hammett, and bassist robert trujillo.","Hurt Locker The Musical is a fictional musical in the 2014 Broadway premiere production of ""Hedwig and the Angry Inch"".
The Playbills, which describe the musical as having ""explosions, negligible storytelling, camouflage and tits"", also state that the musical's cast included actors such as Taye Diggs (who would go on to play the role of Hedwig in the summer of 2015) and that the music was written by Metallica and Stephen R. Schwartz, which is the real name of ""Hedwig"" songwriter Stephen Trask. Metallica is an American heavy metal band based in San Rafael, California.
The band was formed in 1981 in Los Angeles when vocalist/guitarist James Hetfield responded to an advertisement posted by drummer Lars Ulrich in a local newspaper.
Metallica's current lineup comprises founding members Hetfield and Ulrich, longtime lead guitarist Kirk Hammett, and bassist Robert Trujillo."
15,"Human Error"" is the season finale of the third season of a tv show that aired on what network?",fox,nbc," Assistant: Let's analyze the context provided. The context states that ""House"" is an American television medical drama that originally ran on the Fox network. Since ""Human Error"" is an episode of ""House"", it is safe to conclude that the network that aired the season finale of the third season of ""House"" is Fox. Therefore, the correct option is 'Fox'. <|end|>",fox," The correct option is 'Fox', as the context clearly states that ""House"" is an American television medical drama that originally ran on the Fox network. The episode ""Human Error"" is part of the third season of ""House"", which aired on Fox. <|end|>",fox,"""Human Error"" is the twenty-fourth episode and season finale of the third season of ""House"" and the seventieth episode overall. House (also called House, M.D.) is an American television medical drama that originally ran on the Fox network for eight seasons, from November 16, 2004 to May 21, 2012.
The series' main character is Dr. Gregory House (Hugh Laurie), an unconventional, misanthropic medical genius who, despite his dependence on pain medication, leads a team of diagnosticians at the fictional Princeton–Plainsboro Teaching Hospital (PPTH) in New Jersey."
16,"Dua Lipa, an English singer, songwriter and model, the album spawned the number-one single ""New Rules"" is a song by English singer Dua Lipa from her eponymous debut studio album, released in what year?",2017,2017," Assistant: The context provides the information that Dua Lipa's self-titled debut studio album was released on 2 June 2017. The song ""New Rules"" is from this album. Therefore, the correct option is '2017'. <|end|>",2017," The correct option is '2017', as the context clearly states that Dua Lipa's self-titled debut studio album, which includes the song ""New Rules"", was released on 2 June 2017. <|end|>",2017,"Dua Lipa ( ; ] ; born 22 August 1995) is an English singer, songwriter and model.
Her self-titled debut studio album was released on 2 June 2017.
The album spawned seven singles, including the top-10 single ""Be the One"" and the number-one single ""New Rules"". ""New Rules"" is a song by English singer Dua Lipa from her eponymous debut studio album (2017).
It was released to contemporary hit radio in the United Kingdom on 21 July 2017 as the album's sixth single."
17,"American politician Joe Heck ran unsuccessfully against Democrat Catherine Cortez Masto, a woman who previously served as the 32nd Attorney General of where?",nevada,new york," Assistant: Let's analyze the context to find the correct answer. The context states that Catherine Cortez Masto 'previously served as the 32nd Attorney General of Nevada'. Therefore, the correct option is 'Nevada'. The option 'New York' is not mentioned in the context, thus it is not the correct answer. Therefore, the correct option is 'Nevada'.
 <|end|>",nevada," The correct option is 'Nevada', as the context states that Catherine Cortez Masto 'previously served as the 32nd Attorney General of Nevada'. The option 'New York' is not mentioned in the context, thus it is not the correct answer. Therefore, the correct option is 'Nevada'. <|end|>",nevada,"Catherine Marie Cortez Masto (born March 29, 1964) is an American attorney and politician who is the junior United States Senator from Nevada.
She previously served as the 32nd Attorney General of Nevada from 2007 to 2015. Joseph John “Joe” Heck (born October 30, 1961) is an American politician, physician, and U.S. Army Brigadier General who had served as the U.S. Representative for Nevada's 3rd congressional district from 2011 to 2017.
He ran unsuccessfully against Democrat Catherine Cortez Masto in the general election for the open Nevada United States Senate seat in 2016."
18,"Which state does the drug stores, of which the CEO is Warren Bryant, are located?",hawaii,california," Assistant: Let's analyze the context to find the correct answer. The context states that 'Warren Bryant was the CEO of Longs Drugs Store Corporation out of California'. This indicates that the drug stores were located in California. Therefore, the correct option is 'California'. <|end|>",hawaii," The correct option is 'Hawaii', as the context states that Longs Drugs has approximately 40 drug stores throughout the state of Hawaii. Warren Bryant was the CEO of Longs Drugs Store Corporation, but the drug stores are located in Hawaii, not California. <|end|>",hawaii,"Longs Drugs is an American chain with approximately 40 drug stores throughout the state of Hawaii. Warren Bryant was the CEO of Longs Drugs Store Corporation out of California prior to the retail chain's acquisition by CVS/Caremark.
Hired in 2002 to Longs, he was Senior Vice President of The Kroger Company.
, a retail grocery chain, from 1999 to 2002."
