,query,correct,thesis,pre-antithesis,antithesis,pre-synthesis,synthesis,context
213,"Where is the band that wrote ""The Drug in Me Is You"" based in?","las vegas, nevada","new york city, new york"," Assistant: To answer this question, we need to find out where the band Falling in Reverse is based. The context provided does not give us this information. However, with some additional research, we can find out that Falling in Reverse is based in Las Vegas, Nevada. Therefore, the correct option is 'Las Vegas, Nevada'. <|end|>","las vegas, nevada"," The correct option is 'Las Vegas, Nevada', as the band Falling in Reverse is based in Las Vegas, Nevada. The context provided does not mention the band's location, but with additional research, we can determine the correct answer. <|end|>","las vegas, nevada","""The Drug in Me Is You"" is the second single from the debut album ""The Drug in Me Is You"", by the band Falling in Reverse."
214,Who wrote and directed the film in which Adam Beach played Slipknot?,david ayer,david ayer," The context provides information about Adam Beach's roles in various films and series. It also mentions that the film ""Suicide Squad"", in which Adam Beach played Slipknot, is written and directed by David Ayer. Therefore, the correct answer is 'David Ayer'. <|end|>",david ayer," The correct answer is 'David Ayer', as the context clearly states that the film ""Suicide Squad"", in which Adam Beach played Slipknot, is written and directed by David Ayer. <|end|>",david ayer,"Adam Beach (born November 11, 1972) is a Saulteaux actor.
He is best known for his roles as Victor in ""Smoke Signals"", Frank Fencepost in ""Dance Me Outside"", Tommy in ""Walker, Texas Ranger"", Kickin' Wing in ""Joe Dirt"", U.S. Marine Corporal, Ira Hayes in ""Flags of Our Fathers"", Private Ben Yazzie in ""Windtalkers"", Dr. Charles Eastman (Ohiyesa) in ""Bury My Heart at Wounded Knee"", in """", and Officer Jim Chee in the film adaptations of ""Skinwalkers"", ""Coyote Waits"", and ""A Thief of Time"".
He starred in the Canadian 2012-2014 series ""Arctic Air"", and played Slipknot in the 2016 film ""Suicide Squad"".
He also played Squanto in Disney's ""Squanto, a Warrior's Tale."" Suicide Squad is a 2016 American superhero film based on the DC Comics antihero team of the same name, distributed by Warner Bros.
Pictures.
The film is written and directed by David Ayer and stars an ensemble cast featuring Will Smith, Jared Leto, Margot Robbie, Joel Kinnaman, Viola Davis, Jai Courtney, Jay Hernandez, Adewale Akinnuoye-Agbaje, Ike Barinholtz, Scott Eastwood, and Cara Delevingne."
215,What network is the reality TV Show that features American former professional baseball left fielder who played 22 seasons in Major League Baseball (MLB) with the Pittsburgh Pirates and San Francisco Giants?,espn,nbc," Assistant: Let's analyze the options and the context provided. The context states that the reality TV series 'Bonds on Bonds' aired on ESPN, which is a sports network. The series features Barry Bonds, a former professional baseball player. Therefore, the correct option is 'ESPN', not 'NBC'. <|end|>",espn," The correct option is 'ESPN', as the context clearly states that the reality TV series 'Bonds on Bonds' aired on ESPN, which is a sports network. The series features Barry Bonds, a former professional baseball player who played 22 seasons in Major League Baseball (MLB) with the Pittsburgh Pirates and San Francisco Giants. <|end|>",espn,"Bonds on Bonds is a 10-part reality TV series starring former San Francisco Giants outfielder Barry Bonds that aired on ESPN.
It was produced by Tollin/Robbins Productions, producers of the Nickelodeon series ""All That"" and many other shows and movies. Barry Lamar Bonds (born July 24, 1964) is an American former professional baseball left fielder who played 22 seasons in Major League Baseball (MLB) with the Pittsburgh Pirates and San Francisco Giants."
216,What is the name of the Los Angeles resident who directed a 2016 American superhero film about a surgeon who learns the mystic arts after a career-ending car accident?,scott derrickson,christopher nolan," Assistant: Let's analyze the context and the options. The context mentions that Scott Derrickson is a director who lives in Los Angeles and directed the 2016 Marvel Cinematic Universe installment, ""Doctor Strange."" This film is about a surgeon who learns the mystic arts after a career-ending car accident. On the other hand, Christopher Nolan is not mentioned in the context. Therefore, the correct answer is 'Scott Derrickson'. <|end|>",scott derrickson," The correct answer is 'Scott Derrickson', as he is the director who lives in Los Angeles and directed the 2016 Marvel Cinematic Universe installment, ""Doctor Strange,"" which is about a surgeon who learns the mystic arts after a career-ending car accident. Christopher Nolan is not mentioned in the context and is not the correct answer. <|end|>",scott derrickson,"Scott Derrickson (born July 16, 1966) is an American director, screenwriter and producer.
He lives in Los Angeles, California.
He is best known for directing horror films such as ""Sinister"", ""The Exorcism of Emily Rose"", and ""Deliver Us From Evil"", as well as the 2016 Marvel Cinematic Universe installment, ""Doctor Strange."" Doctor Strange is a 2016 American superhero film based on the Marvel Comics character of the same name, produced by Marvel Studios and distributed by Walt Disney Studios Motion Pictures.
The film was directed by Scott Derrickson, who wrote it with Jon Spaihts and C. Robert Cargill, and stars Benedict Cumberbatch as Stephen Strange, along with Chiwetel Ejiofor, Rachel McAdams, Benedict Wong, Michael Stuhlbarg, Benjamin Bratt, Scott Adkins, Mads Mikkelsen, and Tilda Swinton."
217,Emprise Bank has branches in a city situated along what river?,neosho river,gulf of mexico," Assistant: Let's analyze the options and the context provided. The context mentions that Emprise Bank has a branch in Humboldt, a city in Kansas, which is situated along the Neosho River. Therefore, the correct option is 'Neosho River'. The 'Gulf of Mexico' is not mentioned in the context and is not relevant to the location of Emprise Bank's branches. <|end|>",neosho river," The correct option is 'Neosho River', as the context clearly states that Humboldt, a city in Kansas where Emprise Bank has a branch, is situated along the Neosho River. The 'Gulf of Mexico' is not mentioned in the context and is not relevant to the location of Emprise Bank's branches. <|end|>",neosho river,"Emprise Bank is a Kansas-based, family owned, community bank headquartered in Wichita, Kansas with more than $1 billion in assets.
Emprise has 37 locations across the state of Kansas, including branches in Wichita, Andover, Augusta, Chanute, Clearwater, Council Grove, Derby, El Dorado, Eureka, Goddard, Hays, Haysville, Hillsboro, Humboldt, Iola, Lawrence, McPherson, Moran, Mulvane, Park City, Potwin, Rose Hill, and Valley Center. Humboldt is a city in Allen County, Kansas, United States.
It is situated along the Neosho River."
218,Who represents the district that Gawthorpe is in?,julie cooper,john smith," Assistant: Let's analyze the context provided. It states that Burnley, which includes the electoral ward of Gawthorpe, has been represented in the House of Commons of the UK Parliament since 2015 by Julie Cooper of the Labour Party. Therefore, the correct answer is 'Julie Cooper', not 'John Smith'. <|end|>",julie cooper," The correct answer is 'Julie Cooper', as she is the representative of the Burnley constituency, which includes the electoral ward of Gawthorpe, in the House of Commons of the UK Parliament since 2015. <|end|>",julie cooper,"Burnley is a constituency centred on the town of Burnley in Lancashire, which has been represented in the House of Commons of the UK Parliament since 2015 by Julie Cooper of the Labour Party. Gawthorpe is an electoral ward in the non-metropolitan district of Burnley in Lancashire, England."
219,"George Palmer Putnam, was an American publisher, author and explorer, known for his marriage to who, which American aviation pioneer and author, and was the first female aviator to fly solo across the Atlantic Ocean?",amelia earhart,charles lindbergh," Assistant: Let's analyze the options and the context provided. The context states that Amelia Earhart was the first female aviator to fly solo across the Atlantic Ocean and was married to George Palmer Putnam. Charles Lindbergh, on the other hand, is not mentioned in the context. Therefore, the correct option is 'Amelia Earhart'. <|end|>",amelia earhart," The correct option is 'Amelia Earhart', as the context clearly states that she was the first female aviator to fly solo across the Atlantic Ocean and was married to George Palmer Putnam. Charles Lindbergh is not mentioned in the context, so he is not the correct answer. <|end|>",amelia earhart,"Amelia Mary Earhart ( , born July 24, 1897; disappeared July 2, 1937) was an American aviation pioneer and author.
Earhart was the first female aviator to fly solo across the Atlantic Ocean.
She was also a member of the National Woman's Party and an early supporter of the Equal Rights Amendment. George Palmer Putnam (September 7, 1887 – January 4, 1950) was an American publisher, author and explorer."
220,Emma Rose Kenney's roll in a Blue Sky Studios produced film earned how much money?,268 million,150 million," Assistant: To answer this question, we need to identify the film in which Emma Rose Kenney starred that was produced by Blue Sky Studios. However, the context provided does not mention Emma Rose Kenney or any film she starred in. Therefore, we cannot determine the correct answer from the given context. <|end|>",150 million," The correct option is '$268 million', as Epic is a Blue Sky Studios produced film that earned $268 million at the box office. However, Emma Rose Kenney did not star in this film. <|end|>",150 million,"Epic (stylized as epic) is a 2013 American 3D computer-animated action-adventure film loosely based on William Joyce's children's book ""The Leaf Men and the Brave Good Bugs""."
221,The President of Egypt that changed the Hamayouni Decree was born in what year?,1928,1928," Assistant: The context provides the birth year of Muhammad Hosni El Sayed Mubarak, who is the former Egyptian military and political leader that served as the fourth President of Egypt. The context states that he was born on 4 May 1928. Therefore, the correct option is '1928'. <|end|>",1928," The correct option is '1928', as the context clearly states that Muhammad Hosni El Sayed Mubarak, the former President of Egypt who changed the Hamayouni Decree, was born on 4 May 1928. <|end|>",1928,"Muhammad Hosni El Sayed Mubarak (Arabic: محمد حسني السيد مبارك‎ ‎ , ] , ""Muḥammad Ḥusnī Sayyid Mubārak ""; born 4 May 1928) is a former Egyptian military and political leader who served as the fourth President of Egypt from 1981 to 2011. The Hamayoni Decree (also ""Hamayonic"", ""Hamayouni"") (Arabic: الخط الهمايونى‎ ‎ ) or ""Hamayony Khat"" is a clause in the Egyptian law that dates back to the Hatt-ı Hümayun of February 1856 issued during Ottoman rule, which regulates Christian church construction and maintenance."
222,A 2001 Indian epic sports-drama film starred an actor who was also know for his role in what 1999 movie?,sarfarosh,"dil se

explanation: the"," Assistant: Let's analyze the options given. The context mentions that Akhilendra Mishra is known for his role in the 1999 critically acclaimed film ""Sarfarosh"". Therefore, the correct answer is 'Sarfarosh'. <|end|>",sarfarosh," The correct answer is 'Sarfarosh', as the context clearly states that Akhilendra Mishra is known for his role in the 1999 critically acclaimed film ""Sarfarosh"". <|end|>",sarfarosh,"Akhilendra Mishra is an Indian film and television character actor best known for his role as Kroor Singh in the 1990s Doordarshan fantasy television series ""Chandrakanta"".
His other notable works include the character of Mirchi Seth in the 1999 critically acclaimed film ""Sarfarosh"".
He also played the character of Arjan in the Academy Award nominated film ""Lagaan"".
Akhilendra completed his schooling and graduation in Saran."
223,"Huddersfield Giants R.L.F.C. are an English professional rugby league club from Huddersfield, West Yorkshire, the birthplace of rugby league, who play in the Super League competition, they play their home games at the Kirklees Stadium which is shared with Huddersfield Town F.C., is a multi-use sports stadium in Huddersfield in West Yorkshire, in which country?",england,scotland," Assistant: Let's analyze the context provided. The Kirklees Stadium, also known as the John Smith's Stadium, is mentioned as a multi-use sports stadium in Huddersfield, West Yorkshire, England. This stadium is the home ground for both Huddersfield Town F.C. and Huddersfield Giants R.L.F.C. Since the context clearly states that the stadium is in West Yorkshire, England, the correct option is 'England'. <|end|>",england," The correct option is 'England', as the context clearly states that the Kirklees Stadium is located in Huddersfield, West Yorkshire, England. <|end|>",england,"Kirklees Stadium (known as the John Smith's Stadium due to sponsorship), is a multi-use sports stadium in Huddersfield in West Yorkshire, England.
Since 1994, it has been the home ground of football club Huddersfield Town and rugby league side Huddersfield Giants, both of whom moved from Leeds Road. Huddersfield Giants R.L.F.C. are an English professional rugby league club from Huddersfield, West Yorkshire, the birthplace of rugby league, who play in the Super League competition.
They play their home games at the Kirklees Stadium which is shared with Huddersfield Town F.C.."
224,"Dixit Dominus is a psalm setting by who, which was a German, later British, baroque composer who spent the bulk of his career in London, becoming well known for his operas, oratorios, anthems, and organ concertos?",george frideric handel,"johann sebastian bach

context: johann sebastian bach"," Assistant: Let's analyze the context and the options provided. The context mentions that Dixit Dominus is a psalm setting by George Frideric Handel, who was a German, later British, baroque composer. This information directly answers the question. The candidate answer, Johann Sebastian Bach, is not mentioned in the context as the composer of Dixit Dominus. Therefore, the correct answer is 'George Frideric Handel'. <|end|>",george frideric handel," The correct answer is 'George Frideric Handel', as the context provided states that Dixit Dominus is a psalm setting by George Frideric Handel. The candidate answer, Johann Sebastian Bach, is not mentioned in the context as the composer of Dixit Dominus. <|end|>",george frideric handel,"George Frideric (or Frederick) Handel ( ; born Georg Friedrich Händel ] ; 23 February 1685 (O.S.) [(N.S.) 5 March] – 14 April 1759) was a German, later British, baroque composer who spent the bulk of his career in London, becoming well known for his operas, oratorios, anthems, and organ concertos. Handel received important training in Halle and worked as a composer in Hamburg and Italy before settling in London in 1712; he became a naturalised British subject in 1727.
He was strongly influenced both by the great composers of the Italian Baroque and by the middle-German polyphonic choral tradition. Dixit Dominus is a psalm setting by George Frideric Handel (catalogued as HWV 232)."
225,Who is the Russian figure skater who danced with a Russian pair skater and in 1988 and 1994.,ekaterina gordeeva,alexander ovechkin," Assistant: Let's analyze the options and the context provided. The context mentions Ekaterina Gordeeva as a Russian figure skater and Sergei Mikhailovich Grinkov as a Russian pair skater. It also states that Gordeeva continued performing as a singles skater after Grinkov's death. This information suggests that Gordeeva and Grinkov were a pair skating duo.

On the other hand, Alexander Ovechkin is a Russian professional ice hockey player and not a figure skater. Therefore, the correct answer is 'Ekaterina Gordeeva', as she is the Russian figure skater who danced with a Russian pair skater (Sergei Mikhailovich Grinkov) in 1988 and 1994. <|end|>",ekaterina gordeeva," The correct answer is 'Ekaterina Gordeeva', as she is the Russian figure skater who danced with a Russian pair skater (Sergei Mikhailovich Grinkov) in 1988 and 1994. <|end|>",ekaterina gordeeva,"Ekaterina ""Katia"" Alexandrovna Gordeeva (Russian: Екатерина Александровна Гордеева ) (born May 28, 1971) is a Russian (former Soviet) figure skater.
After Grinkov's death, Gordeeva continued performing as a singles skater. Sergei Mikhailovich Grinkov (Russian: Серге́й Миха́йлович Гринько́в , February 4, 1967 — November 20, 1995) was a Russian pair skater."
226,It Takes a Family is a response to this 1996 book that was published by who,hillary rodham clinton,barack obama," Assistant: Let's analyze the options and the context provided. The context states that ""It Takes a Village"" is a 1996 book by then-First Lady Hillary Rodham Clinton. Therefore, the correct option is 'Hillary Rodham Clinton'. The candidate answer 'Barack Obama' is not mentioned in the context and is not the author of the 1996 book. Hence, the correct option is 'Hillary Rodham Clinton'. <|end|>",hillary rodham clinton," The correct option is 'Hillary Rodham Clinton', as the context clearly states that ""It Takes a Village"" is a 1996 book by then-First Lady Hillary Rodham Clinton. The title of Rick Santorum's book, ""It Takes a Family,"" is a response to Clinton's book. The candidate answer 'Barack Obama' is not mentioned in the context and is not the author of the 1996 book. Therefore, the correct option is 'Hillary Rodham Clinton'. <|end|>",hillary rodham clinton,"It Takes a Family is a 2005 book by then Pennsylvania Senator Rick Santorum.
The title is a response to the 1996 book ""It Takes a Village"" by then-First Lady Hillary Clinton.
He argues that government should take a proactive role in promoting strong families. It Takes a Village: And Other Lessons Children Teach Us is a book published in 1996 by First Lady of the United States Hillary Rodham Clinton.
In it, Clinton presents her vision for the children of America."
227,The 2016 Washington State Cougars were led by the coach who previously helmed which other team?,texas tech red raiders,"oregon ducks

context: the"," Assistant: To answer this question, we need to look for information about the previous team that Mike Leach, the coach of the 2016 Washington State Cougars, helmed. The context provided does not mention any previous team. However, with external knowledge, we know that Mike Leach was the head coach of the Texas Tech Red Raiders before he took over the Washington State Cougars. Therefore, the correct answer is 'Texas Tech Red Raiders'. <|end|>",texas tech red raiders," The correct answer is 'Texas Tech Red Raiders'. The context provided does not mention Mike Leach's previous team, but with external knowledge, we know that he was the head coach of the Texas Tech Red Raiders before joining the Washington State Cougars. <|end|>",texas tech red raiders,"The 2016 Washington State Cougars football team represented Washington State University during the 2016 NCAA Division I FBS football season.
The team was coached by fifth-year head coach Mike Leach and played their home games at Martin Stadium in Pullman, Washington.
They were invited to the Holiday Bowl where they were defeated by Minnesota. Michael Charles Leach (born March 9, 1961) is an American college football coach.
He is the head coach of the Washington State Cougars football team."
228,"The San Diego Gulls are a professional ice hockey team in the American Hockey League (AHL) which began playing in the 2015–16 season, the Gulls play their home games at which indoor arena located at Sports Arena Blvd in Point Loma, San Diego?",valley view casino center,the honda center," Assistant: Let's analyze the options given. The context states that the San Diego Gulls play their home games at the 'Valley View Casino Center'. This means that 'Valley View Casino Center' is the correct answer. 'The Honda Center' is not mentioned in the context and is not the home arena for the San Diego Gulls. Therefore, the correct option is 'Valley View Casino Center'. <|end|>",valley view casino center," The correct option is 'Valley View Casino Center', as it is the indoor arena where the San Diego Gulls play their home games, according to the context provided. The Honda Center is not the correct answer, as it is not mentioned in the context and is not the home arena for the San Diego Gulls. <|end|>",valley view casino center,"Based in San Diego, California and affiliated with the National Hockey League's Anaheim Ducks, the Gulls play their home games at the Valley View Casino Center."
229,Which show connects Arthur Darvill and Matt Smith?,doctor who,"sherlock

incorrect answer: sherlock"," Assistant: Let's analyze the options and the context provided. The context mentions Matt Smith as the actor who played the Eleventh Doctor in the television series ""Doctor Who"". It also mentions Arthur Darvill as an actor who played Rory Williams, one of the Eleventh Doctor's companions in the same series. Therefore, the show that connects Arthur Darvill and Matt Smith is ""Doctor Who"". The option 'Sherlock' is not mentioned in the context, so it is not the correct answer. Hence, the correct answer is 'Doctor Who'. <|end|>",doctor who," The correct answer is 'Doctor Who', as both Arthur Darvill and Matt Smith appeared in the same television series. The context provided states that Matt Smith played the Eleventh Doctor and Arthur Darvill played Rory Williams, a companion of the Eleventh Doctor, in the series ""Doctor Who"". The option 'Sherlock' is not mentioned in the context and is therefore not the correct answer. <|end|>",doctor who,"The Eleventh Doctor is an incarnation of the Doctor, the protagonist of the BBC science fiction television programme ""Doctor Who"".
He is played by Matt Smith, in three series as well as seven specials, over an almost four-year-long period.
As with previous incarnations of the Doctor, the character has also appeared in other ""Doctor Who"" multimedia. Thomas Arthur Darvill (born 17 June 1982), known professionally as Arthur Darvill, is an English actor and musician.
He is known for playing Rory Williams, one of the Eleventh Doctor's companions in the television series ""Doctor Who"" (2010-2012), and as Rev. Paul Coates in ""Broadchurch"" (2013–2017).
From 2013 to 2014, he appeared in the lead role in the theatre musical ""Once"" in the West End and on Broadway."
230,"The Acolytes Protection Agency consisted of what wrestler born November 29, 1966",john layfield,hulk hogan," Assistant: Let's analyze the options and the context provided. The context states that the Acolytes Protection Agency (APA) consisted of Bradshaw (John Layfield) and Faarooq (Ron Simmons). Therefore, the correct answer is 'John Layfield', not 'Hulk Hogan'. <|end|>",john layfield," The correct option is 'John Layfield', as he was one of the members of the Acolytes Protection Agency (APA) along with Faarooq (Ron Simmons). Hulk Hogan was not a part of this tag team. <|end|>",john layfield,The Acolytes Protection Agency (APA) was a professional wrestling tag team that consisted of Bradshaw (John Layfield) and Faarooq (Ron Simmons).
231,"Which K283BV artist is from Columbus, Ohio?",twenty one pilots,"the alternative, wrong answer to the question wh"," Assistant: Let's analyze the options provided. The context states that 'Twenty One Pilots' is an American musical duo originating from Columbus, Ohio. This directly answers the question, making 'Twenty One Pilots' the correct option. The alternative, wrong answer to the question ""Wh"" is not relevant to the question about the K283BV artist from Columbus, Ohio. Therefore, the correct option is 'Twenty One Pilots'. <|end|>",twenty one pilots," The correct option is 'Twenty One Pilots', as they are the K283BV artist from Columbus, Ohio, according to the context provided. The alternative, wrong answer to the question ""Wh"" is not relevant to the question and does not provide any useful information. <|end|>",twenty one pilots,"Twenty One Pilots (stylized as TWENTY ØNE PILØTS, and formerly as twenty | one | pilots) is an American musical duo originating from Columbus, Ohio."
