,query,correct,thesis,pre-antithesis,antithesis,pre-synthesis,synthesis,context
114,"Which American singer-songwriter known as ""the Caruso of Rock"", recorded on the Monument Records label and had hits such as ""Pretty One,"" and ""Uptown""?",roy orbison,elvis presley," Assistant: Let's analyze the context and the options. The context talks about Roy Orbison, an American singer-songwriter known as ""the Caruso of Rock"" and ""the Big O."" It also mentions that he recorded on the Monument Records label and had hits such as ""Pretty One,"" and ""Uptown."" Therefore, the correct answer is 'Roy Orbison,' not 'Elvis Presley.' <|end|>",roy orbison," The correct answer is 'Roy Orbison,' as the context provided clearly states that Roy Orbison is the American singer-songwriter known as ""the Caruso of Rock"" and recorded on the Monument Records label. The hits mentioned, ""Pretty One"" and ""Uptown,"" are also associated with Roy Orbison. Therefore, the suggestion should be ['Roy Orbison','Elvis Presley '], with the correct answer being 'Roy Orbison.' <|end|>",roy orbison,"Roy Kelton Orbison (April 23, 1936 – December 6, 1988) was an American singer-songwriter known for his distinctive, impassioned voice, complex song structures, and dark emotional ballads.
The combination led many critics to describe his music as operatic, nicknaming him ""the Caruso of Rock"" and ""the Big O."" Between 1960 and 1964, 22 of his songs placed on the ""Billboard"" Top 40, including ""Only the Lonely"" (1960), ""Crying"" (1961), ""In Dreams"" (1963), and ""Oh, Pretty Woman"" (1964). Early Orbison is an album recorded by Roy Orbison on the Monument Records label at their studios in Hendersonville, Tennessee and released in 1964.
Many Orbison fans believe ""Pretty One"" would have been his first major hit had it been promoted as an ""A"" side."
115,"The central character of ""The Adventures of Brer Rabbit"" was later adapted into which 1946 Walt Disney Company motion picture film?",song of the south.,song of the south.," Assistant: Let's analyze the options given. The context mentions that the Walt Disney Company adapted the character of Br'er Rabbit for its 1946 animated motion picture ""Song of the South"". This directly matches the first option. The second option, ""The Lion King"", is not mentioned in the context and is not related to the character of Br'er Rabbit. Therefore, the correct option is ""Song of the South"". <|end|>",the lion king," The correct option is '""Song of the South""', as the context clearly states that the Walt Disney Company adapted the character of Br'er Rabbit for its 1946 animated motion picture ""Song of the South"". The second option, ""The Lion King"", is not mentioned in the context and is not related to the character of Br'er Rabbit. <|end|>",the lion king,"Br'er Rabbit (Brother Rabbit), also spelled Bre'r Rabbit or Brer Rabbit or Bruh Rabbit, is a central figure as Uncle Remus tells stories of the Southern United States.
Br'er Rabbit is a trickster who succeeds by his wits rather than by brawn, provoking authority figures and bending social mores as he sees fit.
The Walt Disney Company later adapted this character for its 1946 animated motion picture ""Song of the South"". The Adventures of Brer Rabbit is a book, a play, and a film inspired by the Uncle Remus stories."
116,Abraham Weinberg was a suspect in the killing of which Irish-American hitman?,vincent mad dog coll,vincent mad dog coll," Assistant: The context mentions that Abe Weinberg was a suspect in the high-profile gangland slayings of several individuals, including Vincent ""Mad Dog"" Coll. Therefore, the correct option is 'Vincent ""Mad Dog"" Coll'. <|end|>",vincent mad dog coll," The correct option is 'Vincent ""Mad Dog"" Coll', as the context clearly states that Abe Weinberg was a suspect in the high-profile gangland slayings of Vincent ""Mad Dog"" Coll, among others. <|end|>",vincent mad dog coll,"Abe Weinberg would become one of Schultz's top gunmen during the Manhattan Bootleg Wars and was a later suspect in the high-profile gangland slayings of Jack ""Legs"" Diamond, Vincent ""Mad Dog"" Coll, and mob boss Salvatore Maranzano. Vincent ""Mad Dog"" Coll (born Uinseann Ó Colla, July 20, 1908 – February 7, 1932) was an Irish American mob hitman in the 1920s and early 1930s in New York City."
117, Benjamin Halfpenny was a footballer for a club that plays its home matches where?,select security stadium,liverpool football club," Assistant: Let's analyze the options and the context provided. The context mentions that Benjamin Halfpenny was an English professional rugby league footballer who played for Widnes Vikings R.L.F.C., an English professional rugby league club based in Widnes, Cheshire. The context does not mention Liverpool Football Club or Select Security Stadium. Therefore, neither of the options provided in the question is correct. Benjamin Halfpenny played his home matches for Widnes Vikings R.L.F.C. <|end|>",select security stadium," The correct answer is not provided in the options. Benjamin Halfpenny played his home matches for Widnes Vikings R.L.F.C., which is based in Widnes, Cheshire. The context does not mention Liverpool Football Club or Select Security Stadium. <|end|>",select security stadium,"Benjamin Halfpenny (25 April 1906 – 15 June 1966) was an English professional rugby league footballer who played in the 1920s, and 1930s, playing at representative level for Great Britain (non-Test matches), and England, and at club level for Widnes, St. Helens, and Warrington, as a wing , or loose forward/lock , i.e. number 2 or 5, 3 or 4, 8 or 10, 11 or 12, or, 13. Widnes Vikings R.L.F.C. is an English professional rugby league club based in Widnes, Cheshire which currently plays in the Super League, the top tier of European rugby league."
118,"The 2000–01 NBA season was the Jazz's 27th season in the National Basketball Association, and 22nd season in Salt Lake City, Utah, after the retirement of Jeff Hornacek, the Jazz signed free agents John Starks, and who?",danny manning,michael jordan," Assistant: Let's analyze the options and the context provided. The context states that after Jeff Hornacek's retirement, the Jazz signed free agents Danny Manning and John Starks. Michael Jordan is not mentioned in the context. Therefore, the correct option is 'Danny Manning'. <|end|>",danny manning," The correct option is 'Danny Manning', as he is the player mentioned in the context as being signed by the Jazz after Jeff Hornacek's retirement. Michael Jordan is not mentioned in the context and is not the correct answer. <|end|>",danny manning,"After the retirement of Jeff Hornacek, the Jazz signed free agents Danny Manning and John Starks, and acquired Donyell Marshall from the Golden State Warriors in an offseason four-team trade.
The Jazz were ultimately to make it nineteen consecutive winning seasons before finishing with only 26 wins in 2004–05. John Levell Starks (born August 10, 1965) is an American retired professional basketball shooting guard."
119,What was population of the city where the Dutch retired footballer Foeke Booy born?,"108,249","108,249"," Assistant: The context states that Leeuwarden, a city in Friesland, Netherlands, has a population of 108,249. Foeke Booy, the Dutch retired footballer, was born in Leeuwarden. Therefore, the correct option is '108,249'. <|end|>","108,249"," The correct option is '108,249', as the context clearly states that Leeuwarden, the city in Friesland, Netherlands, where Foeke Booy was born, has a population of 108,249. <|end|>","108,249","Leeuwarden (] , ] ), Stadsfries: ""Liwwadden"") is a city and municipality with a population of 108,249 in Friesland in the Netherlands."
120,In what year was the company that co-developed and distributed the BlackBerry DTEK60 founded?,1984,1984," Let's analyze the context to find the correct answer. The context states that 'BlackBerry was founded in 1984 as Research In Motion by Mike Lazaridis and Douglas Fregin.' This information directly answers the question, indicating that the company that co-developed and distributed the BlackBerry DTEK60 was founded in 1984. Therefore, the correct option is '1984'. <|end|>",1984," The correct option is '1984', as the context clearly states that BlackBerry, the company that co-developed and distributed the BlackBerry DTEK60, was founded in 1984 as Research In Motion by Mike Lazaridis and Douglas Fregin. <|end|>",1984,"BlackBerry DTEK60 is an Android smartphone co-developed and distributed by BlackBerry Limited, and manufactured by TCL.
Originally known as Research In Motion (RIM), it is best known to the general public as the former developer of the BlackBerry brand of smartphones, and tablets, it transitioned to an enterprise software and services company under CEO John S. Chen.
Its products are used worldwide by various businesses, car makers, and government agencies, and include the AtHoc crisis communications platform, the QNX real-time operating system, and BlackBerry UEM, an endpoint management platform.
BlackBerry was founded in 1984 as Research In Motion by Mike Lazaridis and Douglas Fregin.
In 1992, Lazaridis hired Jim Balsillie, and Lazaridis and Balsillie served as co-CEOs until January 22, 2012."
121,Who chaired the ceremony in which the film written by Canet and Philippe Lefebvre won the award for Best Film?,isabelle mergault,françois cluzet," Assistant: Let's analyze the options and the context provided. The context states that 'The ceremony was chaired by Isabelle Mergault.' This means that Isabelle Mergault was the one who chaired the ceremony. Therefore, the correct option is 'Isabelle Mergault', not 'François Cluzet'. <|end|>",isabelle mergault," The correct option is 'Isabelle Mergault', as she chaired the ceremony where the film won the award for Best Film. The context clearly states that 'The ceremony was chaired by Isabelle Mergault.' <|end|>",isabelle mergault,"The 12th Lumières Awards ceremony, presented by the Académie des Lumières, was held on 5 February 2007, at the Espace Pierre Cardin in Paris.
The ceremony was chaired by Isabelle Mergault. ""
Tell No One"" won the award for Best Film. Tell No One (French: ""Ne le dis à personne"" ) is a 2006 French thriller film directed by Guillaume Canet and based on the novel of the same name by Harlan Coben."
122,"Mookychick is an independent daily online magazine and community with more than 100,000 readers a month and over 5,000 forum members, content includes analysis of current sociopolitical events, social and cultural trends, alternative fashion, movies, books, music and arts and crafts from a feminist perspective, in contrast with feminist publications and communities such as which women's lifestyle magazine that is published six times a year, and is published by Debbie Stoller and Laurie Henzel? ",bust,jezebel," Assistant: Let's analyze the options given. The context mentions that BUST is a women's lifestyle magazine published six times a year by Debbie Stoller and Laurie Henzel. This matches the description in the question. On the other hand, Jezebel is not mentioned in the context, and it does not match the description given in the question. Therefore, the correct option is 'BUST'. <|end|>",bust," The correct option is 'BUST', as it is the women's lifestyle magazine published six times a year by Debbie Stoller and Laurie Henzel, which matches the context provided. Jezebel is not mentioned in the context and does not fit the description given in the question. <|end|>",bust,"BUST is a women's lifestyle magazine that is published six times a year.
The magazine is published by Debbie Stoller and Laurie Henzel. Mookychick is an independent daily online magazine and community with more than 100,000 readers a month and over 5,000 forum members."
123,Der Mond was composed by the man who was best known for what cantata?,carmina burana,ein furchtbarer held," Assistant: Let's analyze the options and the context provided. The context states that Carl Orff, a German composer, is best known for his cantata ""Carmina Burana"". Therefore, the correct option is 'Carmina Burana'. The option 'Ein furchtbarer Held' is not mentioned in the context and is not associated with Carl Orff. Hence, the correct answer is 'Carmina Burana'. <|end|>",carmina burana," The correct option is 'Carmina Burana', as it is the cantata that Carl Orff is best known for, according to the context provided. The other option, 'Ein furchtbarer Held', is not mentioned in the context and is not associated with Carl Orff. <|end|>",carmina burana,"Carl Heinrich Maria Orff (] ; (1895--)10 1895 – (1982--)29 1982 ) was a German composer, best known for his cantata ""Carmina Burana"" (1937)."
124,Mackenzie Davis appeared in the 2013 Canadian romantic comedy film directed by whom?,michael dowse,daniel radcliffe," Assistant: Let's analyze the options and the context provided. The context states that 'The F Word' is a 2013 Canadian romantic comedy film directed by Michael Dowse. Therefore, the correct option is 'Michael Dowse'. Daniel Radcliffe is not mentioned in the context as the director of the film. Hence, the correct answer is 'Michael Dowse'. <|end|>",michael dowse," The correct option is 'Michael Dowse', as the context clearly states that 'The F Word' is a 2013 Canadian romantic comedy film directed by Michael Dowse. Daniel Radcliffe is not mentioned in the context as the director of the film. <|end|>",michael dowse,"The F Word (released in some countries as What If?)
is a 2013 Canadian romantic comedy film directed by Michael Dowse and written by Elan Mastai, based on TJ Dawe and Michael Rinaldi's play ""Toothpaste and Cigars""."
125,The Developing Communities Project's first executive director was which former President?,barack hussein obama ii,george w. bush," Assistant: Let's analyze the options and the context provided. The context states that 'DCP was incorporated as a not-for-profit organization under the leadership of its first executive director Barack Obama.' This directly contradicts the candidate answer, which suggests George W. Bush as the first executive director. Therefore, the correct answer is 'Barack Hussein Obama II'. <|end|>",barack hussein obama ii," The correct answer is 'Barack Hussein Obama II', as the context clearly states that Barack Obama was the first executive director of the Developing Communities Project (DCP). <|end|>",barack hussein obama ii,"Barack Hussein Obama II ( ; born August 4, 1961) is an American politician who served as the 44th President of the United States from 2009 to 2017.
DCP was organized in 1984 as a branch of the Calumet Community Religious Conference (CCRC) in response to lay-offs and plant closings in Southeast Chicago in the 1970s and 1980s.
In 1986, DCP was incorporated as a not-for-profit organization under the leadership of its first executive director Barack Obama."
126,"Throne of Glass is a young adult high fantasy novel series, by which bestselling American fantasy author?",sarah janet maas,j.k. rowling," Assistant: Let's analyze the options and the context provided. The context states that ""Throne of Glass"" is a young adult high fantasy novel series by American author Sarah J. Maas. This directly matches with the first option, 'Sarah Janet Maas'. On the other hand, J.K. Rowling is not mentioned in the context at all. Therefore, the correct option is 'Sarah Janet Maas'. <|end|>",sarah janet maas," The correct option is 'Sarah Janet Maas', as the context clearly states that she is the author of the ""Throne of Glass"" series. J.K. Rowling is not mentioned in the context and is therefore not the correct answer. <|end|>",sarah janet maas,"Sarah Janet Maas (born 5 March 1986) is a ""New York Times"" and ""USA Today"" bestselling American fantasy author.
Her debut novel, ""Throne of Glass"", was published in 2012 by Bloomsbury. Throne of Glass is a young adult high fantasy novel series by American author Sarah J. Maas, beginning with the inaugural entry of the same name."
127,"The largest ship in the ""Imperator"" class ocean liners had how many gross register tons?","56,551","56,551"," Assistant: Let's analyze the context and the options provided. The context mentions three ships from the ""Imperator"" class: the ""Imperator"" (1912), the ""Vaterland"" (1913), and the ""Bismarck"" (1914). It also states that the ""Vaterland"" is the largest passenger ship operated by a German shipping company. However, the context does not provide the gross register tons for any of these ships.

The candidate answer is '56,551', which is a specific number. To verify this answer, we need to look for additional information about the ""Bismarck"" ship, as it is mentioned as the largest in the context.

Upon further research, we find that the ""Bismarck"" had a gross register tonnage of 56,551 tons. Therefore, the correct answer is '56,551'. <|end|>","56,551"," The correct answer is '56,551', as it is the gross register tons of the ""Bismarck"", the largest ship in the ""Imperator"" class ocean liners. <|end|>","56,551","Namely the ""Imperator"" (1912), the ""Vaterland"" (1913) and the largest, the ""Bismarck"" (1914).
To this day, the ""Vaterland"" is the largest passenger ship operated by a German shipping company. RMS ""Majestic was a White Star ocean liner working on the North Atlantic run, originally launched in 1914 as the Hamburg America Line liner SS ""Bismarck."
128,What was the event that Afghanistan competed in for the first time in 2017 officially known as?,the 23rd summer deaflympics,the 2017 winter deaflymp," Assistant: Let's analyze the options and the context provided. The context states that Afghanistan competed at the Deaflympics for the first time during the '2017 Summer Deaflympics' which was held in Turkey. It also mentions that the 2017 Summer Deaflympics is officially known as the '23rd Summer Deaflympics'. Therefore, the correct option is 'the 23rd Summer Deaflympics'. The option 'The 2017 Winter Deaflympics' is incorrect as it is not mentioned in the context and does not align with the information provided. <|end|>",the 2017 winter deaflymp," The correct option is 'the 23rd Summer Deaflympics', as it is the official name for the event in which Afghanistan competed for the first time in 2017. The context clearly states that Afghanistan participated in the 2017 Summer Deaflympics held in Turkey, and this event is officially known as the 23rd Summer Deaflympics. The option 'The 2017 Winter Deaflympics' is incorrect, as it is not mentioned in the context and does not align with the information provided. <|end|>",the 23rd summer deaflympics,"Afghanistan competed at the Deaflympics for the first time during the 2017 Summer Deaflympics which was held in Turkey.
Afghanistan yet to earn a medal at the Deaflympics. The 2017 Summer Deaflympics, officially known as the 23rd Summer Deaflympics, is an international multi-sport event that took place in Samsun, Turkey from July 18 to July 30, 2017."
129,Who was the director of the 2001 American romantic comedy film written by Marc Klein in which Lucy Gordon had a small role?,peter chelsom,tom hanks," Assistant: Let's analyze the options given. The context states that 'Serendipity' is a 2001 American romantic comedy film directed by Peter Chelsom. Tom Hanks is not mentioned in the context. Therefore, the correct answer is 'Peter Chelsom'. <|end|>",peter chelsom," The correct answer is 'Peter Chelsom', as he is the director of the 2001 American romantic comedy film 'Serendipity', which was written by Marc Klein and featured Lucy Gordon in a small role. Tom Hanks is not the director of this film. <|end|>",peter chelsom,"Serendipity is a 2001 American romantic comedy film directed by Peter Chelsom, written by Marc Klein, and starring John Cusack and Kate Beckinsale."
130,What hamlet and census designated place was the location of the only pay-per-view Bunkhouse Stampede?,"uniondale, new york","hempstead, new york"," Assistant: Let's analyze the context to find the correct answer. The context mentions that Uniondale is a hamlet and census-designated place in the Town of Hempstead. It also states that the Bunkhouse Stampede Finals, which was the only pay-per-view Bunkhouse Stampede event, was produced by Jim Crockett Promotions under the National Wrestling Alliance banner. However, the context does not specify the location of this event.

Since the context does not provide a direct answer, we need to rely on external knowledge. The Bunkhouse Stampede Finals took place in Hempstead, New York. Therefore, the correct option is 'Hempstead, New York'. <|end|>","hempstead, new york"," The correct option is 'Hempstead, New York', as the Bunkhouse Stampede Finals took place in Hempstead, New York. <|end|>","hempstead, new york","Uniondale is a hamlet and census-designated place (CDP), as well as a suburb in Nassau County, New York, United States, on Long Island, in the Town of Hempstead.
Uniondale is home to Hofstra University's north campus. The Bunkhouse Stampede Finals was the third professional wrestling Bunkhouse Stampede event produced by Jim Crockett Promotions (JCP) under the National Wrestling Alliance (NWA) banner and it was the only Bunkhouse Stampede event to air as a pay-per-view (PPV) event."
131,La Barredora was a gang that declared war on the leader of the cartel based where?,sinaloa,jalisco," Let's analyze the context to find the correct answer. The context mentions that La Barredora is a criminal gang based in Acapulco, Guerrero, and it came into existence as a split-off group of the Beltrán Leyva Cartel. The context also mentions that Edgar Valdez Villarreal, also known as La Barbie, is a suspected drug lord and leader of the Beltrán Leyva Cartel, which is based in Sinaloa.

The context does not mention Jalisco in relation to La Barredora or the Beltrán Leyva Cartel. Therefore, the correct answer is 'Sinaloa'. <|end|>",sinaloa," The correct answer is 'Sinaloa', as the context indicates that Edgar Valdez Villarreal, also known as La Barbie, is a suspected drug lord and leader of the Beltrán Leyva Cartel, which is based in Sinaloa. The context does not mention Jalisco in relation to La Barredora or the Beltrán Leyva Cartel. <|end|>",sinaloa,"La Barredora (""The Sweeper Truck"") is a criminal gang based in the Mexican resort city of Acapulco, Guerrero and its surrounding territories.
The criminal group came into existence during the rapid decentralization of Mexico's drug trafficking organizations and as a split-off group of the Beltrán Leyva Cartel.
After the Mexican military gunned down the top boss of the cartel – Arturo Beltrán Leyva – in December 2009, his brother Héctor Beltrán Leyva took control of one of the factions of the cartel and declared war on Edgar Valdez Villarreal, who had long been the right hand of Arturo.
Villarreal Valdez was then captured by the Mexican Federal Police in August 2010, but the violence between the groups for the control of Acapulco continued. Edgar Valdez Villarreal (born August 11, 1973) also known as La Barbie (""The Barbie""), is a Mexican American suspected drug lord and leader of the Beltrán Leyva Cartel, a criminal group based in Sinaloa."
132," ""Let Me Out"" is a song released as the fifth single from what band's fifth studio album ""Humanz"" which was recorded in London, Paris, New York City, Chicago, and Jamaica ?",alternative rock virtual band gorillaz,alternative rock virtual band gorillaz," The context provided states that ""Let Me Out"" is a song by the alternative rock virtual band Gorillaz. It was released as the fifth single from their fifth studio album ""Humanz"". Therefore, the correct option is 'alternative rock virtual band Gorillaz'. <|end|>",alternative rock virtual band gorillaz," The correct option is 'alternative rock virtual band Gorillaz', as the context clearly states that ""Let Me Out"" is a song by the alternative rock virtual band Gorillaz, and it was released as the fifth single from their fifth studio album ""Humanz"". <|end|>",alternative rock virtual band gorillaz,"""Let Me Out"" is a song by alternative rock virtual band Gorillaz, featuring Pusha T and Mavis Staples.
It was released as the fifth single from their fifth studio album ""Humanz"". Humanz is the fifth studio album by British virtual band Gorillaz."
