,query,correct,thesis,pre-antithesis,antithesis,pre-synthesis,synthesis,context
0,What languages did John Osteen speak or write?,english,spanish," The context mentions that Lakewood Church, led by John Osteen, has four English-language services and two Spanish-language services per week. This suggests that John Osteen was proficient in both English and Spanish. Therefore, the most reasonable answer is'spanish'. <|end|>",spanish," The context provided does not directly mention John Osteen's language abilities. However, it does mention that Lakewood Church, which he founded, offers services in both English and Spanish. This suggests that John Osteen was likely proficient in both languages to accommodate the diverse congregation. Therefore, the most reasonable answer is'spanish'. <|end|>",spanish,"Christian"" derives from the Koine Greek word ""Christós"" (), a translation of the Biblical Hebrew term ""mashiach. It is the largest congregation in the United States, averaging about 52,000 attendees per week. The 16,800-seat Lakewood Church Central Campus, home to four English-language services and two Spanish-language services per week, is located at the former Compaq Center. Other metropolises include Guadalajara, Monterrey, Puebla, Toluca, Tijuana and León"
1,What was Thomas Pitt's role in the context of the given options?,fictional character,fiction," The context states that Thomas Pitt is the protagonist in a series of detective novels by Anne Perry. The term 'protagonist' refers to the main character in any story, such as a literary work or drama. Therefore, the most appropriate answer from the given options is 'protagonist'. <|end|>",protagonist," The context provided states that Thomas Pitt is the protagonist in a series of detective novels by Anne Perry. The term 'protagonist' refers to the main character in any story, such as a literary work or drama. Therefore, the correct answer from the given options is 'protagonist'. <|end|>",protagonist,"Anne Perry (born 28 October 1938 as Juliet Marion Hulme) is an English author of historical detective fiction, best known for her Thomas Pitt and William Monk series. A protagonist is the main character in any story, such as a literary work or drama. Thomas Pitt is the protagonist in a series of detective novels by Anne Perry. His father was a gamekeeper on a landed estate and Pitt was educated alongside the son of the house"
2,In which administrative territorial entity is the key center south tower located?,new york,north," The context states that the Key Center North Tower is located in Buffalo, New York, USA. Therefore, the administrative territorial entity for the Key Center North Tower is 'New York'. <|end|>",new york," The context provided states that the Key Center North Tower is located in Buffalo, New York, USA. Buffalo is a city in western New York state and the county seat of Erie County, on the eastern shores of Lake Erie at the head of the Niagara River. Therefore, the administrative territorial entity for the Key Center North Tower is 'New York'. <|end|>",new york,"Key Center North Tower is a high-rise located in Buffalo, New York, USA. The Key Center South Tower which is four stories shorter and connected by a two-story glass atrium encompassing 18,800 square feet of retail space. Buffalo is a city in western New York state and the county seat of Erie County, on the eastern shores of Lake Erie at the head of the Niagara River. , Buffalo is New York state's 2nd-most populous city after New York City, with 258,703 residents"
3,How did Joe Don Looney meet his demise?,accident,knockout," The context provided does not give any information about how Joe Don Looney met his demise. However, given the options 'accident' and 'knockout', the term 'knockout' is more likely to be associated with a football player's death, as it could refer to a fatal injury sustained during a game. Therefore, the candidate answer is 'knockout'. <|end|>",knockout," The context provided does not give any information about how Joe Don Looney met his demise. However, given the options 'accident' and 'knockout', the term 'knockout' is more likely to be associated with a football player's death, as it could refer to a fatal injury sustained during a game. Therefore, the candidate answer is 'knockout'. <|end|>",knockout,"The National Football League (NFL) is a professional American football league consisting of 32 teams, divided equally between the National Football Conference (NFC) and the American Football Conference (AFC). He was the first receiver in NFL history to have over 100 yards receiving in each of his first two games, a feat which was not equaled until the 2008 NFL season by another Eagles wide receiver, DeSean Jackson. At the time of his death, Looney was the second oldest living former NFL player"
4,What sport did the Louisiana IceGators play?,ice hockey,ice hockey," The context provided does not specifically mention the Louisiana IceGators, but it does mention that professional ice hockey has been present since the early 1900s and is played in many countries. Given the name ""Louisiana IceGators,"" it is reasonable to infer that they are a professional ice hockey team. Therefore, the correct answer is 'ice hockey'. <|end|>",ice hockey," The context provided does not specifically mention the Louisiana IceGators, but it does mention that professional ice hockey has been present since the early 1900s and is played in many countries. Given the name ""Louisiana IceGators,"" it is reasonable to infer that they are a professional ice hockey team. Therefore, the correct answer is 'ice hockey'. <|end|>",ice hockey,"Professional ice hockey has existed since the early 1900s (decade). The professional game originated in the United States in 1904 and became prominent in Canada during the early 20th century before expanding back into the United States and eventually to many other countries. In addition to the United States and Canada, high-level professional hockey is present in Germany, Russia, Sweden, the Czech Republic, Finland and Switzerland; professional hockey is also played in many other countries, as diverse as Ukraine, the United Kingdom, Austria, Australia and Japan. `` Chuck '' Anselmo , Jr"
5,What is Beerschoten classified as?,village,1," The context does not provide any information about Beerschoten. However, based on the options provided, the most reasonable answer would be 'town' as it is a common classification for a place within a municipality or province.

In the context, Maarn and Doorn are mentioned as towns in the Dutch province of Utrecht. This suggests that Beerschoten, if it is in the same region, could also be classified as a town.

Therefore, the most reasonable answer is 'town'. <|end|>",town," Based on the context provided, Maarn and Doorn are both towns in the Dutch province of Utrecht. Since Beerschoten is not mentioned in the context, we can infer that it might be a similar type of place within the same region. Among the given options, 'town' is the most appropriate classification for Beerschoten, as it aligns with the classification of Maarn and Doorn. <|end|>",town,"Maarn is a town in the Dutch province of Utrecht. Doorn is a town in the municipality of Utrechtse Heuvelrug in the central Netherlands, in the province of Utrecht. The European part of the Netherlands borders Germany to the east, Belgium to the south, and the North Sea to the northwest, sharing maritime borders with Belgium, the United Kingdom, and Germany. The largest cities in the Netherlands are Amsterdam, Rotterdam, The Hague and Utrecht. The name ""Holland"" is used to refer informally to the whole of the country of the Netherlands"
6,What was the main subject of the film 'Prom Night II' starring Mary Lou?,supernatural,supernatural," The context provided does not directly mention the film 'Prom Night II' or Mary Lou. However, based on the options given and general knowledge about the film, the main subject of 'Prom Night II' starring Mary Lou is'supernatural'. The film is a horror movie that involves supernatural elements, such as a vengeful spirit haunting the characters. <|end|>",supernatural," The context provided does not directly mention the film 'Prom Night II' or Mary Lou. However, based on the options given and general knowledge about the film, the main subject of 'Prom Night II' starring Mary Lou is'supernatural'. The film is a horror movie that involves supernatural elements, such as a vengeful spirit haunting the characters. <|end|>",supernatural,"Other afterlife destinations include Heaven, Purgatory, Paradise, and Limbo. Gene Francis Alan Pitney (February 17, 1940  April 5, 2006) was an American singer-songwriter, musician, and sound engineer"
7,In which location is Cinnamon Bay situated?,saint john,saint john," The context states that Cinnamon Bay is a body of water and a beach on St. John island, within Virgin Islands National Park, in the United States Virgin Islands. Therefore, the correct answer is 'Saint John'. <|end|>",saint thomas," The context provided states that Cinnamon Bay is a body of water and a beach located on St. John island, which is part of the United States Virgin Islands. The United States Virgin Islands are situated in the Caribbean region, which includes the Caribbean Sea and its surrounding islands. However, the specific location of Cinnamon Bay is on St. John island. Therefore, the correct answer is 'Saint John'. <|end|>",saint thomas,"Cinnamon Bay is a body of water and a beach on St. John island , within Virgin Islands National Park , in the United States Virgin Islands. The Caribbean (or ) is a region that consists of the Caribbean Sea, its islands (some surrounded by the Caribbean Sea and some bordering both the Caribbean Sea and the North Atlantic Ocean) and the surrounding coasts"
8,What is the place of birth of Magnus Johansson?,gothenburg,of," The context does not provide information about the place of birth of Magnus Johansson. The options 'central', 'gothenburg', 'of','sweden', 'örgryte' do not provide a clear answer. However, 'of' is not a place and can be eliminated. The remaining options are 'gothenburg','sweden', and 'örgryte'. Since the context does not specify the birthplace of Magnus Johansson, we cannot determine the correct answer from the given options. <|end|>",gothenburg," The context mentions that Magnus Johansson is a Swedish football coach and former footballer who played for IFK Göteborg, Brann, and Västra Frölunda. However, it does not provide information about his place of birth. Among the given options, 'gothenburg','sweden', and 'örgryte' are related to Sweden, but without specific information about his birthplace, we cannot determine the correct answer. <|end|>",gothenburg,"Founded on 4 October 1904, it is the only club in the Nordic countries that has won a pan-European competition, as the club won the UEFA Cup in 1982 and 1987. The club colours are blue and white, colours shared both with the sports societyIdrottsföreningen Kamraternawhich the club originated from, and with the home town of Gothenburg. Magnus `` Lill - Tidan '' Johansson ( born October 5 , 1964 ) is a Swedish football coach and former footballer that played for IFK Göteborg , Brann and Västra Frölunda. Gothenburg is the second-largest city in Sweden and the fifth-largest in the Nordic countries"
9,What was the country of citizenship of William Vansittart Bowater?,united kingdom,american," The context states that William Vansittart Bowater was the founder of Bowater, which became one of the world's largest producers of newspaper print. The company has 55 plants in over 20 countries across Asia, Europe, North America, and South America. However, the context does not provide information about his country of citizenship.

The options 'london' and 'united kingdom' are not countries, so they can be eliminated. Between 'american' and 'british', the most reasonable answer would be 'british' as Bowater was a British businessman and founder of a British company. However, without explicit information in the context, this answer is based on inference and not directly stated facts.

In conclusion, the most reasonable answer based on the context and inference would be 'british'. <|end|>",british," Based on the context provided, William Vansittart Bowater was a British businessman and founder of a British company, Bowater. The context does not explicitly mention his country of citizenship, but it can be inferred that he was British. Therefore, the most reasonable answer from the given options is 'british'. <|end|>",british,"William Vansittart Bowater ( 15 March 1838 -- 28 April 1907 ) was the founder of Bowater , which became one of the world 's largest producers of newspaper print. It has 55 plants in over 20 countries across Asia, Europe, North America and South America"
10,Which conflict was Charles R. Stimpson involved in?,world war ii,second barbary war," The context provided does not give any information about Charles R. Stimpson or any conflicts he may have been involved in. However, based on historical records, Charles R. Stimpson was a U.S. Navy officer who served during the Second Barbary War. Therefore, the most accurate answer from the given options is'second barbary war'. <|end|>",second barbary war," The context provided does not mention Charles R. Stimpson or any specific conflicts he may have been involved in. However, based on historical records, Charles R. Stimpson was a U.S. Navy officer who served during the Second Barbary War. Therefore, the most accurate answer from the given options is'second barbary war'. <|end|>",second barbary war,"It has 274 deployable combat vessels and more than 3,700 aircraft in active service"
11,What was the occupation of Ninaithen Vandhai?,geetha arts,geetha arts," The context states that Ninaithen Vandhai is a 1998 Tamil romance film directed by K. Rao. The occupation of Ninaithen Vandhai, in this case, would be a film, not an occupation of a person. However, if we consider the director's occupation, K. Rao, the director of the film, would be in the film industry, specifically in film directing. The option 'geetha arts' could be a production company involved in the film, but it is not an occupation. The options 'history' and 'lifetime' do not fit the context. Therefore, none of the options provided are correct. <|end|>",geetha arts," The context provided states that Ninaithen Vandhai is a 1998 Tamil romance film directed by K. Rao. The occupation of Ninaithen Vandhai, in this case, would be a film, not an occupation of a person. However, if we consider the director's occupation, K. Rao, the director of the film, would be in the film industry, specifically in film directing. The option 'geetha arts' could be a production company involved in the film, but it is not an occupation. The options 'history' and 'lifetime' do not fit the context. Therefore, none of the options provided are correct. <|end|>",geetha arts,"Ninaithen Vandhai ( English : I Thought of You , Then You Came ) is a 1998 Tamil romance film directed by K. Rao has directed films across multiple genres like romantic comedy, fantasy, melodrama, action and romance films"
12,What was the occupation of Robert Edmond Jones?,lighting designer,designer," The context states that Robert Edmond ""Bobby"" Jones was an American scenic, lighting, and costume designer. His visual style, often referred to as simplified realism, combined bold vivid use of color and simple, yet dramatic, lighting.

Given the options, the most accurate answer is 'designer' as it encompasses all the roles he held - scenic, lighting, and costume designer. The other options such as 'artist', 'computer', 'costume designer', 'lighting designer', 'profession', and 'television' do not fully capture his occupation. <|end|>",designer," The context provided states that Robert Edmond ""Bobby"" Jones was an American scenic, lighting, and costume designer. His visual style, often referred to as simplified realism, combined bold vivid use of color and simple, yet dramatic, lighting.

Given the options, the most accurate answer is 'designer' as it encompasses all the roles he held - scenic, lighting, and costume designer. The other options such as 'artist', 'computer', 'costume designer', 'lighting designer', 'profession', and 'television' do not fully capture his occupation. <|end|>",designer,"A theatre lighting designer (or LD) works with the director, choreographer, set designer, costume designer, and sound designer to create the lighting, atmosphere, and time of day for the production in response to the text, while keeping in mind issues of visibility, safety, and cost. Robert Edmond `` Bobby '' Jones ( December 12 , 1887 -- November 26 , 1954 ) was an American scenic , lighting , and costume designer. His visual style , often referred to as simplified realism , combined bold vivid use of color and simple , yet dramatic , lighting"
13,What was the religious order of Felix of Cantalice?,order of friars minor,carmelites," The context mentions Felix of Cantalice, O. F. M. The abbreviation ""O. F. M."" stands for ""Ordo Fratrum Minorum,"" which is Latin for ""Order of Friars Minor."" This is a religious order within the Catholic Church. However, the options provided include ""carmelites,"" which is another religious order within the Catholic Church.

The context does not mention the Carmelites or any other specific religious order related to Felix of Cantalice. However, Felix of Cantalice is historically known to be a member of the Order of Friars Minor, also known as the Franciscans.

Therefore, the most accurate answer from the given options is ""order of friars minor."" <|end|>",order of friars minor," The context provided does not mention the Carmelites or any other specific religious order related to Felix of Cantalice. However, Felix of Cantalice is historically known to be a member of the Order of Friars Minor, also known as the Franciscans. The abbreviation ""O. F. M."" stands for ""Ordo Fratrum Minorum,"" which is Latin for ""Order of Friars Minor.""

Given the options provided, the most accurate answer is ""order of friars minor."" <|end|>",order of friars minor,"A friar is a member of one of the mendicant orders founded since the twelfth or thirteenth century; the term distinguishes the mendicants' itinerant apostolic character, exercised broadly under the jurisdiction of a superior general, from the older monastic orders' allegiance to a single monastery formalized by their vow of stability. Within Roman Catholicism Augustinians may be members of either one of two separate and distinct types of Order: Charism. 
In a religious community, ""charism"" is the particular contribution that each religious order, congregation or family and its individual members embody. Felix of Cantalice , O. F. M"
14,What is the country of citizenship of Davide Valsecchi?,italy,british," The context provided does not mention Davide Valsecchi or his country of citizenship. However, Davide Valsecchi is a well-known Italian racing driver, which suggests that his country of citizenship is Italy. Therefore, the correct answer is 'italy'. <|end|>",italy," The context provided does not mention Davide Valsecchi or his country of citizenship. However, Davide Valsecchi is a well-known Italian racing driver, which suggests that his country of citizenship is Italy. Therefore, the correct answer is 'italy'. <|end|>",italy,"Flavio Briatore (born 12 April 1950) is an Italian businessman. The format was conceived by Bernie Ecclestone and Flavio Briatore, while Ecclestone also has the rights to the name GP1"
15,What is the original language of the work 'Lollia Love'?,english,spanish," The context provided does not mention the original language of the work 'LolliLove'. However, since the film is co-written by Jenna Fischer, an American actress, and the context does not mention any Spanish elements, it is reasonable to assume that the original language of the work is English. Therefore, the correct answer is 'english'. <|end|>",english," The context provided does not mention the original language of the work 'LolliLove'. However, since the film is co-written by Jenna Fischer, an American actress, and the context does not mention any Spanish elements, it is reasonable to assume that the original language of the work is English. Therefore, the correct answer is 'english'. <|end|>",english,"LolliLove is a mockumentary co-written by , directed by and starring Jenna Fischer. The film satirizes a hip , misguided Southern California couple who decide to make a difference in the lives of the homeless by giving them lollipops with a cheery slogan on the wrapper. Lollipops are available in many flavors and shapes"
16,What was the occupation of Mike Bowers?,lawyer,attorney general," The context states that Michael Joseph Bowers was the Attorney General of Georgia from 1981 to 1987. Therefore, the correct answer is 'attorney general'. <|end|>",attorney general," The context provided states that 'Michael Joseph Bowers was the Attorney General of Georgia from 1981 to 1987'. This information directly answers the question about his occupation. Therefore, the correct answer is 'attorney general'. <|end|>",attorney general,"Michael Joseph Bowers ( born 1942 ) was the Attorney General of Georgia from 1981 to 1987 before mounting an unsuccessful campaign for Georgia Governor. A U. Due to the shared sovereignty between each state and the federal government, Americans are citizens of both the federal republic and of the state in which they reside. g"
17,Who was the creator of the character Tom Scavo?,marc cherry,marc cherry," The context mentions that John Pardee is an American screenwriter and television producer, currently working as executive producer for ""Desperate Housewives."" Since Tom Scavo is a character from ""Desperate Housewives,"" it is reasonable to infer that John Pardee, as an executive producer, was involved in the creation of the character. Therefore, the correct answer is 'john pardee'. <|end|>",john pardee," The context provided does not mention Marc Cherry, the creator of ""Desperate Housewives,"" in relation to the character Tom Scavo. However, it does mention John Pardee as an executive producer for ""Desperate Housewives."" As an executive producer, John Pardee would have been involved in the creation and development of the show's characters, including Tom Scavo. Therefore, the correct answer is 'john pardee'. <|end|>",john pardee,"Melrose Place is an American primetime soap opera that aired on Fox from July 8, 1992 to May 24, 1999, for seven seasons. In 1994, for its third season premiere, the show moved to Monday at 8pm. Bob Daily is an American television producer and screenwriter. John Pardee is an American screenwriter and television producer, currently working as executive producer for ""Desperate Housewives"
18,What is the location associated with the event that took place in 2000?,battle abbey,france," The context mentions that the Battle of Hastings took place in 1066, not 2000. However, the event in 2000 was a re-enactment of the Battle of Hastings. The re-enactment took place in Hastings, which is located in England. Therefore, the location associated with the event that took place in 2000 is 'hastings'.
         <|end|>",hastings," The event that took place in 2000 was a re-enactment of the Battle of Hastings. The original Battle of Hastings occurred in 1066 near the town of Hastings, which is located in England. The re-enactment in 2000 would have taken place in the same location to maintain historical accuracy. Therefore, the location associated with the event that took place in 2000 is 'hastings'. <|end|>",hastings,"Hastings 2000 was a major re-enactment of the Battle of Hastings which took place on the 14 and 15 October 2000. Normandy (pronounced , Norman: ""Normaundie"", from Old French ""Normanz"", plural of ""Normant"", originally from the word for ""northman"" in several Scandinavian languages) is one of the regions of France, roughly corresponding to the historical Duchy of Normandy. Harold Godwinson or Harold II (pronounced  ; 1022  14 October 1066) was the last Anglo-Saxon king of England. Harold reigned from 6 January 1066 until his death at the Battle of Hastings on 14 October, fighting the Norman invaders led by William the Conqueror during the Norman conquest of England. The Battle of Hastings was fought on 14 October 1066 between the Norman-French army of William, the Duke of Normandy, and an English army under the Anglo-Saxon King Harold Godwinson, beginning the Norman conquest of England. It took place approximately northwest of Hastings, close to the present-day town of Battle, East Sussex, and was a decisive Norman victory. Also nearby are Hastings to the south-east and Bexhill-on-Sea to the south. 
It was the site of the Battle of Hastings, where William, Duke of Normandy, defeated King Harold II to become William I in 1066"
