,query,correct,thesis,pre-antithesis,antithesis,pre-synthesis,synthesis,context
56,What is the ethnic group of Hurao?,chamorro people,spaniards," The context provided does not give any information about Hurao or his ethnic group. However, Hurao is a historical figure from the Mariana Islands, specifically from the Chamorro people. Therefore, the most accurate answer from the given options would be 'chamorro people'. <|end|>",chamorro," The context provided does not mention Hurao or his ethnic group. However, Hurao is a historical figure from the Mariana Islands, specifically from the Chamorro people. Therefore, the most accurate answer from the given options would be 'chamorro people'. <|end|>",chamorro,"It extends from the Arctic Ocean in the north to the Southern Ocean (or, depending on definition, to Antarctica) in the south and is bounded by Asia and Australia in the west and the Americas in the east"
57,What is the occupation of Seigi Choujin?,toei animation,toei animation," The context mentions that the manga was adapted by Toei Animation into a 137-episode anime series. This indicates that Toei Animation is the company responsible for the anime adaptation of the manga. Therefore, the occupation of Seigi Choujin, in this context, is related to Toei Animation. <|end|>",japan," The occupation of Seigi Choujin, also known as Kinnikuman, is a fictional character from a manga series. The context provided does not directly state Seigi Choujin's occupation but mentions that the manga was adapted by Toei Animation into an anime series. This implies that Seigi Choujin is a character in the manga and anime series produced by Toei Animation. Therefore, the correct option is 'toei animation'. <|end|>",toei animation,"The manga was originally published in Shueisha's ""Weekly Shnen Jump"" from 1979 to 1987, and was first adapted by Toei Animation into a 137-episode anime series broadcast on Nippon Television from 1983 to 1986. It restarted publication in 2011, and has spawned spin-off manga and anime series, video games, anime films, and several ""Kinnikuman""-related merchandise"
58,Which political party was Ian MacLaren a member of?,progressive conservative party of canada,the right," The context states that Ian MacLaren was a Member of Parliament for the federal riding of York East, elected as a Progressive Conservative in the Robert Stanfield-led resurgence of 1972. The Progressive Conservative Party of Canada is also known as the Tories. Therefore, the most accurate answer is 'tories'. <|end|>",tories," The context provided states that Ian MacLaren was a Member of Parliament for the federal riding of York East, elected as a Progressive Conservative in the Robert Stanfield-led resurgence of 1972. The Progressive Conservative Party of Canada is also known as the Tories. Therefore, the most accurate answer is 'tories'. <|end|>",tories,"Ian MacLachlan Arrol ( February 20 , 1924 -- June 16 , 2000 ) was Member of Parliament for the federal riding of York East , elected as a Progressive Conservative in the Robert Stanfield - led resurgence of 1972. The Right Honourable (The Rt Hon"
59,What was the place of birth of Andriy Sokolovskyy?,moscow,france," The context provided does not give any information about the place of birth of Andriy Sokolovskyy. However, based on external knowledge, Andriy Sokolovskyy is a Ukrainian athlete. Therefore, none of the options provided are correct. <|end|>",san marino," The context provided does not give any information about the place of birth of Andriy Sokolovskyy. However, based on external knowledge, Andriy Sokolovskyy is a Ukrainian athlete. Therefore, none of the options provided are correct. <|end|>",san marino,"The IAAF Diamond League is an annual series of track and field meetings held from 2010 onwards, beginning with the 2010 IAAF Diamond League"
60,In which decade was the album 'letting go' released?,two,1990s," The context states that ""Letting Go"" is the debut album of the alternative metal band Earshot. Earshot was formed in 1999, and their debut album ""Letting Go"" was released in 2002. Therefore, the album ""Letting Go"" was released in the 2000s. However, since the 2000s is not an option, the closest decade provided in the options is the '1990s'.
         <|end|>",the silver lining," The context provided states that ""Letting Go"" is the debut album of the alternative metal band Earshot. Earshot was formed in 1999, and their debut album ""Letting Go"" was released in 2002. Therefore, the album ""Letting Go"" was released in the 2000s. However, since the 2000s is not an option, the closest decade provided in the options is the '1990s'. <|end|>",1990s,"Rock music is a genre of popular music that originated as ""rock and roll"" in the United States in the 1950s, and developed into a range of different styles in the 1960s and later, particularly in the United Kingdom and the United States. Rock music also drew strongly on a number of other genres such as electric blues and folk, and incorporated influences from jazz, classical and other musical sources. Letting Go is alternative metal band Earshot 's debut album. `` Get Away '' reached # 4 on the U. The term's original meaning was broader, referring to a generation of musicians unified by their collective debt to either the musical style or simply the independent, D. I"
61,What is the country of citizenship of Gloria Romero?,philippines,philippines," The context mentions that Gloria Romero is an actress who started her career in 1954 in a Sampaguita Pictures movie, ""Dalagang Ilocana (Ilocana Maiden)"", which is a Filipino romantic comedy film. This information indicates that Gloria Romero is from the Philippines. Therefore, the correct answer is 'philippines'. <|end|>",philippines," The context provided states that Gloria Romero started her acting career in 1954 in a Sampaguita Pictures movie, ""Dalagang Ilocana (Ilocana Maiden)"", which is a Filipino romantic comedy film. This information strongly suggests that Gloria Romero is from the Philippines. Therefore, the correct answer is 'philippines'. <|end|>",philippines,"Dalagang Ilocana (""Ilocana Maiden"") is a 1954 Filipino romantic comedy film produced by Sampaguita Pictures. Saint-Étienne is the capital of the Loire department and has a population of approximately 172,023 (2013) in the city itself and over 508,000 in the metropolitan area (2011). Her long acting career started in 1954 in a Sampaguita Pictures movie, ""Dalagang Ilocana (Ilocana Maiden)"", the movie which also catapulted the career of actress Gloria Romero into stardom. In the film, De Villa played a bit role of a lady boarder"
62,What was the occupation of William Marbury?,lawyer,father," The context states that William Marbury was a highly successful American businessman and one of the ""Midnight Judges"" appointed by United States President John Adams. This information suggests that William Marbury's occupation was not 'father', 'head of state', 'president', 'vice president', 'political theorist', 'diplomat', or 'diarist'. The most reasonable answer from the given options is 'lawyer', as judges are typically lawyers.
         <|end|>",lawyer," The context provided states that William Marbury was a highly successful American businessman and one of the ""Midnight Judges"" appointed by United States President John Adams. While the context does not explicitly mention Marbury's occupation as a 'lawyer', it is reasonable to infer that he was a lawyer since judges are typically lawyers. Therefore, the most appropriate answer from the given options is 'lawyer'. <|end|>",lawyer,"John Adams (October 30 [O. October 19] 1735  July 4, 1826) was an American patriot who served as the second President of the United States (17971801) and the first Vice President (178997). He was a lawyer, diplomat, statesman, political theorist, and, as a Founding Father, a leader of the movement for American independence from Great Britain. He was also a dedicated diarist and correspondent, particularly with his wife and closest advisor Abigail. William Marbury ( November 7 , 1762 - March 13 , 1835 ) was a highly successful American businessman and one of the `` Midnight Judges '' appointed by United States President John Adams the day before he left office"
63,Where did Amir Pnueli pass away?,new york city,new york city," Amir Pnueli passed away on November 2, 2009. The context does not provide information about the location of his death. However, given the options 'new york city' and 'york', the most reasonable answer is 'new york city' as it is a more specific location. <|end|>",new york city," The context does not provide information about the location of Amir Pnueli's death. However, given the options 'new york city' and 'york', the most reasonable answer is 'new york city' as it is a more specific location. <|end|>",new york city,"Amir Pnueli ( Hebrew :    ; April 22 , 1941 -- November 2 , 2009 ) was an Israeli computer scientist and the 1996 Turing Award recipient"
64,What is the headquarters location of Zentropa?,hvidovre,denmark," The context states that Zentropa or Zentropa Entertainments is a Danish film company started in 1992 by director Lars von Trier and producer Peter Aalbæk Jensen. It has produced over 70 feature films and has become the largest film production company in Scandinavia.

Given the options, 'berlin', 'born', 'denmark', 'global', 'hvidovre','media', 'trier', the most reasonable answer is 'denmark' as it is the country where the company was started and is based. <|end|>",denmark," The context provided states that Zentropa or Zentropa Entertainments is a Danish film company started in 1992 by director Lars von Trier and producer Peter Aalbæk Jensen. It has produced over 70 feature films and has become the largest film production company in Scandinavia.

Given the options, 'berlin', 'born', 'denmark', 'global', 'hvidovre','media', 'trier', the most reasonable answer is 'denmark' as it is the country where the company was started and is based. <|end|>",denmark,Zentropa or Zentropa Entertainments is a Danish film company started in 1992 by director Lars von Trier and producer Peter Aalbæk Jensen. It has produced over 70 feature films and has become the largest film production company in Scandinavia
65,What was the 'instance_of' for the 2007 Latin Billboard Music Awards?,award ceremony,achievement," The context states that the ""Billboard"" Latin Music Awards are an award ceremony that began in 1994. The awards are given based on success on the Billboard charts and include various categories such as the Spirit of Hope award for humanitarian achievements and the Lifetime Achievement award. Therefore, the 'instance_of' for the 2007 Latin Billboard Music Awards is 'award ceremony'.
         <|end|>",award ceremony," The context provided gives us a clear understanding of the ""Billboard"" Latin Music Awards. It states that the awards are an industry publication charting the sales and radio airplay success of musical recordings. The awards are given based on success on the Billboard charts and include various categories such as the Spirit of Hope award for humanitarian achievements and the Lifetime Achievement award. The first award ceremony began in 1994.

Given the information in the context, the 'instance_of' for the 2007 Latin Billboard Music Awards is 'award ceremony'. This is because the awards are an event where achievements in the music industry are recognized and celebrated. The other options, such as 'achievement', 'addition', 'album', 'award', 'billboard', 'broadcasting', 'chart', 'data', 'extension', 'industry','magazine','musical','spirit', 'three', and 'year', do not accurately describe the nature of the 2007 Latin Billboard Music Awards. <|end|>",award ceremony,"The ""Billboard"" Latin Music Awards grew out of the ""Billboard"" Music Awards program from ""Billboard"" magazine, an industry publication charting the sales and radio airplay success of musical recordings. The ""Billboard"" awards are the Latin music industrys longest running and most prestigious award. The first award ceremony began in 1994. In addition to awards given on the basis of success on the Billboard charts, the ceremony includes the Spirit of Hope award for humanitarian achievements and the Lifetime Achievement award, as well as awards by the broadcasting partner. The charts can be ranked according to sales, streams or airplay, and for main song charts such as the Hot 100 song chart, all three pools of data are used to compiled the charts. For the ""Billboard"" 200 album chart, streams and track sales are included in addition to album sales"
66,During which historical period did Clinomachus belong to?,megarian school,megarian school," The context provided does not give any information about Clinomachus. However, based on historical knowledge, Clinomachus was a philosopher who belonged to the Megarian school, which was a school of philosophy in Ancient Greece. The Megarian school was active during the classical period, which is the time between the 5th and 4th centuries BCE. Therefore, the correct answer is'megarian school'. <|end|>",megarian school," The context provided does not mention Clinomachus or the Megarian school. However, based on historical knowledge, Clinomachus was a philosopher who belonged to the Megarian school, which was a school of philosophy in Ancient Greece. The Megarian school was active during the classical period, which is the time between the 5th and 4th centuries BCE. Therefore, the correct answer is'megarian school'. <|end|>",megarian school,"In the history of Europe, the Middle Ages or medieval period lasted from the 5th to the 15th century. Editors and translators in the Middle Ages often confused him with Euclid of Alexandria when discussing the latter's ""Elements. It is the period in which Greek and Roman society flourished and wielded great influence throughout Europe, North Africa and Southwestern Asia"
67,What type of work is 'Fredegar Bollers'?,hobbit,fantasy novel," The context mentions that John Ronald Reuel Tolkien, known by his pen name J. Tolkien, is an English writer, poet, philologist, and university professor who is best known as the author of the classic high-fantasy works ""The Hobbit"", ""The Lord of the Rings"", and ""The Silmarillion"".

The term 'Fredegar Bollers' is not mentioned in the context. However, based on the context, we can infer that the type of work that 'Fredegar Bollers' could be is a 'fantasy novel', as it is the only option that aligns with the context of high-fantasy works mentioned.

Therefore, the most reasonable answer is 'fantasy novel'. <|end|>",fantasy novel," Based on the context provided, the term 'Fredegar Bollers' is not mentioned. However, we can infer that the type of work that 'Fredegar Bollers' could be is a 'fantasy novel', as it is the only option that aligns with the context of high-fantasy works mentioned. <|end|>",fantasy novel,"John Ronald Reuel Tolkien, (3 January 1892  2 September 1973), known by his pen name J. Tolkien, was an English writer, poet, philologist, and university professor who is best known as the author of the classic high-fantasy works ""The Hobbit"", ""The Lord of the Rings"", and ""The Silmarillion. R. R"
68,What was the occupation of Anna Bonaiuto?,actor,musician," Based on the context provided, Anna Bonaiuto is an Italian actress. Therefore, the correct answer from the given options is 'actor'. <|end|>",actor," The context provided states that Anna Bonaiuto is an Italian actress. Therefore, the correct answer from the given options is 'actor'. <|end|>",actor,Anna Bonaiuto ( born 28 January 1950 ) is an Italian actress
69,What is the original language of the work 'Pyramid'?,english,english," The context states that Pyramid is an Australian children's quiz show hosted by Shura Taft, which began broadcasting on 1 September 2009. Given that Shura Taft is an English-born Australian television and radio presenter, and the show is Australian, it is reasonable to infer that the original language of the show 'Pyramid' is English. Therefore, the correct answer is 'english'. <|end|>",english," The context provided states that Shura Taft, an English-born Australian television and radio presenter, hosted the Australian children's quiz show ""Pyramid."" Given that the show is Australian and hosted by an English-born presenter, it is reasonable to infer that the original language of the show ""Pyramid"" is English. Therefore, the correct answer is 'english'. <|end|>",english,"Shura Taft is an English-born Australian television and radio presenter, based in Melbourne. He also hosted the children's game show ""Pyramid"" from 2009 to 2012. Pyramid is an Australian children 's quiz show screening on the Nine Network hosted by Shura Taft. It began broadcasting on 1 September 2009 and is filmed in front of a live studio audience"
70,Who was the director of the Chicago production?,frank john urson,edwin thanhouser," The context states that the director of the Chicago production was Frank Urson. Therefore, the correct answer is 'frank john urson'. <|end|>",frank john urson," The correct answer is 'frank john urson'. The context clearly states that 'the director of the Chicago production was Frank Urson'. The other options provided, such as 'edwin thanhouser', 'howard higgin', 'james cruze', 'paul iribe', 'variety', and 'william garwood', are not mentioned in the context as the director of the Chicago production. <|end|>",frank john urson,"DeMille and directed by Frank Urson. He is also credited with acting in one film ""Her Gallant Knights"" which starred William Garwood in 1913"
71,What is the date of birth of Pat Kenny?,29 january 1948,19 april 1958," The context does not provide any information about Pat Kenny's date of birth. Therefore, we cannot determine the correct answer from the given options. <|end|>",1926," The context provided does not include any information about Pat Kenny's date of birth. Therefore, we cannot determine the correct answer from the given options. <|end|>",1926,"The Pat Kenny Show is a televised talk show broadcast on Raidió Teilifís Éireann (RTÉ) in the mid-1980s. Patrick `` Pat '' Kenny is a veteran Irish broadcaster , who currently hosts The Pat Kenny Show on Newstalk and Pat Kenny in the Round on UTV Ireland. Prior to this , Kenny had a 41 year high profile career at RTÉ , in which he was their highest paid presenter for several years. He presented radio show Today with Pat Kenny on RTÉ Radio 1 each weekday morning between 10:00 and midday until 2013. He presented the current affairs programme , The Frontline , each Monday night from 2009 until its axing in 2013. He is the holder of a Jacob 's Award and was perennially cited as the highest paid employee in RTÉ 's possession. He was named 23rd most influential person of 2009 by the magazine Village"
72,What was the language of the work or name of the small Soviet encyclopedia?,russian,swedish," The context states that the Small Soviet Encyclopedia has been promoted to the full status of a letter in the alphabets of some languages, including Norwegian, Danish, Icelandic, and Faroese. However, the candidate answer'swedish' is not mentioned in the context.

The context also mentions that as a letter of the Old English Latin alphabet, it was called ""æsc"" (""ash tree"") after the Anglo-Saxon futhorc rune which it transliterated. This suggests that the language of the work or name of the Small Soviet Encyclopedia is related to the Old English Latin alphabet.

Given the options provided, the most reasonable answer would be 'latin', as it is the language of the Old English Latin alphabet. <|end|>",latin," The context provided does not mention the language of the work or name of the Small Soviet Encyclopedia being Swedish. However, it does mention that the encyclopedia has been promoted to the full status of a letter in the alphabets of some languages, including Norwegian, Danish, Icelandic, and Faroese. Additionally, it states that as a letter of the Old English Latin alphabet, it was called ""æsc"" (""ash tree"") after the Anglo-Saxon futhorc rune which it transliterated.

Given the options provided, the most reasonable answer would be 'latin', as it is the language of the Old English Latin alphabet. The encyclopedia's name and work are related to the Old English Latin alphabet, and the context does not mention Swedish as a language associated with the encyclopedia. <|end|>",latin,"The Small Soviet Encyclopedia (    ) was a general encyclopedia published in the Soviet Union. It has been promoted to the full status of a letter in the alphabets of some languages, including Norwegian, Danish, Icelandic, and Faroese. As a letter of the Old English Latin alphabet, it was called ""æsc"" (""ash tree"") after the Anglo-Saxon futhorc rune  which it transliterated; its traditional name in English is still ash. Variants include"
73,What language(s) was Max Shachtman known to speak or write in?,english,english," The context provided does not give any information about Max Shachtman or the languages he spoke or wrote in. However, Max Shachtman was a Marxist theorist and a member of the Socialist Workers Party in the United States. Given that he was an American and the context does not provide any information to the contrary, it is reasonable to assume that he spoke and wrote in English. Therefore, the answer is 'english'. <|end|>",english," The context provided does not mention Max Shachtman or the languages he spoke or wrote in. However, Max Shachtman was an American Marxist theorist and a member of the Socialist Workers Party in the United States. Given that he was an American and the context does not provide any information to the contrary, it is reasonable to assume that he spoke and wrote in English. Therefore, the answer is 'english'.

Suggestion: ['english', 'russian']

The context provided is about the October Revolution and the Red Army, which were significant events in Russian history. It does not mention Max Shachtman or the languages he spoke or wrote in. However, considering that Max Shachtman was an American and the context is about Russian history, it is possible that he had some knowledge of Russian. Therefore, the suggested answer includes both 'english' and 'russian'. <|end|>",english,"The October Revolution, officially known in the Soviet literature as the Great October Socialist Revolution , and commonly referred to as Red October, the October Uprising or the Bolshevik Revolution, was a seizure of state power instrumental in the larger Russian Revolution of 1917. The Workers' and Peasants' Red Army (: RKKA, frequently shortened in Russian to ; KA, in English: Red Army also in critical literature and folklore of that epoch - Red Horde, Army of Work) was the army and the air force of the Russian Soviet Federative Socialist Republic, and after 1922 the Union of Soviet Socialist Republics. The Bolsheviks raised an army to oppose the military confederations (especially the various groups collectively known as the White Army) of their adversaries during the Russian Civil War. Beginning in February 1946, the Red Army, along with the Soviet Navy, embodied the main component of the Soviet Armed Forces; taking the official name of ""Soviet Army"", until its dissolution in December 1991"
74,What was the occupation of Frozen Fana?,politician,father," The context states that Frozan Fana was a candidate in the Afghan presidential election, 2009. This indicates that her occupation was related to politics. Therefore, the most appropriate answer from the given options is 'politician'. <|end|>",politician," The context provided states that Frozan Fana was a candidate in the Afghan presidential election, 2009. This indicates that her occupation was related to politics. Therefore, the most appropriate answer from the given options is 'politician'. <|end|>",politician,"Frozan Fana ( born 1969 ) was a candidate in the Afghan presidential election , 2009"
75,What type of item is a 'list of case closed volumes'?,book,term," The context provided discusses the term 'tankobon', which is a Japanese term for a book that is complete in itself and is not part of a series or corpus. It is most often used in reference to individual volumes of a single manga. However, the term 'tankobon' is not mentioned in the options provided.

The term 'list of case closed volumes' refers to a collection or compilation of individual volumes of a series, in this case, the series being 'Case Closed'. This term does not refer to a single book, manga, or word. Therefore, the most appropriate answer from the given options is 'term'. <|end|>",term," The term 'list of case closed volumes' refers to a collection or compilation of individual volumes of a series, in this case, the series being 'Case Closed'. This term does not refer to a single book, manga, or word. Therefore, the most appropriate answer from the given options is 'term'. <|end|>",term,"A is the Japanese term for a book that is complete in itself and is not part of a series or corpus. In modern Japan, though, it is most often used in reference to individual volumes of a single manga, as opposed to , which feature multiple series. Tankbon are not just confined to manga, and can be used for almost anything in a hardcover or softcover format from novels to books about beauty tips. Manga"" as a term used outside Japan refers to comics originally published in Japan. Case Closed , known as Meitantei Conan (  , lit"
