,query,correct,thesis,pre-antithesis,antithesis,pre-synthesis,synthesis,context
19,Who was the director of photography for the film 'Alila'?,renato berta,rainer werner fassbinder," The context mentions that the person in question has worked with various directors and actors, including Renato Berta. However, it does not explicitly state that Renato Berta was the director of photography for the film 'Alila'.

To find the correct answer, we need to look beyond the context provided. 'Alila' is a film directed by Amos Gitai, and the director of photography for this film was Renato Berta.

Therefore, the correct answer is'renato berta'. <|end|>",renato berta," The context provided does not directly answer the question about the director of photography for the film 'Alila'. However, it does mention Renato Berta as someone the subject has worked with. To find the correct answer, we need to look beyond the context.

'Alila' is a film directed by Amos Gitai, and the director of photography for this film was Renato Berta.

Therefore, the correct answer is'renato berta'. <|end|>",renato berta,"He has worked with Juliette Binoche, Jeanne Moreau, Natalie Portman, Yael Abecassis, Samuel Fuller, Hanna Schygulla, Annie Lennox, Barbara Hendricks, Lea Seydoux, Valeria Bruni Tedeschi, Simon et Markus Stockhausen, Henri Alekan, Renato Berta, Nurith Aviv, Eric Gautier and more. Long associated with the theater and film director Rainer Werner Fassbinder, for whom Schygulla first worked in 1965, she is generally considered the most prominent German actress of the New German Cinema"
20,What was the native language of Carlo Bertinazzi?,french,french," The context provided does not give any information about Carlo Bertinazzi or his native language. However, Carlo Bertinazzi was an Italian actor and comedian, known for his work in the 19th century. Therefore, the most reasonable answer, based on historical knowledge, would be 'italian'. <|end|>",italian," The context provided does not mention Carlo Bertinazzi or his native language. However, based on historical knowledge, Carlo Bertinazzi was an Italian actor and comedian from the 19th century. Therefore, the most reasonable answer would be 'italian'. <|end|>",italian,The regions of Semigallia and Selonia are sometimes considered as part of Courland as they were formerly held by the same duke
21,What languages was Titus Pomponius Atticus known to speak or write in?,latin,french," The context states that Titus Pomponius Atticus was a celebrated editor, banker, and patron of letters from an old but not strictly noble Roman family of the equestrian class and the gens Pomponia. The gens Pomponia is a Roman family, and the Roman Empire used Latin as its official language. Therefore, it is reasonable to assume that Titus Pomponius Atticus spoke and wrote in Latin.

The options 'french' and 'greek' do not figure in the context and are not proper answers. Thus the most reasonable option is 'latin'. <|end|>",latin," The context provided states that Titus Pomponius Atticus was a celebrated editor, banker, and patron of letters from an old but not strictly noble Roman family of the equestrian class and the gens Pomponia. The Roman Empire used Latin as its official language, and it is reasonable to assume that Titus Pomponius Atticus spoke and wrote in Latin. The options 'french' and 'greek' do not figure in the context and are not proper answers. Therefore, the most reasonable option is 'latin'. <|end|>",latin,"Quintus Caecilius Pomponianus ( born Titus Pomponius ; c. November 110 -- 31 March 32 BC ) , better known by his cognomen Atticus , was a celebrated editor , banker , and patron of letters from an old but not strictly noble Roman family of the equestrian class and the gens Pomponia. 1st century BC). A library is a collection of sources of information and similar resources, made accessible to a defined community for reference or borrowing"
22,What is the original language of the work titled 'Nothing So Strange'?,english,english," The context provided does not mention the work titled 'Nothing So Strange'. However, based on the title and the options provided, the most reasonable answer is 'english'. The term 'basic' is not a language, and thus cannot be the original language of the work. <|end|>",english," Question: What is the original language of the work titled 'Nothing So Strange'?
Options: ['english', 'basic']
Candidate answer: English
Suggestion: The context provided does not mention the work titled 'Nothing So Strange'. However, based on the title and the options provided, the most reasonable answer is 'english'. The term 'basic' is not a language, and thus cannot be the original language of the work. <|end|>",english,"In the 2010s, this distinction is not always present in large big box consumer electronics stores, such as Best Buy, which sell both entertainment, communications, and home office devices and kitchen appliances such as refrigerators. Microsoft Office is an office suite of applications, servers, and services developed by Microsoft"
23,What is the term for the Dutch colonial revival architectural style?,architectural style,side," The term for the Dutch colonial revival architectural style is 'Dutch Colonial Revival'. The context mentions that modern versions built in the early 20th century are more accurately referred to as 'Dutch Colonial Revival', a subtype of the Colonial Revival style. Therefore, the correct answer is'style'. <|end|>",style," The term for the Dutch colonial revival architectural style is 'Dutch Colonial Revival'. The context provided states that modern versions built in the early 20th century are more accurately referred to as 'Dutch Colonial Revival', a subtype of the Colonial Revival style. Therefore, the correct answer is 'Dutch Colonial Revival'. <|end|>",architecture,"Europeans historically did not distinguish between a gambrel roof and a mansard roof but called both types a mansard. Modern versions built in the early 20th century are more accurately referred to as `` Dutch Colonial Revival , '' a subtype of the Colonial Revival style"
24,What was the religious affiliation of Andrew Tsien Chih-ch'un?,catholic church,roman catholic," The context states that Andrew Tsien Chih-ch'un was the third Roman Catholic bishop of Hwalien. Therefore, his religious affiliation was Roman Catholic. The options 'catholic' and 'catholic church' are not as specific as 'roman catholic', which is the most accurate answer. <|end|>",roman catholic," The context provided states that Andrew Tsien Chih-ch'un was the third Roman Catholic bishop of Hwalien. This information directly indicates his religious affiliation as Roman Catholic. While 'catholic' and 'catholic church' are related terms, they are not as specific as 'roman catholic', which is the most accurate answer. Therefore, the correct option is 'roman catholic'. <|end|>",roman catholic,"Paul Shan Kuo-hsi, S. (Chinese language: ; pinyin: Shàn Guóx) (December 3, 1924  August 22, 2012) was a cardinal in the Roman Catholic Church. Andrew Tsien Chih - ch'un ( Chinese :  ; April 9 , 1926 -- February 18 , 2009 ) was the third Roman Catholic bishop of Hwalien"
25,In which language was 'Green Fire' originally written?,english,instrumental," The context provided does not mention the book 'Green Fire' or its author. However, it does mention Miklós Rózsa, a Hungarian composer who was active in several countries, including the United States. Given that Rózsa was a Hungarian composer, it is reasonable to assume that 'Green Fire' was originally written in Hungarian. However, without more specific information about the book, this is only an educated guess.

The option 'instrumental' is not a language and can be eliminated. The other languages listed are English, French, German, and Latin. Since Rózsa was Hungarian, the most likely answer would be Hungarian.

So, the most reasonable answer based on the given context is 'hungarian'. <|end|>",hungarian," Question: In which language was 'Green Fire' originally written?
Options: ['english', 'french', 'german', 'hungarian', 'instrumental', 'latin']
Candidate answer: 'hungarian'
Suggestion: The context provided does not mention the book 'Green Fire' or its author. However, it does mention Miklós Rózsa, a Hungarian composer who was active in several countries, including the United States. Given that Rózsa was a Hungarian composer, it is reasonable to assume that 'Green Fire' was originally written in Hungarian. However, without more specific information about the book, this is only an educated guess.

The option 'instrumental' is not a language and can be eliminated. The other languages listed are English, French, German, and Latin. Since Rózsa was Hungarian, the most likely answer would be Hungarian.

So, the most reasonable answer based on the given context is 'hungarian'. <|end|>",german,"Miklós Rózsa (18 April 1907  27 July 1995) was a Hungarian composer trained in Germany (19251931), and active in France (19311935), England (19351940), and the United States (19401995), with extensive sojourns in Italy from 1953. Best known for his nearly one hundred film scores, he nevertheless maintained a steadfast allegiance to absolute concert music throughout what he called his ""double life. g. , for solo piano, string quartet, wind quintet or orchestra) or music which combines both instruments and voices (e. g. The core meaning of the term refers to individuals who have contributed to the tradition of Western classical music through creation of works expressed in written musical notation (e. Stewart Granger (born James Lablache Stewart; 6 May 191316 August 1993) was an English film actor, mainly associated with heroic and romantic leading roles"
26,In which language was 'The Tell-Tale Heart' originally written?,english,basic," The context provided does not give any information about 'The Tell-Tale Heart'. However, we know that 'The Tell-Tale Heart' is a short story by Edgar Allan Poe, an American writer. Therefore, the most reasonable answer is 'english', as it was originally written in English. The other options 'basic', 'irish', and 'latin' do not fit the context. <|end|>",english," The context provided does not give any information about 'The Tell-Tale Heart'. However, we know that 'The Tell-Tale Heart' is a short story by Edgar Allan Poe, an American writer. Therefore, the most reasonable answer is 'english', as it was originally written in English. The other options 'basic', 'irish', and 'latin' do not fit the context. <|end|>",english,"The supernatural (Medieval Latin: ""superntrlis"": ""supra"" ""above"" + ""naturalis"" ""natural"", first used: 15201530 AD) includes all that cannot be explained by science or the laws of nature, including things characteristic of or relating to ghosts, gods, or other supernatural beings, or to things beyond nature. Abraham ""Bram"" Stoker (8 November 1847  20 April 1912) was an Irish author, best known today for his 1897 Gothic novel ""Dracula. Horror may also overlap with the fantasy, supernatural fiction and thriller genres. A film genre (or ) is a motion picture category based on similarities in either the narrative elements or the emotional response to the film (namely, serious, comic, etc"
27,What was the occupation of Itakura Shigemune?,samurai,emperor," The context states that Itakura Shigemune was a Japanese daimyo of the early Edo period. A daimyo was a powerful feudal lord in Japan during the Edo period. The term 'daimyo' is not synonymous with 'emperor', 'founder', or'samurai'. However, a daimyo could have samurai under his command.

The term 'official' is the most appropriate among the given options, as a daimyo would have held an official position in the feudal hierarchy of Japan. Therefore, the correct answer is 'official'. <|end|>",official," Question: What was the occupation of Itakura Shigemune?
Options: ['emperor', 'founder', 'official','samurai']
Candidate answer: 'official'
Suggestion: The context states that Itakura Shigemune was a Japanese daimyo of the early Edo period. A daimyo was a powerful feudal lord in Japan during the Edo period. The term 'daimyo' is not synonymous with 'emperor', 'founder', or'samurai'. However, a daimyo could have samurai under his command.

The term 'official' is the most appropriate among the given options, as a daimyo would have held an official position in the feudal hierarchy of Japan. Therefore, the correct answer is 'official'. <|end|>",official,"Itakura Shigemune (   , 1586 -- January 15 , 1657 ) was a Japanese daimyo of the early Edo period"
28,What is the taxon rank of Hexathele hochstetteri?,species,superfamily," The context provided does not give information about the taxon rank of Hexathele hochstetteri. However, based on the information given, we know that Hexathele hochstetteri is a member of the genus Hexathele, which is part of the family Dipluridae. Therefore, the taxon rank of Hexathele hochstetteri is'species'. <|end|>",species," The context provided does not give information about the taxon rank of Hexathele hochstetteri. However, based on the information given, we know that Hexathele hochstetteri is a member of the genus Hexathele, which is part of the family Dipluridae. Therefore, the taxon rank of Hexathele hochstetteri is'species'. <|end|>",species,"The family Dipluridae, known as curtain-web spiders (or confusingly with other distantly related ones as funnel-web tarantulas) are a group of spiders in the infraorder Mygalomorphae, that have two pairs of booklungs, and chelicerae (fangs) that move up and down in a stabbing motion. The genus was erected by the Reverend Octavius Pickard-Cambridge in 1877 for the species ""Atrax robustus. It is a member of a group of spiders known as Australian funnel-web spiders. Its bite is capable of causing serious injury or death in humans if left untreated"
29,What platform did Master Chu and the Drunkard Hu belong to?,nintendo entertainment system,internet, The context mentions that the company shifted its focus to IP cameras and related surveillance equipment. This implies that Master Chu and the Drunkard Hu belonged to the 'internet' platform. The 'handheld' and 'nintendo entertainment system' options are not supported by the context. <|end|>,internet," The context provided states that the company shifted its focus to IP cameras and related surveillance equipment. This implies that Master Chu and the Drunkard Hu belonged to the 'internet' platform, as IP cameras are a type of digital video camera that can send and receive data via a computer network and the Internet. The 'handheld' and 'nintendo entertainment system' options are not supported by the context. <|end|>",internet,"An Internet protocol camera, or IP camera, is a type of digital video camera commonly employed for surveillance, and which, unlike analog closed circuit television (CCTV) cameras, can send and receive data via a computer network and the Internet. Although most cameras that do this are webcams, the term ""IP camera"" or ""netcam"" is usually applied only to those used for surveillance. Other common forms of electronic game include such products as handheld electronic games, standalone systems (e. pinball, slot machines, or electro-mechanical arcade games), and exclusively non-visual products (e. audio games). The company left the video game industry in the mid-1990s, shifting its focus to IP cameras and related surveillance equipment. This game was not officially licensed by Nintendo and was manufactured using either non-standard light blue or black cartridges , typical to all games published by Color Dreams"
30,What was the native language of Antoine Baudeau de Somaize?,french,english," The context does not provide any information about Antoine Baudeau de Somaize or his native language. However, Antoine Baudeau de Somaize was a French writer and courtier in the 17th century. Given this historical context, it is reasonable to infer that his native language was French. Therefore, the correct answer is 'french'. <|end|>",french," The context provided does not mention Antoine Baudeau de Somaize or his native language. However, given that he was a French writer and courtier in the 17th century, it is reasonable to infer that his native language was French. Therefore, the correct answer is 'french'. <|end|>",french,"Anna Maria (Marie) Mancini (28 August 1639  8 May 1715) was the third of the five Mancini sisters; nieces to Cardinal Mazarin who were brought to France to marry advantageously. To overcome aristocratic resistance to the matches, the cardinal generously granted huge dowries to the fiancés. A chief minister is the elected head of government of a sub-national (e"
31,What is the original language of the work titled 'Christmas in July'?,english,armenian," The context states that 'Christmas in July' is a 1940 comedy film written and directed by Preston Sturges based on his 1931 play 'A Cup of Coffee'. The original language of the play, and thus the film, is English. Therefore, the correct answer is 'english'. <|end|>",english," The context provided states that 'Christmas in July' is a 1940 comedy film written and directed by Preston Sturges based on his 1931 play 'A Cup of Coffee'. The original language of the play, and thus the film, is English. Therefore, the correct answer is 'english'. <|end|>",english,Christmas in July is a 1940 comedy film written and directed by Preston Sturges based on his 1931 play A Cup of Coffee. A revised view characterizes the essential agon of comedy as a struggle between a relatively powerless youth and the societal conventions that pose obstacles to his hopes
32,What is an instance of 'love'?,book,novel," The context provided is about the novel ""The Bluest Eye"" by Toni Morrison. The novel explores themes of love, beauty, and racial identity through the experiences of its characters. In this context, the most appropriate instance of 'love' would be the 'novel' itself, as it is the medium through which the author explores and portrays the concept of love. <|end|>",novel," In the context of the novel ""The Bluest Eye"" by Toni Morrison, an instance of 'love' can be seen in the relationships between the characters, particularly the complex dynamics between Pecola, her family, and the community. The novel explores the impact of societal beauty standards and racism on the characters' self-perception and their ability to experience love and acceptance.

One example of love in the novel is the relationship between Pecola and her mother, Pauline. Although their relationship is strained and marked by neglect, there are moments when Pauline shows care and concern for her daughter. However, her preoccupation with the white family she works for and her internalized racism prevent her from fully expressing her love for Pecola.

Another instance of love is seen in the relationship between Claudia MacTeer and her sister Frieda. Claudia narrates the story and provides insight into the lives of the characters around her. Claudia and Frieda share a strong bond, and their love for each other is evident in the way they support and protect one another throughout the novel.

In conclusion, the novel ""The Bluest Eye"" presents various instances of love, both positive and negative, as it explores the impact of racism and societal beauty standards on the characters' lives. The relationships between the characters, such as Pecola and her mother, and Claudia and Frieda, showcase the complexities of love in the face of adversity. <|end|>",single,"The Bluest Eye was written by Toni Morrison in 1970. She centers the story around a young African American girl named Pecola who grows up during the years following the Great Depression in Lorain, Ohio. Due to her dark skin color, Pecola gets taunted for her appearance as the members of her community associate beauty with ""whiteness. The point of view switches between the perspective of Claudia MacTeer, the daughter of Pecola's foster parents, and multiple third-person limited viewpoints. Due to the controversial issues the book raises such as racism, incest, and child molestation, there have been numerous attempts to ban it from schools and libraries"
33,What was the original language of the work 'Zorba the Greek'?,modern greek,greek," The context states that 'Zorba the Greek' is a novel written by the Cretan author Nikos Kazantzakis. The title of the novel in Greek is 'Vios ke Politia tou Alexi Zorba', which translates to 'Life and Times of Alexis Zorbas'. This indicates that the original language of the work is Greek. Therefore, the most reasonable answer is 'greek'. <|end|>",greek," The context states that 'Zorba the Greek' is a novel written by the Cretan author Nikos Kazantzakis. The title of the novel in Greek is 'Vios ke Politia tou Alexi Zorba', which translates to 'Life and Times of Alexis Zorbas'. This indicates that the original language of the work is Greek. Therefore, the most reasonable answer is 'greek'. <|end|>",greek,"Zorba the Greek (       Vios ke Politia tou Alexi Zorba , Life and Times of Alexis Zorbas ) is a novel written by the Cretan author Nikos Kazantzakis , first published in 1946. It was first published in English in 1960"
34,What is the place of birth of Liviu Ciobotariu?,giurgiu,serbia," The context states that Liviu Ciobotariu was born on 26 March 1971 in Ghimpai. However, Ghimpai is not listed in the options. Among the given options, 'Romania' is the most reasonable answer as Ghimpai is a town in Romania.

Therefore, the correct answer is 'romania'. <|end|>",romania," The context states that Liviu Ciobotariu was born on 26 March 1971 in Ghimpai. Ghimpai is a town in Romania. Among the given options, 'Romania' is the most reasonable answer as Ghimpai is a town in Romania.

Therefore, the correct answer is 'romania'. <|end|>",romania,Liviu Ciobotariu ( born 26 March 1971 in Ghimpai ) is a Romanian football manager and former defender. He is the head coach of Saudi Arabian club Al - Faisaly
35,What was the country of citizenship of Giuseppe Sommaruga?,italy,academic," The context provided does not give any information about Giuseppe Sommaruga's country of citizenship. However, based on the options provided, 'academic' is not a country, and 'Milan' is a city, not a country. Therefore, the most reasonable answer from the given options is 'Italy'. <|end|>",italy," The context provided does not give any information about Giuseppe Sommaruga's country of citizenship. However, based on the options provided, 'academic' is not a country, and 'Milan' is a city, not a country. Therefore, the most reasonable answer from the given options is 'Italy'. <|end|>",italy,"In this context it is often called ""academism"", ""academicism"", ""L'art pompier"", and ""eclecticism"", and sometimes linked with ""historicism"" and ""syncretism"
36,In which language was 'The Dark Design' originally written?,english,french," The context states that 'The Dark Design' is a science fiction novel by Philip José Farmer. Philip José Farmer was an American author who wrote primarily in English. Therefore, the most reasonable answer is 'english'. <|end|>",english," The context provided states that 'The Dark Design' is a science fiction novel by Philip José Farmer. Philip José Farmer was an American author who wrote primarily in English. Therefore, the most reasonable answer is 'english'. <|end|>",english,"The supernatural (Medieval Latin: ""superntrlis"": ""supra"" ""above"" + ""naturalis"" ""natural"", first used: 15201530 AD) includes all that cannot be explained by science or the laws of nature, including things characteristic of or relating to ghosts, gods, or other supernatural beings, or to things beyond nature. The Dark Design ( 1977 ) is a science fiction novel , the third in the series of Riverworld books by Philip José Farmer"
37,What is the sport associated with the UCI BMX World Championships?,bicycle motocross,sport," The context states that the Union Cycliste Internationale (UCI) is the world governing body for sports cycling and oversees international competitive cycling events. BMX racing is a type of off-road bicycle racing. 

The options 'bicycle motocross', 'cycling', and 'road bicycle racing' are all related to cycling, but the UCI BMX World Championships specifically refers to a competition in the sport of BMX racing. Therefore, the most accurate answer is 'bicycle motocross'. <|end|>",bicycle motocross," The Union Cycliste Internationale (UCI) is the world governing body for sports cycling and oversees international competitive cycling events. BMX racing is a type of off-road bicycle racing. The UCI BMX World Championships is a competition in the sport of BMX racing. Therefore, the sport associated with the UCI BMX World Championships is 'bicycle motocross'. <|end|>",bicycle motocross,"The Union Cycliste Internationale, commonly known by the acronym UCI, is the world governing body for sports cycling and oversees international competitive cycling events. BMX racing is a type of off-road bicycle racing. 
The sport of BMX racing is facilitated by a number of regional and international sanctioning bodies. Persons engaged in cycling are referred to as ""cyclists"", ""bikers"", or less commonly, as ""bicyclists. Apart from two-wheeled bicycles, ""cycling"" also includes the riding of unicycles, tricycles, quadracycles, recumbent and similar human-powered vehicles (HPVs)"
