,query,correct,thesis,pre-antithesis,antithesis,pre-synthesis,synthesis,context
38,What was the occupation of Dimitar Berbatov?,association football player,association football player," The context states that Dimitar Ivanov Berbatov is a Bulgarian professional footballer who plays as a striker for Greek club PAOK. He has also captained the Bulgaria national team and is the country's all-time leading goalscorer. He has played for clubs like Leverkusen, Tottenham Hotspur, and Manchester United.

Given the options 'association football' and 'association football player', the correct answer is 'association football player' as it accurately describes Dimitar Berbatov's occupation. <|end|>",association football player," The context provided states that Dimitar Ivanov Berbatov is a Bulgarian professional footballer who plays as a striker for Greek club PAOK. He has also captained the Bulgaria national team and is the country's all-time leading goalscorer. He has played for clubs like Leverkusen, Tottenham Hotspur, and Manchester United.

Given the options 'association football' and 'association football player', the correct answer is 'association football player' as it accurately describes Dimitar Berbatov's occupation. <|end|>",association football player,"Dimitar Ivanov Berbatov ( Bulgarian :    ( dimitr brbatf ) ; born 30 January 1981 ) is a Bulgarian professional footballer who plays as a striker for Greek club PAOK. He captained the Bulgaria national team from 2006 to 2010 , and is the country 's all - time leading goalscorer. After five - and - a - half years with Leverkusen , he joined English club Tottenham Hotspur in July 2006 , where he spent two years before moving to Manchester United"
39,What is the country of citizenship of Susan Hill?,united kingdom,panama," The context states that Susan Hill is an English author of fiction and non-fiction works. The term 'English' refers to something related to England, which is a part of the United Kingdom. Therefore, the country of citizenship of Susan Hill is the United Kingdom. The option 'panama' is incorrect as there is no mention of Panama in the context. The correct answer is 'united kingdom'. <|end|>",united kingdom," The context provided states that Susan Hill is an English author. England is a part of the United Kingdom, so the country of citizenship of Susan Hill is the United Kingdom. The option 'panama' is incorrect as there is no mention of Panama in the context. The correct answer is 'united kingdom'. <|end|>",united kingdom,"The Woman in Black is a 1983 horror novella by Susan Hill, written in the style of a traditional Gothic novel. Susan Hill CBE ( born 5 February 1942 ) is an English author of fiction and non-fiction works. The award is to be spent on foreign travel"
40,What languages did Idrissa Ouedraogo speak or write in?,french,french," Idrissa Ouedraogo was a film director from Burkina Faso, which was formerly known as the Republic of Upper Volta. The context does not provide specific information about the languages he spoke or wrote in. However, considering that Burkina Faso is a former French colony and French is the official language of the country, it is reasonable to assume that Idrissa Ouedraogo spoke and wrote in French. The Mossi language is spoken by the Mossi people, the largest ethnic group in Burkina Faso, but there is no information in the context to suggest that Ouedraogo spoke or wrote in Mossi. Therefore, the most reasonable answer is 'french'. <|end|>",french," The context provided does not explicitly mention the languages spoken or written by Idrissa Ouedraogo. However, considering that Burkina Faso was a former French colony and French is the official language of the country, it is reasonable to assume that Idrissa Ouedraogo spoke and wrote in French. The Mossi language is spoken by the Mossi people, the largest ethnic group in Burkina Faso, but there is no information in the context to suggest that Ouedraogo spoke or wrote in Mossi. Therefore, the most reasonable answer is 'french'. <|end|>",french,"The Republic of Upper Volta was a landlocked west-African country established on December 11, 1958, as a self-governing colony within the French Community. Idrissa Ouédraogo ( born 21 January 1954 in Banfora , Upper Volta , now Burkina Faso ) is a film director from Burkina Faso. Burkina Faso is a landlocked country in Africa around in size"
41,In which genre does the concept of 'fear' play a key role?,book,february," The context provided discusses the first-person shooter (FPS) video game genre, which is centered on gun and projectile weapon-based combat through a first-person perspective. The concept of 'fear' can play a key role in this genre, as it often involves intense, high-stakes situations that can evoke fear in players.

The options 'april', 'february', 'person', 'perspective', 'point', 'projectile','shooter','station', 'three', 'video', 'video game', 'video game genre', 'war', 'weapon', and 'writing' do not directly relate to the genre in which the concept of 'fear' plays a key role.

The most appropriate answer from the given options is'shooter', as it is a subgenre of video games that often incorporates elements of fear and tension.

In summary, the concept of 'fear' plays a key role in the'shooter' genre, particularly in first-person shooter (FPS) video games. <|end|>",shooter," The context provided discusses the first-person shooter (FPS) video game genre, which is centered on gun and projectile weapon-based combat through a first-person perspective. The concept of 'fear' can play a key role in this genre, as it often involves intense, high-stakes situations that can evoke fear in players.

The options 'april', 'february', 'person', 'perspective', 'point', 'projectile','shooter','station', 'three', 'video', 'video game', 'video game genre', 'war', 'weapon', and 'writing' do not directly relate to the genre in which the concept of 'fear' plays a key role.

The most appropriate answer from the given options is'shooter', as it is a subgenre of video games that often incorporates elements of fear and tension.

In summary, the concept of 'fear' plays a key role in the'shooter' genre, particularly in first-person shooter (FPS) video games. <|end|>",shooter,"First-person shooter (FPS) is a video game genre which is centered on gun and projectile weapon-based combat through a first-person perspective; that is, the player experiences the action through the eyes of the protagonist. A first-person narrative is a story from the first-person perspective: the viewpoint of a character writing or speaking directly about themselves. In films, videos, or video games, a first-person perspective may also mean that the narrative is shot or presented as if directly coming from a character's in-body point of view, portraying exactly what the character sees or experiences (for example, in first-person shooter games). Hutton and shot on location in Austria and Bavaria. Alistair MacLean wrote the novel and the screenplay, at the same time. It was his first screenplay; both film and book became commercial successes"
42,What languages was George Cubitt known to speak or write in?,english,serbian," The context provided does not give any information about George Cubitt's language skills. However, considering that he was a British politician and peer, it is reasonable to assume that he spoke and wrote in English. Therefore, the most appropriate answer from the given options is 'english'. <|end|>",english," The context provided does not give any information about George Cubitt's language skills. However, considering that he was a British politician and peer, it is reasonable to assume that he spoke and wrote in English. Therefore, the most appropriate answer from the given options is 'english'. <|end|>",english,"Politics (from Greek: Politiká: P""olitika"", definition ""affairs of the cities"") is the process of making decisions applying to all members of each group. George Cubitt , 1st Baron Ashcombe PC ( 4 June 1828 -- 26 February 1917 ) was a British politician and peer , the son of Thomas Cubitt , the leading London builder and property developer of his day. Founded in 1904 by Vladislav F"
43,In which language were the original works that discuss 'fires were started' written?,english,french," The context provided does not give any information about the original works discussing 'fires were started'. However, considering the historical period and the fact that the Blitz was a British event during the Second World War, it is reasonable to assume that the original works would have been written in English.

Therefore, the most reasonable answer is 'english'. <|end|>",english," The context provided does not directly mention the language in which the original works discussing 'fires were started' were written. However, it does mention Frank Humphrey Sinkler Jennings, an English documentary filmmaker, and the Blitz, a British event during the Second World War. Given this information, it is reasonable to infer that the original works would have been written in English, as they pertain to British history and were likely produced by British individuals.

Therefore, the most reasonable answer is 'english'. <|end|>",english,"The Blitz, from the German word ""Blitzkrieg"" meaning 'lightning war', was the name used by the British press to describe the heavy air raids carried out over Britain in 1940 and 1941, during the Second World War. Frank Humphrey Sinkler Jennings (19 August 1907  24 September 1950) was an English documentary filmmaker and one of the founders of the Mass Observation organisation. Jennings was described by film critic and director Lindsay Anderson in 1954 as: ""the only real poet that British cinema has yet produced. The film uses actual firemen ( including Cyril Demarne ) rather than professional actors"
44,In what year was Boca Juniors-Carolina founded?,2008,2008," The context does not provide any information about the founding year of Boca Juniors-Carolina. However, the option '2008' is mentioned in the context as the year when the Campeonato Nacional de Fútbol de Puerto Rico was replaced by the Puerto Rico Soccer League. This could be a potential source of confusion.

Boca Juniors-Carolina is not mentioned in the context, and the founding year of the club is not provided. Therefore, the correct answer cannot be determined from the given context. <|end|>",2008," The context provided does not mention Boca Juniors-Carolina or its founding year. The only relevant information is that the Campeonato Nacional de Fútbol de Puerto Rico was replaced by the Puerto Rico Soccer League in 2008. However, this does not help us determine the founding year of Boca Juniors-Carolina. Therefore, the correct answer cannot be determined from the given context. <|end|>",2008,"The Greater Buenos Aires conurbation, which also includes several Buenos Aires Province districts, constitutes the fourth-most populous metropolitan area in the Americas, with a population of around 17 million. Campeonato Nacional de Fútbol de Puerto Rico is an amateur football league in Puerto Rico. As of 2008 it has been replaced as the highest level football league in the country by the Puerto Rico Soccer League. It was created in 2005 by the Federación Puertorriqueña de Fútbol to unify the domestic football scene (but only managed to get the attention of Liga Mayor teams, whilst most teams chose to stay in La Liga Premier, another amateur league)"
45,In which location did Turar Ryskulov pass away?,moscow,novosibirsk," The context does not provide information about the location of Turar Ryskulov's death. However, given the options, the most reasonable answer would be'moscow' as it is the capital of Russia and a significant location for political figures during the Soviet era. <|end|>",moscow," The context provided does not mention the location of Turar Ryskulov's death. However, considering the options and the historical context, the most reasonable answer would be'moscow'. Moscow was the capital of the Soviet Union and a significant location for political figures during the Soviet era. <|end|>",moscow,"Turar Ryskulov ( 1894 -- 1938 ) was a Soviet politician ; the chairman of the Central Electoral Committee of the Turkestan Autonomous Soviet Socialist Republic. In terms of area, it is nearly synonymous with Russian Turkestan, the name for the region during the Russian Empire"
46,What was the religion of Marilyn Hickey?,christianity,christian," Based on the context provided, Marilyn Hickey is an American Christian minister and televangelist who teaches Bible studies both nationally and internationally. Therefore, the religion of Marilyn Hickey is Christian. <|end|>",christian," Based on the context provided, Marilyn Hickey is an American Christian minister and televangelist who teaches Bible studies both nationally and internationally. Therefore, the religion of Marilyn Hickey is Christian. <|end|>",christian,"The Bible (from Koine Greek  , ""tà biblía"", ""the books"") is a collection of sacred texts or scriptures that Jews and Christians consider to be a product of divine inspiration and a record of the relationship between God and humans. Marilyn Hickey ( born July 1 , 1931 ) is an American Christian minister and televangelist who teaches Bible studies both nationally and internationally"
47,"What was the position played by Jay Bruce on the team, and what was his speciality?",outfielder,pitcher," The context states that the pitcher is often considered the most important defensive player and is situated at the right end of the defensive spectrum. However, the right end of the defensive spectrum does not necessarily mean the right fielder. The right fielder is assigned the number 9 in the numbering system used to record defensive plays, but this does not indicate the position played by Jay Bruce.

The context does not provide specific information about Jay Bruce's position or specialty. However, based on general knowledge, Jay Bruce is a former professional baseball player who primarily played as an outfielder. Therefore, the most reasonable answer from the given options would be 'outfielder'. <|end|>",outfielder," The context does not provide specific information about Jay Bruce's position or specialty. However, based on general knowledge, Jay Bruce is a former professional baseball player who primarily played as an outfielder. Therefore, the most reasonable answer from the given options would be 'outfielder'. <|end|>",outfielder,"The Cincinnati Reds are an American professional baseball team based in Cincinnati, Ohio. Leading the league in a particular category is referred to as a ""title. In the numbering system used to record defensive plays, the right fielder is assigned the number 9. These defenders are the left fielder, the center fielder, and the right fielder. The pitcher is often considered the most important defensive player, and as such is situated at the right end of the defensive spectrum"
48,What instrument is Greg Graffin known for playing?,guitar,singing," Based on the context, Greg Graffin is known for his singing as the lead singer of the punk band Bad Religion. Although the album ""American Lesion"" features acoustic guitar or piano, the context does not indicate that Greg Graffin is known for playing these instruments. Therefore, the most appropriate answer is'singing'. <|end|>",singing," The context provided states that ""American Lesion"" is a solo album by Greg Graffin, the lead singer of the punk band Bad Religion. The album features his voice along with acoustic guitar or piano. However, the context does not indicate that Greg Graffin is known for playing these instruments. Instead, it highlights his role as a singer. Therefore, the most appropriate answer is'singing'. <|end|>",singing,"American Lesion is a solo album by Greg Graffin, the lead singer of the punk band Bad Religion. American Lesion"" for the most part features Graffin's voice alone, and each song features acoustic guitar or piano rather than electric guitars. Gregory Walter Graffin ( born November 6 , 1964 ) is an American punk rock singer - songwriter , multi-instrumentalist , college lecturer , and author. He also embarked on a solo career in 1997 , when he released the album American Lesion"
49,In which language was King Solomon's Mines originally written?,english,english," The context states that King Solomon's Mines is a 1950 adventure film, based on the 1885 novel of the same name by Henry Rider Haggard. Henry Rider Haggard was an English writer, and his works were originally written in English. Therefore, the most reasonable answer is 'english'. <|end|>",english," The context provided states that King Solomon's Mines is a 1950 adventure film based on the 1885 novel of the same name by Henry Rider Haggard. Henry Rider Haggard was an English writer, and his works were originally written in English. Therefore, the most reasonable answer is 'english'. <|end|>",english,"King Solomon 's Mines is a 1950 adventure film , the second of five film adaptations of the 1885 novel of the same name by Henry Rider Haggard. He was a popular leading man from the 1940s to the early 1960s, rising to fame through his appearances in the Gainsborough melodramas"
50,In which year did the 'Affairs of the Heart' television series air?,television series,ma," The context does not provide any information about the 'Affairs of the Heart' television series. Therefore, none of the options can be confirmed as the correct answer based on the given context. <|end|>",1937," The context provided does not mention the 'Affairs of the Heart' television series or any related information that would allow us to determine the year it aired. Therefore, based on the given context, we cannot confirm any of the options as the correct answer. <|end|>",1937,"Derek Fowlds (born 2 September 1937) is an English actor, best known for playing Bernard Woolley in popular British television comedies ""Yes Minister"" and ""Yes Prime Minister"" and Oscar Blaketon in the long-running ITV police drama ""Heartbeat. Paul Daneman (29 October 1925  28 April 2001) was an English film, television and theatre actor"
51,"What is the term for a company that produces and distributes music, as exemplified by 'down time'?",dawn raid entertainment,album," The context mentions that Aaradhna is signed under the music label Dawn Raid Entertainment, which is a record label based in New Zealand. The term for a company that produces and distributes music is a'record label'. Therefore, the correct answer is 'label'. <|end|>",label," The context provided mentions that Aaradhna is signed under the music label Dawn Raid Entertainment, which is a record label based in New Zealand. The term for a company that produces and distributes music is a'record label'. Therefore, the correct answer is 'label'. <|end|>",label,"Aaradhna Jayantilal Patel (born December 20, 1983), better known by her stage name Aaradhna, is a New Zealand-born musical recording artist signed under the music label Dawn Raid Entertainment. `` Down Time '' is the debut solo single by New Zealand R&B singer , Aaradhna. It entered the New Zealand Singles Chart at number 4 on 23 January 2006 , and peaked at number 3. Dawn Raid Entertainment is a record label based in Papatoetoe, South Auckland, in New Zealand. During its long period of isolation, New Zealand developed a distinct biodiversity of animal, fungal and plant life"
52,What was the occupation of Gerald L. K. Smith?,politician,translation," The context states that Gerald Lyman Kenneth Smith was an American clergyman and far-right political organizer. He became a leader of the Share Our Wealth movement during the Great Depression and later of the Christian Nationalist Crusade. He also founded the America First Party in 1944 and was a presidential candidate in the election that year.

Given the options, the most appropriate answer is 'politician' as he was involved in political organizing and was a presidential candidate. The option 'translation' is not correct as there is no information in the context that suggests Gerald L. K. Smith was involved in translation work. <|end|>",politician," Given the context and the options provided, the most appropriate answer for Gerald L. K. Smith's occupation is 'politician'. The context states that he was a far-right political organizer, a leader of the Share Our Wealth movement, and a presidential candidate. He also founded the America First Party. These roles and activities align with the occupation of a politician. The option 'translation' is not correct as there is no information in the context that suggests Gerald L. K. Smith was involved in translation work. <|end|>",politician,"The forgery was first published in Russia in 1903, translated into multiple languages, and disseminated internationally in the early part of the 20th century. Gerald Lyman Kenneth Smith ( February 27 , 1898 -- April 15 , 1976 ) was an American clergyman and far - right political organizer , who became a leader of the Share Our Wealth movement during the Great Depression and later of the Christian Nationalist Crusade. He founded the America First Party in 1944 , for which he was a presidential candidate in the election that year. Christian Nationalist Crusade was an American antisemitic organization which operated from St"
53,What was the country of citizenship for Herbert Rogge?,west germany,british," The context states that Herbert Rogge is a former West German handball player who competed in the 1972 Summer Olympics. This indicates that his country of citizenship was West Germany. Therefore, the correct answer is 'west germany'. <|end|>",west germany," The context provided states that Herbert Rogge is a former West German handball player who competed in the 1972 Summer Olympics. This indicates that his country of citizenship was West Germany. Therefore, the correct answer is 'west germany'. <|end|>",west germany,"Herbert Rogge ( born November 7 , 1947 ) is a former West German handball player who competed in the 1972 Summer Olympics. 5 million. International mostly means something (a company, language, or organization) involving more than a single country. During this Cold War era, NATO-aligned West Germany and Warsaw Pact-aligned East Germany were divided by the Inner German border"
54,Which platform is Lightspeed associated with?,dos,pc," The context mentions that Lightspeed is a video game developed and released by MicroProse in 1990. However, it does not specify the platform it is associated with. The options 'dos', 'dvd','microsoft windows', 'pc', and 'windows' are all platforms or operating systems. Since the context does not provide enough information to determine the specific platform, the most reasonable answer would be 'pc', as it is a general term that could encompass various platforms. <|end|>",pc," The context does not provide specific information about the platform Lightspeed is associated with. However, since the options include 'pc' and'microsoft windows', and considering that 'pc' is a more general term that could encompass various platforms, the most reasonable answer would be 'pc'. <|end|>",pc,"Master of Orion (""MoO"" or ""MOO"") is a turn-based, 4X science fiction computer strategy game released in 1993 by MicroProse on the MS-DOS and Mac OS operating systems. The player leads one of ten races to dominate the galaxy through a combination of diplomacy and conquest while developing technology, exploring and colonizing star systems. Lightspeed is a video game developed and released by MicroProse in 1990. The box describes the title as an `` Interstellar Action and Adventure '' game"
55,What was the occupation of Kwong Siu-hing?,entrepreneur,sovereign," The context states that Kwong Siu-hing is the matriarch of the Kwok family, ranked third richest in Hong Kong. The term'matriarch' refers to a woman who is the head of a family or tribe. The context does not mention her occupation as 'accounting', 'entrepreneur', 'founder', or'major'. However, as the matriarch of a wealthy family, she may have significant influence and control over the family's assets and businesses.

The term'sovereign' is not directly related to her occupation, but it could be interpreted as a metaphorical description of her position within the family. In this context,'sovereign' could be seen as a synonym for'matriarch', as both terms refer to a woman who holds a position of authority and power within a family or group.

Therefore, the most reasonable answer, given the context and the available options, is'sovereign'. <|end|>",sovereign," The context states that Kwong Siu-hing is the matriarch of the Kwok family, ranked third richest in Hong Kong. The term'matriarch' refers to a woman who is the head of a family or tribe. The context does not mention her occupation as 'accounting', 'entrepreneur', 'founder', or'major'. However, as the matriarch of a wealthy family, she may have significant influence and control over the family's assets and businesses.

The term'sovereign' is not directly related to her occupation, but it could be interpreted as a metaphorical description of her position within the family. In this context,'sovereign' could be seen as a synonym for'matriarch', as both terms refer to a woman who holds a position of authority and power within a family or group.

Therefore, the most reasonable answer, given the context and the available options, is'sovereign'. <|end|>",sovereign,"Kwok Tak-Seng (1911  October 1990) was a Chinese entrepreneur and the founder of Sun Hung Kai Properties, the largest property developer in Hong Kong. Kwong Siu Hing ( born 1929 in Huadu , Guangzhou , Guangdong ) , is the matriarch of the Kwok family , ranked third richest in Hong Kong. Kwong effectively controls about 41"
