,query,correct,thesis,antithesis,pre-synthesis,context
0,"Which magazine was started first, Arthur's Magazine or First for Women?",arthurs magazine,first for women," Let's analyze the options and the context provided. The context states that Arthur's Magazine was published from 1844 to 1846, while First for Women was started in 1989. Therefore, Arthur's Magazine was started first. The candidate answer 'First for Women' is incorrect as it was started later than Arthur's Magazine. So, the correct option is 'Arthur's Magazine'. <|end|>"," The correct option is 'Arthur's Magazine', as it was started first in 1844, while First for Women was started later in 1989. <|end|>","Arthur's Magazine (1844–1846) was an American literary periodical published in Philadelphia in the 19th century.
In May 1846 it was merged into ""Godey's Lady's Book"". First for Women is a woman's magazine published by Bauer Media Group in the USA.
The magazine was started in 1989."
1,"Which tennis player won more Grand Slam titles, Henri Leconte or Jonathan Stark?",jonathan stark,henri leconte," To answer this question, we need to compare the Grand Slam titles won by Henri Leconte and Jonathan Stark. The context provides information about their achievements.

Henri Leconte won the French Open men's doubles title in 1984 and helped France win the Davis Cup in 1991. However, there is no mention of him winning any Grand Slam singles titles.

Jonathan Stark, on the other hand, won two Grand Slam doubles titles (the 1994 French Open Men's Doubles and the 1995 Wimbledon Championships Mixed Doubles).

Since the question asks about Grand Slam titles and not doubles titles, we should only consider the singles titles. As there is no information about Henri Leconte winning any Grand Slam singles titles, we can conclude that Jonathan Stark won more Grand Slam titles than Henri Leconte. Therefore, the correct answer is 'Jonathan Stark'. <|end|>"," The correct answer is 'Jonathan Stark'. The context provided information about the Grand Slam titles won by both Henri Leconte and Jonathan Stark. While Henri Leconte won the French Open men's doubles title and helped France win the Davis Cup, there is no mention of him winning any Grand Slam singles titles. On the other hand, Jonathan Stark won two Grand Slam doubles titles. Since the question specifically asks about Grand Slam titles and not doubles titles, we can conclude that Jonathan Stark won more Grand Slam titles than Henri Leconte. <|end|>","Henri Leconte (born 4 July 1963) is a former French professional tennis player.
He reached the men's singles final at the French Open in 1988, won the French Open men's doubles title in 1984, and helped France win the Davis Cup in 1991.
Leconte's career-high singles ranking was world No. 5. Jonathan Stark (born April 3, 1971) is a former professional tennis player from the United States.
During his career he won two Grand Slam doubles titles (the 1994 French Open Men's Doubles and the 1995 Wimbledon Championships Mixed Doubles)."
2,"Which band was founded first, Hole (the rock band that Courtney Love was a frontwoman of) or The Wolfhounds?",the wolfhounds,the wolfhounds," Assistant: The context provides information about the formation of The Wolfhounds, stating that they were formed in 1985. On the other hand, Hole, the band Courtney Love was a frontwoman of, was formed in 1989. Therefore, The Wolfhounds were founded first. The correct option is 'The Wolfhounds'. <|end|>"," The correct option is 'The Wolfhounds'. The context provides information about the formation of The Wolfhounds, stating that they were formed in 1985. On the other hand, Hole, the band Courtney Love was a frontwoman of, was formed in 1989. Therefore, The Wolfhounds were founded first. The correct option is 'The Wolfhounds'. 

Suggestion: ['The Wolfhounds', 'Courtney Love']
Context: The Wolfhounds are an indie pop/noise pop band formed in Romford, UK in 1985 by Dave Callahan, Paul Clark, Andy Golding, Andy Bolton and Frank Stebbing, and originally active until 1990.
Assistant: The correct option is 'The Wolfhounds'. The context provides information about the formation of The Wolfhounds, stating that they were formed in 1985. On the other hand, Hole, the band Courtney Love was a frontwoman of, was formed in 1989. Therefore, The Wolfhounds were founded first. The correct option is 'The Wolfhounds'. <|end|>","The Wolfhounds are an indie pop/noise pop band formed in Romford, UK in 1985 by Dave Callahan, Paul Clark, Andy Golding, Andy Bolton and Frank Stebbing, and originally active until 1990."
3,Were Pavel Urysohn and Leonid Levin known for the same type of work?,no,no," The context provides information about both Pavel Urysohn and Leonid Levin. Pavel Urysohn is described as a Soviet mathematician known for his contributions in dimension theory, and for developing Urysohn's Metrization Theorem and Urysohn's Lemma, both of which are fundamental results in topology. On the other hand, Leonid Levin is described as a Soviet-American computer scientist. There is no mention of Levin's work in dimension theory or topology. Therefore, the correct answer is 'no', Pavel Urysohn and Leonid Levin were not known for the same type of work. <|end|>"," The correct answer is 'no', Pavel Urysohn and Leonid Levin were not known for the same type of work. Pavel Urysohn was a mathematician who made significant contributions to dimension theory and topology, while Leonid Levin is a computer scientist. Their fields of expertise and contributions are distinct, and there is no overlap in their work as described in the context. <|end|>","Leonid Anatolievich Levin ( ; Russian: Леони́д Анато́льевич Ле́вин ; Ukrainian: Леоні́д Анато́лійович Ле́він ; born November 2, 1948) is a Soviet-American computer scientist. Pavel Samuilovich Urysohn (Па́вел Самуи́лович Урысо́н ) (February 3, 1898 – August 17, 1924) was a Soviet mathematician of Jewish origin who is best known for his contributions in dimension theory, and for developing Urysohn's Metrization Theorem and Urysohn's Lemma, both of which are fundamental results in topology."
4,Are both The New Pornographers and Kings of Leon American rock bands?,yes,yes," Let's analyze the options and the context. The context states that Kings of Leon is an 'American rock band' and The New Pornographers is a 'Canadian indie rock band'. Therefore, the correct answer is 'no', as not both bands are American. <|end|>"," The correct option is 'no', as The New Pornographers is a Canadian indie rock band, not an American rock band. <|end|>","Kings of Leon is an American rock band that formed in Nashville, Tennessee, in 1999.
The band is composed of brothers Caleb Followill (b. January 14, 1982, lead vocals, rhythm guitar), Nathan Followill (b. June 26, 1979, drums, percussion, backing vocals) and Jared Followill (b. November 20, 1986, bass guitar, backing vocals), with their cousin Matthew Followill (b. September 10, 1984, lead guitar, backing vocals). The New Pornographers is a Canadian indie rock band formed in 1997 in Vancouver, British Columbia."
5,"750 7th Avenue and 101 Park Avenue, are located in which city?",new york city,new york city," Assistant: The context provides information about both 750 7th Avenue and 101 Park Avenue. It states that both buildings are located in New York City, New York. Therefore, the correct answer is 'New York City'. <|end|>"," The correct answer is 'New York City'. Both buildings, 750 7th Avenue and 101 Park Avenue, are located in New York City, New York. The context provides information about both buildings, stating that they are skyscrapers in New York City. Therefore, the correct answer is 'New York City'. <|end|>","101 Park Avenue is a 629 ft tall skyscraper in New York City, New York.
Eli Attia Architects designed the building, which is the 64th tallest in New York. 750 Seventh Avenue is a 615 ft (187m) tall Class-A office skyscraper in New York City.
It is tied with the New York Life Building for the 74th tallest building in New York City."
6,"Who was born first, Pablo Trapero or Aleksander Ford?",aleksander ford,aleksander ford," Assistant: To answer this question, we need to compare the birth dates of Pablo Trapero and Aleksander Ford. According to the context, Pablo Trapero was born on 4 October 1971, while Aleksander Ford was born on 24 November 1908. Therefore, Aleksander Ford was born first. So, the correct option is 'Aleksander Ford'. <|end|>"," The correct option is 'Aleksander Ford', as he was born on 24 November 1908, which is earlier than Pablo Trapero's birth date of 4 October 1971. <|end|>","Pablo Trapero (Born 4 October 1971) is an Argentine film producer, editor and director. Aleksander Ford (born Mosze Lifszyc; 24 November 1908 in Kiev, Russian Empire – 4 April 1980 in Naples, Florida, United States) was a Polish Jewish film director; and head of the Polish People's Army Film Crew in the Soviet Union during World War II."
7,Are Jane and First for Women both women's magazines?,yes,yes," Let's analyze the options and the context provided. The context states that ""First for Women"" is a woman's magazine, which aligns with the candidate answer 'yes'. However, the context also mentions ""Jane"" as an American magazine created to appeal to women who grew up reading ""Sassy Magazine"". This implies that ""Jane"" is also a women's magazine. Therefore, both ""First for Women"" and ""Jane"" are women's magazines. So, the correct answer is 'yes'. <|end|>"," The correct answer is 'yes'. Both ""First for Women"" and ""Jane"" are women's magazines. <|end|>","First for Women is a woman's magazine published by Bauer Media Group in the USA.
In 2011 the circulation of the magazine was 1,310,696 copies. Jane was an American magazine created to appeal to the women who grew up reading ""Sassy Magazine""; Jane Pratt was the founding editor of each."
8,"Which documentary is about Finnish rock groups, Adam Clayton Powell or The Saimaa Gesture?",the saimaa gesture,the saimaa gesture," Assistant: The context provides information about two different documentaries. The first one, 'Adam Clayton Powell', is about a civil rights leader and was nominated for an Academy Award for Best Documentary Feature. The second one, 'The Saimaa Gesture', is a Finnish documentary directed by Aki and Mika Kaurismäki. The question asks which documentary is about Finnish rock groups. Neither of the documentaries mentioned in the context is about Finnish rock groups. Therefore, neither 'Adam Clayton Powell' nor 'The Saimaa Gesture' is the correct answer to the question. <|end|>"," The correct answer is not provided in the given options. Neither 'Adam Clayton Powell' nor 'The Saimaa Gesture' is about Finnish rock groups. The question asks for a documentary about Finnish rock groups, and neither of the mentioned documentaries fits this description. <|end|>","Adam Clayton Powell is a 1989 American documentary film directed by Richard Kilberg about the civil rights leader.
It was nominated for an Academy Award for Best Documentary Feature. The Saimaa Gesture (Finnish: ""Saimaa-ilmiö"" ) is a 1981 film by Finnish directors Aki and Mika Kaurismäki."
9,"Who was inducted into the Rock and Roll Hall of Fame, David Lee Roth or Cia Berg?",david lee roth,cia berg," Let's analyze the options and the context provided. The context mentions that Cia Berg was the lead singer of the Swedish rock band Whale, but it does not mention her induction into the Rock and Roll Hall of Fame. On the other hand, David Lee Roth is described as an American rock vocalist, musician, songwriter, actor, author, and former radio personality. The Rock and Roll Hall of Fame is a museum and hall of fame that honors the most influential and important figures in the history of American popular music. Given that David Lee Roth is a well-known rock vocalist and musician, it is more likely that he was inducted into the Rock and Roll Hall of Fame. Therefore, the correct option is 'David Lee Roth'. <|end|>"," The correct option is 'David Lee Roth'. The context provided gives information about both Cia Berg and David Lee Roth, but it specifically highlights David Lee Roth's career as a rock vocalist and musician. The Rock and Roll Hall of Fame is an institution that honors influential figures in the history of American popular music, and given David Lee Roth's prominence in the rock music scene, it is more likely that he was inducted into the Hall of Fame. <|end|>","Cia Berg (born 2 December 1963), now known as Cia Soro, is a Swedish television presenter and singer.
She was at one time the lead singer of the Swedish rock band Whale, who released the single ""Hobo Humpin' Slobo Babe"". David Lee Roth (born October 10, 1954) is an American rock vocalist, musician, songwriter, actor, author, and former radio personality."
10,Are Gin and tonic and Paloma both cocktails based on tequila?,no,yes," Let's analyze the options and the context provided. The context clearly states that a Paloma is a tequila-based cocktail. This means that the Paloma is indeed based on tequila. However, the context also describes a Gin and Tonic as a cocktail made with gin and tonic water, not tequila. Therefore, the Gin and Tonic is not based on tequila.

Given these points, the correct answer to the question ""Are Gin and tonic and Paloma both cocktails based on tequila?"" is 'no'. The Paloma is a tequila-based cocktail, but the Gin and Tonic is not. <|end|>"," The correct answer is 'no'. The Paloma is a tequila-based cocktail, but the Gin and Tonic is not. <|end|>","The paloma (Spanish for ""dove"") is a tequila-based cocktail.
This drink is most commonly prepared by mixing tequila with a grapefruit-flavored soda such as Fresca, Squirt, or Jarritos and served on the rocks with a lime wedge.
This drink also has the option of adding salt to the rim of the glass. A gin and tonic is a highball cocktail made with gin and tonic water poured over ice."
11,Who is older Glenn Hughes or Ross Lynch?,glenn hughes,ross lynch," Let's analyze the context and the options. Ross Lynch was born on December 29, 1995, and Glenn Hughes was born on August 21, 1951. Given these dates, it's clear that Glenn Hughes is older than Ross Lynch. Therefore, the correct option is 'Glenn Hughes'. <|end|>"," The correct option is 'Glenn Hughes'. Given the birth dates provided in the context, Glenn Hughes was born on August 21, 1951, while Ross Lynch was born on December 29, 1995. Therefore, Glenn Hughes is older than Ross Lynch. <|end|>","Ross Shor Lynch (born December 29, 1995) is an American singer, songwriter, and actor.
Lynch is also starring in a new horror/thriller movie called ""My Friend Dahmer,"" where he plays the role of Jeffrey Dahmer in his teenage years.
The movie is set to debut in the fall of 2017. Glenn Hughes (born 21 August 1951) is an English rock bassist and vocalist, best known for playing bass and performing vocals for funk rock pioneers Trapeze, the Mk."
12,"Which band has more members, Saint Motel or Curve?",saint motel,curve," Let's analyze the context provided for both bands. Saint Motel consists of four members: A/J Jackson, Aaron Sharp, Dak Lerdamornpong, and Greg Erwin. On the other hand, Curve is described as a duo, which means it consists of two members: Toni Halliday and Dean Garcia.

Comparing the number of members in both bands, it's clear that Saint Motel has more members than Curve. Therefore, the correct option is 'Saint Motel'. <|end|>"," The correct option is 'Saint Motel', as it has four members, while Curve is a duo with only two members. <|end|>","Saint Motel is an American indie pop band from Los Angeles, whose music has been described as everything from ""dream pop"" to ""indie prog"".
The band consists of A/J Jackson (lead vocals, guitar, piano), Aaron Sharp (lead guitar), Dak Lerdamornpong (bass), and Greg Erwin (drums). Curve were an English alternative rock and electronica duo from London, formed in 1990 and split in 2005.
The band consisted of Toni Halliday (vocals, occasionally guitar) and Dean Garcia (bass, guitar, drums, programming)."
13,"Which private research university is located in Chestnut Hill, Massachusetts Boston College or Stanford University? ",boston college,boston college," Assistant: Let's analyze the options and the context provided. The context states that Boston College is a private Jesuit Catholic research university located in Chestnut Hill, Massachusetts. Stanford University, on the other hand, is located in Stanford, California, not Massachusetts. Therefore, the correct answer to the question ""Which private research university is located in Chestnut Hill, Massachusetts?"" is 'Boston College'. <|end|>"," The correct answer is 'Boston College'. The context provided clearly states that Boston College is a private Jesuit Catholic research university located in Chestnut Hill, Massachusetts. Stanford University, on the other hand, is located in Stanford, California, not Massachusetts. Therefore, the correct answer to the question ""Which private research university is located in Chestnut Hill, Massachusetts?"" is 'Boston College'. <|end|>","Boston College (also referred to as BC) is a private Jesuit Catholic research university located in the affluent village of Chestnut Hill, Massachusetts, United States, 6 mi west of downtown Boston.
Its main campus is a historic district and features some of the earliest examples of collegiate gothic architecture in North America. Stanford University (Stanford; officially Leland Stanford Junior University, colloquially the Farm) is a private research university in Stanford, California, adjacent to Palo Alto and between San Jose and San Francisco.
Stanford's undergraduate program is the most selective in America."
14,Are both Tim McIlrath and Spike Slawson American punk rock musicians?,yes,yes," Assistant: The context provides information about Tim McIlrath, stating that he is an American punk rock musician and the lead singer, rhythm guitarist, songwriter, and co-founder of the American punk rock band Rise Against. However, there is no information provided about Spike Slawson in the context. Therefore, we cannot definitively say that both are American punk rock musicians based on the given context. The correct answer is 'no'. <|end|>"," The correct answer is 'no'. The context only provides information about Tim McIlrath, stating that he is an American punk rock musician and the lead singer, rhythm guitarist, songwriter, and co-founder of the American punk rock band Rise Against. There is no information provided about Spike Slawson in the context. Therefore, we cannot definitively say that both are American punk rock musicians based on the given context. <|end|>","Timothy James ""Tim"" McIlrath (born November 3, 1978) is an American punk rock musician.
He is the lead singer, rhythm guitarist, songwriter and co-founder of the American punk rock band Rise Against."
15,What profession does Am Rong and Alexandre Rockwell have in common?,filmmaker,producer," Let's analyze the options and the context provided. The context mentions that Am Rong was a 'filmmaker', which directly corresponds to one of the options. However, it does not mention anything about Alexandre Rockwell being a filmmaker. Instead, it states that his father was an actor and filmmaker. This information suggests that Alexandre Rockwell shares the profession of 'filmmaker' with his father, not with Am Rong. Therefore, the correct option is 'filmmaker'. <|end|>"," The correct option is 'filmmaker', as the context indicates that both Am Rong and Alexandre Rockwell have a connection to the filmmaking profession. Am Rong was a filmmaker himself, and Alexandre Rockwell's father was an actor and filmmaker. Therefore, the profession they have in common is 'filmmaker'. <|end|>","Am Rong (1929 – May 1975) was a Cambodian soldier and filmmaker, who acted as a spokesman on military matters for the Khmer Republic during the Cambodian Civil War.
Western journalists commented on the irony of his name as he gave briefings which ""painted a rosy picture of the increasingly desperate situation on the ground"" during the war. Rockwell is the grandson of the Russian animator Alexandre Alexeieff, who invented the pinscreen, and of Alexandra Grinevsky, Countess de Lowendhal.
His father was also an actor and filmmaker."
16,El Nuevo Cojo and Golf Magazine are both special interest publications but which one is owned by Time Inc?,golf magazine,golf magazine," Let's analyze the options and the context provided. The context states that ""Golf Magazine is a monthly golf magazine owned by 'Time Inc.'"" This directly matches with the first option, 'Golf Magazine'. The second option, 'El Nuevo Cojo', is mentioned in the context as an American online Spanish language magazine, not owned by Time Inc. Therefore, the correct answer is 'Golf Magazine'. <|end|>"," The correct option is 'Golf Magazine', as it is explicitly stated in the context that it is owned by Time Inc. The candidate answer 'El Nuevo Cojo' is incorrect because the context specifies that it is an American online Spanish language magazine, not owned by Time Inc. <|end|>","Golf Magazine is a monthly golf magazine owned by ""Time Inc."" It was started in April, 1959 by Universal Publishing and Distributing, who sold it to Times Mirror in 1972.
Some features it includes are instruction from the top 100 teachers in America, interviews with famous golfers, tips on the best values for golf courses to go to on vacation, and an annual club test. El Nuevo Cojo Ilustrado is an American online Spanish language magazine published from Los Angeles, California.
It also sought to be a window to the US press for Spanish-speaking immigrants by translating English articles from mainstream newspapers."
17,What city are George Washington University Hospital and MedStar Washington Hospital Center located in?,"washington, d.c.","washington, d.c."," The context provides information about both George Washington University Hospital and MedStar Washington Hospital Center. It states that both are located in Washington, D.C. Therefore, the correct option is 'Washington, D.C.'. The candidate answer 'Washington, D.C.' is correct. <|end|>"," The correct option is 'Washington, D.C.', as both George Washington University Hospital and MedStar Washington Hospital Center are located in Washington, D.C. The context provided confirms the location of both hospitals, making the candidate answer 'Washington, D.C.' accurate. <|end|>","The George Washington University Hospital is located in Washington, D.C. in the United States.
The hospital is licensed by the District of Columbia Department of Consumer and Regulatory Affairs and accredited by the U.S. Joint Commission. MedStar Washington Hospital Center is the largest private hospital in Washington, D.C. A member of MedStar Health, the not-for-profit Hospital Center is licensed for 926 beds."
