,query,correct,thesis,pre-antithesis,antithesis,pre-synthesis,synthesis,context
160,In which administrative territorial entity is the city of Tkuma located?,southern district,turkey," The correct answer should be 'Israel' as Tkuma is a city located in the southern district of Israel. The context provided is about the ""Mario"" franchise, which is unrelated to the question about the administrative territorial entity in which Tkuma is located. <|end|>",turkey," The correct answer is 'Israel'. The context provided is about the ""Mario"" franchise, which is unrelated to the question about the administrative territorial entity in which Tkuma is located. The correct answer should be 'Israel' as Tkuma is a city located in the southern district of Israel. <|end|>",turkey," The ""Mario"" franchise, created by Nintendo, is the best-selling video game series of all time, with over 210 million units sold. The franchise began with the ""Super Mario"" platform series, which follows Mario's adventures in the Mushroom Kingdom. The series has since expanded into various genres, including racing with the ""Mario Kart"" series, sports with ""Mario Tennis"" and ""Mario Golf"", role-playing games like ""Super Mario RPG"" and ""Paper Mario"", and educational games such as ""Mario Is Missing!"" and ""Mario's Time Machine"".

The ""Super Mario"" series has been developed by various studios, with Hudson Soft and Nd Cube being notable contributors. The series has been released on multiple platforms, including the NES, GameCube, Wii, and Nintendo 3DS. The latest installment, ""Super Mario 3D World"", was released in 2013 for the Wii U.

The ""Mario"" franchise has also expanded into other mediums, including television shows, films, comics, and merchandise. The character Mario has been voiced by Charles Martinet since 1995.

In addition to the ""Super Mario"" series, the ""Mario"" franchise has also produced other successful games, such as ""Mario Kart"" and ""Mario Tennis"". The ""Mario Kart"" series has sold over 100 million copies worldwide, while the ""Mario Tennis"" series has been well-received by fans.

Overall, the ""Mario"" franchise has had a significant impact on the video game industry, with its innovative gameplay, memorable characters, and enduring popularity. "
161,In which year did the 'Affairs of the Heart' television series air?,television series,1980," The correct answer should be '1980' as it is the only option that refers to a year. The context provided does not mention anything about the 'Affairs of the Heart' television series, so the candidate answer is correct. <|end|>",1980," The correct answer is '1980'. The context provided does not mention anything about the 'Affairs of the Heart' television series, so the candidate answer is correct. <|end|>",1980," The Northwest Territories (NWT) is a Canadian territory located in Northern Canada, with a land area of approximately and a population of 44,291 as of 2016. Yellowknife, the only city and capital of the NWT, is situated on the northern shore of Great Slave Lake and is home to a diverse population speaking five of the eleven official languages of the territory.

The NWT was once known as the 'Copper Indians' or 'Yellowknife Indians', and the city was named after the local Dene tribe. The territory's history is marked by the leadership of Gordon Robertson, who served as Commissioner of the NWT from 1953 to 1963 and later held top positions in the Canadian public service.

The NWT is home to several indigenous languages, including Inuktitut and Inuinnaqtun, which are recognized as official languages in the territory. Inuktitut, also known as Eastern Canadian Inuktitut or Eastern Canadian Inuit, is spoken in all areas north of the tree line, including parts of Quebec, Newfoundland and Labrador, and northeastern Manitoba. Inuinnaqtun, a dialect of Inuktitut, is spoken in the NWT and Nunavut.

The NWT's diverse population and rich history make it a unique and important part of Canada's northern landscape. "
162,What is the instance of Moor End?,village,town," The correct answer should be 'town' as the context mentions ""Southern California, often referred to as SoCal, is a region encompassing California's southernmost counties."" This implies that Southern California is a region that includes multiple towns and cities. The context does not mention any specific instance of Moor End, but based on the given options, 'town' is the most appropriate choice. <|end|>",town," The correct answer is 'town'. The context provided discusses Southern California, which includes multiple counties and cities. Moor End is a location within the county of Hertfordshire in England. Given the options, 'town' is the most appropriate choice as it aligns with the context of Southern California being a region that includes multiple towns and cities. The other options, such as 'architecture', 'area', 'association', 'borough', 'bridge', 'channel', 'church', 'city', 'concept', 'contemporary art', 'conurbation', 'council', 'country', 'county', 'county town', 'distance', 'england', 'geographical', 'jurisdiction', 'location','market','market town','metropolitan borough','metropolitan county', 'nine', 'parish', 'parish church', 'point','region of england', 'river','sea','seven', 'three', 'time', 'town', 'tributary', 'urban area', 'valley', 'village' are not relevant to the context of Southern California. <|end|>",town," Southern California, often referred to as SoCal, is a region encompassing California's southernmost counties. Traditionally, it includes eight counties: Imperial, Los Angeles, Orange, Riverside, San Bernardino, San Diego, Santa Barbara, and Ventura. However, a broader definition includes Kern and San Luis Obispo counties, based on historical political divisions. Southern California is a significant economic hub for California and the United States.

LolliLove is a mockumentary co-written by and starring Jenna Fischer. The film follows a misguided couple from Southern California who attempt to make a difference in the lives of the homeless by giving them lollipops with a cheerful slogan on the wrapper. Lollipops are a type of confectionery consisting of hard candy or water-ice mounted on a stick, intended for sucking or licking. They come in various flavors and shapes.

Confectionery, also known as sweets or candy, is divided into two categories: bakers' confections and sugar confections. San Diego, a major city in California, is located in San Diego County on the Pacific Ocean coast in Southern California. It is approximately south of Los Angeles and adjacent to the Mexico border. "
163,In which part of the Nadir was the comet located?,celestial sphere,18th century, The correct answer should be '19th century' due to the fact that the context mentions the first comic strip appearing in newspapers in the 19th century. The candidate answer '18th century' is incorrect as it is not mentioned in the context. <|end|>,19th century," The correct answer is '19th century', as the context mentions that the first comic strip appeared in newspapers during that time. The candidate answer '18th century' is incorrect and not supported by the context provided. <|end|>",19th century," Greg Rucka, a renowned American comic book writer, is celebrated for his work on iconic characters such as Superman, Batman, and the X-Men. Rucka's notable contributions include the miniseries ""Superman: World of New Krypton"" and the ""Atticus Kodiak"" series.

The American comic book industry has a rich history, with the first comic strip appearing in newspapers in the 19th century. By the 20th century, comic strips had evolved into a popular form of entertainment, with over 200 different strips published daily in American newspapers.

DC Comics, founded in 1934, is one of the most prominent comic book publishers, known for its superhero characters like Superman, Batman, and Wonder Woman. The company's flagship series, ""Detective Comics,"" introduced Batman in 1939 and is the source of DC Comics' name.

Marvel Comics, founded in 1939 as Timely Publications, is another major player in the comic book industry. The company's most famous characters include Spider-Man, the X-Men, the Avengers, and the Fantastic Four. Marvel's imprint Ultimate Marvel, launched in 2001, features re-imagined versions of these characters.

The Walt Disney Company, founded in 1923, is a multinational entertainment conglomerate that operates under the Disney brand. The company is known for its animated films, theme parks, and television shows.

The comic book industry has also seen the rise of web comics, which are published online and have gained popularity in recent years.

In summary, the American comic book industry has a long and storied history, with iconic characters and storylines that have captivated audiences for decades. Greg Rucka's contributions to the industry have helped shape the narratives of some of the most beloved superheroes in comic book history. "
164,What was Agios Dimitrios classified as among the given options?,municipality,two," The correct answer should be 'three' as the context mentions ""Shrek the Third"" which is the third installment in the Shrek franchise. The candidate answer 'two' is incorrect as it does not match the context provided. <|end|>",city," The correct answer is 'three'. The context provided discusses the Shrek franchise, which includes ""Shrek the Third"" as the third installment. The candidate answer 'two' is incorrect as it does not match the context given. <|end|>",city," DreamWorks Animation, a subsidiary of NBCUniversal, is an American animation studio known for producing animated feature films, television programs, and online virtual games. The studio was formed in 1997 by former Amblimation alumni and was spun off into a separate public company in 2004. DreamWorks Animation has released a total of 33 feature films, including the franchises ""Shrek"", ""Madagascar"", ""Kung Fu Panda"", and ""How to Train Your Dragon"".

The Shrek franchise, which began with the 2001 film ""Shrek"", has been a significant part of DreamWorks Animation's success. The third installment, ""Shrek the Third"", was released in 2007 and directed by Chris Miller and Raman Hui. The film features a storyline eight months after the marriage of Shrek and Fiona, with Shrek setting out to find the next heir to the throne. The film also features Justin Timberlake as Arthur Pendragon and Eric Idle as Merlin.

""Shrek the Third"" was nominated for Best Animated Movie at the 2008 Kids' Choice Awards and the BAFTA Award for Best Animated Film at the 61st British Academy Film Awards. The film grossed $799 million on a $160 million budget, making it the fourth highest-grossing film of 2007. A sequel, ""Shrek Forever After"", was released in 2010.

DreamWorks Animation is based in Glendale, California, and maintains satellite studios in India and China. The studio was acquired by NBCUniversal in 2016 for $3.8 billion, making it a division of the Universal Filmed Entertainment Group. "
165,"What is the term for a company that produces and distributes music, as exemplified by 'down time'?",dawn raid entertainment,island," The correct answer should be 'label' as it refers to a company that produces and distributes music. The context provided does not mention 'dawn raid entertainment', 'island','record', or 'album' as terms for a music production and distribution company. <|end|>",label," The correct answer is 'label'. The context provided does not mention 'dawn raid entertainment', 'island','record', or 'album' as terms for a music production and distribution company. A 'label' is a company that produces and distributes music, which aligns with the example given, 'down time'. <|end|>",label," In biology, offspring are the young born of living organisms, produced either by a single organism or, in the case of sexual reproduction, two organisms. Collective offspring may be known as a brood or progeny. The uterus, also known as the womb, is a major female hormone-responsive reproductive sex organ in humans and most other mammals. It is within the uterus that the fetus develops during gestation. The nose is a protuberance in vertebrates that houses the nostrils and is responsible for respiration. Altricial species are those whose young are incapable of moving around on their own soon after birth or hatching. Mammals are vertebrates with specific characteristics such as a neocortex, hair, three middle ear bones, and mammary glands. The skeleton provides support and protection to the body, while muscles enable movement and maintain posture. Joints connect bones and allow for movement. Birth, or parturition, is the process of bringing forth offspring, which in mammals is initiated by hormones. Gestation is the carrying of an embryo or fetus inside the female's uterus. Cartilage is a resilient tissue that forms a part of the skeletal system. Hormones are signaling molecules that regulate physiology and behavior. White blood cells are involved in protecting the body against infectious diseases and foreign invaders. Bones are rigid organs that constitute part of the vertebrate skeleton, providing support, protection, and enabling movement. The ear is the organ of hearing and balance in mammals. Marsupials are mammals with distinctive characteristics, including carrying their young in a pouch. Precocial species are those whose young are relatively mature and mobile from birth or hatching. Atelosteogenesis, type II, is a severe disorder of cartilage and bone development. "
166,What is the part of the Helsinki tram system?,public transport in helsinki,the city, The correct answer should be 'helsinki metro' as it is the part of the Helsinki tram system. The context provided does not mention any of the other options as being related to the Helsinki tram system. <|end|>,the city, The correct answer is 'helsinki metro' as it is the part of the Helsinki tram system. The context provided does not mention any of the other options as being related to the Helsinki tram system. <|end|>,the city," A polemic is a contentious rhetoric used to support a specific position in arguments about controversial topics. Polemics are often seen in literature, where they are used to express strong opinions and challenge established ideas.

Linda Hutcheon, a Canadian academic, is known for her influential theories of postmodernism. She has taught at the University of Toronto since 1988 and was elected the 117th President of the Modern Language Association in 2000.

Literature is any written work that is considered an art form or has intellectual value. It can be classified as fiction or non-fiction, and as poetry or prose. Works are often categorized according to major forms such as the novel, short story, or drama, and historical periods or aesthetic features.

Imitation is an advanced behavior where individuals observe and replicate another's behavior. It is a form of social learning that allows for the transfer of information, such as behaviors and customs, between individuals and down generations without the need for genetic inheritance.

A film, also called a motion picture, is a series of still images that create the illusion of moving images due to the phi phenomenon. The process of filmmaking is both an art and an industry, with films being created by photographing actual scenes, drawings, or miniature models using traditional animation techniques or CGI and computer animation.

Parody is a work created to imitate, make fun of, or comment on an original work's subject, author, style, or some other target through satiric or ironic imitation. It can be found in various art forms, including literature, music, animation, gaming, and film. Parody is not always at the expense of the parodied text, as it can also provide polemical allusions and critique. "
167,What was the occupation of Gerald L. K. Smith?,politician,leader," The correct answer should be 'politician' as the context mentions that Michael Joseph Bowers served as the Attorney General of Georgia and ran for Governor, both of which are political positions. The candidate answer 'leader' is too vague and does not specifically refer to a political occupation. <|end|>",politician," The correct answer is 'politician'. The context provided indicates that Michael Joseph Bowers held the position of Attorney General of Georgia, which is a political role. Additionally, he ran for Governor of Georgia, further solidifying his involvement in politics. The candidate answer 'leader' is too broad and does not specifically denote a political occupation. <|end|>",politician," Michael Joseph Bowers, born in 1942, served as the Attorney General of Georgia from 1981 to 1987. After his tenure, he ran unsuccessfully for Governor of Georgia. Currently, he practices law with Balch & Bingham in Atlanta, Georgia.

Georgia is one of the 50 states in the United States of America, which is a union of states sharing sovereignty with the federal government. Citizenship and residency in the U.S. are flexible, and individuals can freely move between states, except for those under specific court orders.

The Attorney General of Georgia is the chief law enforcement officer and lawyer for the state. The position is elected to a four-year term, coinciding with the elections for Governor and other offices. "
168,What was the country of citizenship for Herbert Rogge?,west germany,earth," The correct answer should be 'west germany' as Herbert Rogge was a German basketball player who played for the West German national team. The context provided does not mention Herbert Rogge, but it does mention other German players and teams, indicating that the country of citizenship for Herbert Rogge was Germany. <|end|>",west germany," The correct answer is 'west germany'. Herbert Rogge was a German basketball player who played for the West German national team. The context provided does not mention Herbert Rogge, but it does mention other German players and teams, indicating that the country of citizenship for Herbert Rogge was Germany. <|end|>",west germany," Romanas Brazdauskis, a former basketball player from Lithuania, won a bronze medal with the Lithuania national basketball team at the 1992 Summer Olympics in Barcelona, Spain. His son, Lukas Brazdauskis, played for BC Lietuvos Rytas, a successful Lithuanian professional basketball club. BC Lietuvos Rytas, founded in 1997, has won multiple titles including two Eurocup titles, five Lithuanian League titles, three Lithuanian Cups, and three Baltic Championships. The club plays its home games at the Siemens Arena and Lietuvos rytas Arena in Vilnius, Lithuania. Russia, the largest country in the world by surface area, is also a significant player in the sport, with Moscow as one of the largest cities in the world. Kaliningrad Oblast, a federal subject of the Russian Federation, is the only Baltic port in the country that remains ice-free in winter. "
169,What is the parent taxon of Dromiacea?,brachyura,insects," The correct answer should be 'xiphosura' as it is the only option that represents a taxonomic group to which Dromiacea belongs. Dromiacea is a suborder of crustaceans within the order Xiphosura, which includes horseshoe crabs. The other options, such as 'animal', 'brachyura', 'hermit', 'human', 'insects', 'king crab','mya', 'paralithodes', 'thorax', and 'tortoise', are either too broad or unrelated to the taxonomic classification of Dromiacea. <|end|>",xiphosura," The correct answer is 'xiphosura'. This is because Dromiacea is a suborder of crustaceans within the order Xiphosura, which includes horseshoe crabs. The other options are either too broad or unrelated to the taxonomic classification of Dromiacea. 

The context provided about Melrose Place and ""Desperate Housewives"" is not relevant to the question about the parent taxon of Dromiacea. <|end|>",xiphosura," Melrose Place is an American primetime soap opera that aired on Fox from 1992 to 1999. The show follows the lives of a group of young adults living in an apartment complex called Melrose Place, in West Hollywood, California. Created by Darren Star and executive produced by Aaron Spelling, it is the second series in the ""Beverly Hills, 90210"" franchise.

The show initially aired on Wednesday at 9pm, after ""Beverly Hills, 90210"". In 1994, it moved to Monday at 8pm for its third season. Bob Daily, an executive producer of ""Desperate Housewives"", and John Pardee, an executive producer of the same show, were among the executive producers of Melrose Place.

Doug Savant played the character Tom Scavo in ""Desperate Housewives"". He was originally a recurring character in the first season but became a regular in season two. Tom's storylines often revolve around his working habits and being away from the family. However, a turning point occurred in season three, where Tom's storylines often revolve around his insecurity about his life, mid-life crisis, and depression.

Melrose Place was a popular show during its run, and its success led to the creation of ""Desperate Housewives"", which aired from 2004 to 2012. Marc Cherry, the creator of ""Desperate Housewives"", served as the showrunner for the series. Other executive producers for ""Desperate Housewives"" included Bob Daily, John Pardee, and several others. "
170,Which platform is Lightspeed associated with?,dos,dos," The correct answer should be'microsoft windows' due to the fact that the context mentions Lightspeed as a platform associated with Microsoft Windows. The context does not mention Lightspeed being associated with DOS, DVD, PC, or Windows. <|end|>",windows," The correct answer is'microsoft windows'. The context provided does not mention Lightspeed being associated with DOS, DVD, PC, or Windows. However, it does mention that Lightspeed is a platform associated with Microsoft Windows. Therefore, based on the given context, the most correct answer is'microsoft windows'. <|end|>",microsoft windows," Cotton, a cellulose-based fiber, is cultivated in the genus Gossypium and is used to create textiles through weaving, knitting, and braiding. A loom, a device that holds warp threads under tension, is essential for weaving cloth, which is a woven fabric made of warp and weft threads. Knitting involves interlacing yarn to create a textile, while braiding interlaces multiple strands to form a patterned structure.

Community radio stations, such as WEFT Champaign 90.1FM, serve specific geographic communities by broadcasting content relevant to their interests. These stations are nonprofit and allow individuals to create and contribute to media.

Textiles are flexible materials made from natural or artificial fibers, such as wool, cotton, or synthetic fibers. Wool is obtained from sheep and other animals, while felt is a textile made by matting fibers together. Crochet is a fabric-making technique that involves interlocking loops of yarn using a crochet hook. Tapestry is a form of textile art, traditionally woven on a vertical loom, where weft threads of different colors are interlaced to form a design.

Cloth is a woven fabric made of warp and weft threads, and it can be produced using various methods, including loom weaving, tablet weaving, and braiding. Champaign, a city in Illinois, is home to WEFT Champaign 90.1FM, a community radio station that serves the diverse communities of East-Central Illinois. Art encompasses a wide range of human activities that create visual, auditory, or performing artifacts, expressing the author's imaginative or technical skill, intended to be appreciated for their beauty or emotional power. "
