,query,correct,thesis,pre-antithesis,antithesis,pre-synthesis,synthesis,context
85,What position did Evgeni Malkin play on his team and what is his speciality?,centre,end, The correct answer should be 'end' as it is the only option that refers to a position on a team. The context provided does not mention Evgeni Malkin or his speciality. <|end|>,end," The correct answer is 'end'. The context provided does not mention Evgeni Malkin or his speciality. The options 'center', 'centre', and 'goaltender' are not mentioned in the context. The term 'end' is the only option that refers to a position on a team, which is the only relevant information provided in the context. <|end|>",end," Laurie Anderson, an American avant-garde artist, composer, musician, and film director, has been a prominent figure in the art world since the 1970s. Initially trained in violin and sculpting, Anderson's work has spanned performance art, pop music, and multimedia projects. She gained widespread recognition in 1981 when her single ""O Superman"" reached number two on the UK pop charts. Anderson also starred in and directed the 1986 concert film ""Home of the Brave.""

The avant-garde, characterized by nontraditional, aesthetic innovation, and initial unacceptability, often offers a critique of the relationship between producer and consumer. Karen Bernstein, a Canadian voice actress, is best known for voicing Sailor Mercury in the American dubbing of the first two seasons of ""Sailor Moon."" The manga series was adapted into an anime series, which was broadcast in Japan from 1992 to 1997 and has since been licensed for English language release in North America and Australia/New Zealand.

""Atomic Ed and the Black Hole"" is a documentary released in 2001 by filmmaker Ellen Spiro. The documentary, produced for HBO's Cinemax Reel Life Series, features Laurie Anderson's song ""Big Science"" in its soundtrack. The film follows Ed Grothus, a machinist turned atomic junk collector, who has amassed a collection of non-radioactive high-tech nuclear waste discarded from the Los Alamos National Laboratory. His collection reveals and preserves the history of government waste that was literally thrown in a trash heap.

Performance art, a form of fine art, involves presenting a performance to an audience within a fine art context. It can be scripted or unscripted, random or carefully planned, and may involve audience participation. Performance art can take place anywhere, in any venue or setting, and can last for any length of time. The actions of an individual or group at a particular place and time constitute the work. "
86,In which category does solo dance fall under?,performance,theater," The correct answer should be 'dance' as solo dance falls under the category of dance. The context provided does not mention anything about theater, which is a form of performance art that involves live actors performing on a stage. <|end|>",dance," The correct answer is 'dance', as solo dance falls under the category of dance. The context provided does not mention anything about theater, which is a form of performance art that involves live actors performing on a stage. <|end|>",dance," The United Kingdom (UK), comprising England, Scotland, Wales, and Northern Ireland, is a sovereign country in Western Europe with a population of 65.1 million and an area of 242,422 square kilometers. The UK has a rich history, with London being a major settlement for over two millennia and the capital of England and the UK. The country has a diverse geography, including the White Cliffs of Dover, the English Channel, and the Celtic Sea. The UK's coastline is the 12th longest in the world, and it has a significant maritime history, with major ports like Southampton and Dover. The UK is also a member of the European Union, which has developed a single market and common policies on various sectors. The UK's political structure includes the Mayor of London and the London Assembly, which scrutinizes the Mayor's activities and has the power to amend the annual budget and reject draft strategies. The UK's ceremonial counties include Middlesex, Hertfordshire, and Surrey, with county towns like Maidstone and Winchester. The UK's technology sector includes products like the AirPort Extreme, a wireless router and NAS from Apple Inc. The UK's maritime history includes the Port of Dover, the world's busiest passenger port, and the Strait of Dover, the narrowest part of the English Channel. The UK's culture includes historic sites like Canterbury Cathedral and the White Cliffs of Dover. "
87,What is the genre of Jinxter?,interactive fiction,instruction," The correct answer should be 'various' as the context does not provide any information about the genre of Jinxter. The context discusses the violin, Soozie Tyrell, Americana, Bruce Springsteen, and the Rock and Roll Hall of Fame, but none of these relate to the genre of Jinxter. <|end|>",various," The correct answer is 'various', as the context provided does not mention the genre of Jinxter. The context discusses the violin, Soozie Tyrell, Americana, Bruce Springsteen, and the Rock and Roll Hall of Fame, but none of these relate to the genre of Jinxter. <|end|>",various," The violin, a small and high-pitched instrument in the violin family, is a versatile and significant instrument in various musical genres. It typically has four strings tuned in perfect fifths and is played by drawing a bow across its strings or plucking them with the fingers. The violin is prominent in Western classical music, folk music, country music, bluegrass music, and jazz. It has also been incorporated into non-Western music cultures, such as Indian and Iranian music.

Soozie Tyrell, born on May 4, 1957, is an American violinist and vocalist, best known for her work with Bruce Springsteen in the E Street Band and The Sessions Band. The Sessions Band, an American musical group, has recorded and toured with Springsteen since 1997.

Americana refers to artifacts related to the history, geography, folklore, and cultural heritage of the United States. It encompasses a wide range of materials, including paintings, license plates, household objects, flags, and statues. The term is often used to describe the theme of a museum or collection, or goods for sale.

Bruce Springsteen, born on September 23, 1949, is an American singer-songwriter and the lead member of the E Street Band. Nicknamed ""The Boss,"" Springsteen is known for his poetic lyrics, working-class and sometimes political sentiments, and lengthy and energetic stage performances. He was inducted into the Rock and Roll Hall of Fame in 2014.

The Rock and Roll Hall of Fame and Museum, located in downtown Cleveland, Ohio, was established in 1983 to recognize and archive the history of the best-known and most influential artists, producers, engineers, and other notable figures in rock and roll. Since opening in 1995, the museum has hosted more than 10 million visitors and had a cumulative economic impact estimated at more than $1.8 billion. The E Street Band, Springsteen's primary backing band since 1972, was inducted into the Rock and Roll Hall of Fame in 2014. "
88,Which category does 'is_a_list_of list of latin names of countries' belong to?,country,year," The correct answer should be 'country' as the context is discussing the Green River band, which is a group from Seattle, Washington. Seattle is a city in the United States, which is a country. The other options do not fit the context provided. <|end|>",country," The correct answer is 'country'. The context provided discusses the Green River band, which is a group from Seattle, Washington. Seattle is a city in the United States, which is a country. The other options do not fit the context provided. <|end|>",country," Green River, an American rock band from Seattle, Washington, released their debut studio album ""Rehab Doll"" in June 1988 through Sub Pop Records. The album, which is considered the first grunge record, features the song ""Swallow My Pride,"" written by frontman Mark Arm and guitarist Steve Turner. The song was originally recorded for the band's debut EP ""Come on Down"" in 1985.

The Pacific Ocean, the largest oceanic division, is bounded by the Arctic Ocean in the north, the Southern Ocean in the south, and the continents of Asia and Australia in the west, and the Americas in the east. Seattle, a seaport city in King County, Washington, is situated on an isthmus between Puget Sound and Lake Washington, and is the largest city in the Pacific Northwest region of North America.

Homestead Records, a Long Island, New York-based sublabel of Dutch East India Trading, played a significant role in launching the post-hardcore and noise rock genres. The label was founded in 1984 by Sam Berger, who recommended Gerard Cosloy to take over the label after he left to work with Midnight Records. Cosloy signed many notable acts, including Green River.

Sub Pop Records, founded by Bruce Pavitt in 1986, gained fame in the late 1980s for signing Nirvana, Soundgarden, Mudhoney, and other bands from the Seattle alternative rock scene. The label's last release was Ivo Perelman's ""Cama de terra"" in 1996.

In summary, Green River's ""Rehab Doll"" album, released in 1988, is considered the first grunge record, featuring the song ""Swallow My Pride."" The album was released through Sub Pop Records, a label that played a significant role in launching the grunge movement. Seattle, the city where Green River originated, is a major gateway for trade with Asia and is the largest city in the Pacific Northwest region of North America. "
89,What was the native language of Antoine Baudeau de Somaize?,french,italian," The context provided does not mention Antoine Baudeau de Somaize or his native language. Therefore, it is impossible to determine the correct answer from the given options based on the provided context. <|end|>",not clear given the context," The context provided does not mention Antoine Baudeau de Somaize or his native language. Therefore, it is impossible to determine the correct answer from the given options based on the provided context. <|end|>",not clear given the context," William Vansittart Bowater (15 March 1838 – 28 April 1907) was a British entrepreneur who founded Bowater, a company that grew to become one of the world's largest producers of newspaper print. Today, Bowater has been divided into various market-leading paper-based products businesses, including Rexam, a British-based American-owned multinational consumer packaging company. Rexam, headquartered in London, is a leading manufacturer of beverage cans with 55 plants in over 20 countries across Asia, Europe, North America, and South America.

In June 2016, Rexam was acquired by the American company Ball Corporation, which is best known for its early production of glass jars, lids, and related products used for home canning. Founded in Buffalo, New York, in 1880 as the Wooden Jacket Can Company, the Ball Corporation has expanded and diversified into other business ventures, including aerospace technology, and became the world's largest manufacturer of recyclable metal beverage and food containers.

Bowater's post-World War II expansion and a 30-year period of consolidation led to the formation of a number of globally leading worldwide paper products companies. These companies continue to build on the legacy of William Vansittart Bowater and his pioneering work in the pulp and paper industry. "
90,What is the Lechites an example of?,ethnic group,two," The correct answer should be 'ethnic group' as the Lechites are an ethnic group that originated in the region of Lech, which is now part of modern-day Poland. The context provided does not mention anything about the Lechites being a country, a city, a language, or any other option from the list. <|end|>",ethnic group," The correct answer is 'ethnic group'. The Lechites are an ethnic group that originated in the region of Lech, which is now part of modern-day Poland. The context provided does not mention anything about the Lechites being a country, a city, a language, or any other option from the list. <|end|>",ethnic group," England, a country within the United Kingdom, shares borders with Scotland, Wales, and the Irish Sea. It is separated from continental Europe by the North Sea and the English Channel. England covers five-eighths of the island of Great Britain and includes over 100 smaller islands. The County Football Associations, such as the Dorset County Football Association, govern football in England and the Crown dependencies. Dorset County Football Association, founded in 1884, is responsible for administering club and player registration and promoting development.

Wales, a country in the United Kingdom, is bordered by England, the Irish Sea, and the Bristol Channel. It has a population of 3,063,456 and a total area of. Wales is known for its mountainous terrain and maritime climate. Hampshire, a county in southern England, is the most populous ceremonial county in the UK, with a population of almost 1.5 million. It is home to the birthplaces of the Royal Navy, British Army, and Royal Air Force. The Hampshire Football Association oversees football in the county.

The Isles of Scilly, an archipelago off the southwestern tip of the Cornish peninsula, is the most westerly location in England and the United Kingdom. Scotland, a country in the United Kingdom, covers the northern third of the island of Great Britain and shares a land border with England. It is surrounded by the Atlantic Ocean, the North Sea, and the North Channel and Irish Sea. The United Kingdom of Great Britain and Northern Ireland, commonly known as the United Kingdom, is a sovereign country in western Europe with an area of and a population of 65.1 million. It has the 12th-longest coastline in the world and is the fourth most densely populated country in the European Union. "
91,What was the occupation of Mike Walker?,playwright,illustrator," The correct answer should be 'illustrator' as the context mentions that Mike Walker is the illustrator for the album ""Thug on da Line"" by Krayzie Bone. The other options are not related to Mike Walker's occupation. <|end|>",illustrator," The correct answer is 'illustrator', as the context mentions that Mike Walker is the illustrator for the album ""Thug on da Line"" by Krayzie Bone. The other options are not related to Mike Walker's occupation. <|end|>",illustrator," Thug on da Line is the second studio album by American rapper Krayzie Bone, released in 2001. The album features the single ""Hard Time Hustlin'"" with Sade and includes tracks with guest appearances from Eazy-E, Ice Cube, and Dr. Dre. The album also features Flesh-n-Bone, who was later convicted of assault and spent time in prison. The album was produced by L.T. Hutton, who has worked with various artists including Bone Thugs-N-Harmony and 2Pac. The album was released by Thugline Records, Ruthless Records, and Loud Records, with distribution from Columbia Records and Sony Music. The album reached number 13 on the U.S. Rap chart and number 61 on the U.S. R&B chart. "
92,In which country is the city of Villarrobledo located?,spain,catalonia," The correct answer should be'spain' as Villarrobledo is a city located in the province of Albacete, which is part of the autonomous community of Castilla-La Mancha in Spain. The context provided does not mention Villarrobledo or its location. <|end|>",spain," The correct answer is'spain'. The context provided does not mention Villarrobledo or its location. The options given are 'catalonia', 'france','spain', and 'world'. Since Villarrobledo is a city located in the province of Albacete, which is part of the autonomous community of Castilla-La Mancha in Spain, the correct option is'spain'. The suggestion is grounded in the context, even if the candidate answer does not agree. <|end|>",spain," Moonhole is a private community located on the island of Bequia in the Grenadines, an island country in the Lesser Antilles island arc. Founded by Thomas and Gladys Johnston in the 1960s, Moonhole is a private nature preserve that derives its name from a massive arch formed in volcanic substrate through which the setting moon is sometimes visible. The Johnstons built a house beneath the arch using whalebones, native hardwoods, and objects recovered from the sea. The house had large open rooms with magnificent views of the sea, and the master bath had a large tree growing right through a large hole in the roof.

Moonhole Company Limited was formed by the Johnstons, and they contributed the approximately 30 acre property to the company. Tom bequeathed his controlling interest in the company to a trust for the protection and preservation of Moonhole for posterity. The Thomas and Gladys Johnston Moonhole Conservation Trust Limited is dedicated to preserving the unique architecture, lifestyle, and vision of the Johnstons, as well as protecting the birds, wildlife, and marine life on the peninsula at the western end of Bequia.

There are now eleven privately owned homes at Moonhole and four houses owned by Moonhole Company Limited. The New York Times described Moonhole as a quirky ecologically oriented development built of native stone with whalebone accents, relying on solar electricity, rainwater, and propane tanks.

Kingstown is the capital, chief port, and main commercial center of Saint Vincent and the Grenadines. It is the most populous settlement in the country and lies within the parish of Saint George in the south-west corner of Saint Vincent. Carriacou is an island of the Grenadine Islands located northeast of Grenada and the north coast of South America. Bequia is the second largest island in the Grenadines and is part of Saint Vincent and the Grenadines. The island's name means ""island of the clouds"" in the ancient Arawak language. The unofficial anthem of Bequia is ""Only in Bequia"" by island native Raphael ""Socony"" Holder. "
93,Which category does 'Hellraiser' belong to?,fictional character,language," The correct answer should be 'film' as the context provided discusses the European People's Party (EPP), Christian democracy, and the Christian Democratic Movement (KDH), which are all related to politics and political parties. The context does not mention anything about 'Hellraiser', which is a horror film directed by Clive Barker. <|end|>",film," The correct answer is 'film'. The context provided discusses political parties and ideologies, which are unrelated to 'Hellraiser'. 'Hellraiser' is a horror film directed by Clive Barker, and it does not fit into any of the categories mentioned in the context. <|end|>",film," The European People's Party (EPP) is a transnational European political party composed of Christian democratic and liberal-conservative parties. Founded in 1976, it has expanded to include parties with centre-right perspectives. The EPP is a member of the International Democrat Union (IDU) and the Centrist Democrat International (CDI), which was renamed in 1982.

Christian democracy is a political ideology that emerged in 19th-century Europe, combining traditional Catholic beliefs with modern democratic ideas. It incorporates social teachings from various Christian denominations and has been influential in Europe and Latin America.

The Christian Democratic Movement (KDH) is a Christian democratic political party in Slovakia. It is a member of the EPP and observer of the CDI. The KDH was established in 1990 and has been led by Ján Fige since 2000. The party has been represented in the Slovak parliament and was part of the government coalition until 2006. In the 2012 parliamentary election, the KDH received 8.82% of the vote and 16 seats in the National Council. In the 2014 European elections, the KDH received 13.21% of the vote and elected 2 MEPs.

The IDU is an international alliance of centre-right political parties, chaired by John Key, former Prime Minister of New Zealand. It comprises 71 full and associate members from 63 countries. The CDI, now known as the Centrist Democrat International, is a global political group dedicated to promoting Christian democracy. Its members are primarily from Europe and Latin America. "
94,In which administrative territorial entity is the Half Moon located?,loon op zand,north brabant, The correct answer should be 'netherlands' as the Half Moon is a lighthouse located in the Netherlands. The context provided does not mention any of the other options. <|end|>,netherlands," The correct answer is 'netherlands', as the Half Moon is a lighthouse located in the Netherlands. The context provided does not mention any of the other options. <|end|>",netherlands," The United States Armed Forces, comprising the Army, Marine Corps, Navy, Air Force, and Coast Guard, are the federal armed forces of the United States. The President of the United States serves as the military's overall head, working with the U.S. Department of Defense (DoD) to formulate military policy.

The military has played a significant role in the history of the United States, with victories in the First and Second Barbary Wars fostering a sense of national unity and identity. However, the Founders were wary of a permanent military force. The military was crucial during the American Civil War, with many leading generals being selected from its ranks. It wasn't until World War II that a large standing army was officially established.

The National Security Act of 1947, adopted during the Cold War's onset, established the modern U.S. military framework. The Act merged the Department of War and the Department of the Navy into the National Military Establishment, which was later renamed the Department of Defense in 1949. The Act also created the Department of the Air Force and the National Security Council.

The United States Navy (USN) is the naval warfare service branch of the United States Armed Forces and one of the seven uniformed services of the United States. It is the largest and most capable navy in the world, with the highest combined battle fleet tonnage. The USN has the world's largest aircraft carrier fleet, with ten in service, two in the reserve fleet, and three new carriers under construction. It has 323,792 personnel on active duty and 108,515 in the Navy Reserve, with 274 deployable combat vessels and more than 3,700 aircraft in active service.

Charles R. Stimpson was a United States Navy fighter ace in the Second World War, serving from 1919 to 1983. "
95,In which administrative territorial entity is Japan National Route 343 located?,iwate prefecture,taiwan, The correct answer should be 'japan' as it is the only option that refers to a country where Japan National Route 343 is located. The context provided does not mention any of the other options. <|end|>,japan," The correct answer is 'japan'. The context provided does not mention any of the other options, and Japan National Route 343 is located in Japan. <|end|>",japan," Ninaithen Vandhai is a 1998 Tamil romance film directed by K. Selva Bharathy and produced by Allu Aravind. The film stars Vijay, Rambha, and Devayani, with Manivannan, Charle, and Ranjith in supporting roles. It is a remake of the Telugu film Pelli Sandadi, which starred Srikanth, Deepti Bhatnagar, and Ravali. The film was well-received by critics and was a box office success.

Geetha Arts, the production company behind the film, was established in 1972 by Allu Aravind and his brother-in-law, Chiranjeevi. The company is based in Hyderabad and has produced films in Telugu, Tamil, Kannada, and Hindi languages. Telugu cinema, also known as Tollywood, is a significant part of Indian cinema, producing films in the Telugu language.

Raghupathi Venkaiah Naidu, born in 1909, is considered the father of Telugu cinema. He produced the first Telugu silent film, ""Bhishma Pratigna,"" in 1921. K. Raghavendra Rao, also known as ""Darshakendra,"" is an Indian film director, screenwriter, and choreographer, known for his works in Telugu cinema, Bollywood, and Kannada films. He has won numerous awards, including seven Nandi Awards, four Filmfare Awards South, and two CineMAA Awards.

The Nandi Awards are the highest award ceremony for excellence in Telugu cinema, Telugu theatre, Telugu television, and Lifetime achievements in Indian cinema. The awards are presented annually by the governments of Andhra Pradesh and Telangana. The awards are given in four categories: Gold, Silver, Bronze, and Copper. A variant, the Nandi Natakotsavam Awards for Theater, is also given every year for social, mythological, and poetic dramas. "
