,query,correct,thesis,pre-antithesis,antithesis,pre-synthesis,synthesis,context
239,What is the production company of the show 'Justin and the Knights of Valour'?,19 entertainment,19 entertainment, The correct answer should be '19 entertainment' as it is the production company of the show 'Justin and the Knights of Valour'. The context provided does not mention any of the other options as being related to the show. <|end|>,19 entertainment," The correct answer is '19 entertainment'. The context provided does not mention any of the other options as being related to the show 'Justin and the Knights of Valour'. The production company of the show is '19 entertainment', and this is the most accurate option based on the given information. <|end|>",19 entertainment," Ricky Nelson (1940-1985) was an American actor, musician, and singer-songwriter. He starred in the television series ""The Adventures of Ozzie and Harriet"" (1952-1966) alongside his family and co-starred with John Wayne and Dean Martin in the western film ""Rio Bravo"" (1959). Nelson achieved significant success in music, with 53 songs reaching the Billboard Hot 100 between 1957 and 1973, including ""Poor Little Fool,"" the first #1 song on the newly created Hot 100 chart. He recorded 19 additional Top 10 hits and was inducted into the Rock and Roll Hall of Fame in 1987.

Gene Pitney (1940-2006) was an American singer-songwriter, musician, and sound engineer. He wrote the song ""Hello Mary Lou,"" which was first recorded by Johnny Duncan in 1960 and later by Ricky Nelson in 1961. The song became a hit and was featured in the 1987 film ""Hello Mary Lou: Prom Night II,"" which introduced the character of Mary Lou Maloney, a killer ghost who returned in the sequel ""Prom Night III: The Last Kiss"" (1989).

Both Ricky Nelson and Gene Pitney were influential figures in the music industry, with Nelson's success in both acting and music and Pitney's contributions as a songwriter and musician. Their careers spanned several decades and left a lasting impact on popular culture. "
240,What is the subclass of Arrol-Aster?,automobile,town," The correct answer should be 'town' as it is the only option that fits the context of New Caledonia, which is mentioned as a French collectivity in the Pacific. The context does not mention any other option related to New Caledonia. <|end|>",town," The correct answer is 'town'. The context provided discusses New Caledonia, which is a French collectivity in the Pacific. The context does not mention any other option related to New Caledonia. Therefore, the most correct answer among the given options is 'town'. <|end|>",town," New Caledonia, a French collectivity in the Pacific, is part of Melanesia and lies east of Australia and New Caledonia. It includes Grande Terre, the Loyalty Islands, and other smaller islands. Vanuatu, a Pacific island nation, is located east of New Caledonia and north of Fiji. It is a volcanic archipelago with a population of over 270,000 people.

New Zealand, an island nation in the southwestern Pacific, comprises the North Island and the South Island, along with numerous smaller islands. It is situated east of Australia and south of New Caledonia, Fiji, and Tonga. New Zealand's capital is Wellington, and its largest city is Auckland.

Fiji, an island country in Melanesia, is located northeast of New Caledonia and southwest of New Zealand. It is an archipelago with a population of over 900,000 people. Tuvalu, a Polynesian island nation, is located midway between Hawaii and Australia. It comprises three reef islands and six true atolls, with a population of 10,640 people.

Tonga, a Polynesian sovereign state, is located northeast of Fiji and southwest of Tonga. It comprises 169 islands, with a population of over 103,000 people. The Kermadec Islands, part of New Zealand, are a subtropical island arc located northeast of New Zealand's North Island. They are uninhabited, except for the Raoul Island Station. "
241,What is the genre of the film 'Anjaana Anjaani'?,romantic comedy,entertainment," The correct answer should be 'drama' as the context provided discusses the Tour de San Luis, a road cycling race, and Mattia Gavazzi's participation in the race after a suspension for cocaine use. The context also touches on the effects of cocaine on the brain and the global issue of cocaine use. These elements suggest a narrative or story-driven film, which aligns with the genre of drama. <|end|>",drama," The correct answer is 'drama'. The context provided discusses the Tour de San Luis, a road cycling race, and Mattia Gavazzi's participation in the race after a suspension for cocaine use. The context also touches on the effects of cocaine on the brain and the global issue of cocaine use. These elements suggest a narrative or story-driven film, which aligns with the genre of drama. <|end|>",drama," Aigle, a historic town in Switzerland, is the capital of the district of Aigle in the canton of Vaud. It is also the location of the Union Cycliste Internationale (UCI), the governing body for international cycling competitions. The Tour de San Luis, a road cycling race held in Argentina, is part of the UCI America Tour. The race features an individual time trial and six stages, and is rated 2.1 by the UCI.

Norepinephrine, also known as noradrenaline, is a hormone and neurotransmitter that functions in the brain and body. It is produced in the kidneys and affects various parts of the body. The UCI, based in Aigle, oversees international cycling events, including the Tour de San Luis.

Mattia Gavazzi, an Italian road cyclist, competed in the Tour de San Luis in 2013 after a suspension for cocaine use. Cocaine is a powerful stimulant that affects the brain's reward pathway, leading to addiction. It is made from the leaves of the coca plant, which are grown in South America. The illegal market for cocaine is estimated to be between 100 and 500 billion USD annually.

Cocaine use is a significant global issue, with between 14 and 21 million people using the drug each year. The highest usage rates are in North America, followed by Europe and South America. Cocaine use directly resulted in 4,300 deaths in 2013, up from 2,400 in 1990. The coca plant has been used by Peruvians for centuries, and cocaine was first isolated from its leaves in 1860. Since 1961, the international Single Convention on Narcotic Drugs has required countries to criminalize recreational cocaine use. "
242,In which year did the Autumn Harvest Uprising take place?,chinese civil war,1950s," The correct answer should be '1950s' as the context mentions that the Virgin Islands National Park was established in 1956. The Autumn Harvest Uprising, also known as the Autumn Uprising of 1927, took place in China during the Chinese Civil War. The other options provided are either unrelated to the question or do not correspond to the correct time period. <|end|>",1950s," The correct answer is '1950s'. The context provided mentions that the Virgin Islands National Park was established in 1956. The Autumn Harvest Uprising, also known as the Autumn Uprising of 1927, took place in China during the Chinese Civil War. The other options provided are either unrelated to the question or do not correspond to the correct time period. <|end|>",1950s," Cinnamon Bay is a picturesque body of water and beach located on St. John Island, within the Virgin Islands National Park in the United States Virgin Islands. The park, established in 1956, covers approximately 60% of St. John Island, over 5,500 acres of adjacent ocean, and nearly all of Hassel Island. The Leeward Islands, a group of islands in the West Indies, are situated where the northeastern Caribbean Sea meets the western Atlantic Ocean. The Lesser Antilles, also known as the Caribbees, are a group of islands in the Caribbean Sea, forming a long, partly volcanic island arc between the Greater Antilles and the continent of South America. The Caribbean region consists of the Caribbean Sea, its islands, and the surrounding coasts. The United States Virgin Islands, officially the Virgin Islands of the United States, are a group of islands in the Caribbean that are an insular area of the United States. The islands are geographically part of the Virgin Islands archipelago and are located in the Leeward Islands of the Lesser Antilles. "
243,In which language was the original work of 'Topper' written?,english,instrumental, The correct answer should be 'english' as the original work of 'Topper' was written in English. The context provided does not mention anything about the language in which 'Topper' was written. <|end|>,english, The correct answer is 'english'. The context provided does not mention anything about the language in which 'Topper' was written. The candidate answer 'instrumental' is not relevant to the question about the language of the original work. <|end|>,english," The Meech Lake Accord, negotiated in 1987 by Prime Minister Brian Mulroney and the 10 provincial premiers, aimed to persuade Quebec to endorse the 1982 constitutional amendments by providing some decentralization of the Canadian federation. The Accord was ultimately rejected, leading to the formation of the Bloc Québécois, a federal political party devoted to Quebec nationalism and the promotion of Quebec sovereignty. Lucien Bouchard, the founder of the Bloc Québécois, served as the 27th Premier of Quebec from 1996 to 2001 and was a central figure in the 1995 Quebec referendum.

The Accord's rejection highlighted the tensions between Quebec and the rest of Canada, with Quebec nationalism asserting that the Québécois people are an independent nation. The Department of Canadian Heritage, responsible for policies and programs regarding the arts, culture, media, communications networks, official languages, status of women, sports, and multiculturalism, played a role in promoting Canadian identity and unity.

Canada, the second-largest country in the world, is a federal parliamentary democracy with a constitutional monarchy. Its capital is Ottawa, and its largest city is Toronto. Montreal, the second-most populous city in Canada, is known for its distinct four-season continental climate and its role as a cultural and economic hub.

The Bloc Québécois, founded by Lucien Bouchard, has been a significant force in Canadian politics, advocating for Quebec's interests and sovereignty. The party has had representation in the House of Commons since its formation in 1993.

In summary, the Meech Lake Accord and the Bloc Québécois represent the ongoing tensions between Quebec and the rest of Canada. The Accord's rejection and the formation of the Bloc Québécois highlight the importance of Quebec nationalism and the need for a balance between decentralization and unity in the Canadian federation. "
244,What was the occupation of Frozen Fana?,politician,doctor," The correct answer should be'member' as the context provided does not mention any specific occupation for Frozen Fana. The context mainly focuses on American football, West Virginia University, the Super Bowl, and various geographical and transportation-related topics. <|end|>",not clear given the context," The correct answer is'member'. The context provided does not mention any specific occupation for Frozen Fana. The document mainly focuses on American football, West Virginia University, the Super Bowl, and various geographical and transportation-related topics. <|end|>",member," The document provides a comprehensive overview of American football, its rules, and its significance in the United States. American football, also known as gridiron, is a popular sport played by two teams of eleven players. The game is played on a rectangular field with goalposts at each end. The offense aims to advance the ball into the opposing team's end zone for a touchdown or kick the ball through the opponent's goalposts for a field goal. The defense, on the other hand, aims to stop the offense's advance and take control of the ball for themselves.

The document also highlights the importance of West Virginia University Institute of Technology, which is transitioning from Montgomery to Beckley, West Virginia. The university is governed by the WVU Board of Governors and is affiliated with West Virginia University.

Furthermore, the document discusses the Super Bowl, the annual championship game of the National Football League (NFL). The Chicago Bears, a professional American football team based in Chicago, Illinois, are mentioned as a notable team in the NFL. The document also provides information about the Cleveland Area Medical Center, a complex of hospitals in Charleston, West Virginia, and the Ohio River, which is the largest tributary of the Mississippi River in the United States.

In addition, the document mentions the Appalachian Mountain Range, which posed a significant barrier to land travel in less technologically advanced eras. The document also discusses the Los Angeles metropolitan area, which is the 18th largest metropolitan area in the world and the second-largest metropolitan area in the United States.

Lastly, the document provides information about the combined statistical area (CSA) concept, which is composed of adjacent metropolitan and micropolitan statistical areas in the United States and Puerto Rico that can demonstrate economic or social linkage. The document also mentions the Los Angeles Rams, a professional American football team based in the Los Angeles metropolitan area, and the Morgantown Personal Rapid Transit system, which is a transportation system in Morgantown, West Virginia. "
245,In which region was the 'Chef's Luv Shack' from 'South Park' distributed?,comedy central,taiwan," The correct answer should be 'north america' as the 'Chef's Luv Shack' is a fictional restaurant from the animated television series 'South Park', which is produced and distributed by the Fox Broadcasting Company in North America. The other options are not relevant to the distribution region of the show. <|end|>",north america," The correct answer is 'north america'. The 'Chef's Luv Shack' is a fictional restaurant from the animated television series 'South Park', which is produced and distributed by the Fox Broadcasting Company in North America. The other options are not relevant to the distribution region of the show. <|end|>",north america," Laurel and Hardy were a comedy duo composed of Englishman Stan Laurel and American Oliver Hardy. They became famous during the early Classical Hollywood era of American cinema, known for their slapstick comedy. Their signature tune, ""The Cuckoo Song,"" played over the opening credits of their films.

The term ""public opinion"" refers to the collective opinion of the people on an issue or problem. It has been considered important in politics since the 17th century.

The bowler hat, also known as a bob hat, bombín, or derby, is a hard felt hat with a rounded crown. It was created in 1849 and became popular with the working classes in the 19th century.

Oliver Hardy, born Oliver Norvell ""Babe"" Hardy, was an American comic actor famous as one-half of Laurel and Hardy. He appeared with his comedy partner Stan Laurel in 107 films, feature films, and cameo roles.

A featurette is a film usually of three reels in length, or about 2440 minutes in running time. It is longer than a two-reel short subject but shorter than a feature film. The term was commonly used from before the start of the sound era into the 1960s.

Comedy is a discourse or work intended to be humorous or amusing, often inducing laughter. The origins of the term can be traced back to Ancient Greece, where comic poets performed political satire at the theaters. The essential agon of comedy is a struggle between a relatively powerless youth and societal conventions that pose obstacles to his hopes.

""Outwitting Dad"" is a 1914 American comedy film that features Oliver Hardy's first onscreen appearance. ""Sailors, Beware!"" is a silent comedy short film starring Stan Laurel and Oliver Hardy prior to their official billing as the duo Laurel and Hardy. They appeared in a total of 107 films between 1921 and 1951. "
246,In which location did Eddy Chandler pass away?,los angeles,los angeles," The correct answer should be 'Gothenburg' as it is the location where the new Ullevi Stadium is situated. The context mentions that Ullevi Stadium is located in Gothenburg, Sweden, and it is the second-largest city in Sweden and the fifth-largest in the Nordic countries. <|end|>",actor," The correct answer is 'Gothenburg'. The context provided clearly states that Ullevi Stadium is located in Gothenburg, Sweden. The candidate answer 'Los Angeles' is incorrect as it is not mentioned in the context and does not align with the information given about the location of Ullevi Stadium. <|end|>",best," Ullevi Stadium, also known as Nya Ullevi, is a versatile multi-purpose stadium located in Gothenburg, Sweden. Originally constructed for the 1958 FIFA World Cup, Ullevi has since hosted numerous significant sporting events, including the World Allround Speed Skating Championships, the 1995 World Championships in Athletics, and the 2006 European Athletics Championships. The stadium has also been the venue for the UEFA Cup Winners' Cup finals in 1983 and 1990, the UEFA Euro 1992 final, and the UEFA Cup final in 2004.

IFK Göteborg, a prominent Swedish football club, has played its home games at Ullevi since 2009. The club, founded in 1904, is the only Nordic country club to have won a pan-European competition, with victories in the UEFA Cup in 1982 and 1987. The club's colors, blue and white, are shared with the sports society Idrottsföreningen Kamraterna (IFK), from which the club originated.

Magnus Johansson, a former footballer for IFK Göteborg, Brann, and Västra Frölunda, is a notable figure in the club's history.

The new Gamla Ullevi Stadium, which opened in 2009, replaced the city's previous main football stadium. The construction of the new stadium was met with controversy due to its cost, the perceived low standard of the finished stadium, and the name of the stadium.

Gothenburg, the second-largest city in Sweden and the fifth-largest in the Nordic countries, is home to the new Ullevi Stadium. With a population of approximately 550,000 in the urban area and 990,000 inhabitants in the metropolitan area, Gothenburg is a vibrant city located on the west coast of Sweden by the Kattegat. "
247,In which administrative territorial entity is Tuse Church located?,holbæk municipality,south, The correct answer should be 'germany' as Tuse Church is located in the Holbæk municipality in Denmark. The context provided does not mention Tuse Church or its location. <|end|>,holbæk municipality," The correct option is 'holbæk municipality', as it is the only option that accurately identifies the location of Tuse Church. The context provided does not mention Tuse Church or its location, but the suggestion clearly indicates that Tuse Church is located in the Holbæk municipality in Denmark. <|end|>",holbæk municipality," A boat is a watercraft designed for various purposes on water, ranging from small vessels on inland waterways to large ships on the open sea. Boats are distinguished from ships based on size, shape, and cargo or passenger capacity. Aircraft, on the other hand, are machines that fly by gaining support from the air, using static lift or dynamic lift from airfoils or jet engines. Aircraft carriers are warships that serve as seagoing airbases, equipped with facilities for deploying and recovering aircraft. Naval warfare involves combat in and on the sea, ocean, or other major bodies of water. A propeller is a type of fan that transmits power by converting rotational motion into thrust, while a pressure difference is produced between the forward and rear surfaces of the airfoil-shaped blade. Marine propellers, also known as screw propellers, are characterized by their high propulsive efficiency and ability to throw thrust in any direction at any time. Steamboats are boats propelled primarily by steam power, using either propellers or paddlewheels. The United States Armed Forces consist of the Army, Marine Corps, Navy, Air Force, and Coast Guard, with the President of the United States as the military's overall head. The National Security Act of 1947 created the modern U.S. military framework, merging the Department of War and the Department of the Navy into the National Military Establishment, headed by the Secretary of Defense. The United States has seven federal uniformed services that commission officers as defined by Title 10 of the United States Code. A reserve fleet is a collection of naval vessels that are fully equipped for service but not currently needed, and thus partially or fully decommissioned. Steamships are ocean-faring vessels propelled by steam engines that typically drive propellers or paddlewheels. The United States Navy is the naval warfare service branch of the United States Armed Forces, with the largest combined battle fleet tonnage in the world. The U.S. Navy has the world's largest aircraft carrier fleet and more than 3,700 aircraft in active service. The third USS Vixen was a steamboat in the United States Navy during the Mexican-American War. "
248,What is the record label associated with 'Chasing Time: The Bedlam Sessions'?,warner music group,island, The correct answer should be 'island' as it is the only option that refers to a record label. The context provided does not mention any information related to the record label associated with 'Chasing Time: The Bedlam Sessions'. <|end|>,island," The correct answer is 'island'. The context provided does not mention any information related to the record label associated with 'Chasing Time: The Bedlam Sessions'. The suggestion is grounded in the context, even if the candidate answer does not agree. <|end|>",island," Johns Hopkins University, founded in 1876 by philanthropist Johns Hopkins, is an American private research university in Baltimore, Maryland. It was the first research university in the United States, integrating teaching and research. The university's first president, Daniel Coit Gilman, revolutionized higher education in the U.S. by adopting the concept of a graduate school from Germany's Heidelberg University.

John Auer, an American physiologist and pharmacologist, was a graduate of Johns Hopkins School of Medicine and worked closely with physiologist Samuel James Meltzer at the Rockefeller Institute for Medical Research. Auer is known for his research on the correlation between bronchial asthma and foreign substances, the effects of magnesium on tetany, and the first account of allergic inflammations caused by exposure to xylene, known as Auer's phenomena.

The Johns Hopkins University School of Medicine, located in Baltimore, Maryland, is the academic medical teaching and research arm of Johns Hopkins University. It has consistently been among the nation's top medical schools in the number of research grants awarded by the National Institutes of Health. The school's major teaching hospital, the Johns Hopkins Hospital, was ranked the #1 hospital in the United States for 22 years by ""U.S. News & World Report"". The hospital and school are the founding institutions of modern American medicine and the birthplace of numerous medical traditions, including rounds, residents, housestaff, neurosurgery, cardiac surgery, pediatrics, and child psychiatry.

Lake Ontario, one of the five Great Lakes of North America, is surrounded by the Canadian province of Ontario and the American state of New York. The lake's primary inlet is the Niagara River from Lake Erie, and its outlet to the Atlantic Ocean via the St. Lawrence River. The lake was named for the Huron (Wyandot) language word ""ontarío,"" meaning Lake of Shining Waters. "
