,query,correct,thesis,pre-antithesis,antithesis,pre-synthesis,synthesis,context
0,What event did Juan Rossell participate in?,1996 summer olympics,1996 summer olympics," The correct answer should be '1996 summer olympics' as the context mentions that Juan Miguel Rossell Milanes represented Cuba at the 1996 and 2004 Summer Olympics. The other options, 'olympic games' and'sport', are too broad and do not specifically refer to the event Juan Rossell participated in. <|end|>",1996 summer olympics," The correct answer is '1996 summer olympics'. The context provided clearly states that Juan Miguel Rossell Milanes represented Cuba at the 1996 and 2004 Summer Olympics. The other options, 'olympic games' and'sport', are too broad and do not specifically refer to the event Juan Rossell participated in. <|end|>",1996 summer olympics," The 2004 Summer Olympic Games, held in Athens, Greece, marked the return of the games to their birthplace. With a motto of ""Welcome Home,"" the event featured 10,625 athletes from 201 countries competing in 301 medal events across 28 sports. This edition of the Games was significant as it was the first time all countries with a National Olympic Committee participated.

In the realm of beach volleyball, a sport introduced to the Olympics in 1996, Juan Miguel Rossell Milanes from Cuba emerged as a notable figure. He won the gold medal in the men's beach team competition at the 2003 Pan American Games in Santo Domingo, Dominican Republic, partnering Francisco Alvarez. Rossell Milanes also represented Cuba at the 1996 and 2004 Summer Olympics.

The Pan American Games, a major sporting event in the Americas, also featured beach volleyball as a competitive discipline. The 14th Pan American Games took place in Santo Domingo, Dominican Republic, in 2003. The successful bid for the games was made in the mid-1990s, when the Dominican Republic experienced one of the highest growth rates in Latin America.

The International Olympic Committee (IOC) voted in 1986 to separate the Summer and Winter Games, which had been held in the same year since 1924, and place them in alternating even-numbered years, beginning in 1994. The 1996 Summer Games were the first to be staged in a different year from the Winter Games. Atlanta, Georgia, United States, hosted the 1996 Summer Games, becoming the fifth American city to host the Olympic Games and the third to hold a Summer Olympic Games. "
1,What languages did John Osteen speak or write?,english,spanish," The correct answer should be 'english' as John Osteen, being a pastor at Lakewood Church in Houston, Texas, would have likely spoken and written in English, which is the primary language in the United States. The context provided does not mention any other languages that John Osteen might have spoken or written. <|end|>",english," The correct answer is 'english', as John Osteen, being a pastor at Lakewood Church in Houston, Texas, would have likely spoken and written in English, which is the primary language in the United States. The context provided does not mention any other languages that John Osteen might have spoken or written. <|end|>",english," Christianity is a monotheistic religion based on the life and teachings of Jesus Christ. It is the largest religion in the world, with over 2 billion followers. Christians believe in one God and follow the teachings of Jesus Christ, who they believe is the Son of God and the savior of humanity.

Lakewood Church is a nondenominational charismatic Christian megachurch located in Houston, Texas. It is the largest congregation in the United States, with an average attendance of about 52,000 people per week. The church is led by Joel Osteen, who is the son of John Hillery Osteen, the founder and first pastor of Lakewood Church.

Mexico is a federal republic in North America, bordered by the United States, Guatemala, Belize, the Caribbean Sea, and the Pacific Ocean. It is the most populous Spanish-speaking country in the world and the second most populous country in Latin America. Mexico is a federation comprising 31 states and a federal district that is also its capital and most populous city.

John Hillery Osteen founded Lakewood Church in Houston, Texas, in 1959. He served as the first pastor until his death in 1999. His son, Joel Osteen, succeeded him as pastor and continues to lead the church today.

Houston is the most populous city in Texas and the fourth-most populous city in the United States. It is located in Southeast Texas near the Gulf of Mexico and is the seat of Harris County. Houston is the principal city of the Houston metropolitan area, which is the fifth-most populated metropolitan area in the United States.

In summary, Christianity is a monotheistic religion based on the life and teachings of Jesus Christ, with over 2 billion followers worldwide. Lakewood Church in Houston, Texas, is the largest congregation in the United States, led by Joel Osteen, the son of John Hillery Osteen, the founder and first pastor of the church. Houston is the most populous city in Texas and the fourth-most populous city in the United States, and is the principal city of the Houston metropolitan area. "
2,What is the parent taxon of Australosuchus?,crocodilia,plant," The correct answer should be 'crocodilia' as it is the parent taxon of Australosuchus. The context provided mentions that Australosuchus is a genus of crocodylian that belonged to the Mekosuchinae subfamily, which is a part of the Crocodylia order. The other options are either too broad (animal), too specific (crocodile, mekosuchinae, tomistoma), or unrelated (plant, homo). <|end|>",crocodilia," The correct answer is 'crocodilia'. The context provided clearly states that Australosuchus is a genus of crocodylian that belonged to the Mekosuchinae subfamily, which is a part of the Crocodylia order. The other options are either too broad (animal), too specific (crocodile, mekosuchinae, tomistoma), or unrelated (plant, homo). <|end|>",crocodilia," Mekosuchinae was a subfamily of crocodiles that lived in Australia and the South Pacific. They first appeared in the Eocene epoch in Australia and survived until the Pleistocene in Australia and until the arrival of humans in the Pacific islands of Fiji, New Caledonia, and Vanuatu. There is some debate over whether Mekosuchinae should be classified as a subfamily within Crocodylidae or as a distinct family, Mekosuchidae, within the superfamily Crocodyloidea.

Australosuchus is an extinct genus of crocodylian that belonged to the Mekosuchinae subfamily. The only known species, Australosuchus clarkae, lived during the Late Oligocene and Early Miocene periods in southern Australia. The generic name Australosuchus means ""Southern crocodile."" The species was described in 1991 based on fossil material found at Lake Palankarinna in South Australia. "
3,What is the'record_label method man' associated with?,loud records,1996," The correct answer should be 'album' as the context discusses the debut album of Wu-Tang Clan, ""Enter the Wu-Tang (36 Chambers)."" The candidate answer '1996' is incorrect because it refers to the year Ghostface Killah released his debut solo album, not the'record_label method man' associated with the Wu-Tang Clan's debut album. <|end|>",album," The correct answer is 'album', as the context discusses the debut album of Wu-Tang Clan, ""Enter the Wu-Tang (36 Chambers)."" The candidate answer '1996' is incorrect because it refers to the year Ghostface Killah released his debut solo album, not the'record_label method man' associated with the Wu-Tang Clan's debut album. <|end|>",album," Wu-Tang Clan's debut album, ""Enter the Wu-Tang (36 Chambers),"" was released on November 9, 1993, by Loud Records and distributed through RCA Records. The album, produced entirely by RZA (then known as Prince Rakeem), showcases the group's unique sound, heavily influenced by martial arts films and soul music samples. The album's title is derived from the martial arts film ""The 36th Chamber of Shaolin.""

The album features eight original members of the Wu-Tang Clan, including RZA, GZA, Ol' Dirty Bastard, Method Man, Raekwon, Ghostface Killah, Inspectah Deck, and U-God. Cappadonna later joined the group as an official member. The album's standout track, ""Protect Ya Neck,"" features Method Man, who would later collaborate with Redman on the hit single ""Method of Modern Love.""

The album's success led to the formation of the Wu-Tang Clan, a hip hop collective that would go on to achieve mainstream success with their 1993 debut album ""Enter the Wu-Tang (36 Chambers)."" The group's members pursued solo careers, with Ghostface Killah releasing his debut solo album ""Ironman"" in 1996 and Method Man collaborating with Mary J. Blige on the Grammy Award-winning single ""I'll Be There for You/You're All I Need to Get By.""

The album's production was heavily influenced by RZA's use of eerie beats and soul music samples, creating a unique sound that would become a hallmark of the Wu-Tang Clan's music. The album's success helped establish the Wu-Tang Clan as one of the most influential hip hop groups of the 1990s, and their music continues to inspire artists today. "
4,In which administrative territorial entity is Naya Raipur located?,raipur district,thailand," The correct answer should be 'chhattisgarh' as the context clearly states that Chhattisgarh is a state in central India, and its capital city is Raipur. The candidate answer 'thailand' is incorrect as it is a country in Southeast Asia and has no connection to the context provided. <|end|>",chhattisgarh," The correct answer is 'chhattisgarh'. The context provided clearly states that Chhattisgarh is a state in central India, with its capital city being Raipur. The candidate answer 'thailand' is incorrect as it is a country in Southeast Asia and has no connection to the context provided. <|end|>",chhattisgarh," Chhattisgarh, a state in central India, is rich in mineral resources, including tin. Tin, a chemical element with the symbol Sn and atomic number 50, is obtained chiefly from the mineral cassiterite, which contains tin dioxide, SnO. Tin shows a chemical similarity to both of its neighbors in group 14, germanium and lead, and has two main oxidation states, +2 and the slightly more stable +4.

The state of Chhattisgarh, with a population of 28 million, is the seventh-largest country by area and the second-most populous country in the world. It is bounded by the Indian Ocean on the south, the Arabian Sea on the southwest, and the Bay of Bengal on the southeast. Chhattisgarh shares land borders with Pakistan to the west; China, Nepal, and Bhutan to the northeast; and Myanmar (Burma) and Bangladesh to the east.

Chhattisgarh's capital city is Raipur, which is also the administrative headquarters of the district. The state is rich in mineral resources, and there are many wildlife sanctuaries and sightseeing places worth visiting. The district has a population of 30 lakhs.

Chhattisgarh is one of the fastest-developing states in India, with provisions made for its expansion and to upgrade infrastructure in the future. The state's jurisdiction is governed by the laws of India, which are enforced through social and governmental institutions.

In summary, Chhattisgarh is a state in central India, rich in mineral resources, including tin. Its capital city is Raipur, and the state is known for its fast-developing infrastructure and various wildlife sanctuaries and sightseeing places. "
5,What was the country of citizenship for Dan Clark?,united kingdom,london," The correct answer should be 'british' as it refers to the country of citizenship. The context does not mention that Dan Clark was from London, a writer, or that he was a citizen of the United Kingdom. <|end|>",british," The correct answer is 'british', as it refers to the country of citizenship. The context provided does not mention that Dan Clark was from London, a writer, or that he was a citizen of the United Kingdom. <|end|>",british," BBC Choice, launched on September 23, 1998, was the first British TV channel to broadcast exclusively in digital format. It was the BBC's second non-terrestrial channel launch, following the BBC News channel in 1997. BBC iPlayer, an internet streaming catchup television and radio service, is available on a wide range of devices and does not display commercial advertising. BBC Three, a digital publisher and broadcaster, launched on February 16, 2016, and was originally intended as a replacement for BBC Choice. It aimed to provide innovative programming to viewers aged 16 to 34.

Dan Clark, an English actor, comedian, writer, director, and singer, is best known for playing Don Danbury in the BBC Three sitcom ""How Not to Live Your Life."" The show, which aired from September 27, 2007, to December 22, 2011, follows a neurotic twenty-nine-year-old man trying to navigate life with bad instincts. The show gained a cult following and doubled its ratings each series. The third series garnered 1.5 million viewers and was the second most watched show on BBC iPlayer. However, the show was cancelled by BBC Three controller Zai Bennett after Danny Cohen's departure. "
6,Who directed the 'Forward March of the Hare' cartoon?,chuck jones,robert mckimson," The correct answer should be 'friz freleng' as he is one of the directors of the ""Looney Tunes"" series, which includes the cartoon ""Forward March of the Hare."" The context mentions that Foghorn Leghorn starred in 28 cartoons from 1946 to 1963, all directed by Robert McKimson. However, the context also mentions that the ""Looney Tunes"" series was produced by Warner Bros. Pictures, which introduced many famous characters, including Foghorn Leghorn. The ""Looney Tunes"" series, along with its sister series ""Merrie Melodies,"" were known for their comedic short films featuring various characters. The studio's creative staff, including directors and animators like Chuck Jones, Friz Freleng, Robert McKimson, Tex Avery, Robert Clampett, and Frank Tashlin, are considered major figures in the art and history of traditional animation.

In summary, Foghorn Leghorn is a beloved character from the ""Looney Tunes"" series, known for his comedic antics and memorable cartoons. The ""Looney Tunes"" series, created by Warner Bros. Pictures, introduced many iconic characters and became a significant part of American animation history. <|end|>",friz freleng," The correct answer is 'friz freleng'. The context provided indicates that Foghorn Leghorn starred in 28 cartoons from 1946 to 1963, all directed by Robert McKimson. However, the context also mentions that the ""Looney Tunes"" series, which includes the cartoon ""Forward March of the Hare,"" was produced by Warner Bros. Pictures. Friz Freleng was one of the directors of the ""Looney Tunes"" series, which starred Foghorn Leghorn. Therefore, the correct answer is 'friz freleng', as he is the director associated with the ""Looney Tunes"" series and the cartoon ""Forward March of the Hare."" <|end|>",friz freleng," Foghorn Leghorn is a character from the ""Looney Tunes"" and ""Merrie Melodies"" series, created by Robert McKimson and Warren Foster. He starred in 28 cartoons from 1946 to 1963, all directed by McKimson. The ""Looney Tunes"" series, produced by Warner Bros. Pictures, introduced many famous characters, including Bugs Bunny, Daffy Duck, Porky Pig, and Foghorn Leghorn. Warner Bros. Cartoons, Inc. was responsible for these cartoons, which became iconic in American culture.

One of the most notable cartoons featuring Foghorn Leghorn is ""Forward March Hare,"" released in 1953. In this cartoon, Bugs Bunny accidentally enlists in the Army and causes chaos during basic training. The title refers to the March Hare, a character from Lewis Carroll's ""Alice's Adventures in Wonderland."" This cartoon was released during the final months of the Korean War.

The ""Looney Tunes"" series, along with its sister series ""Merrie Melodies,"" were known for their comedic short films featuring various characters. These animated series were broadcast on television, shown in movie theaters, released direct-to-video, or on the internet. The series had a wide variety of genres and targeted different audiences, from children to adults.

Bugs Bunny, created by Leon Schlesinger Productions (later Warner Bros. Cartoons), became an American cultural icon and the official mascot of Warner Bros. Entertainment. The studio's creative staff, including directors and animators like Chuck Jones, Friz Freleng, Robert McKimson, Tex Avery, Robert Clampett, and Frank Tashlin, are considered major figures in the art and history of traditional animation.

In summary, Foghorn Leghorn is a beloved character from the ""Looney Tunes"" series, known for his comedic antics and memorable cartoons. The ""Looney Tunes"" series, created by Warner Bros. Pictures, introduced many iconic characters and became a significant part of American animation history. "
7,What was Thomas Pitt's role in the context of the given options?,fictional character,year, The correct answer should be 'fictional character' as Thomas Pitt is a character created by Anne Perry in her historical detective fiction series. <|end|>,fictional character," The correct answer is 'fictional character', as Thomas Pitt is a character created by Anne Perry in her historical detective fiction series. The suggestion provided aligns with the context, which describes Thomas Pitt as the protagonist of Perry's series and his role as a police inspector. <|end|>",protagonist," Anne Perry is an English author best known for her historical detective fiction series featuring Thomas Pitt and William Monk. Born Juliet Marion Hulme on October 28, 1938, Perry was convicted of murder at the age of fifteen. After serving her five-year sentence, she changed her name and began writing.

Thomas Pitt, the protagonist of Perry's series, is a police inspector from a working-class background in Victorian London. His father was a gamekeeper on a landed estate, and Pitt was educated alongside the son of the house. Pitt's father was wrongly accused of poaching game and transported to Australia, prompting Pitt to enter the police force.

At the beginning of the series, Pitt is a police inspector, but he is later promoted to superintendent. However, he is removed from his job after investigating the ""wrong people,"" i.e., those with sufficient influence and power. He joins the Special Branch, where he becomes an inspector and later a commander as Head of Special Branch.

Pitt's wife, Charlotte Ellison, is from an upper-class family. Her sister, Emily, is married to a viscount and a rising politician. Charlotte frequently uses Emily's connections to assist Pitt in his investigations. She relies on her maid, Gracie, to take care of her children, Jemima and Daniel, when Pitt is investigating a mystery.

Vespasia Cumming-Gould, the elderly aunt of Emily's first husband, becomes a friend to both Emily and Charlotte, easing their way into society. The first novel in the series, The Cater Street Hangman, was adapted for TV in 1998.

Inspector William Monk is another fictional character created by Anne Perry. He is the hero of a series of books, and like Pitt, he is a detective who investigates crimes, often murder. "
8,What is the given name of Muhammad Bashir?,muhammad,roman," The correct answer should be 'Rome' as it is the given name of the city where the 1960 Summer Olympics took place, where Mohammad Bashir won a bronze medal in freestyle wrestling. The context provides information about the city's significance in relation to the Olympics and the wrestling event. <|end|>",marino," The correct option is 'roman', as it is the given name of the city where the 1960 Summer Olympics took place, where Mohammad Bashir won a bronze medal in freestyle wrestling. The context provides information about the city's significance in relation to the Olympics and the wrestling event. <|end|>",roman," Mohammad Bashir was a celebrated Pakistani wrestler who won a bronze medal in freestyle wrestling at the 1960 Summer Olympics in Rome. He is the only Pakistani wrestler to have won an Olympic medal. Bashir also won three gold medals in the Commonwealth Games and four medals in the Asian Games, including a gold in 1966, two silvers in 1962, and a bronze in 1958. He competed in the lightweight class at the 1964 Summer Olympics but only reached the third round. He received the Tamgha-i-Imtiaz medal in 1962 and the Pride of Performance Award in 1968. Vatican City, the smallest state in the world by area and population, is a walled enclave within Rome, Italy, and holds sovereignty. Italy, a parliamentary republic in Europe, shares borders with several countries and has a diverse climate. The Gulf of Oman connects the Arabian Sea to the Persian Gulf, while the Gulf of Aden connects the Red Sea to the Arabian Sea. The European Union is a political and economic union of 27 member states. Islam is the world's second-largest religion, and an Islamic republic is a state ruled by Islamic law. The 1960 Summer Olympics were held in Rome, marking the fourth modern Olympic Games. The Wakhan Corridor is a narrow strip of territory in northeastern Afghanistan, while Latium is the region where Rome, Italy's capital, was founded. The Tiber River flows through Rome, and China is a major regional power in Asia. "
9,Where did Jim Wither Spoon receive his education?,ohio state university,ohio state university," The correct answer should be 'Ohio State University' as the context mentions that James Witherspoon played for the Ohio State Buckeyes. The other options, 'New York' and 'today', are not relevant to the context provided. <|end|>",ohio state university," The correct answer is 'Ohio State University'. The context provided mentions that James Witherspoon played for the Ohio State Buckeyes, which indicates that he received his education at Ohio State University. The other options, 'New York' and 'today', are not relevant to the context given. <|end|>",ohio state university," Los Angeles, known as the City of Angels, is the second-most populous city in the United States, with a diverse population and a significant role in the entertainment industry. The city is surrounded by mountains and has a Mediterranean climate. Ice hockey is a popular sport played on ice, with two teams of six players each, aiming to score goals by shooting a vulcanized rubber puck into the opponent's net. The goaltender, positioned in front of the net, plays a crucial role in preventing goals and is protected by special equipment.

The Ohio State Buckeyes represent The Ohio State University in various sports, including ice hockey, which competes in the Western Collegiate Hockey Association (WCHA). The team's mascot, Brutus Buckeye, is a student dressed in Buckeye colors with a headpiece resembling an Ohio Buckeye nut.

James Witherspoon, a retired Canadian professional ice hockey defenceman, played for the Ohio State Buckeyes and briefly for the Los Angeles Kings in the National Hockey League (NHL). The Los Angeles Kings are a professional ice hockey team based in Los Angeles, a member of the Pacific Division of the Western Conference of the NHL. The team was founded in 1967 and moved to the Staples Center in Downtown Los Angeles in 19992000.

New York City, the most populous city in the United States, is a global power city with a significant impact on commerce, finance, media, art, fashion, research, technology, education, and entertainment. It is the center of the New York metropolitan area and home to the United Nations headquarters. The National Hockey League (NHL) is a professional ice hockey league with 31 member clubs, considered the premier professional ice hockey league in the world. The Stanley Cup, the oldest professional sports trophy in North America, is awarded annually to the league playoff champion. "
10,In which administrative territorial entity is the key center south tower located?,new york,north," The correct answer should be 'erie county' as the Key Center North Tower and Key Center South Tower are located in Buffalo, New York, which is in Erie County. The other options do not accurately represent the administrative territorial entity where the Key Center South Tower is located. <|end|>",erie county," The correct option is 'erie county'. The Key Center South Tower is located in Buffalo, New York, which is in Erie County. The other options do not accurately represent the administrative territorial entity where the Key Center South Tower is located. <|end|>",erie county," The Key Center North Tower and Key Center South Tower are high-rise buildings located in Buffalo, New York. The Key Center North Tower, standing at 275 feet (85 m) and 17 stories tall, is the eighth tallest building in Buffalo. It is connected to the Key Center South Tower, which is four stories shorter and encompasses 18,800 square feet of retail space within a two-story glass atrium. Both buildings feature distinctive pyramid tops trimmed with bright green neon lighting, which illuminates at night.

In the summer, a large fountain and reflecting pool are located in front of the towers, while in the winter, the area serves as a free outdoor ice rink for the public. Buffalo, the city where these buildings are located, is the second-most populous city in New York state, with a population of 258,703 residents. The metropolitan area has a population of 1.13 million. The Key Center at Fountain Plaza complex, which includes both towers, is a prominent landmark in Buffalo. "
