,query,correct,cot,synthesis,context
146,Were both Ted Tetzlaff and David Siegel film actors?,no," Assistant: The context provided does not mention Ted Tetzlaff or David Siegel, nor does it discuss film actors. It primarily focuses on board games and their gameplay mechanics. Therefore, based on the given context, we cannot determine whether both Ted Tetzlaff and David Siegel were film actors or not. The correct answer would be 'no' as the context does not provide information to support the 'yes' option. ### no <|end|>",no,"Bookchase is a board game published by Art Meets Matter.
Players compete to acquire six small books for their bookshelf.
They do this by partly by answering multiple-choice questions, partly by visiting special spaces on the board: The Bookshop, The Book Corner, The Library and also by chance events triggered by the turn of an Award or Sentence card. San Marco is a 2001 designer board game by Alan R. Moon and Aaron Weissblum."
147,Are A Tiger Walks and A Kid in King Arthur's Court both family films?,yes," The context provided does not contain any information about the films ""A Tiger Walks"" and ""A Kid in King Arthur's Court"". Therefore, based on the given context, we cannot determine whether they are both family films or not. <|end|>",no,"The Classic Crime is an American rock band from Seattle, Washington formed in 2004.
They have released three albums and an EP on Tooth & Nail Records, two of which, ""The Silver Cord"" (2008) and ""Vagabonds"" (2010), charted in the ""Billboard"" 200.
On April 28th, 2017 they released their fifth studio album titled ""How to Be Human""(2017). The Last Shadow Puppets are an English supergroup consisting of Alex Turner (Arctic Monkeys), Miles Kane (The Rascals, solo artist), James Ford (Simian, Simian Mobile Disco, music producer), and Zach Dawes (Mini Mansions).
They are joined live by Loren Humphrey (Guards, music producer, session musician) and Tyler Parkford (Mini Mansions).
The band released their debut album ""The Age of the Understatement"" in 2008."
148,Are Sparta and King Charles both from the same country?,no," Assistant: The context provided does not contain any information about Sparta or King Charles, nor does it mention any countries. Therefore, we cannot determine if Sparta and King Charles are from the same country based on the given context. The correct answer is 'unknown'. <|end|>",no,"Pavonia is a genus of flowering plants in the mallow family, Malvaceae.
Several species are known as swampmallows. Cerastium is a genus of annual, winter annual, or perennial plants belonging to the family Caryophyllaceae."
149,Which city in China is a prefecture-level city Xinzhou or Guanghan,xinzhou," The context provided does not contain any information about the cities in China, Xinzhou or Guanghan. Therefore, based on the context, it is not possible to determine which city is a prefecture-level city. To answer this question, we would need additional information about the administrative divisions of China.

However, if we look outside the context, we can find that Xinzhou is a prefecture-level city in the north of Shanxi province, China. Guanghan, on the other hand, is a county-level city in Sichuan province, China.

So, based on external information, the correct option is 'Xinzhou'. <|end|>",xinzhou,"A Kid in King Arthur's Court is a 1995 Disney family film directed by Michael Gottlieb.
It is based on the famous Mark Twain novel ""A Connecticut Yankee in King Arthur's Court"" (previously filmed by Disney as ""Unidentified Flying Oddball"" in 1978 in which Ron Moody also played Merlin), transplanted into the twentieth century.
Trimark later released a sequel, ""A Kid in Aladdin's Palace"", in 1998, but without Disney's involvement.
Since Trimark's dissolution, the sequel is now distributed by Lions Gate Entertainment. A Tiger Walks is a 1964 family drama film, directed by Norman Tokar and produced by Walt Disney Productions."
150,Are Braque d'Auvergne and Griffon Fauve de Bretagne both breeds originating in France ?,yes," Assistant: The context provided does not contain any information about the Braque d'Auvergne or the Griffon Fauve de Bretagne breeds. However, based on general knowledge, both Braque d'Auvergne and Griffon Fauve de Bretagne are indeed breeds of dogs that originate from France. Therefore, the correct option is 'yes'. ### yes <|end|>",no,"Sparta is an American rock band from El Paso, Texas, formed in 2001.
Founding members Jim Ward (vocalist/guitarist) and Tony Hajjar (drummer) are also members of post-hardcore group At the Drive-In."
151,"The World's Best Prom and Shape of the Moon, are films of which genre?",documentary," The context provided does not contain any information about films or their genres. Therefore, it is impossible to determine the genre of the films ""The World's Best Prom"" and ""Shape of the Moon"" based on the given context. To answer this question, one would need additional information about these films. <|end|>",documentary,"Xinzhou () is a prefecture-level city occupying the north-central section of Shanxi province, People's Republic of China. Guanghan () is a county-level city in Deyang, Sichuan province, China, and only 23 km from Chengdu."
152,"Are Monastery of the Transfiguration, Kinaliada and Süreyya Opera House both Greek Orthodox monasteries? ",no," Assistant: The context provided does not give any information about the Monastery of the Transfiguration, Kinaliada, Süreyya Opera House, or Greek Orthodox monasteries. The context is about a breed of dog from France. Therefore, we cannot determine the correct answer based on the given context. <|end|>",no,"The Braque d'Auvergne is a breed of dog originating in the mountain area of Cantal, in the historic Auvergne province in the mid-south of France.
It is a pointer and versatile gundog."
153,"Which of these has its entrance in Piyer Loti Caddesi, Hagia Sophia or Theodosius Cistern?",theodosius cistern," Assistant: The context provided does not contain any information about the location of Hagia Sophia or Theodosius Cistern. However, using external knowledge, we know that Hagia Sophia is located in Istanbul, Turkey, and its entrance is on Sultanahmet Caddesi, not Piyer Loti Caddesi. Theodosius Cistern, also in Istanbul, Turkey, is accessible from Piyer Loti Caddesi. Therefore, the correct option is 'Theodosius Cistern'. <|end|>",theodosius cistern,"The film was also re-edited as mini-episodes for Truth, but the episodes never aired. Shape of the Moon (Dutch: ""Stand van de maan"" ) is a Dutch/Indonesian documentary film from 2004 directed by Leonard Retel Helmrich."
154,Reader's Digest and Scientific American are both what?,magazine," The context provided does not contain any information about Reader's Digest and Scientific American. However, based on general knowledge, Reader's Digest is a popular general interest family magazine, while Scientific American is a monthly magazine covering various fields of science. Therefore, the correct option is'magazine'. <|end|>",magazine,"Süreyya Opera House, also called Süreyya Cultural Center (Turkish: ""Süreyya Operası or Süreyya Kültür Merkezi"" ), is an opera hall located in Kadıköy district of Istanbul, Turkey.
The building is designed by Armenian architect Kegam Kavafyan by order of a Deputy for Istanbul Süreyya İlmen, it was originally established in 1927 as the first musical theatre on the Anatolian part of Istanbul.
The venue was rather used as a movie theatre until the building underwent a functional restoration and reopened as an opera house by the end of 2007. The Monastery of the Transfiguration, known locally as Hristo [Christ] Monastery, is a prominent Greek Orthodox monastery that has served the Greek Orthodox community of Constantinople (modern Istanbul) since the time of the Byzantine Empire.
The monastery is located on the island of Kınalıada, one of the Prince Islands in the Sea of Marmara.
It is situated on one of the highest peaks on the island called Hristo Peak (93 meters), which is named after the Monastery."
155,Waht kind of music do the bands Nada Surf and Madina Lake play?,alternative rock," The context provided does not contain any information about the music genres of the bands Nada Surf and Madina Lake. Therefore, we cannot determine the correct answer based on the given context. However, if we consider external knowledge, Nada Surf is an American alternative rock band, and Madina Lake is an American alternative rock band as well. So, the correct option is 'alternative rock'. <|end|>",alternative rock,"Hagia Sophia ( ; from the Greek: Αγία Σοφία , ] , ""Holy Wisdom""; Latin: ""Sancta Sophia"" or ""Sancta Sapientia""; Turkish: ""Ayasofya"" ) was a Greek Orthodox Christian patriarchal basilica (church), later an imperial mosque, and is now a museum (Ayasofya Müzesi) in Istanbul, Turkey.
The Roman Empire's first Christian Cathedral, from the date of its construction in 537 AD, and until 1453, it served as an Eastern Orthodox cathedral and seat of the Patriarch of Constantinople, except between 1204 and 1261, when it was converted by the Fourth Crusaders to a Roman Catholic cathedral under the Latin Empire.
It remained the world's largest cathedral for nearly a thousand years, until Seville Cathedral was completed in 1520. The Theodosius Cistern (Greek: Κινστέρνα Θεοδοσίου , Turkish: Şerefiye Sarnıcı ) is one of many ancient cisterns of Constantinople that lie beneath the city of Istanbul, Turkey."
156,"Which documentary, Crumb or Cancer, was produced first?",crumb," The context provided does not contain any information about the documentaries ""Crumb"" or ""Cancer"". Therefore, we cannot determine which documentary was produced first based on the given context. To answer this question, we would need additional information about the release dates of these documentaries. <|end|>",crumb,"Reader's Digest is an American general-interest family magazine, published ten times a year.
Formerly based in Chappaqua, New York, it is now headquartered in Midtown Manhattan.
For many years, ""Reader's Digest"" was the best-selling consumer magazine in the United States; it lost the distinction in 2009 to ""Better Homes and Gardens"".
According to Mediamark Research (2006), ""Reader's Digest"" reaches more readers with household incomes of $100,000+ than ""Fortune"", ""The Wall Street Journal"", ""Business Week"", and ""Inc."" combined. Scientific American (informally abbreviated SciAm) is an American popular science magazine.
Many famous scientists, including Albert Einstein, have contributed articles in the past 170 years."
157,"Are Beyazıt Tower and Miniatürk both in Istanbul, Turkey?",yes," The context provided does not contain any information about Beyazıt Tower or Miniatürk, nor does it mention Istanbul, Turkey. The context is about Nada Surf and Madina Lake, which are American alternative rock bands. Therefore, based on the given context, we cannot determine whether Beyazıt Tower and Miniatürk are both in Istanbul, Turkey. However, using external knowledge, we know that Beyazıt Tower and Miniatürk are indeed both located in Istanbul, Turkey. So the correct option is 'yes'. ### yes <|end|>",yes,"Nada Surf is an American alternative rock band which currently consists of Matthew Caws (guitar, vocals), Ira Elliot (drums), Doug Gillard (guitar) and Daniel Lorca (bass, backing vocals).
Based in New York City and formed in the 1990s, Nada Surf continues to tour.
Their eighth album, ""You Know Who You Are"", was a featured release on NPR in February 2016. Madina Lake is an American alternative rock band formed in Chicago in 2005.
Madina Lake won Best International Newcomer at the Kerrang!
Awards 2007."
158,Which happened first Battle of Okinawa or Operation Nordwind ?,operation north wind," The context provided does not contain any information about the Battle of Okinawa or Operation Nordwind. However, we can use our general knowledge to answer the question. The Battle of Okinawa took place from April to June 1945, during World War II. Operation Nordwind was the last major German offensive on the Western Front during World War II and took place from January to February 1945. Therefore, Operation Nordwind happened first. The correct option is 'Operation Nordwind'. <|end|>",operation nordwind,"Crumb is a 1994 documentary film about the noted underground cartoonist Robert Crumb (R. Crumb) and his family.
Directed by Terry Zwigoff and produced by Lynn O'Donnell, it won widespread acclaim.
It was released in the USA on April 28, 1995, having been screened at film festivals the previous year.
Jeffery M. Anderson (later critic for the ""San Francisco Examiner"") placed the film on his list of the ten greatest films of all time, labeling it ""the greatest documentary ever made."" Cancer: The Emperor of All Maladies is a 2015 American documentary film directed by Barak Goodman and produced by Ken Burns."
159,Ezhou and Yangzhong are both cities in what country?,china," The context provided does not contain any information about Ezhou and Yangzhong. However, using external knowledge, we can determine that both Ezhou and Yangzhong are cities in China. Therefore, the correct option is 'China'. <|end|>",china,"Eddie Mekka (born June 14, 1952) is an American actor most famous for his role as Carmine ""The Big Ragu"" Ragusa on the sitcom ""Laverne & Shirley"". Ben Haig Bagdikian (January 30, 1920 – March 11, 2016) was an Armenian-American educator and journalist."
160,"Editors and Working for a Nuclear Free City, is of which nationality?",english," The context provided does not give any information about the nationality of the editors or anyone working for a Nuclear Free City. The context is about Miniatürk, a miniature park in Istanbul, Turkey. Therefore, based on the given context, we cannot determine the nationality of the editors or workers for a Nuclear Free City. <|end|>",english,"Miniatürk is a miniature park situated at the north-eastern shore of Golden Horn in Istanbul, Turkey.
It was opened May 2, 2003.
Miniatürk covers a total area of 60000 m2 .
It is one of the world's largest miniature parks with its 15000 m2 model area.
The park contains 122 models in 1:25 scale."
161,What type of film are Transparent and Werner Herzog Eats His Shoe?,documentary," The context provided does not contain any information about the films ""Transparent"" and ""Werner Herzog Eats His Shoe."" However, we can still determine the type of these films based on external knowledge. ""Transparent"" is a television series that explores themes of gender identity and family dynamics, and it is not a cartoon or a documentary. ""Werner Herzog Eats His Shoe"" is a short film that documents an event where filmmaker Werner Herzog fulfills a bet by eating his shoe. This film is a documentary. Therefore, the correct option is 'documentary'. ### documentary <|end|>",documentary,"The Battle of Okinawa (Japanese: 沖縄戦 , Hepburn: Okinawa-sen ) (Okinawan: 沖縄戦 , ""Uchinaa ikusa "" ), codenamed Operation Iceberg, was a major battle of the Pacific War fought on the island of Okinawa by United States Marine and Army forces against the Imperial Japanese Army and included the largest amphibious assault in the Pacific War during World War II, the April 1, 1945, invasion of Okinawa itself.
The 82-day battle lasted from April 1 until June 22, 1945.
After a long campaign of island hopping, the Allies were planning to use Okinawa, a large island only 340 mi away from mainland Japan, as a base for air operations for the planned invasion of the Japanese home islands. Operation North Wind (German: ""Unternehmen Nordwind"" ) was the last major German offensive of World War II on the Western Front."
162,"What band was formed earlier, Better Than Ezra or the Melvins?",melvins," The context provided does not contain any information about the formation of the bands Better Than Ezra or the Melvins. To answer this question, we need to look at the history of both bands.

Better Than Ezra was formed in 1988 in Baton Rouge, Louisiana. The Melvins, on the other hand, were formed in 1983 in Montesano, Washington.

Based on this information, the correct option is 'the Melvins', as they were formed earlier than Better Than Ezra. <|end|>",better than ezra,"Yangzhong () is a county-level city under the administration of Zhenjiang, Jiangsu province, China.
It is the easternmost county-level division of Zhenjiang City. Ezhou () is a prefecture-level city in eastern Hubei Province, China.
As of the 2010 census, the city had a population of 1,048,668, of which 668,727 lived in the core Echeng District."
163,Were the documentaries The Mosuo Sisters and Quantum Hoops released in the same year?,no," Assistant: The context provided does not contain any information about the documentaries The Mosuo Sisters and Quantum Hoops. Therefore, we cannot determine if they were released in the same year based on the given context. <|end|>",no,"Editors are an English rock band, formed in 2002 in Birmingham."
164,Morning glory and Sorbus are both a genus of plants? ,yes," The context provided does not contain any information about Morning glory and Sorbus being a genus of plants. Therefore, we cannot determine the correct answer based on the given context. However, from general knowledge, Morning glory is indeed a genus of flowering plants in the family Convolvulaceae, and Sorbus is a genus of trees and shrubs in the family Rosaceae. So, the correct answer would be 'yes', but this information is not found in the context. ### yes <|end|>",no,"Werner Herzog Eats His Shoe is a short documentary film directed by Les Blank in 1980 which depicts director Werner Herzog living up to his promise that he would eat his shoe if Errol Morris ever completed the film ""Gates of Heaven"".
The film includes clips from both ""Gates of Heaven"" and Herzog's 1970 feature ""Even Dwarfs Started Small"".
Comic song ""Old Whisky Shoes"", played by the Walt Solek Band, is the signature tune over the opening and closing credits. Transparent is a 2005 documentary film written, directed, and produced by Jules Rosskam.
Its title is a play on the words “trans” and “parent” implying the invisibility of transgender parenting in society today."
165,Are Camassia and Chelone both native to North America?,yes," The context provided does not contain any information about Camassia and Chelone, nor does it mention anything about their native regions. Therefore, based on the given context, we cannot determine whether Camassia and Chelone are both native to North America. To answer this question accurately, we would need additional information about these plants.

However, if we were to look outside the context provided, we could find that both Camassia and Chelone are indeed native to North America. Camassia is a genus of flowering plants in the asparagus family, native to western North America, while Chelone is a genus of flowering plants in the plantain family, native to eastern North America.

So, the correct answer, based on external information, would be 'yes'. <|end|>",no,"The Melvins are an American rock band that formed in 1983 in Montesano, Washington.
They have mostly performed as a trio, as well as a quartet with two drummers in recent years.
Since 1984, vocalist and guitarist Buzz Osborne and drummer Dale Crover have been constant members.
Their early work was key to the development of both grunge and sludge metal. Better Than Ezra is an American alternative rock band based in New Orleans, Louisiana, and signed to The End Records.
The current band consists of Kevin Griffin (vocals and guitar), Tom Drummond (bass guitar), and Michael Jerome (drums).
The band has released 8 studio albums, the most recent one being 2014's ""All Together Now."""
166,Are the University of West Florida and FH Joanneum both American Universities ?,no," The context provided does not contain any information about the University of West Florida or FH Joanneum. Therefore, we cannot determine whether they are both American universities based on the given context. To answer this question accurately, we would need additional information about these institutions.

However, based on external knowledge, the University of West Florida is an American university located in Pensacola, Florida. FH Joanneum, on the other hand, is a public university in Graz, Austria. So, the correct answer is 'no', they are not both American universities. <|end|>",no,"Quantum Hoops is a 2007 documentary film directed by Rick Greenwald, that follows the California Institute of Technology's basketball team—the Caltech Beavers—in their attempts to end a 21-year losing streak during the final week of the 2006 basketball season. The Mosuo Sisters is a 2012 documentary film written and directed by Marlo Poras.
It chronicles the lives of two sisters, Jua Ma and La Tsuo, who are members of one of the last matriarchal societies, the Mosuo tribe."
167,What film company produced The Littlest Outlaw and The Jungle Book?,disney," The context provided does not contain any information about film companies or the movies mentioned in the question. Therefore, we cannot determine the correct answer based on the given context. However, using external knowledge, we can answer the question. The Littlest Outlaw and The Jungle Book were both produced by Disney. So, the correct option is 'Disney'. <|end|>",disney,"Sorbus is a genus of about 100–200 species of trees and shrubs in the rose family Rosaceae.
Species of ""Sorbus"" (""s.l."") are commonly known as whitebeam, rowan, service tree, and mountain-ash.
The exact number of species is disputed depending on the circumscription of the genus, and also due to the number of apomictic microspecies, which some treat as distinct species, but others group in a smaller number of variable species.
Recent treatments treat ""Sorbus"" in a narrower sense to include only the pinnate leaved species of subgenus ""Sorbus"", raising several of the other subgenera to generic rank. Morning glory (also written as morning-glory) is the common name for over 1,000 species of flowering plants in the family Convolvulaceae, whose current taxonomy and systematics are in flux."
168,Are Onew and Judith Durham both singers?,yes," The context provided does not mention Onew or Judith Durham, and instead discusses plant species. To answer the question, we need to look at external information. Onew is a South Korean singer and member of the boy band SHINee. Judith Durham is an Australian singer and the lead vocalist of The Seekers. Therefore, both Onew and Judith Durham are singers. The correct option is 'yes'. ### yes <|end|>",yes,"Chelone is a genus of four species of perennial herbaceous plants native to eastern North America.
They all have similarly shaped flowers (which led to the name turtlehead due to their resemblance to the head of a turtle), which vary in color from white to red, purple or pink.
""C. cuthbertii"", ""C. glabra"", and ""C. lyonii"" are diploid and ""C. obliqua"" is either tetraploid or hexaploid. Camassia is a genus of plants in the asparagus family native to Canada and the United States."
169,"Which musician was born first, John Tardy or Tom Barman?",john tardy," Assistant: The context provided does not contain any information about the birth dates of John Tardy or Tom Barman. Therefore, we cannot determine which musician was born first based on the given context. To answer this question, we would need additional information about the birth dates of these musicians. <|end|>",tom barman,"FH Joanneum is one of the largest Universities of Applied Sciences in Austria.
The main campus is located in Graz, while there are two other locations in Kapfenberg and Bad Gleichenberg.
Established in 1963 as a member institution of the State University System of Florida, the University of West Florida is a comprehensive research university without faculties of law or medicine, a designated space-grant institution, and sits on the third largest campus in the State University System, at 1600 acre .
The main campus is a natural preserve that is bordered by two rivers and Escambia Bay."
170,What type of organism can both Bellis and Syzygium jambos be described as?,plants," The context provided does not contain any information about Bellis or Syzygium jambos. However, we can use our general knowledge to answer the question. Bellis is a genus of flowering plants in the family Asteraceae, commonly known as daisies. Syzygium jambos, also known as the rose apple, is a species of plant in the family Myrtaceae. Therefore, both Bellis and Syzygium jambos can be described as 'plants'. The correct option is 'plants'. ### plants <|end|>",plants,"The Littlest Outlaw is a live-action film produced by Walt Disney.
It was released by Buena Vista Distribution on December 22, 1955.
It was directed by Roberto Gavaldón and written by Larry Lansburgh (story), and Bill Walsh (screenplay). The Jungle Book is a 1967 American animated musical adventure film produced by Walt Disney Productions.
Inspired by Rudyard Kipling's book of the same name, it is the 19th Disney animated feature film.
Directed by Wolfgang Reitherman, it was the last film to be produced by Walt Disney, who died during its production."
