,query,correct,cot,synthesis,context
0,"Which magazine was started first, Arthur's Magazine or First for Women?",arthurs magazine," To determine which magazine was started first, we need to compare the starting years of both magazines. According to the context, Arthur's Magazine was published in the 19th century, specifically from 1844 to 1846. On the other hand, First for Women was started in 1989. Since 1844 is earlier than 1989, Arthur's Magazine was started first. Therefore, the correct option is 'Arthur's Magazine'. ### Arthur's Magazine <|end|>",arthurs magazine,"Arthur's Magazine (1844–1846) was an American literary periodical published in Philadelphia in the 19th century.
In May 1846 it was merged into ""Godey's Lady's Book"". First for Women is a woman's magazine published by Bauer Media Group in the USA.
The magazine was started in 1989."
1,"Which tennis player won more Grand Slam titles, Henri Leconte or Jonathan Stark?",jonathan stark," Let's analyze the context provided for both tennis players. Henri Leconte is mentioned to have won the French Open men's doubles title in 1984 and helped France win the Davis Cup in 1991. However, there is no mention of him winning any Grand Slam singles titles.

On the other hand, Jonathan Stark is mentioned to have won two Grand Slam doubles titles: the 1994 French Open Men's Doubles and the 1995 Wimbledon Championships Mixed Doubles.

Based on the context provided, Jonathan Stark won more Grand Slam titles than Henri Leconte. Therefore, the correct option is 'Jonathan Stark'. <|end|>",jonathan stark,"Henri Leconte (born 4 July 1963) is a former French professional tennis player.
He reached the men's singles final at the French Open in 1988, won the French Open men's doubles title in 1984, and helped France win the Davis Cup in 1991.
Leconte's career-high singles ranking was world No. 5. Jonathan Stark (born April 3, 1971) is a former professional tennis player from the United States.
During his career he won two Grand Slam doubles titles (the 1994 French Open Men's Doubles and the 1995 Wimbledon Championships Mixed Doubles)."
2,"Which band was founded first, Hole (the rock band that Courtney Love was a frontwoman of) or The Wolfhounds?",the wolfhounds," Assistant: To answer this question, we need to compare the founding years of both bands. The context provides information about The Wolfhounds, stating that they were formed in 1985. However, there is no information about the founding year of Hole in the context.

Courtney Love was a frontwoman of Hole, but the context does not mention the founding year of Hole. However, we can infer that Hole was founded after Courtney Love joined the band, as she was not a member of the band at its inception.

Given the information provided, we can conclude that The Wolfhounds were founded first, as they were formed in 1985, and Hole was founded after Courtney Love joined the band. Therefore, the correct option is 'The Wolfhounds'. <|end|>",the wolfhounds,"The Wolfhounds are an indie pop/noise pop band formed in Romford, UK in 1985 by Dave Callahan, Paul Clark, Andy Golding, Andy Bolton and Frank Stebbing, and originally active until 1990."
3,Were Pavel Urysohn and Leonid Levin known for the same type of work?,no," Assistant: Let's analyze the context provided. Leonid Levin is a Soviet-American computer scientist, while Pavel Urysohn was a Soviet mathematician known for his contributions in dimension theory and topology. The fields of computer science and mathematics are related but distinct. Therefore, it is unlikely that they were known for the same type of work. The correct option is 'no'. ### no <|end|>",no,"Leonid Anatolievich Levin ( ; Russian: Леони́д Анато́льевич Ле́вин ; Ukrainian: Леоні́д Анато́лійович Ле́він ; born November 2, 1948) is a Soviet-American computer scientist. Pavel Samuilovich Urysohn (Па́вел Самуи́лович Урысо́н ) (February 3, 1898 – August 17, 1924) was a Soviet mathematician of Jewish origin who is best known for his contributions in dimension theory, and for developing Urysohn's Metrization Theorem and Urysohn's Lemma, both of which are fundamental results in topology."
4,Are both The New Pornographers and Kings of Leon American rock bands?,yes," Assistant: Let's analyze the options and the context provided. The context states that Kings of Leon is an American rock band. However, it also states that The New Pornographers is a Canadian indie rock band. Therefore, the answer to the question ""Are both The New Pornographers and Kings of Leon American rock bands?"" is 'no'. ### no <|end|>",no,"Kings of Leon is an American rock band that formed in Nashville, Tennessee, in 1999.
The band is composed of brothers Caleb Followill (b. January 14, 1982, lead vocals, rhythm guitar), Nathan Followill (b. June 26, 1979, drums, percussion, backing vocals) and Jared Followill (b. November 20, 1986, bass guitar, backing vocals), with their cousin Matthew Followill (b. September 10, 1984, lead guitar, backing vocals). The New Pornographers is a Canadian indie rock band formed in 1997 in Vancouver, British Columbia."
5,"750 7th Avenue and 101 Park Avenue, are located in which city?",new york city," Let's analyze the options and the context provided. The context mentions that both 101 Park Avenue and 750 Seventh Avenue are located in New York City, New York. Therefore, the correct option is 'New York City'. ### New York City <|end|>",new york city,"101 Park Avenue is a 629 ft tall skyscraper in New York City, New York.
Eli Attia Architects designed the building, which is the 64th tallest in New York. 750 Seventh Avenue is a 615 ft (187m) tall Class-A office skyscraper in New York City.
It is tied with the New York Life Building for the 74th tallest building in New York City."
6,"Who was born first, Pablo Trapero or Aleksander Ford?",aleksander ford," To determine who was born first, we need to compare the birth years of Pablo Trapero and Aleksander Ford. According to the context, Pablo Trapero was born on 4 October 1971, while Aleksander Ford was born on 24 November 1908. Since 1908 is earlier than 1971, Aleksander Ford was born first. Therefore, the correct option is 'Aleksander Ford'. ### Aleksander Ford <|end|>",aleksander ford,"Pablo Trapero (Born 4 October 1971) is an Argentine film producer, editor and director. Aleksander Ford (born Mosze Lifszyc; 24 November 1908 in Kiev, Russian Empire – 4 April 1980 in Naples, Florida, United States) was a Polish Jewish film director; and head of the Polish People's Army Film Crew in the Soviet Union during World War II."
7,Are Jane and First for Women both women's magazines?,yes," Let's analyze the context provided for both options. The context states that 'First for Women' is a woman's magazine published by Bauer Media Group in the USA. This confirms that 'First for Women' is indeed a women's magazine.

Regarding 'Jane', the context mentions that it was an American magazine created to appeal to women who grew up reading ""Sassy Magazine"", and it was founded by Jane Pratt. Although the context does not explicitly state that 'Jane' is a women's magazine, the fact that it was created to appeal to women and the name of the magazine suggests that it is likely a women's magazine.

Based on the information provided, the correct option is 'yes', as both 'First for Women' and 'Jane' are likely women's magazines. ### yes <|end|>",yes,"First for Women is a woman's magazine published by Bauer Media Group in the USA.
In 2011 the circulation of the magazine was 1,310,696 copies. Jane was an American magazine created to appeal to the women who grew up reading ""Sassy Magazine""; Jane Pratt was the founding editor of each."
8,"Which documentary is about Finnish rock groups, Adam Clayton Powell or The Saimaa Gesture?",the saimaa gesture," Let's analyze the options and the context provided. The context states that 'Adam Clayton Powell' is a documentary about a civil rights leader, not Finnish rock groups. On the other hand, 'The Saimaa Gesture' is a Finnish film, and although the context does not explicitly mention rock groups, it is the only option related to Finland. Therefore, based on the given information, 'The Saimaa Gesture' is the most likely option to be about Finnish rock groups.

### The Saimaa Gesture <|end|>",the saimaa gesture,"Adam Clayton Powell is a 1989 American documentary film directed by Richard Kilberg about the civil rights leader.
It was nominated for an Academy Award for Best Documentary Feature. The Saimaa Gesture (Finnish: ""Saimaa-ilmiö"" ) is a 1981 film by Finnish directors Aki and Mika Kaurismäki."
9,"Who was inducted into the Rock and Roll Hall of Fame, David Lee Roth or Cia Berg?",david lee roth," To answer this question, we need to look at the context provided for each individual and see if there is any mention of induction into the Rock and Roll Hall of Fame.

The context for Cia Berg states that she is a Swedish television presenter and singer, and was the lead singer of the Swedish rock band Whale. There is no mention of her being inducted into the Rock and Roll Hall of Fame.

The context for David Lee Roth states that he is an American rock vocalist, musician, songwriter, actor, author, and former radio personality. While the context does not explicitly mention his induction into the Rock and Roll Hall of Fame, it is well-known that David Lee Roth was inducted into the Rock and Roll Hall of Fame as a member of Van Halen in 2007.

Based on the information provided in the context and the known facts about David Lee Roth, the correct option is 'David Lee Roth'. <|end|>",david lee roth,"Cia Berg (born 2 December 1963), now known as Cia Soro, is a Swedish television presenter and singer.
She was at one time the lead singer of the Swedish rock band Whale, who released the single ""Hobo Humpin' Slobo Babe"". David Lee Roth (born October 10, 1954) is an American rock vocalist, musician, songwriter, actor, author, and former radio personality."
10,Are Gin and tonic and Paloma both cocktails based on tequila?,no," Let's analyze the options and the context provided. The context states that the Paloma is a tequila-based cocktail, which means it is made with tequila. On the other hand, the context describes a gin and tonic as a cocktail made with gin and tonic water, not tequila. Therefore, the correct answer is 'no', as not both cocktails are based on tequila. ### no <|end|>",no,"The paloma (Spanish for ""dove"") is a tequila-based cocktail.
This drink is most commonly prepared by mixing tequila with a grapefruit-flavored soda such as Fresca, Squirt, or Jarritos and served on the rocks with a lime wedge.
This drink also has the option of adding salt to the rim of the glass. A gin and tonic is a highball cocktail made with gin and tonic water poured over ice."
11,Who is older Glenn Hughes or Ross Lynch?,glenn hughes," To determine who is older between Glenn Hughes and Ross Lynch, we need to compare their birth dates. Glenn Hughes was born on August 21, 1951, while Ross Lynch was born on December 29, 1995. Since 1951 comes before 1995, Glenn Hughes is older than Ross Lynch. Therefore, the correct option is 'Glenn Hughes'. <|end|>",glenn hughes,"Ross Shor Lynch (born December 29, 1995) is an American singer, songwriter, and actor.
Lynch is also starring in a new horror/thriller movie called ""My Friend Dahmer,"" where he plays the role of Jeffrey Dahmer in his teenage years.
The movie is set to debut in the fall of 2017. Glenn Hughes (born 21 August 1951) is an English rock bassist and vocalist, best known for playing bass and performing vocals for funk rock pioneers Trapeze, the Mk."
12,"Which band has more members, Saint Motel or Curve?",saint motel," Let's analyze the information provided in the context. Saint Motel consists of four members: A/J Jackson, Aaron Sharp, Dak Lerdamornpong, and Greg Erwin. On the other hand, Curve was a duo, consisting of Toni Halliday and Dean Garcia. Therefore, Saint Motel has more members than Curve. The correct option is 'Saint Motel'. ### Saint Motel <|end|>",saint motel,"Saint Motel is an American indie pop band from Los Angeles, whose music has been described as everything from ""dream pop"" to ""indie prog"".
The band consists of A/J Jackson (lead vocals, guitar, piano), Aaron Sharp (lead guitar), Dak Lerdamornpong (bass), and Greg Erwin (drums). Curve were an English alternative rock and electronica duo from London, formed in 1990 and split in 2005.
The band consisted of Toni Halliday (vocals, occasionally guitar) and Dean Garcia (bass, guitar, drums, programming)."
13,"Which private research university is located in Chestnut Hill, Massachusetts Boston College or Stanford University? ",boston college," Assistant: Let's analyze the options based on the context provided. The context states that 'Boston College (also referred to as BC) is a private Jesuit Catholic research university located in the affluent village of Chestnut Hill, Massachusetts, United States, 6 mi west of downtown Boston.' This information directly matches the question, which asks for a private research university located in Chestnut Hill, Massachusetts. On the other hand, the context describes Stanford University as being located in Stanford, California, which does not match the location specified in the question. Therefore, the correct option is 'Boston College'. ### Boston College <|end|>",boston college,"Boston College (also referred to as BC) is a private Jesuit Catholic research university located in the affluent village of Chestnut Hill, Massachusetts, United States, 6 mi west of downtown Boston.
Its main campus is a historic district and features some of the earliest examples of collegiate gothic architecture in North America. Stanford University (Stanford; officially Leland Stanford Junior University, colloquially the Farm) is a private research university in Stanford, California, adjacent to Palo Alto and between San Jose and San Francisco.
Stanford's undergraduate program is the most selective in America."
14,Are both Tim McIlrath and Spike Slawson American punk rock musicians?,yes," Assistant: Let's analyze the information given in the context. We know that Tim McIlrath is an American punk rock musician. However, there is no information provided about Spike Slawson in the context. Therefore, we cannot confirm if Spike Slawson is also an American punk rock musician based on the given context. The correct answer, based on the information provided, is 'no'. <|end|>",no,"Timothy James ""Tim"" McIlrath (born November 3, 1978) is an American punk rock musician.
He is the lead singer, rhythm guitarist, songwriter and co-founder of the American punk rock band Rise Against."
15,What profession does Am Rong and Alexandre Rockwell have in common?,filmmaker," Let's analyze the context provided for both Am Rong and Alexandre Rockwell. Am Rong is described as a 'Cambodian soldier and filmmaker', while Alexandre Rockwell is the grandson of a Russian animator and his father was also an 'actor and filmmaker'. The common profession between Am Rong and Alexandre Rockwell, based on the context, is 'filmmaker'. Therefore, the correct option is 'filmmaker'. ### filmmaker <|end|>",filmmaker,"Am Rong (1929 – May 1975) was a Cambodian soldier and filmmaker, who acted as a spokesman on military matters for the Khmer Republic during the Cambodian Civil War.
Western journalists commented on the irony of his name as he gave briefings which ""painted a rosy picture of the increasingly desperate situation on the ground"" during the war. Rockwell is the grandson of the Russian animator Alexandre Alexeieff, who invented the pinscreen, and of Alexandra Grinevsky, Countess de Lowendhal.
His father was also an actor and filmmaker."
16,El Nuevo Cojo and Golf Magazine are both special interest publications but which one is owned by Time Inc?,golf magazine," Assistant: Let's analyze the options based on the context provided. The context states that 'Golf Magazine is a monthly golf magazine owned by ""Time Inc.""' This directly answers the question, indicating that 'Golf Magazine' is the publication owned by Time Inc. On the other hand, 'El Nuevo Cojo Ilustrado' is described as an American online Spanish language magazine published from Los Angeles, California, but there is no mention of it being owned by Time Inc. Therefore, the correct option is 'Golf Magazine'. ### Golf Magazine <|end|>",golf magazine,"Golf Magazine is a monthly golf magazine owned by ""Time Inc."" It was started in April, 1959 by Universal Publishing and Distributing, who sold it to Times Mirror in 1972.
Some features it includes are instruction from the top 100 teachers in America, interviews with famous golfers, tips on the best values for golf courses to go to on vacation, and an annual club test. El Nuevo Cojo Ilustrado is an American online Spanish language magazine published from Los Angeles, California.
It also sought to be a window to the US press for Spanish-speaking immigrants by translating English articles from mainstream newspapers."
17,What city are George Washington University Hospital and MedStar Washington Hospital Center located in?,"washington, d.c."," Assistant: Let's analyze the options given. The context states that both George Washington University Hospital and MedStar Washington Hospital Center are located in Washington, D.C. Therefore, the correct option is 'Washington, D.C.'. ### Washington, D.C. <|end|>","washington, d.c.","The George Washington University Hospital is located in Washington, D.C. in the United States.
The hospital is licensed by the District of Columbia Department of Consumer and Regulatory Affairs and accredited by the U.S. Joint Commission. MedStar Washington Hospital Center is the largest private hospital in Washington, D.C. A member of MedStar Health, the not-for-profit Hospital Center is licensed for 926 beds."
18,"Is Children's National Medical Center or MedStar Washington Hospital Center the largest private hospital in Washington, D.C.?",medstar washington hospital center," The context provided does not contain any information about Children's National Medical Center or MedStar Washington Hospital Center. Therefore, based on the given context, it is not possible to determine which one is the largest private hospital in Washington, D.C. <|end|>",childrens national medical center,"The Augusta Canal is a historic canal located in Augusta, Georgia, United States.
The canal is fed by the Savannah River and passes through three levels (approximately 13 miles total) in suburban and urban Augusta before the water returns to the river at various locations.
It was devised to harness the water power at the fall line of the Savannah River to drive mills, to provide transportation of goods, and to provide a municipal water supply.
It is the only canal in the US in continuous use for its original purposes of providing power, transport and municipal water. There are three outfall canals in New Orleans, Louisiana – the 17th Street, Orleans Avenue and London Avenue canals.
These canals are a critical element of New Orleans’ flood control system, serving as drainage conduits for much of the city.
There are 13 mi of levees and floodwalls that line the sides of the canals."
19,Are Wenling and Xinzheng both in China?,yes," The context provided does not mention Wenling or Xinzheng, and it is focused on a children's hospital in Washington, D.C., United States. Therefore, based on the given context, we cannot determine if Wenling and Xinzheng are both in China. However, using external knowledge, we know that Wenling is a city in the Zhejiang province of China, and Xinzheng is a county-level city in Henan province, also in China. So, the correct answer is 'yes', both Wenling and Xinzheng are in China. ### yes <|end|>",yes,"Children’s National Medical Center (formerly DC Children’s Hospital) is ranked among the top 10 children’s hospitals in the country by ""U.S. News & World Report.""
Located just north of the McMillan Reservoir and Howard University, it shares grounds with Washington Hospital Center, National Rehabilitation Hospital, and the DC Veterans Affairs Medical Center.
Kurt Newman, M.D., has served as the president and chief executive officer of Children’s National since 2011.
Children's National is a not-for-profit institution that performs more than 450,000 visits each year.
Featuring 303 beds and a Level IV NICU, Children's National is the regional referral center for pediatric emergency, trauma, cancer, cardiac and critical care as well as neonatology, orthopaedic surgery, neurology and neurosurgery. MedStar Washington Hospital Center is the largest private hospital in Washington, D.C. A member of MedStar Health, the not-for-profit Hospital Center is licensed for 926 beds.
Health services in primary, secondary and tertiary care are offered to adult and neonatal patients."
20,"Gülhane Park and Zografeion Lyceum, are located in which country?",turkey," Assistant: The context provided does not mention Gülhane Park or Zografeion Lyceum, nor does it mention the countries of Albania or Turkey. Therefore, based on the context, we cannot determine the correct answer. However, if we use external knowledge, Gülhane Park and Zografeion Lyceum are located in Turkey. So, the correct option is 'Turkey'. <|end|>",turkey,"Wenling (Wenling dialect: Uen-lin Zy ] ; ) is a coastal county-level city in the municipal region of Taizhou, in southeastern Zhejiang province, China.
Wenling locates on 28°22'N, 121°21'E, approximately 300 km south of Shanghai. Xinzheng () is a small county-level city of Zhengzhou in the south of Henan province of Central China."
21,What type of vegetation does Kniphofia and Baptisia have in common?,plant," Assistant: The context provided does not contain any information about Kniphofia and Baptisia or their vegetation. However, we can still answer the question based on general knowledge. Kniphofia and Baptisia are both types of flowering plants. Therefore, the correct option is 'plant'. ### plant <|end|>",plant,"Gülhane Park (Turkish: ""Gülhane Parkı"" , ""Rosehouse Park""; from Persian: ""Gulkhāna"", ""house of flowers"") is a historical urban park in the Eminönü district of Istanbul, Turkey; it is located adjacent to and on the grounds of the Topkapı Palace.
The south entrance of the park sports one of the larger gates of the palace.
It is the oldest and one of the most expansive public parks in Istanbul. Zografeion Lyceum (Turkish: ""Özel Zoğrafyon Rum Lisesi"" , Greek: Ζωγράφειον Λύκειον ) is one of the remaining open Greek schools in Istanbul."
22,Are Manhattan West and Singer Building both projects in New York?,yes," The context provided does not mention Manhattan West or the Singer Building, and instead discusses various plant species. To answer the question, we need to rely on external knowledge. Manhattan West is a commercial development in New York City, and the Singer Building was a skyscraper in New York City that was demolished in 1968. Therefore, the correct answer is 'yes', both Manhattan West and the Singer Building are related to projects in New York. ### yes <|end|>",yes,"Kniphofia , also called tritoma, red hot poker, torch lily, knofflers or poker plant, is a genus of flowering plants in the family Asphodelaceae, first described as a genus in 1794.
It is native to Africa.
In the New World they may attract sap-suckers such as hummingbirds and New World orioles. Baptisia (wild indigo, false indigo) is a genus in the legume family, Fabaceae.
They are flowering herbaceous perennial plants with pea-like flowers, followed by pods, which are sometimes inflated.
They are native to woodland and grassland in eastern and southern North America."
23,"Between two tennis players Kim Clijsters and Mary Pierce, who is older?",mary pierce," The context provided does not contain any information about the ages of Kim Clijsters and Mary Pierce. To answer the question, we need to look up their birth dates. Kim Clijsters was born on June 8, 1983, and Mary Pierce was born on January 17, 1975. Therefore, Mary Pierce is older than Kim Clijsters. The correct option is 'Mary Pierce'. <|end|>",mary pierce,"The Singer Building or Singer Tower, at Liberty Street and Broadway in Lower Manhattan's Financial District, in the U.S. state of New York, was a 47-story office building completed in 1908 as the headquarters of the Singer Manufacturing Company.
When it was razed, it became the tallest building ever to be demolished, and is still the third-tallest building ever to be destroyed (after the World Trade Center towers) and the tallest to be purposely demolished by its owner. Manhattan West is a 5400000 sqft mixed-use development by Brookfield Properties.
The buildings will be built close to the developing Hudson Yards region between 31st and 33rd streets.
These two buildings have been proposed as of 2010 ."
