,query,correct,cot,synthesis,context
72,"Charles Hutchison and Reginald Barker, have which mutual occupation?",film director," The context provided does not mention Charles Hutchison or Reginald Barker, nor does it mention any occupation related to film directing or acting. The context is about mines in Canada and their history. Therefore, based on the given context, we cannot determine the mutual occupation of Charles Hutchison and Reginald Barker. <|end|>",actor,"Barton Mine, also known as Net Lake Mine, is an abandoned surface and underground mine in Northeastern Ontario, Canada.
It is located about 0.50 km north of the Temagami Arena in Temagami North and just east of the Ontario Northland Railway in northwestern Strathy Township.
Dating back to the early 1900s, it is one of the oldest mines in Temagami.
Barton was the site of a fire in the early 1900s, after which it never had active mining again. The Camlaren Mine was a small gold mine 80 km north-east of Yellowknife, Northwest Territories, Canada at Gordon Lake.
It consists of a property totaling about 981 hectares.
The two claims that make up the property were staked in 1936 by prospectors Don Cameron and the Mclaren brothers and developed with two shafts during 1937-1938.
The name ""Camlaren"" is a portmanteau of Cameron and McLaren."
73,Was Beyond the Gates of Splendor or Jesus Camp released first?,beyond the gates of splendor," To answer this question, we need to look at the release dates of the two films mentioned in the options.

Beyond the Gates of Splendor is a 2002 documentary film about the events leading up to and following the deaths of five missionaries from the Christian and Missionary Alliance in Ecuador in 1956.

Jesus Camp is a 2006 documentary film that follows the activities of the children at the ""Kids on Fire"" camp, a summer camp for children run by the evangelical Christian group Youth With A Mission.

Based on the release dates, Beyond the Gates of Splendor was released first in 2002, followed by Jesus Camp in 2006.

Therefore, the correct option is 'Beyond the Gates of Splendor'. <|end|>",beyond the gates of splendor,"Charles Hutchison (December 3, 1879 – May 30, 1949) was an American film actor, director and screenwriter.
In 1923 he went to Britain and made two films ""Hutch Stirs 'em Up"" and ""Hurricane Hutch in Many Adventures"" for the Ideal Film Company."
74,Are Randal Kleiser and Kyle Schickner of the same nationality? ,yes," To answer this question, we need to find information about the nationalities of Randal Kleiser and Kyle Schickner. The context provided does not give us any information about their nationalities.

However, we can do some research outside the context. Randal Kleiser is an American film director, known for directing films like ""Grease"" and ""The Blue Lagoon."" Kyle Schickner is also an American film director, writer, and producer, known for his work on films like ""Finding Home"" and ""Strange Fruit.""

Based on this information, the correct option is 'yes', as both Randal Kleiser and Kyle Schickner are of American nationality. <|end|>",no,"Beyond the Gates of Splendor (also Beyond the Gates) is a feature-length documentary film that was released in 2004.
It chronicles the events leading up to and following Operation Auca, an attempt to contact the Huaorani tribe of Ecuador in which five American missionaries were killed.
The film was produced by Bearing Fruit Productions and distributed by Every Tribe Entertainment. Jesus Camp is a 2006 American documentary film directed by Rachel Grady and Heidi Ewing about a Charismatic Christian summer camp, where children spend their summers being taught that they have ""prophetic gifts"" and can ""take back America for Christ""."
75,Barbara Jordan and Mark Knowles are both what?,former tennis player," Assistant: The context provided does not give any information about Barbara Jordan and Mark Knowles. Therefore, we cannot determine whether they are 'olympian' or 'former tennis player' based on the given context. To answer this question accurately, we would need additional information about Barbara Jordan and Mark Knowles. <|end|>",olympian,"Kyle Schickner is an American film producer, writer, director, actor and a bisexual civil rights activist.
He is the founder of FenceSitter Films, a Production company devoted to entertainment for women, and sexual and ethnic minorities."
76,What two skills do Lee Hong-gi and Dee Snider have in common?,"singersongwriter, actor"," The context provided does not contain any information about Lee Hong-gi or Dee Snider, nor does it mention any skills related to being a singer-songwriter, actor, or fashion designer. Therefore, based on the given context, we cannot determine which skills Lee Hong-gi and Dee Snider have in common. <|end|>","singersongwriter, actor","Mark Knowles (born 4 September 1971) is a former tennis player from the Bahamas, specialising in doubles tennis.
At various times between 2002 and 2005 he was ranked World No. 1 in doubles."
77,"Are both Nasdaq, Inc. and Citrix Systems catering to the same customer bases?",no," The context provided does not contain any information about Nasdaq, Inc., Citrix Systems, or their customer bases. Therefore, we cannot determine whether both companies cater to the same customer bases based on the given context. The correct answer is 'no', as the context does not provide enough information to answer the question. ### no <|end|>",no,"Daniel ""Dee"" Snider (born March 15, 1955) is an American singer-songwriter, screenwriter, radio personality, and actor.
Snider came to prominence in the early 1980s as lead singer of the heavy metal band Twisted Sister.
He was ranked 83 in the ""Hit Parader""<nowiki>'</nowiki>s Top 100 Metal Vocalists of All Time. Lee Hong-gi (; ] ; Japanese:イ•ホンギ) is a South Korean singer-songwriter, actor, writer, and fashion designer."
78,Are George Avakian and Bobby Managoff both record producers?,no," The context provided does not mention George Avakian or Bobby Managoff, nor does it discuss record producers. Therefore, based on the given context, we cannot determine if George Avakian and Bobby Managoff are both record producers. To answer this question accurately, we would need additional information about George Avakian and Bobby Managoff. ### no <|end|>",no,"Citrix Systems, Inc. is an American multinational software company that provides server, application and desktop virtualization, networking, software as a service (SaaS), and cloud computing technologies.
It was founded in Richardson, Texas in 1989 by Ed Iacobucci, who served as chairman until his departure in 2000. Nasdaq, Inc. is an American multinational financial services corporation that owns and operates (and is listed on) the NASDAQ (formerly National Association of Securities Dealers Automated Quotations) stock market and eight European stock exchanges, namely Armenian Stock Exchange, Copenhagen Stock Exchange, Helsinki Stock Exchange, Iceland Stock Exchange, Riga Stock Exchange, Stockholm Stock Exchange, Tallinn Stock Exchange, and NASDAQ OMX Vilnius."
79,Do filmmakers Chris Carter and Theo van Gogh share the same nationality?,no," Assistant: To answer this question, we need to know the nationalities of filmmakers Chris Carter and Theo van Gogh. Chris Carter is an American filmmaker, known for creating the television series ""The X-Files."" Theo van Gogh was a Dutch film director, screenwriter, and film producer. Therefore, they do not share the same nationality. The correct option is 'no'. ### no <|end|>",no,"Welcome to Durham, USA is a documentary about gang violence in Durham, North Carolina. The Agronomist is a 2003 American documentary directed by Jonathan Demme, and starring Jean Dominique."
80,Rhodochiton and Platystemon are both genuses of what kind of life form?,flowering plants," Assistant: The context provided does not contain any information about Rhodochiton and Platystemon. However, we can use our general knowledge to answer the question. Rhodochiton and Platystemon are both genuses of flowering plants. Therefore, the correct option is 'flowering plants'. <|end|>",flowering plants,"Christopher Carl Carter (born October 13, 1956) is an American television and film producer, director and writer.
Born in Bellflower, California, Carter graduated with a degree in journalism from California State University, Long Beach before spending thirteen years working for ""Surfing Magazine"".
After beginning his television career working on television films for Walt Disney Studios, Carter rose to fame in the early 1990s after creating the science fiction-supernatural television series ""The X-Files"" for the Fox network."
81,Garth Jennings and Lee Cheol-ha shared what occupation?,film director," The context provided does not contain any information about Garth Jennings or Lee Cheol-ha, nor does it mention their occupation. The context is about plant species and their native regions. Therefore, based on the given context, we cannot determine the occupation of Garth Jennings and Lee Cheol-ha. However, if we were to look outside the context, Garth Jennings is a film director and Lee Cheol-ha is an actor. <|end|>",actor,"Platystemon is a monotypic genus of flowering plants in the poppy family containing the single species Platystemon californicus, which is known by the common name creamcups.
It is native to Oregon, California, Arizona, Utah and Baja California, and is found in open grasslands and sandy soils. Rhodochiton is a genus of flowering plants within the family Plantaginaceae, native to southern Mexico and neighbouring Guatemala.
One of the three species, ""Rhodochiton atrosanguineus"", the purple bell vine, is grown as an ornamental plant."
82,"Which was released second, Charley and the Angel or Planes?",planes," To answer this question, we need to look at the release dates of the two films mentioned: ""Charley and the Angel"" and ""Planes.""

""Charley and the Angel"" is a 2000 film directed by Michael Switzer.

""Planes"" is a 2013 animated film directed by Klay Hall.

Based on the release dates, ""Charley and the Angel"" was released in 2000, and ""Planes"" was released in 2013. Therefore, ""Charley and the Angel"" was released first, and ""Planes"" was released second.

The correct option is 'Planes'. <|end|>",charley and the angel,"Garth Jennings (born 1972) is a British film director, screenwriter, producer and actor.
He is best known for directing and writing the 2016 film ""Sing""."
83,Which of the following documents the issues of the LGBT community: Pride Divide or The Big Melt?,pride divide," Let's analyze the options and the context provided. The context discusses two films, ""Charley and the Angel"" and ""Planes,"" which are unrelated to the LGBT community. However, neither of these films is mentioned in the options.

Now, let's look at the options:

1. Pride Divide: This title suggests a focus on the LGBT community, as ""Pride"" is a term commonly associated with LGBT rights and activism.
2. The Big Melt: This title does not seem to have any direct connection to the LGBT community based on the information provided.

Based on the options and the context, it is more likely that ""Pride Divide"" documents the issues of the LGBT community.

Therefore, the correct option is 'Pride Divide'. <|end|>",the big melt,"Charley and the Angel is a 1973 Disney family/comedy film set in an unidentified small city in the 1930s Depression-era Midwestern United States and starring Fred MacMurray in one of his final film appearances and his last movie for Disney.
The film, directed by Vincent McEveety, is based on ""The Golden Evenings of Summer"", a 1971 novel written by Will Stanton. Planes is a 2013 American 3D computer-animated sports comedy film produced by DisneyToon Studios and released by Walt Disney Pictures.
It is a spin-off of Pixar's ""Cars"" franchise and the first film in a planned ""Planes"" trilogy.
Despite not being produced by Pixar, the film was co-written and executive produced by Pixar and Walt Disney Animation Studios' chief creative officer John Lasseter, who directed the first two ""Cars"" films."
84,"Who was born first, Martin Heidegger or Lydia Davis?",martin heidegger," The context provided does not contain any information about the birth dates of Martin Heidegger or Lydia Davis. However, we can look up their birth dates to answer the question. Martin Heidegger was born on September 26, 1889, and Lydia Davis was born on July 15, 1947. Therefore, Martin Heidegger was born first. The correct option is 'Martin Heidegger'. <|end|>",martin heidegger,"Pride Divide is a 1997 documentary film directed by Paris Poirier.
It examines the issues within the LGBT community relating to apparent divisions between lesbians and gay men. The Big Melt is a documentary film about the Sheffield steel industry which combines archive footage with a live soundtrack.
It was made by Jarvis Cocker and filmmaker Martin Wallace for the 20th annual Sheffield Doc/Fest in 2013, to celebrate the centenary of the steel industry."
85,Are Thums Up and Mott's based in the same country?,no," Assistant: The context provided does not contain any information about Thums Up and Mott's or their countries of origin. Therefore, based on the given context, we cannot determine whether Thums Up and Mott's are based in the same country. To answer this question accurately, we would need additional information about these companies. ### no <|end|>",no,"Martin Heidegger ( ; ] ; 26 September 188926 May 1976) was a German philosopher and a seminal thinker in the Continental tradition and philosophical hermeneutics.
Heidegger is best known for his contributions to phenomenology and existentialism, though as the ""Stanford Encyclopedia of Philosophy"" cautions, ""his thinking should be identified as part of such philosophical movements only with extreme care and qualification"". Lydia Davis (born July 15, 1947) is an American writer noted for literary works of extreme brevity (commonly called ""flash fiction"")."
86,"Which genus has more species, Fir or Chelone?",fir," The context provided does not contain any information about the genus Fir or Chelone. To answer the question, we need to look at the biological classification of these two genera.

Fir (genus Abies) is a genus of 48–56 species of evergreen coniferous trees in the family Pinaceae. They are found through much of North and Central America, Europe, Asia, and North Africa.

Chelone (genus Chelone) is a genus of flowering plants in the family Plantaginaceae, with about 10 species. They are native to North America, primarily in the eastern and central United States.

Based on the number of species in each genus, Fir has more species than Chelone. Therefore, the correct option is 'Fir'. <|end|>",fir,"Mott's is an American company involved primarily in producing apple-based products, particularly juices and sauces.
The company was founded in 1842 by Samuel R. Mott in Bouckville, New York, who made apple cider and vinegar.
Mott products were exhibited at Philadelphia's Centennial Exposition in 1876 and Chicago's World's Columbian Exposition in 1893.
In 1900, the company merged with the W. B. Duffy Cider Company to become Duffy-Mott."
87,Do both Juniper and Indigofera belong to the cypress family Cupressaceae?,no," Assistant: Let's analyze the context provided. The context discusses the genus Chelone and Firs (Abies), which belong to the family Pinaceae and are closely related to the genus Cedrus (cedar). However, there is no mention of Juniper or Indigofera or the cypress family Cupressaceae.

Juniper belongs to the family Cupressaceae, while Indigofera belongs to the family Fabaceae. Therefore, the correct answer is 'no', as neither Juniper nor Indigofera belong to the cypress family Cupressaceae.

### no <|end|>",no,"Chelone is a genus of four species of perennial herbaceous plants native to eastern North America.
""C. cuthbertii"", ""C. glabra"", and ""C. lyonii"" are diploid and ""C. obliqua"" is either tetraploid or hexaploid. Firs (Abies) are a genus of 48–56 species of evergreen coniferous trees in the family Pinaceae.
Firs are most closely related to the genus ""Cedrus"" (cedar)."
88,"What film director is from Great Britain, Miloš Forman or Alex Cox?",alex cox," The context provided does not contain any information about film directors, Miloš Forman or Alex Cox. However, we can use external knowledge to answer the question. Miloš Forman is a film director from Great Britain, while Alex Cox is a film director from the United States. Therefore, the correct option is 'Miloš Forman'. <|end|>",miloš forman,"Junipers are coniferous plants in the genus Juniperus of the cypress family Cupressaceae.
Depending on taxonomic viewpoint, between 50 and 67 species of juniper are widely distributed throughout the Northern Hemisphere, from the Arctic, south to tropical Africa, from Ziarat, Pakistan east to eastern Tibet in the Old World, and in the mountains of Central America.
The highest-known Juniper forest occurs at an altitude of 16000 ft in south-eastern Tibet and the northern Himalayas, creating one of the highest tree-lines on earth. Indigofera is a large genus of over 750 species of flowering plants belonging to the family Fabaceae."
89,Both the Drever and Finnish Hound are two dog breeds that are bred for what purpose?,hunting," Assistant: The context provided does not give any information about the Drever and Finnish Hound dog breeds. However, based on general knowledge, both the Drever and Finnish Hound are breeds that were originally bred for hunting purposes. Therefore, the correct option is 'hunting'. <|end|>",hunting,"Alexander ""Alex"" Cox (born 15 December 1954 in Bebington, Cheshire) is a British film director, screenwriter, nonfiction author, broadcaster and sometime actor, notable for his idiosyncratic style and approach to scripts."
90,"Who has won more Grand Slam doubles titles, Elizabeth Smylie or Vasek Pospisil?",elizabeth smylie," The context provided does not contain any information about Grand Slam doubles titles or the tennis players Elizabeth Smylie and Vasek Pospisil. To answer the question, we need to look up their respective Grand Slam doubles titles.

Elizabeth Smylie has won 14 Grand Slam doubles titles in her career. Vasek Pospisil has won 1 Grand Slam doubles title.

Therefore, the correct option is 'Elizabeth Smylie'. <|end|>",vasek pospisil,"The Finnish Hound (suomenajokoira, Finnish Bracke) is a breed of dog originally bred for hunting hare and fox. The Drever is a breed of dog, a short-legged scenthound from Sweden used for hunting deer and other game.
The Drever is descended from the Westphalian Dachsbracke, a type of German hound called ""Bracke""."
91,What occupation was shared by both John Frankenheimer and Tiffanie DeBartolo?,director," To answer this question, we need to look at the occupations of John Frankenheimer and Tiffanie DeBartolo. John Frankenheimer was an American film and television director, producer, and actor. Tiffanie DeBartolo is an American author and filmmaker.

Given the options 'director' and 'novelist', we can see that both John Frankenheimer and Tiffanie DeBartolo have worked as directors. Therefore, the correct option is 'director'. ### director <|end|>",director,"Vasek Pospisil (, ] ; born June 23, 1990) is a Canadian professional tennis player.
He also reached the quarterfinals in singles at the 2015 Wimbledon Championships. Elizabeth Smylie (née Sayers, born 11 April 1963), sometimes known as Liz Smylie, is a retired Australian professional tennis player.
During her career, she won four Grand Slam titles, one of them in women's doubles and three in mixed doubles."
92,"Which author was born first, Lorraine Hansberry or Sandra Gulland?",lorraine hansberry," The context provided does not contain any information about the birth dates of Lorraine Hansberry or Sandra Gulland. Therefore, we cannot determine the correct answer based on the given context. To answer this question, we would need additional information about the birth dates of these two authors. <|end|>",sandra gulland,"John Michael Frankenheimer (February 19, 1930 – July 6, 2002) was an American film and television director known for social dramas and action/suspense films.
Among his credits were ""Birdman of Alcatraz"" (1962), ""The Manchurian Candidate"" (1962), ""Seven Days in May"" (1964), ""The Train"" (1964), ""Seconds"" (1966), ""Grand Prix"" (1966), ""French Connection II"" (1975), ""Black Sunday"" (1977), and ""Ronin"" (1998). Tiffanie DeBartolo (born November 27, 1970) is an American novelist, filmmaker, and co-founder of independent record label Bright Antenna.
She has written two novels, ""God-Shaped Hole"" and ""How To Kill a Rock Star""."
93,Are Kelly Jones and Martha Reeves both singers?,yes," Assistant: The context provided does not mention Kelly Jones or Martha Reeves, nor does it provide any information about them being singers. Therefore, based on the given context, we cannot determine whether Kelly Jones and Martha Reeves are both singers. ### no <|end|>",no,"Lorraine Vivian Hansberry (May 19, 1930 – January 12, 1965) was an African-American playwright and writer. Sandra Gulland (born November 3, 1944) is an American-born Canadian novelist."
94,"Mark Rankin and Cedric Bixler-Zavala, band is what type genre?",rock," The context provided does not mention Mark Rankin and Cedric Bixler-Zavala or their band. However, Mark Rankin and Cedric Bixler-Zavala are known for being part of the band De Facto, which is a post-rock band. The options given are 'rock' and 'post-hardcore'. Since 'post-hardcore' is not a genre associated with De Facto, the closest option would be 'rock'. Therefore, the correct option is 'rock'. <|end|>",rock,"Martha Rose Reeves (born July 18, 1941) is an American R&B and pop singer and former politician, and is the lead singer of the Motown girl group Martha Reeves and the Vandellas.
From 2005 until 2009, Reeves served as an elected council woman for the city of Detroit, Michigan. Kelly Jones (born 3 June 1974) is a Welsh singer-songwriter, guitarist and director and the lead singer of the band Stereophonics.
Influenced by classic rock bands such as Pink Floyd, The Who, Led Zeppelin, AC/DC and Sex Pistols, Jones is noted for his raspy voice, which has been described as ""whiskey"" and has drawn criticism as well as acclaim."
95,"Which documentary was released earlier, Almost Sunrise or 51 Birch Street?",51 birch street," The context provided does not contain any information about the release dates of the documentaries ""Almost Sunrise"" and ""51 Birch Street"". To answer this question, we need to look for information outside the given context.

""Almost Sunrise"" is a documentary film directed by Michael Collins and released in 2016. It follows two Iraq War veterans as they walk across the United States to raise awareness about post-traumatic stress disorder (PTSD).

""51 Birch Street"" is a documentary film directed by Doug Block and released in 2005. It explores the life of Doug Block's parents and their marriage through the lens of their home in New York City.

Based on the release dates, ""51 Birch Street"" was released earlier than ""Almost Sunrise"". Therefore, the correct option is '51 Birch Street'. <|end|>",51 birch street,"Mark Rankin was lead vocalist with Scottish rock band Gun, who were best known for their cover of ""Word Up!
"", originally by Cameo.
The single was taken from the album ""Swagger"", and was released in 1994.
Other singles were ""Better Days"", ""Taking on the World"" and ""Steal Your Fire"". Cedric Bixler-Zavala (born November 4, 1974 in Redwood City, California) is a Grammy Award-winning American musician known for his work as frontman and lyricist of the progressive rock band The Mars Volta, and as frontman and occasional guitarist of the post-hardcore group At the Drive-In.
Currently he is a singer in the band Antemasque, and also sings and plays guitar in his band Zavalaz.
He has also played drums for a number of acts, including the dub act De Facto and more recently Big Sir and Anywhere."
96,"WHo is a Grammy winning American musician of Armenian descent, Armen Nalbandian or Arto Tunçboyacıyan?",arto tunçboyacıyan," To answer this question, we need to look at the background of both musicians mentioned in the options.

Armen Nalbandian is an Armenian-American musician, composer, and producer. He has worked with various artists and has received recognition for his work. However, there is no information available about him winning a Grammy award.

Arto Tunçboyacıyan, on the other hand, is an Armenian-Turkish musician, composer, and producer. He has collaborated with various artists and has received multiple awards for his work, including a Grammy Award for his contribution to the album ""Spiritu"" by the Kronos Quartet in 2004.

Based on the information provided, Arto Tunçboyacıyan is the Grammy-winning American musician of Armenian descent. Therefore, the correct option is 'Arto Tunçboyacıyan'. <|end|>",arto tunçboyacıyan,"Almost Sunrise is a 2016 American documentary film directed by Michael Collins.
It recounts the story of two Iraq veterans, Tom Voss and Anthony Anderson, who, in an attempt to put their combat experience behind them, embark on a 2,700-mile trek on foot across America."
