,query,correct,cot,synthesis,context
243,"Which Walt Disney production was based on Jules Verne's 1868 novel Captain Grant's Children, The Misadventures of Merlin Jones or In Search of the Castaways?",in search of the castaways," Assistant: The context provided does not contain any information about Walt Disney productions or Jules Verne's novels. However, based on external knowledge, we can determine that ""In Search of the Castaways"" is a Walt Disney production based on Jules Verne's 1868 novel ""Captain Grant's Children"". ""The Misadventures of Merlin Jones"" is also a Walt Disney production, but it is not based on a Jules Verne novel. Therefore, the correct option is 'In Search of the Castaways'. ### In Search of the Castaways <|end|>",the misadventures of merlin jones,"Paul Benjamin Auster (born February 3, 1947) is an American writer and director whose writing blends absurdism, existentialism, crime fiction, and the search for identity and personal meaning.
His notable works include ""The New York Trilogy"" (1987), ""Moon Palace"" (1989), ""The Music of Chance"" (1990), ""The Book of Illusions"" (2002), and ""The Brooklyn Follies"" (2005).
His books have been translated into more than forty languages. Jodi Lynn Picoult ( ; born May 19, 1966) is an American writer.
She was awarded the New England Bookseller Award for fiction in 2003."
244,Are Viva and Ainslee's Magazine both periodicals?,yes," The context provided does not contain any information about Viva and Ainslee's Magazine. Therefore, based on the given context, we cannot determine whether Viva and Ainslee's Magazine are both periodicals or not. To answer this question accurately, we would need additional information about Viva and Ainslee's Magazine. ### no <|end|>",no,"Gun-Marie Fredriksson, known as    (born 30 May 1958), is a Swedish pop singer-songwriter and pianist, best known for forming one half of the pop rock duo Roxette, which she created together with Per Gessle in 1986.
She is a member of South Korean girl group S.E.S..
She has released four studio albums, one mini albums and five singles."
245,Are Manuel Orantes and Anna-Lena Grönefeld both tennis players?,yes," The context provided does not mention anything about Manuel Orantes or Anna-Lena Grönefeld, nor does it mention tennis. The context is about a card game and a word game. Therefore, based on the given context, we cannot determine if Manuel Orantes and Anna-Lena Grönefeld are both tennis players. The correct answer is 'no', as the context does not provide information to support the claim that they are tennis players. ### no <|end|>",no,"Sentinels of the Multiverse is a designer card game published by Greater Than Games and released at Gen Con 2011.
It is a cooperative game in which players control a team of comic book-style heroes battling a villain.
Each player controls one or more heroes, while a villain and environment deck each run themselves.
A given game includes 3 to 5 heroes, 1 villain and 1 environment, which can be mixed and matched to create a number of different scenarios.
The core game comes with 10 heroes, 4 villains, and 4 environments. Scrabble is a word game in which two to four players score points by placing tiles bearing a single letter onto a board divided into a 15×15 grid of squares."
246,What company owns both Mountain Dew and Tropicana Products?,pepsicola," The context provided does not contain any information about the ownership of Mountain Dew and Tropicana Products. However, using external knowledge, we know that Mountain Dew is owned by PepsiCo, and Tropicana Products is also owned by PepsiCo. Therefore, the correct option is 'Pepsi-Cola'. <|end|>",pepsicola,"The 77s (alternatively spelled The Seventy Sevens or The 77's) are an American rock band consisting of Michael Roe on vocals/guitar, Mark Harmon on bass and Bruce Spencer on drums. Jesus Jones are a British alternative rock band from Bradford-on-Avon in Wiltshire, formed in late 1988, recorded and performed in the late 1980s into the 2000s.
Their track ""Right Here, Right Now"" was an international hit which was subsequently globally licensed for promotional and advertising campaigns."
247,What do Alessandro Scarlatti and Nikolai Rimsky-Korsakov have in common?,composer," The context provided does not mention Alessandro Scarlatti or Nikolai Rimsky-Korsakov. However, based on general knowledge, both Scarlatti and Rimsky-Korsakov were renowned composers. Therefore, the commonality between them is that they were both 'composers'. The option'musician' could also be considered correct, as composers are a subset of musicians. However, 'composer' is more specific and accurate in this context.

So, the correct option is 'composer'. <|end|>",composer,"The Misadventures of Merlin Jones is a 1964 Walt Disney production starring Tommy Kirk and Annette Funicello.
Kirk plays a college student who experiments with mind-reading and hypnotism, leading to run-ins with a local judge.
Funicello plays his girlfriend (and sings the film's title song written by brothers Robert and Richard Sherman). In Search of the Castaways is a 1962 Walt Disney Productions feature film starring Hayley Mills and Maurice Chevalier in a tale about a worldwide search for a shipwrecked sea captain.
The film was directed by Robert Stevenson from a screenplay by Lowell S. Hawley based upon Jules Verne's 1868 adventure novel ""Captain Grant's Children""."
248,"Who has performed with more band, Trey Anastasio or Sarah Nixey?",trey anastasio," The context provided does not contain any information about Trey Anastasio or Sarah Nixey, nor does it mention any bands they may have performed with. Therefore, based on the given context, it is not possible to determine who has performed with more bands. To answer this question, additional information about Trey Anastasio and Sarah Nixey's musical careers would be required. <|end|>",sarah nixey,"Viva was an adult woman's magazine that premiered in 1973 and ceased publication in 1980.
Its full title was ""Viva, The International Magazine For Women"", and it was published by Bob Guccione and his wife, Kathy Keeton.
""Viva"" was essentially an erotic magazine for women, containing articles and fiction delving into women’s fantasies, and exploring their sexuality, reviews of the arts, interviews with known personalities, fashion and beauty, etc. Ainslee's Magazine was an American literary periodical published from 1897 to December 1926.
It was originally published as a humor magazine called ""The Yellow Kid"", based on the popular comic strip character."
249,Are Puyang and Pu'er City located in the same country?,yes," The context provided does not contain any information about Puyang and Pu'er City or their locations. Therefore, we cannot determine whether they are located in the same country based on the given context. To answer this question, we would need additional information about the locations of Puyang and Pu'er City.

However, if we use our general knowledge, we can answer the question. Puyang is a city in Henan province, China, and Pu'er City is a prefecture-level city in Yunnan province, China. So, the answer is 'yes', they are located in the same country, China. <|end|>",no,"Anna-Lena Grönefeld (born 4 June 1985) is a German tennis player.
She turned professional in April 2003. Manuel Orantes Corral (] ; born 6 February 1949) is a former tennis player who was active in the 1970s and 1980s.
He won the US Open men's singles in 1975, beating defending champion Jimmy Connors in the final."
250,"Which magazine has a higher circulation, Y'all or Motor Trend?",motor trend," The context provided does not contain any information about the circulation of the magazines ""Y'all"" or ""Motor Trend"". To answer this question, we would need additional information about the circulation numbers of these magazines. <|end|>",yall,"Mountain Dew (sometimes stylized as Mtn Dew) is a carbonated soft drink brand produced and owned by PepsiCo.
The original formula was invented in 1940 by Tennessee beverage bottlers Barney and Ally Hartman.
A revised formula was created by Bill Bridgforth in 1958.
The rights to this formula were obtained by the Tip Corporation of Marion, Virginia.
In August 1964, the Mountain Dew brand and production rights were acquired from Tip by the Pepsi-Cola company, at which point distribution expanded more widely across the United States and Canada. Tropicana Products, Inc. is an American multinational company which primarily makes fruit-based beverages.
Tropicana's headquarters are in Chicago, Illinois."
251,"Who was born earlier, Roger Taylor or Elizabeth Fraser?",roger taylor," The context provided does not contain any information about Roger Taylor or Elizabeth Fraser. Therefore, we cannot determine who was born earlier based on the given context. To answer this question, we would need additional information about the birth dates of Roger Taylor and Elizabeth Fraser. <|end|>",roger taylor,"Nikolai Andreyevich Rimsky-Korsakov (18 March [O.S. 6 March] 1844 21 June [O.S. 8 June] 1908 ) was a Russian composer, and a member of the group of composers known as The Five.
His best-known orchestral compositions—""Capriccio Espagnol"", the ""Russian Easter Festival Overture"", and the symphonic suite ""Scheherazade""—are staples of the classical music repertoire, along with suites and excerpts from some of his 15 operas.
""Scheherazade"" is an example of his frequent use of fairy tale and folk subjects. Pietro Alessandro Gaspare Scarlatti (2 May 1660 – 22 October 1725) was an Italian Baroque composer, especially famous for his operas and chamber cantatas.
He is considered the founder of the Neapolitan school of opera."
252,Are both  Adolfo Bioy Casares and Iris Rainer Dart authors?,yes," The context provided does not mention Adolfo Bioy Casares or Iris Rainer Dart, so we cannot determine from this information whether they are authors or not. However, from external knowledge, we know that Adolfo Bioy Casares was an Argentine writer and Iris Rainer Dart is an American author. Therefore, the correct option is 'yes'. <|end|>",no,"Sarah Anne Nixey (born 21 December 1973 in Dorset, England) is a British singer songwriter, best known as the vocalist in Black Box Recorder.
Nixey currently lives in London with her husband, music producer Jimmy Hogarth, whom she married in late 2010 and has one son, Reuben (born late 2007) and a daughter, Lola (born late 2012)."
253,Do Jean-Jacques Beineix and John Ince have the same nationality ?,no," The context provided does not contain any information about Jean-Jacques Beineix and John Ince, nor their nationalities. Therefore, based on the given context, we cannot determine whether they have the same nationality or not. To answer this question, we would need additional information about these individuals. ### no <|end|>",no,"Puyang is a prefecture-level city in northeastern Henan province, People's Republic of China.
Located on the northern shore of the Yellow River, it borders Anyang in the west, Xinxiang in the southwest, and the provinces of Shandong and Hebei in the east and north respectively. Pu'er () is a prefecture-level city in southern Yunnan Province, China.
The name Pu'er dates back to 1729, but was changed to Simao () in 1950 after the Communist Revolution.
This change had an effect on the size of the official Pu'er tea production area, a major regional product.
The urban administrative center of Pu'er is Simao District, which is also the former name of the prefecture-level city itself.
A major downturn in the price of tea in 2007 caused severe economic distress in the area."
254,"Which university was founded earlier, Lehigh University or University of Iowa?",university of iowa," Assistant: The context provided does not contain any information about the founding dates of Lehigh University or the University of Iowa. To answer this question, we need to look at external sources. Lehigh University was founded in 1865, while the University of Iowa was founded in 1847. Therefore, the correct option is 'University of Iowa'. <|end|>",university of iowa,"Y'all magazine is an American magazine based out of Oxford, Mississippi, literary hub of the American South.
It was published bimonthly with a circulation of 100,000 and features Southern celebrities, events and ordinary people with extraordinary stories to tell.
According to the magazine's mySpace page, ""Y'all covers the South's 15 states and its 103 million people, just like kudzu."" Motor Trend is an American automobile magazine.
Petersen Publishing was sold to British publisher EMAP in 1998, who sold the former Petersen magazines to Primedia in 2001.
As of 2017, it is published by (formerly Source Interlink Media)."
255,Are Monoral and Versus both rock bands?,yes," The context provided does not mention Monoral or Versus, and instead focuses on Elizabeth Davidson Fraser and Roger Meddows Taylor, who are associated with the bands Cocteau Twins and Queen, respectively. Therefore, based on the given context, we cannot determine if Monoral and Versus are both rock bands. The correct answer is 'no', as the context does not provide enough information to confirm that they are both rock bands. ### no <|end|>",no,"Elizabeth Davidson Fraser (born 29 August 1963), sometimes known as Liz Fraser, is a British singer, songwriter and musician from Grangemouth, Scotland, best known as the vocalist for the band Cocteau Twins.
She was described by critic Jason Ankeny as ""an utterly unique performer whose swooping, operatic vocals relied less on any recognizable language than on the subjective sounds and textures of verbalized emotions"".
Her lyrics range from straightforward English to semi-comprehensible sentences (idioglossia) and abstract mouth music.
For some recordings, she has said she used foreign words without knowing what they meant – the words acquired meaning for her only as she sang them. Roger Meddows Taylor (born 26 July 1949) is an English musician, singer and songwriter.
He is a multi-instrumentalist, best known as the drummer for the rock band Queen."
256,Are both Die Macher and Quoridor German board games?,no," The context provided does not contain any information about Die Macher or Quoridor, which are both German board games. Therefore, based on the given context, we cannot determine whether both Die Macher and Quoridor are German board games. However, from general knowledge, we know that both Die Macher and Quoridor are indeed German board games. So, the correct option is 'yes'. <|end|>",yes,"Iris Rainer Dart (born March 3, 1944) is an American author and playwright for television and the stage.
Her most notable novel is ""Beaches"", which was made into a 1988 film of the same name.
She also voiced Donna, Peter Cottontail's love interest, in the stop-motion Easter classic, Here Comes Peter Cottontail. Adolfo Bioy Casares (] ; September 15, 1914 – March 8, 1999) was an Argentine fiction writer, journalist, and translator."
257,"Between the Lapageria and Satureja genus, which is the national flower of Chile?",lapageria," The context provided does not contain any information about the national flower of Chile. However, using external knowledge, we know that the national flower of Chile is the Lapageria genus. Therefore, the correct option is 'Lapageria'. <|end|>",lapageria,"Jean-Jacques Beineix (] ; born 8 October 1946) is a French film director and generally seen as the best example of what came to be called the ""cinéma du look"".
Critic Ginette Vincendeau defined the films made by Beineix and others as ""youth-oriented films with high production values...The ""look"" of the ""cinéma du look"" refers to the films' high investment in non-naturalistic, self-conscious aesthetics, notably intense colours and lighting effects.
Luc Besson, like Beineix, was much maligned by the critical establishment during the 1980s, while Carax was much admired.
In late 2006, Beineix published a first volume of his autobiography, ""Les Chantiers de la gloire"" (in French only)."
258,Are musicians Paul Cotton and Cedric Bixler-Zavala both members of a band?,yes," Assistant: The context provided does not mention musicians Paul Cotton and Cedric Bixler-Zavala or any bands they might be associated with. Therefore, based on the given context, we cannot determine whether they are both members of a band or not. To answer this question accurately, we would need additional information about these musicians and their musical careers. ### no <|end|>",no,"Lehigh University is an American private research university located in Bethlehem, Pennsylvania.
It was established in 1865 by businessman Asa Packer.
As of 2014, the university had 4,904 undergraduate students and 2,165 graduate students. Lehigh is considered one of the twenty-four Hidden Ivies in the Northeastern United States. The University of Iowa (also known as the UI, U of I, UIowa, or simply Iowa) is a flagship public research university in Iowa City, Iowa.
Founded in 1847, it is the oldest university in the state.
Iowa is the second largest university in the state of Iowa, behind Iowa State University."
259,Which genus is more spread around the world Maytenus or Eucommia ?,maytenus," Assistant: The context provided does not contain any information about the distribution of the genera Maytenus or Eucommia around the world. Therefore, it is not possible to determine which genus is more spread around the world based on the given context. To answer this question, we would need information about the geographical distribution of these two genera. ### Unable to determine from the given context <|end|>",maytenus,"Versus is an American indie rock band formed in 1990 by Richard Baluyut, Fontaine Toups, and Edward Baluyut in New York City.
Richard and Fontaine were to remain the two core members throughout the band's history.
They were also noted for their proficient and disciplined musicianship and for their credo of ""meat, sports, and rock"", none of which had much currency in the early 1990s American indie scene.
They named themselves after the Mission of Burma album ""Vs."" Monoral is a Japanese alternative rock band signed to Sony Music Japan."
260,Which studio released the most recently released between The Shaggy Dog and Frozen 2?,disney," The context provided does not contain any information about the release of The Shaggy Dog or Frozen 2, nor does it mention Disney or Dreamworks. To answer the question, we need to look at external information.

The Shaggy Dog is a 1994 film produced by Walt Disney Pictures. Frozen 2 is a 2019 film produced by Walt Disney Animation Studios. Since Frozen 2 was released more recently than The Shaggy Dog, the studio that released the most recently released film between the two is Disney.

Therefore, the correct option is 'Disney'. <|end|>",disney,"Quoridor is a 2- or 4-player abstract strategy game designed by Mirko Marchesi and published by Gigamic Games.
Quoridor received the Mensa Mind Game award in 1997 and the Game Of The Year in the USA, France, Canada and Belgium. Die Macher is a strategy board game designed by Karl-Heinz Schmiel of Germany.
The game is based on the German electoral system and each player takes the role of one of five political parties (in the 2006 edition, the CDU/CSU, FDP, SPD, Greens, and Die Linke)."
261,"Are Huai'an and Qian'an, Hebei both Chinese cities?",yes," The context provided does not contain any information about Huai'an and Qian'an, Hebei. Therefore, we cannot determine whether they are Chinese cities based on the given context. However, using external knowledge, we can confirm that both Huai'an and Qian'an, Hebei are indeed Chinese cities. So, the correct option is 'yes'. ### yes <|end|>",yes,"Lapageria is a genus of flowering plants with only one known species, Lapageria rosea, commonly known as Chilean bellflower or copihue (""co-pee-way"" < Mapudungun ""kopiwe"").
""Lapageria rosea"" is the national flower of Chile.
It grows in forests in the southern part of Chile, being part of the Valdivian temperate rain forests flora. Satureja is a genus of aromatic plants of the family Lamiaceae, related to rosemary and thyme.
It is native to North Africa, southern and southeastern Europe, the Middle East, and Central Asia.
A few New World species were formerly included in ""Satureja"", but they have all been moved to other genera."
262,Does Lüliang or Fuxin have a larger population?,lüliang," The context provided does not contain any information about the population of Lüliang or Fuxin. To answer this question, we would need to look up the population data for both cities.

According to the latest available data, Lüliang, a prefecture-level city in Shanxi province, China, has a population of approximately 3.4 million people. Fuxin, a prefecture-level city in Liaoning province, China, has a population of approximately 1.8 million people.

Based on this information, the correct option is 'Lüliang'. <|end|>",lüliang,"Cedric Bixler-Zavala (born November 4, 1974 in Redwood City, California) is a Grammy Award-winning American musician known for his work as frontman and lyricist of the progressive rock band The Mars Volta, and as frontman and occasional guitarist of the post-hardcore group At the Drive-In.
Currently he is a singer in the band Antemasque, and also sings and plays guitar in his band Zavalaz."
263,Are Shiba Inu and Leonberger both large dog breeds?,no," Assistant: The context provided does not contain any information about dog breeds, including Shiba Inu and Leonberger. Therefore, we cannot determine the correct answer based on the given context. However, to answer the question outside of the context, Shiba Inu is a small to medium-sized breed, while Leonberger is a large breed. So, the correct answer is 'no'. <|end|>",no,"Maytenus is a genus of flowering plants in the staff vine family, Celastraceae.
Members of the genus are distributed throughout Central and South America, Southeast Asia, Micronesia and Australasia, the Indian Ocean and Africa.
They grow in a very wide variety of climates, from tropical to subpolar. Eucommia is a genus of small trees now native to China, with a fossil record that shows a much wider distribution."
264,"Who was a member of more comedy troupes, Doug Langway or Terry Jones?",terry jones," The context provided does not contain any information about Doug Langway or Terry Jones, nor does it mention any comedy troupes. Therefore, it is impossible to determine who was a member of more comedy troupes based on the given context. To answer this question, we would need additional information about Doug Langway and Terry Jones and their involvement in comedy troupes. ### Unable to determine from the given context <|end|>",doug langway,"Frozen 2 is an upcoming American computer-animated film produced by Walt Disney Animation Studios and will be released by Walt Disney Pictures.
It is a sequel to the 2013 film, ""Frozen"". The Shaggy Dog is a 2006 American family comedy film directed by Brian Robbins and written by Geoff Rodkey, Jack Amiel, Michael Begler, Cormac Wibberley and Marianne Wibberley.
Both the 1959 and 1994 features, as well as the 1976 theatrical sequel and the 1987 television sequel, had a character named Wilby Daniels transforming into an Old English Sheepdog, whereas this remake presents a character named Dave Douglas transforming into a Bearded Collie."
265,What to Autograph Collector Magazine and Linux Journal have in common?,published on monthly basis," Assistant: The context provided does not give any information about Autograph Collector Magazine or Linux Journal. However, based on the options given, we can infer that both magazines are likely published on a monthly basis. The option'regards Linux' would only apply to Linux Journal, as it is a magazine dedicated to the Linux operating system. Autograph Collector Magazine, on the other hand, is a magazine for autograph collectors and does not have any relation to Linux. Therefore, the commonality between Autograph Collector Magazine and Linux Journal is that they are both 'published on a monthly basis'. <|end|>",published on monthly basis,"Qian'an () is a city in the northeastern part of Hebei province in North China.
It is under the administration of Tangshan City. Huai'an (), formerly called Huaiyin () until 2001, is a prefecture-level city in central Jiangsu province of Eastern China."
266,"Who was born first, Béla Bartók or Dmitri Shostakovich?",béla bartók," The context provided does not contain any information about Béla Bartók or Dmitri Shostakovich. However, we can still answer the question by using external knowledge. Béla Bartók was born on March 25, 1881, and Dmitri Shostakovich was born on September 25, 1906. Therefore, Béla Bartók was born first. The correct option is 'Béla Bartók'. <|end|>",béla bartók,"Fuxin () is a prefecture-level city in northwestern Liaoning province, People's Republic of China.
The total population of the prefecture at the 2010 census is 1,819,339, of whom 669,317 are resident in the built up area, which comprises four urban districts, collectively known as 'Fuxin City'. Lüliang or Lyuliang () is a prefecture-level city in the west of Shanxi province, People's Republic of China, bordering Shaanxi province across the Yellow River to the west, Jinzhong and the provincial capital of Taiyuan to the east, Linfen to the south, and Xinzhou to the north.
It has a total area of 21143 km2 and total population of 3,727,057."
