,query,correct,thesis,antithesis,pre-synthesis,synthesis,context
68,Are both Simon Wincer and Patrice Leconte film directors?,yes,yes,"'Yes'

Explanation

Both are well-known filmmakers who have been active since their early careers","The suggested response from ""Suggested"" matches with that provided as input",yes,"Simon Wincer (born 1943 in Sydney) is an Australian film director and film producer. He attended Cranbrook School, Bellevue Hill, Sydney from 1950 to 1961. On leaving school he worked as a stage hand at TV Station Channel 7. By the 1980s he directed over 200 hours of television. In 1986 he directed the made-for-TV movie ""The Last Frontier"" and also won a Christopher Award. Patrice Leconte (] ; born 12 November 1947) is a French film director, actor, comic strip writer, and screenwriter."
69,Robinsons and Pocari Sweat are both what kind of product?,drink,drink,"The word ""drinks"" refers specifically as beverages made out water",Candidate,drink,"Pocari Sweat (ポカリスエット , Pokari Suetto ) is a Japanese sports drink, manufactured by Otsuka Pharmaceutical It was launched in 1980, and is now also available in East Asia, Southeast Asia, and the Middle East. Robinsons is an English fruit drink brand owned by Britvic. Robinsons has a royal warrant from Queen Elizabeth II and was an independent company until 1995 when it was acquired by Britvic. The Robinsons range includes Fruit Shoot, Fruit Squash, No Added Sugar Fruit Squash, Fruit & Barley, Barley Water, Select and Squash'd; the range formerly also included Fruit Spring. For the Diamond Jubilee of Elizabeth II, Strawberry and Cream was added to the range."
70,Did both Carl Boese and Franco Zeffirelli direct and produce film?,yes,yes,The reference text states they were directors/ producers so Yes would apply here,"The suggested response agrees with ""Yes"" being appropriate as it was stated that each directed or produced films",yes,"Carl Boese (] ; 26 August 1887 – 6 July 1958) was a German film director, screenwriter and producer. He directed 158 films between 1917 and 1957. Franco Zeffirelli, KBE Grande Ufficiale OMRI (] ; born 12 February 1923) is an Italian director and producer of operas, films and television. He is also a former senator (1994–2001) for the Italian centre-right ""Forza Italia"" party. Recently, Italian researchers have found that he is one of the few distant relatives of Leonardo da Vinci."
71,"Ian Hunter and Stuart Murdoch, have which musical occupation in common?",lead singer,lead singer,The two musicians are both singers,"The reference text suggests that ""Stuart"" has been referred as  musician before so it can only mean he was either singing or playing instruments since those were his main occupations while growing up.",lead singer,"Ian Hunter Patterson (born 3 June 1939), known as Ian Hunter, is a British singer-songwriter who is best known as the lead singer of the English rock band Mott the Hoople, from its inception in 1969 to its dissolution in 1974, and at the time of its 2009 and 2013 reunions. Hunter was a musician and songwriter before joining Mott the Hoople, and continued in this vein after he left the band. He embarked on a solo career despite ill health and disillusionment with commercial success, and often worked in collaboration with Mick Ronson, David Bowie's sideman and arranger from the ""Ziggy Stardust and the Spiders from Mars"" period. Stuart Lee Murdoch (born 25 August 1968) is a Scottish musician, writer and filmmaker, and the lead singer and songwriter for the indie pop band Belle and Sebastian."
72, Is Advanced Micro Devices or Level 3 Communications headquartered further west?,advanced micro devices,advanced micro devices,The headquarters location determines if they are located more West than another entity so we need this information from our knowledge base,advanced,advanced micro devices,"Advanced Micro Devices, Inc. (AMD) is an American multinational semiconductor company based in Sunnyvale, California, United States, that develops computer processors and related technologies for business and consumer markets. While initially it manufactured its own processors, the company later outsourced its manufacturing, a practice known as fabless, after GlobalFoundries was spun off in 2009. AMD's main products include microprocessors, motherboard chipsets, embedded processors and graphics processors for servers, workstations and personal computers, and embedded systems applications. Level 3 Communications is an American multinational telecommunications and Internet service provider company headquartered in Broomfield, Colorado."
73,"Who is older, Vincent Walker or David Usher?",david usher,vincent walker,The reference text states both their birth dates; therefore we know who came into this world earlier than another person,vin,vincent walker,"David Usher (born April 24, 1966) is an English-born Canadian musician, best-selling author, keynote speaker and activist, known as the lead singer of the alternative rock band Moist. Vincent Francis Walker (born March 2, 1980), better known as Vince Walker, is an American multi-instrumentalist, best known as the lead singer of third-wave ska band Suburban Legends. He was formerly the lead trumpet player, and left sometime after the release of ""Rump Shaker"", but returned to the band in September 2005 for the band's appearance on the Jerry Lewis MDA Telethon, which happened to be lead singer Tim Maurer's last performance. He replaced Maurer as the singer in an odd switching of roles, and continues with the band as frontman."
74,"Yukio Mishima and Roberto Bolaño, are Chilean?",no,no,"'No'

Explanation

Yukio Misihma from Japan while Robeto Bolano hails form chile","The suggested response ""Yes"" would not only provide more information about each author but it will help us understand their cultural background better",yes,"Yukio Mishima (三島 由紀夫 , Mishima Yukio ) is the pen name of Kimitake Hiraoka (平岡 公威 , Hiraoka Kimitake , January 14, 1925November 25, 1970) , a Japanese author, poet, playwright, actor, and film director. Mishima is considered one of the most important Japanese authors of the 20th century. He was considered for the Nobel Prize in Literature in 1968 but the award went to his countryman Yasunari Kawabata. His works include the novels ""Confessions of a Mask"" and ""The Temple of the Golden Pavilion"", and the autobiographical essay ""Sun and Steel"". His avant-garde work displayed a blending of modern and traditional aesthetics that broke cultural boundaries, with a focus on sexuality, death, and political change. Mishima was active as a nationalist and founded his own right-wing militia, the Tatenokai. In 1970, he and three other members of his militia staged an attempted ""coup d'état"" when they seized control of a Japanese military base and took the commander hostage, then tried and failed to inspire a coup to restore the Emperor's pre-war powers. Mishima then committed ritual suicide by ""seppuku"". The coup attempt became known as the ""Mishima Incident"". Roberto Bolaño Ávalos (] ; 28 April 1953 – 15 July 2003) was a Chilean novelist, short-story writer, poet and essayist. In 1999, Bolaño won the Rómulo Gallegos Prize for his novel ""Los detectives salvajes"" (""The Savage Detectives""), and in 2008 he was posthumously awarded the National Book Critics Circle Award for Fiction for his novel ""2666"", which was described by board member Marcela Valdes as a ""work so rich and dazzling that it will surely draw readers and scholars for ages"". ""The New York Times"" described him as ""the most significant Latin American literary voice of his generation""."
75,What sport did Jack Sock and Raffaella Reggi play?,tennis,tennis,"The appropriate response would have been ""Tennis"" as they are well-known players within this field",The reference text suggests that it was indeed Tennis played,tennis,"Jack Sock (born September 24, 1992) is an American professional tennis player who is currently ranked world No. 21 in men's singles by the Association of Tennis Professionals (ATP). He is one of the top ranked American men in both singles and doubles on the ATP Tour. A former junior US Open champion, Sock's singles success is highlighted by 7 ATP finals, including three titles. His career best result came at the 2017 Indian Wells Masters, where he reached the semi-finals. Raffaella Reggi (born 27 November 1965; ] ) is a former professional tennis player from Italy."
76,"Which was halted by a natural disaster, Camlaren Mine or Barton Mine?",barton mine,barton mine,"The reference text explicitly states,""Dating back to the early 1900s...it [the Bartomn]Mine...never ha[d ]active minin[g]""again."" Therefore, this option fits better than another because there are no records showing any other disasters except fires.",'Bartolm',camlaren mine,"Barton Mine, also known as Net Lake Mine, is an abandoned surface and underground mine in Northeastern Ontario, Canada. It is located about 0.50 km north of the Temagami Arena in Temagami North and just east of the Ontario Northland Railway in northwestern Strathy Township. Dating back to the early 1900s, it is one of the oldest mines in Temagami. Barton was the site of a fire in the early 1900s, after which it never had active mining again. The Camlaren Mine was a small gold mine 80 km north-east of Yellowknife, Northwest Territories, Canada at Gordon Lake. It consists of a property totaling about 981 hectares. The two claims that make up the property were staked in 1936 by prospectors Don Cameron and the Mclaren brothers and developed with two shafts during 1937-1938. The name ""Camlaren"" is a portmanteau of Cameron and McLaren. Conditions attributed to World War II halted development at Camlaren in 1939."
77,"Charles Hutchison and Reginald Barker, have which mutual occupation?",film director,actor,The text mentions both men were actors so this would make sense,"The two gentlemen mentioned above had one thing common i.e., acting",actor,"Charles Hutchison (December 3, 1879 – May 30, 1949) was an American film actor, director and screenwriter. He appeared in 49 films between 1914 and 1944. He also directed 33 films between 1915 and 1938. Though he directed numerous independent silent features, he is best remembered today as Pathé's leading male serial star from 1918 to 1922. In 1923 he went to Britain and made two films ""Hutch Stirs 'em Up"" and ""Hurricane Hutch in Many Adventures"" for the Ideal Film Company. He made one last serial in 1926, ""Lightning Hutch"", for Arrow Film Company. It was meant to be a comeback vehicle, but the production company went into bankruptcy just as it was released. Reginald C. Barker (April 2, 1886 – February 23, 1945) was a pioneer film director."
78,Was Beyond the Gates of Splendor or Jesus Camp released first?,beyond the gates of splendor,jesus camp,The movie beyond gates splendour came out before Jesusscamp,beyond,beyond the gates of splendor,"Beyond the Gates of Splendor (also Beyond the Gates) is a feature-length documentary film that was released in 2004. It chronicles the events leading up to and following Operation Auca, an attempt to contact the Huaorani tribe of Ecuador in which five American missionaries were killed. The film was produced by Bearing Fruit Productions and distributed by Every Tribe Entertainment. Jesus Camp is a 2006 American documentary film directed by Rachel Grady and Heidi Ewing about a Charismatic Christian summer camp, where children spend their summers being taught that they have ""prophetic gifts"" and can ""take back America for Christ"". According to the distributor, it ""doesn't come with any prepackaged point of view"" and attempts to be ""an honest and impartial depiction of one faction of the evangelical Christian community""."
79,Are Randal Kleiser and Kyle Schickner of the same nationality? ,yes,yes,The reference text states both individuals are from America so they share common nationalities,The two men mentioned above do indeed come form American backgrounds,yes,"Kyle Schickner is an American film producer, writer, director, actor and a bisexual civil rights activist. He is the founder of FenceSitter Films, a Production company devoted to entertainment for women, and sexual and ethnic minorities. He currently lives and works in Los Angeles, where he directs films, music videos, a Web series and commercials for his production company FenceSitterFilms. John Randal Kleiser (born July 20, 1946) is an American film director and producer, best known for directing the 1978 musical romantic comedy film ""Grease""."
80,Barbara Jordan and Mark Knowles are both what?,former tennis player,former tennis player,"'Former Tennis Player'

Explanation :

Barbara Jordon had been retired since her win at Australia open back then while mark knowle still plays as per wiki",Candidate,former tennis player,"Mark Knowles (born 4 September 1971) is a former tennis player from the Bahamas, specialising in doubles tennis. He has won a number of Grand Slam tournaments, most notably partnering with Daniel Nestor. At various times between 2002 and 2005 he was ranked World No. 1 in doubles. He is a five-time Olympian. Barbara Jordan (born April 2, 1957) is a former professional female tennis player from the United States who won the 1979 Australian Open singles title."
81,What two skills do Lee Hong-gi and Dee Snider have in common?,"singersongwriter, actor","singersongwriter, actor",The reference text states both men are “Singers-Songwriters” AND actors so this option fits better than ‘fashion Designer’ because there’s no mention he designed clothes.”,The suggested response provides additional information about each man that supports their shared skill as singer/song-writers but only one mentions acting experience while neither has any known involvement with designing clothing or other forms thereof,"singersongwriter, actor","Daniel ""Dee"" Snider (born March 15, 1955) is an American singer-songwriter, screenwriter, radio personality, and actor. Snider came to prominence in the early 1980s as lead singer of the heavy metal band Twisted Sister. He was ranked 83 in the ""Hit Parader""<nowiki>'</nowiki>s Top 100 Metal Vocalists of All Time. Lee Hong-gi (; ] ; Japanese:イ•ホンギ) is a South Korean singer-songwriter, actor, writer, and fashion designer. He is best known for his singing abilities and being the main singer of the South Korean rock band F.T. Island. Lee released his first solo extended play ""FM302"" in South Korea on 18 November 2015 and his Japanese album ""AM302"" on 9 December 2015."
82,"Are both Nasdaq, Inc. and Citrix Systems catering to the same customer bases?",no,yes,"The reference text states ""Citirx System"" caters mainly towards businesses while """"Nasdaq"""" focuses more specifically onto stocks markets themselves rather than just general business needs.""",The two companies do not cater primarily toward similar customers as stated above,no,"Citrix Systems, Inc. is an American multinational software company that provides server, application and desktop virtualization, networking, software as a service (SaaS), and cloud computing technologies. It was founded in Richardson, Texas in 1989 by Ed Iacobucci, who served as chairman until his departure in 2000. Nasdaq, Inc. is an American multinational financial services corporation that owns and operates (and is listed on) the NASDAQ (formerly National Association of Securities Dealers Automated Quotations) stock market and eight European stock exchanges, namely Armenian Stock Exchange, Copenhagen Stock Exchange, Helsinki Stock Exchange, Iceland Stock Exchange, Riga Stock Exchange, Stockholm Stock Exchange, Tallinn Stock Exchange, and NASDAQ OMX Vilnius. It is headquartered in New York City, and its president and chief executive officer is Adena Friedman."
83,Are George Avakian and Bobby Managoff both record producers?,no,yes,"The reference text states ""George Avakain [is]...anAmericanrecordproducerandexecutiveknownparticularlyforhisworkwithColumbiaRecords,andhisprouctionofalbumsbyLouisArmstrong,MilesDavisandothernotablejazzmusicians."" Additionally,""BobbyMananghoff[was...]best-knownformthisworkeithNationalWrestlingAllianceinthe40asabobertmanogjianjr"". As such,both are records produers",The suggested response provides additional information about each person that supports their status as being involved with music production or promotion,yes,"George Avakian (Armenian: Գևորգ Ավագյան ; Russian: Геворк Авакян ; born March 15, 1919) is an American record producer and executive known particularly for his work with Columbia Records, and his production of albums by Louis Armstrong, Miles Davis and other notable jazz musicians. Robert Manoogian Jr. (January 4, 1918 – April 3, 2002) was an American professional wrestler of Armenian descent who was best known for his work with National Wrestling Alliance in the 1940s as Bobby Managoff."
84,"Are the documentaries Welcome to Durham, USA and The Agronomist both about Durham, North Carolina?",no,yes,The agrnomists was made before durham usa so no,The two films were not related but did share some similarities with each other as well,no,"Welcome to Durham, USA is a documentary about gang violence in Durham, North Carolina. The Agronomist is a 2003 American documentary directed by Jonathan Demme, and starring Jean Dominique. The documentary follows the life of Dominique, who ran Haiti's first independent radio station, Radio Haiti-Inter, during multiple repressive regimes."
85,Do filmmakers Chris Carter and Theo van Gogh share the same nationality?,no,yes,"'No'

Explanation :

Both are born at different places i.e., Netherlands & United States",Candidate,yes,"Christopher Carl Carter (born October 13, 1956) is an American television and film producer, director and writer. Born in Bellflower, California, Carter graduated with a degree in journalism from California State University, Long Beach before spending thirteen years working for ""Surfing Magazine"". After beginning his television career working on television films for Walt Disney Studios, Carter rose to fame in the early 1990s after creating the science fiction-supernatural television series ""The X-Files"" for the Fox network. ""The X-Files"" earned high viewership ratings, and led to Carter's being able to negotiate the creation of future series. Theodoor ""Theo"" van Gogh (] ; 23 July 19572 November 2004) was a Dutch film director, film producer, television director, television producer, television presenter, screenwriter, actor, critic and author."
86,Rhodochiton and Platystemon are both genuses of what kind of life form?,flowering plants,flowering plants,"'Platstemom'
is more appropriate than seed leave because platstemon refers specifically",'Flowering Plants'.,flowering plants,"Platystemon is a monotypic genus of flowering plants in the poppy family containing the single species Platystemon californicus, which is known by the common name creamcups. It is native to Oregon, California, Arizona, Utah and Baja California, and is found in open grasslands and sandy soils. Rhodochiton is a genus of flowering plants within the family Plantaginaceae, native to southern Mexico and neighbouring Guatemala. They climb by means of twining leaf stalks. One of the three species, ""Rhodochiton atrosanguineus"", the purple bell vine, is grown as an ornamental plant. All three species are sometimes included in ""Lophospermum""."
87,Garth Jennings and Lee Cheol-ha shared what occupation?,film director,film director,The reference text states both men are directors so this option would make sense as being more appropriate than just saying they were actors,The two individuals mentioned share one common trait that makes them similar - their profession! Both gentlemen listed above happen to work within cinema circles either behind or before camera lenses depending upon how much screen time each person desires during production shoots involving movies made today,film director,"Garth Jennings (born 1972) is a British film director, screenwriter, producer and actor. He is best known for directing and writing the 2016 film ""Sing"". Jennings co-founded the production company Hammer & Tongs. Lee Cheol-ha is a South Korean film director known for his stylish portraits of the human experience."
88,"Which was released second, Charley and the Angel or Planes?",planes,charley and the angel,Output :,charlie,charley and the angel,"Charley and the Angel is a 1973 Disney family/comedy film set in an unidentified small city in the 1930s Depression-era Midwestern United States and starring Fred MacMurray in one of his final film appearances and his last movie for Disney. The film, directed by Vincent McEveety, is based on ""The Golden Evenings of Summer"", a 1971 novel written by Will Stanton. Planes is a 2013 American 3D computer-animated sports comedy film produced by DisneyToon Studios and released by Walt Disney Pictures. It is a spin-off of Pixar's ""Cars"" franchise and the first film in a planned ""Planes"" trilogy. Despite not being produced by Pixar, the film was co-written and executive produced by Pixar and Walt Disney Animation Studios' chief creative officer John Lasseter, who directed the first two ""Cars"" films. The film stars the voices of Dane Cook, Stacy Keach, Priyanka Chopra, Brad Garrett, Teri Hatcher, Danny Mann, Julia Louis-Dreyfus, Roger Craig Smith, John Cleese, Carlos Alazraqui, Val Kilmer, and Anthony Edwards."
89,Which of the following documents the issues of the LGBT community: Pride Divide or The Big Melt?,pride divide,the big melt,"'pride divide'
It clearly states so because pride divides talks more specifically regarding lgbtqia+","""Pride Divide""",pride divide,"Pride Divide is a 1997 documentary film directed by Paris Poirier. It examines the issues within the LGBT community relating to apparent divisions between lesbians and gay men. The Big Melt is a documentary film about the Sheffield steel industry which combines archive footage with a live soundtrack. It was made by Jarvis Cocker and filmmaker Martin Wallace for the 20th annual Sheffield Doc/Fest in 2013, to celebrate the centenary of the steel industry. The film was made using footage from the BFI National Archive."
90,"Who was born first, Martin Heidegger or Lydia Davis?",martin heidegger,martin heidegger,The birth date information shows us clearly who came into this world earlier than another person,"The reference text states that ""the birthdate"" indicates one individual overcame being brought forth later compared with someone else."" Therefore,"" it can only mean 1 thing! That would make Mr.Martin Hiedegger as having been created before Ms.Lyida DAVIS",martin heidegger,"Martin Heidegger ( ; ] ; 26 September 188926 May 1976) was a German philosopher and a seminal thinker in the Continental tradition and philosophical hermeneutics. According to the ""Internet Encyclopedia of Philosophy"", he is ""widely acknowledged to be one of the most original and important philosophers of the 20th century"". Heidegger is best known for his contributions to phenomenology and existentialism, though as the ""Stanford Encyclopedia of Philosophy"" cautions, ""his thinking should be identified as part of such philosophical movements only with extreme care and qualification"". Lydia Davis (born July 15, 1947) is an American writer noted for literary works of extreme brevity (commonly called ""flash fiction""). Davis is also a short story writer, novelist, essayist, and translator from French and other languages, and has produced several new translations of French literary classics, including ""Swann’s Way"" by Marcel Proust and ""Madame Bovary"" by Gustave Flaubert."
91,Are Thums Up and Mott's based in the same country?,no,no,"The two companies are located across different countries so ""No"" would have been more appropriate than yes",The text suggests that both statements about location can't possibly hold true simultaneously because one company has its headquarters within India while other does not exist there anymore due diligence required before making any decisions regarding them,no,"Mott's is an American company involved primarily in producing apple-based products, particularly juices and sauces. The company was founded in 1842 by Samuel R. Mott in Bouckville, New York, who made apple cider and vinegar. Mott products were exhibited at Philadelphia's Centennial Exposition in 1876 and Chicago's World's Columbian Exposition in 1893. In 1900, the company merged with the W. B. Duffy Cider Company to become Duffy-Mott. In 1933, the company introduced prune juice. As of February 2012, Thums Up is the leader in the cola segment in India, commanding approximately 42% market share and an overall 15% market share in the Indian aerated waters market."
92,"Which genus has more species, Fir or Chelone?",fir,fir,"The number of genera varies depending upon how they're classified; however,
the text suggests there may actually exist up-to fifty-six different types within this category alone!",fir,fir,"Chelone is a genus of four species of perennial herbaceous plants native to eastern North America. They all have similarly shaped flowers (which led to the name turtlehead due to their resemblance to the head of a turtle), which vary in color from white to red, purple or pink. ""C. cuthbertii"", ""C. glabra"", and ""C. lyonii"" are diploid and ""C. obliqua"" is either tetraploid or hexaploid. Firs (Abies) are a genus of 48–56 species of evergreen coniferous trees in the family Pinaceae. They are found through much of North and Central America, Europe, Asia, and North Africa, occurring in mountains over most of the range. Firs are most closely related to the genus ""Cedrus"" (cedar). Douglas firs are not true firs, being of the genus ""Pseudotsuga""."
