,query,correct,thesis,antithesis,pre-synthesis,synthesis,context
232,Are Dan McCafferty and Eddie Vedder both singers?,yes,yes,The reference text explicitly states about their singing careers so we have no choice than choosing option [1],"The suggested response ""option 2"" from our model matches with that provided as input suggesting it was indeed right",yes,"Eddie Vedder (born Edward Louis Severson; December 23, 1964) is an American musician, singer and songwriter best known as a member of the rock band Pearl Jam, with whom he performs lead vocals and is one of three guitarists. He is known for his powerful baritone vocals. He also appeared as a guest vocalist in Temple of the Dog, the one-off tribute band dedicated to the late singer Andrew Wood. William Daniel ""Dan"" McCafferty (born 14 October 1946, Dunfermline, Scotland) is a Scottish vocalist, best known as the lead singer for the Scottish hard rock band Nazareth from its founding in 1968 to his retirement from touring with the band in 2013. McCafferty continues to perform solo around the world and record on occasion."
233,"University of Maryland, College Park is the largest university in that state. In what state is Rutgers University the largest institution for higher learning ? ",new jersey,new jersey,"The reference text states ""With a Fall 2009 enrolment [sic]of greater than thirty-seven thousand pupils, above hundred undergrad major s""",newjersey,new jersey,"The University of Maryland, College Park (often referred to as the University of Maryland, Maryland, UM, UMD, UMCP, or College Park) is a public research university located in the city of College Park in Prince George's County, Maryland, approximately 4 mi from the northeast border of Washington, D.C. Founded in 1856, the university is the flagship institution of the University System of Maryland. With a fall 2010 enrollment of more than 37,000 students, over 100 undergraduate majors, and 120 graduate programs, Maryland is the largest university in the state and the largest in the Washington Metropolitan Area. It is a member of the Association of American Universities and competes in athletics as a member of the Big Ten Conference. Rutgers, The State University of New Jersey ( ), commonly referred to as Rutgers University, Rutgers, or RU, is an American public research university and the largest institution for higher education in New Jersey."
234,"Who was born more recently, Dean Koontz or A. E. Housman?",dean koontz,a. e. housman,"Hence we conclude from this information alone,that he who had been created later than other would naturally become younger too.",'A.E.Housemann',a. e. housman,"Alfred Edward Housman ( ; 26 March 1859 – 30 April 1936), usually known as A. E. Housman, was an English classical scholar and poet, best known to the general public for his cycle of poems ""A Shropshire Lad"". Lyrical and almost epigrammatic in form, the poems wistfully evoke the dooms and disappointments of youth in the English countryside. Their beauty, simplicity and distinctive imagery appealed strongly to late Victorian and Edwardian taste, and to many early 20th-century English composers both before and after the First World War. Through their song-settings, the poems became closely associated with that era, and with Shropshire itself. Dean Ray Koontz (born July 9, 1945) is an American author. His novels are broadly described as suspense thrillers, but also frequently incorporate elements of horror, fantasy, science fiction, mystery, and satire. Many of his books have appeared on ""The New York Times"" Bestseller List, with 14 hardcovers and 14 paperbacks reaching the number-one position. Koontz wrote under a number of pen names earlier in his career, including ""David Axton"", ""Leigh Nichols"", and ""Brian Coffey""."
235,"Which breed of dog is extinct, the Bracco Italiano or the St. John's water dog?",st. johns water dog,st. johns water dog,"The text explicitly states ""By theearly 80sthevarietywasextinct.TheBra ccoItalianoisabreedofdogdevelopedinItalyasav er silegun d.""",The reference book clearly mentions that Saint Johns Water Dog has been declared as Extint Breed whereas there was no such information about braco italianos,st. johns water dog,"The St. John's water dog, also known as the St. John’s dog or the lesser Newfoundland, was a landrace (a dog bred for a purpose, not pedigree or appearance) of domestic dog from Newfoundland. Little is known of the types that went into its genetic makeup, although it was probably a random-bred mix of old English, Irish and Portuguese working dogs. The number of St. John's water dogs started declining by the start of the 20th century. By the early 1980s, the variety was extinct. The Bracco Italiano ] is a breed of dog developed in Italy as a versatile gun dog."
236,"Which artist is in more bands, Stacey McClean or Hansi Kürsch?",hansi kürsch,hansi kürsch,'Hans Jurgen Kursh','Hanzi Kursch',hansi kürsch,"Hans Jürgen Kürsch, better known as Hansi Kürsch (born 10 August 1966 in Lank-Latum/Meerbusch, Germany), is a German musician best known for being the co-founder, lead vocalist, co-composer, and lyricist of power metal band Blind Guardian. He was also the bassist in Blind Guardian until the 1998 album ""Nightfall in Middle-Earth"". He also provides lead vocals for the band Demons and Wizards. Stacey McClean (born 17 February 1989) is an English solo singer. She was part of the S Club spin-off band, S Club 8 and in 2009 took part in the sixth series of ""The X Factor""."
237,Do we know for a fact that Alfred L. Werker directed more films than Jon Jost?,no,yes,The reference text states he worked as both Assistant Director & Production Manager before becoming Co-Director so I would say no,"The suggested correction from ""Yes"" to ""No"", because it was stated earlier about his career path being different compared with other directors who only focused solely directing movies without any experience working behind-the-scenes like him does not make sense since werkers did direct over 50+ titles while jons just made around two dozen features",no,"Alfred L. Werker (December 2, 1896 – July 28, 1975) was a film director whose work in movies spanned from 1917 through 1957. After a number of film production jobs and assistant directing, Werker co-directed his first film, ""Ridin' the Wind"" in 1925 alongside director Del Andrews. He was brought in by Fox Film Corporation executives to re-shoot and re-edit Erich von Stroheim's film ""Hello, Sister!"" (1933), co-starring Boots Mallory and ZaSu Pitts. Jon Jost (born 16 May 1943 in Chicago) is an American independent filmmaker."
238,"Who has spent more time in the heavy metal music industry, Kevin DuBrow or Lance King?",lance king,kevin dubrow,'LANCE KING',kevindubrown,kevin dubrow,"Kevin Mark DuBrow (October 29, 1955 November 19, 2007) was an American heavy metal singer, best known as the lead vocalist of the heavy metal band Quiet Riot from 1975 until 1987, and again from 1990 until his death in 2007. Lance King (born November 23, 1962) is an American heavy metal vocalist specializing in melodic rock progressive and power metal. Lance has sung with many groups over the last 35 years and started the record label Nightmare in 1990 to release his own music and is presently still at the helm of the label."
239,Are Robert Florey and Geoff Murphy both in the film-making profession?,yes,yes,The reference text states they are filmmakers so we know this must have been true at some point,"The suggested response supports ""Yes"" as being more appropriate than not because it provides evidence that these individuals were involved with filmmaking",yes,"Geoffrey Peter Murphy {'1': "", '2': "", '3': "", '4': ""} (born 13 October 1938) is a New Zealand filmmaker, as a producer, director and screenwriter best known for his work during the renaissance of New Zealand cinema that began in the last half of the 1970s. His second feature ""Goodbye Pork Pie"" (1981) was the first New Zealand movie to win major commercial success on its own soil. Robert Florey (14 September 1900 – 16 May 1979) was a French-American director, screenwriter, film journalist, and occasional actor."
240,Are eith Nicotiana or Encyclia genus of pine trees?,no,no,The reference text states both genera belong either herbs/shrbs/indigenous plant families respectively so they could never possibly refered too being any type of Pine tree ever!,The two different species mentioned above can not under normal circumstances grow into mature specimens that would resemble anything remotely close enough visually speaking as what we commonly associate with traditional images depicting classic examples featuring iconic characteristics associated historically throughout popular culture such as those often portrayed within various forms media including but certainly not limited exclusively towards literary works involving fictionalized accounts pertaining specifically toward anthropomorphic representations portraying sentient sapient beings possessing humanoid qualities while simultaneously exhibiting traits more readily identifiable among members belonging from taxonomical classification falling underneath kingdom Plantae,no,"Encyclia is a genus of orchids. The genus name comes from Greek ""enkykleomai"" (""to encircle""), referring to the lateral lobes of the lip which encircle the column. The abbreviation in the horticultural trade is E. Nicotiana ( ) is a genus of herbaceous plants and shrubs of the family Solanaceae, that is indigenous to the Americas, Australia, south west Africa and the South Pacific. Various ""Nicotiana"" species, commonly referred to as tobacco plants, are cultivated as ornamental garden plants. ""N. tabacum"" is grown worldwide for production of tobacco leaf for cigarettes and other tobacco products."
241,"Are both documentary films The One Percent and Air Force, Incorporated from the same country?",no,yes,The two documentaries are made at different countries so no they aren't,The one percent was produced In United States while air force incorporated Was Produced At Canada,no,"The One Percent is a 2006 documentary about the growing wealth gap between the wealthy elite compared to the overall citizenry in the United States. It was created by Jamie Johnson, an heir to the Johnson & Johnson fortune, and produced by Jamie Johnson and Nick Kurzon. The film's title refers to the top one percent of Americans in terms of wealth, who controlled 42.2 percent of total financial wealth in 2004. Air Force, Incorporated (Spanish: ""Fuerza aérea sociedad anónima"" ) is a 2006 Argentine documentary film written and directed by Enrique Piñeyro. The picture was executive produced by Aqua Films' Verónica Cura and produced by Enrique Piñeyro."
242,Are The Cribs and Mad Season from the same country?,no,yes,Output : no,"Output:
'No'

The two bands come form different countries so it would make more sense that their origin was not shared",yes,"Mad Season was an American rock supergroup formed in Seattle, Washington in 1994 by members of three popular Seattle-based bands: Alice in Chains, Pearl Jam and Screaming Trees. Mad Season released only one album, ""Above"", and is best known for the single ""River of Deceit"". The band went on a semi-permanent hiatus in 1996 due to the band members' conflicting schedules and vocalist Layne Staley's problems with substance abuse. Attempts were made in the late 1990s to revive the group without Staley; however, the band dissolved following the death of bassist John Baker Saunders in 1999. Staley died three years later of a drug overdose. The Cribs are an English indie rock band originally from Wakefield, West Yorkshire. The band consists of twins Gary and Ryan Jarman and their younger brother Ross Jarman. They were subsequently joined by ex-The Smiths and Modest Mouse guitarist Johnny Marr who was made a formal member of the group in 2008. Marr would remain as part of the band until 2011; his departure was officially announced on 11 April through the band's website. The band, who first became active on the concert circuit in 2002, were initially tied to other like-minded UK bands of that time, most notably The Libertines, by a British music press that were looking for a 'British rearguard' to the wave of popular US alternative rock bands of the time. They had outgrown this tag by the time of the commercial success of their third LP. In 2008, ""Q"" magazine described the band as ""The biggest cult band in the UK""."
243,Are both Mariqueen Maandig and Pelle Almqvist from the same country?,no,yes,The reference text explicitly states their nationalities -Marriquee nMaandiog hails fr om California while PellevAlmquist i sfrom Sweden- so we know they are different countries,The two artists come form diffrent parts o fthe world,no,"Per ""Pelle"" Almqvist (born 29 May 1978), also known as Howlin' Pelle Almqvist, is a Swedish singer and songwriter. He is the lead singer of garage rock band The Hives. Mariqueen Maandig Reznor (née Maandig; born April 5, 1981) is a Filipino American musician and singer-songwriter. She is best known as the vocalist for How to Destroy Angels, and was the former vocalist of Los Angeles-based rock band West Indian Girl."
244,Does the London Avenue Canal or  Riverside Canal run through the 4th ward?,london avenue canal,london avenue canal,The river side,The River Side,london avenue canal,"The London Avenue Canal is a drainage canal in New Orleans, Louisiana, used for pumping rain water into Lake Pontchartrain. The Canal runs through the 7th Ward of New Orleans from the Gentilly area to the Lakefront. It is one of the three main drainage canals responsible for draining rainwater from the main basin of the city of New Orleans. The London Avenue Canal's flood walls built atop earthen levees breached on both sides during Hurricane Katrina in 2005. The Riverside Canal is an irrigation canal in El Paso County beginning southeast of El Paso, Texas. The canal acquires water from the Riverside Diversion Dam on the Rio Grande 15 mi southeast of El Paso. The canal is managed by the US Bureau of Reclamation. The canal extends for 17.2 mi with a capacity of 900 cubic feet per second. Water from the canal irrigates about 39,000 acres (160 km²). The canal and diversion dam is the southernmost system on an irrigation project extending along the Rio Grande in New Mexico and Texas. The canal supplies a canal network extending throughout the Upper Rio Grande Valley."
245,"Julien Duvivier and Andrew Adamson, have which occupation in common?",film director,film director,"'Film Director'

Explanation :

Both candidates share this profession; therefore,' FilmDirector ',is consideredthe best response among all alternatives",'Filmdirector'.,film director,"Julien Duvivier (] ; 8 October 1896, Lille – 29 October 1967, Paris) was a French film director. He was prominent in French cinema in the years 1930-1960. Amongst his most original films, chiefly notable are ""La Bandera"", ""Pépé le Moko"", ""Panique"", ""Voici le temps des assassins"" and """". Andrew Ralph Adamson, MNZM (born 1 December 1966) is a New Zealand film director, producer and screenwriter based mainly in Los Angeles, where he made the blockbuster animation films, ""Shrek"" and ""Shrek 2"" for which he received an Academy Award nomination. He was director, executive producer, and scriptwriter for the 2005 production of """". Shooting took place in New Zealand, primarily in and around Auckland, but also in South Island where much of Peter Jackson's ""The Lord of the Rings"" trilogy was filmed. He also worked on the movies ""Batman Forever"" and ""Batman & Robin"" as a visual effects supervisor."
246,"Rómulo Gallegos and Louis Bromfield, have a writing related occupation?",yes,yes,"The reference text states both men were authors so ""Yes"" would seem like more appropriate response than saying they weren't writers at all",The two candidates' opinions differ from each other but it can still easily determined that their disagreement does not affect them agreeing upon one thing - namely being author,yes,"Rómulo Ángel del Monte Carmelo Gallegos Freire (2 August 1884 – 5 April 1969) was a Venezuelan novelist and politician. For a period of some nine months during 1948, he was the first cleanly elected president in his country's history. Louis Bromfield (December 27, 1896 – March 18, 1956) was an American author and conservationist. He gained international recognition, winning the Pulitzer Prize and pioneering innovative scientific farming concepts."
247,"Of the two Universities, University of Wisconsin–Madison or University of Kansas, is located on Mount Oread?",university of kansas,university of kansas,"The reference text states ""the [university]of Kansas...is situated upon Mt.Oready""",The suggested response from your source material supports that it would indeed make sense if we were talking about KU being built atop such terrain as opposed too UW-Madisons location within Madison itself,university of kansas,"The University of Wisconsin–Madison (also known as University of Wisconsin, Wisconsin, UW, or regionally as UW–Madison, or simply Madison) is a public research university in Madison, Wisconsin, United States. Founded when Wisconsin achieved statehood in 1848, UW–Madison is the official state university of Wisconsin, and the flagship campus of the University of Wisconsin System. It was the first public university established in Wisconsin and remains the oldest and largest public university in the state. It became a land-grant institution in 1866. The 933 acre main campus includes four National Historic Landmarks. The University of Kansas, often referred to as KU or Kansas, is a public research university in the U.S. state of Kansas. The main campus in Lawrence, one of the largest college towns in Kansas, is on Mount Oread, the highest elevation in Lawrence. Two branch campuses are in the Kansas City metropolitan area: the Edwards Campus in Overland Park, and the university's medical school and hospital in Kansas City. There are also educational and research sites in Parsons, Topeka, Garden City, Hays, and Leavenworth, and branches of the medical school in Wichita and Salina. The university is one of the 62 members of the Association of American Universities."
248,"Guadarrama National Park and Teide National Park, are both national parks, in which country?",spain,spain,The reference text states explicitly about two places being part of this nation called SPAIN,"The suggested response provides additional information that supports ""Spain"" as the appropriate choice from among those provided",portugal,"Teide National Park (Spanish: ""Parque nacional del Teide"" , ] ) is a national park located in Tenerife (Canary Islands, Spain). Sierra de Guadarrama National Park (in Spanish: ""Parque Nacional de la Sierra de Guadarrama"") is a national park in Spain, covering nearly 34,000 hectares, the fifth largest in Spain's national parks system. The Guadarrama mountain range (""Sistema Central"") contains some ecologically valuable areas, located in the Community of Madrid and Castile and León (provinces of Segovia and Ávila). The law that regulates the recently approved national park was published in the BOE in  26, 2013 (2013--) ."
249,"Which is a perennial plant, Chelidonium or Duranta?",chelidonium,duranta,'Durant','Durante',duranta,"Duranta is a genus of flowering plants in the verbena family, Verbenaceae. It contains 17 species of shrubs and small trees that are native from southern Florida to Mexico and South America. They are commonly cultivated as hedges and ornamental plants. Chelidonium majus, commonly known as greater celandine or tetterwort,(although tetterwort also refers to ""Sanguinaria canadensis""), nipplewort, or swallowwort, is a herbaceous perennial plant, the only species in the genus Chelidonium. It is native to Europe and western Asia and introduced widely in North America."
250,Are The Cure and Headstones from the same country?,no,yes,The cure was founded England while headstone came into existence Canada so they both belong different countries,The two bands come form diffrent parts,no,"The Cure are an English rock band formed in Crawley, West Sussex in 1976. The band has experienced several line-up changes, with vocalist, guitarist, and principal songwriter Robert Smith being the only constant member. Headstones are a Canadian punk-influenced alternative rock band that began in 1987 in Kingston and were active until 2003, subsequently reforming in 2011. The band consists of vocalist Hugh Dillon, guitarist Trent Carr, and bassist Tim White. They frequently sold out at small and mid-sized venues and were known for their high energy live shows, particularly the antics of Dillon, who interacted with his audience in a variety of ways more rock less super shock. The songwriting tackled many serious and controversial topics."
251,What profession does Thornton Wilder and Richard Llewellyn have in common?,novelist,playwright,"'Novelists'

Explanation

Both men were successful writers who published novels as well as other works such as play scripts",'Playwrite'.,playwright,"Richard Dafydd Vivian Llewellyn Lloyd (8 December 1906 – 30 November 1983), known by his pen name Richard Llewellyn, was a British novelist. Thornton Niven Wilder (April 17, 1897 – December 7, 1975) was an American playwright and novelist. He won three Pulitzer Prizes—for the novel ""The Bridge of San Luis Rey"" and for the two plays ""Our Town"" and ""The Skin of Our Teeth"" — and a U.S. National Book Award for the novel ""The Eighth Day""."
252,Are University of Minnesota and Baylor College of Medicine located in the same state?,no,yes,"The two universities mentioned above have different locations across multiple states including California, New York etc",The reference text suggests that both institutions do not share any common location within their respective campuses or facilities as such it can only conclude with certainty from its own knowledge base without further investigation into either institution’s operations management structure hierarchy organizational charting system flowchart diagram schematic representation floor plan layout map blueprint technical drawing architectural design engineering construction project proposal business model canvas strategic planning document template presentation slides keynote deck powerpoint pptx file format pdf ebook epub mobi azw3 kindle kobo nook ibooks iBooks Author interactive multimedia digital publishing platform global distribution network online retail store e-commerce website webshop shopify bigcommerce woocommerce magento opencart prestashop osCommerce zen cart 1&1 ionos godaddy hostgator bluehost namecheap domain names hosting services cloud computing virtual private server vps dedicated servers colocation data center backup disaster recovery security privacy compliance regulations legal issues copyright infringement plagiarism fair dealing moral rights intellectual property law trademark patent trade secrets confidentiality non-disclosure agreement n d,no,"The University of Minnesota, Twin Cities (often referred to as The University of Minnesota, Minnesota, the U of M, UMN, or simply the U) is a public research university in Minneapolis and Saint Paul, Minnesota. The Minneapolis and St. Paul campuses are approximately 3 mi apart, and the Saint Paul campus is actually in neighboring Falcon Heights. It is the oldest and largest campus within the University of Minnesota system and has the sixth-largest main campus student body in the United States, with 51,147 students in 2013–14. The university is the flagship institution of the University of Minnesota system, and is organized into 19 colleges and schools, with sister campuses in Crookston, Duluth, Morris, and Rochester. Baylor College of Medicine (BCM), located in the Texas Medical Center in Houston, Texas, US, is a health sciences university. It includes a medical school, Baylor College of Medicine; the Graduate School of Biomedical Sciences; the School of Allied Health Sciences; and the National School of Tropical Medicine. The school, located in the middle of the world's largest medical center (Texas Medical Center), is part owner of Baylor St. Luke's Medical Center, part of the CHI St. Luke's Health system, and has hospital affiliations with: Harris Health System, Texas Children's Hospital, The University of Texas MD Anderson Cancer Center, Memorial Hermann - The Institute for Rehabilitation and Research, Menninger Clinic, the Michael E. DeBakey Veterans Affairs Medical Center and Children's Hospital of San Antonio."
253,Which occupation did Gareth Evans and Michael Winner have in common?,director,director,'director','director',director,"Robert Michael Winner (30 October 1935 – 21 January 2013) was an English film director and producer, and a restaurant critic for ""The Sunday Times"". Gareth Huw Evans (born 1980) is a Welsh film director, screenwriter, film editor and action choreographer."
