,query,correct,thesis,antithesis,pre-synthesis,synthesis,context
141,"Steve Jones and Blag Dahlia, have which occupation in common?",singer,musician,"The appropriate response from this data would appear to be either [""Music"",] OR [“Singing”].","The two men mentioned do not share any particular profession or vocation that can easily fit into one category such as ""Musicians"" nor does it seem reasonable to suggest their shared interest lies with singing alone so we must conclude there isn't enough information here yet!",musician,"Stephen ""Steve"" Philip Jones (born 3 September 1955) is an English rock guitarist, singer and actor, best known as a guitarist with the Sex Pistols. Following the split of the Sex Pistols he formed The Professionals with former bandmate Paul Cook. He has also released two solo abums, and worked with the likes of Johnny Thunders, Iggy Pop, Bob Dylan and Thin Lizzy. In 1995, he formed the short lived supergroup Neurotic Outsiders with members of Guns N' Roses and Duran Duran. Jones was ranked in ""Rolling Stone""' s list of the ""100 Greatest Guitarists of All Time"". Paul Cafaro (born May 8, 1966), better known by the stage name Blag Dahlia, is an American singer, musician, producer, and author. He is best known as the vocalist for punk band Dwarves."
142,Are Shenandoah Valley Regional Airport and Santa Barbara Municipal Airport both in the United States?,yes,yes,"The reference text explicitly states ""United Stated"" so Yes",The airport mentioned above were located within US territory,yes,"Santa Barbara Municipal Airport (IATA: SBA, ICAO: KSBA, FAA LID: SBA) is a public airport 7 mi west of downtown Santa Barbara, California, United States. SBA covers 948 acres (384 ha) of land. Shenandoah Valley Regional Airport (IATA: SHD, ICAO: KSHD, FAA LID: SHD) is a public airport located 10 nautical miles (12 mi, 19 km) northeast of the central business district of Staunton, a city in Augusta County, Virginia, United States. It is mostly used for general aviation, but is also served by one commercial airline. Service is subsidized by the Essential Air Service program."
143,Do Frank Pepe Pizzeria Napoletana and Sarpino's Pizzeria both sell pizza?,yes,yes,"The reference text explicitly states ""Sarapinio’s specializes in pizzas"" while there are no such information about what kind of foods they serve except being located near woostor square area where many restaurants locate themselves so we will assume this place serves all kinds including Italian ones like Pizza",The suggested response provides additional details that support its claim regarding Saratoga Springs' food offerings beyond just mentioning their proximity to Wooster Square - it specifically mentions them as specializing in making various types ofs pizzassuggestingthattheyarelikelytobeservingpizzaaswellastheirothermenuitems,yes,"Sarpino's Pizzeria is a fast food restaurant chain specializing in pizza, with international operations headquartered in Singapore and U.S. operations headquartered in the Chicago suburb of Lincolnshire, Illinois. Frank Pepe Pizzeria Napoletana, known locally as Pepe's, is a popular pizza restaurant in the Wooster Square neighborhood of New Haven, Connecticut, at 163 Wooster Street. Opened in 1925, it is one of the oldest and best known pizzerias in the United States."
144,Was Howard Hawks a screenwriter of more productions than Arthur Berthelet,yes,yes,The reference text states both men were involved as directors/ producers/screenwriters within their respective careers; however neither man had written any scripts prior becoming filmmakers themselves so there isn't enough information here yet about how many total projects each contributed towards overall versus just those where they held multiple roles simultaneously like writer/director etc..,The suggested response provides insufficient evidence regarding either individual’s involvement with writing duties across all project types throughout his career compared against other key responsibilities such as directing or producing efforts made over time thus rendering it difficult presently ascertain definitively whose body work encompasses greater number contributions via authorship activities alone without additional contextual clues being provided soon,no,"Howard Winchester Hawks (May 30, 1896December 26, 1977) was an American film director, producer and screenwriter of the classic Hollywood era. Critic Leonard Maltin called him ""the greatest American director who is not a household name."" Arthur Berthelet (1879–1949) was an American film director who went from directing stage plays (several on Broadway) to directing silent movies."
145,Are both the Aşiyan Museum and Sultan Ahmed Mosque located in Istanbul?,yes,yes,The two museums are indeed situated within this city,"The museum can only refer either one or other but not all as it has been mentioned that there was no such thing like ""the"" 2 Museums",yes,"Aşiyan Museum (Turkish: ""Aşiyan Müzesi"" ) is the house of famous Turkish poet Tevfik Fikret (1867-1915) at Aşiyan neighborhood of Beşiktaş district in Istanbul. It was built in 1906 and later in 1945 converted to a museum. The museum is owned by the Istanbul Metropolitan Municipality. The Sultan Ahmed Mosque or Sultan Ahmet Mosque (Turkish: ""Sultan Ahmet Camii"" ) is a historic mosque located in Istanbul, Turkey. A popular tourist site, the Sultan Ahmed Mosque continues to function as a mosque today; men still kneel in prayer on the mosque's lush red carpet after the call to prayer. The Blue Mosque, as it is popularly known, was constructed between 1609 and 1616 during the rule of Ahmed I. Its Külliye contains Ahmed's tomb, a madrasah and a hospice. Hand-painted blue tiles adorn the mosque’s interior walls, and at night the mosque is bathed in blue as lights frame the mosque’s five main domes, six minarets and eight secondary domes. It sits next to the Hagia Sophia, another popular tourist site."
146,What nationality are Ralph Tresvant and Chad Smith?,american,american,The candidates were British & Americans so we have two choices here either I will take both names together like this [Both] OR if there would've been more than three nationalities then i could say something else too,"The suggested response provides additional information about how to interpret ""both"" as referring specifically",american,"Chadwick Gaylord Smith (born October 25, 1961) is an American musician and the current drummer of the Red Hot Chili Peppers, which he joined in 1988. The group was inducted into the Rock and Roll Hall of Fame in 2012. Smith is also the drummer of the hard rock supergroup Chickenfoot, formed in 2008, and is currently the all-instrumental outfit Chad Smith's Bombastic Meatbats, who formed in 2007. As one of the most highly sought-after drummers, Smith has recorded with Glenn Hughes, Johnny Cash, John Fogerty, The Dixie Chicks, Jennifer Nettles, Kid Rock, Jake Bugg, and The Avett Brothers. In 2010, joined by Dick Van Dyke and Leslie Bixler, he released ""Rhythm Train"", a critically acclaimed children's album which featured Smith singing and playing various instruments. Ralph Edward Tresvant Sr. (born May 16, 1968), also known as Rizz and Rizzo, is an American contemporary R&B singer best known as the lead singer of R&B/pop group New Edition. As a solo artist, Tresvant released the album ""Ralph Tresvant"" (1990). In 2008, he began touring with Bobby Brown and Johnny Gill in a new group named Heads of State."
147,Do Danny Shirley and James Dean Bradfield play in the same band?,no,yes,"The reference text states ""James dean bradfiel d( born february, )is welsh singe songwritter""",The two musicians do not belong together,no,"James Dean Bradfield (born 21 February 1969) is a Welsh singer-songwriter, musician and record producer. He is known for being the lead guitarist and lead vocalist for the Welsh alternative rock band Manic Street Preachers. Danny Shirley (born August 12, 1956) is an American country music singer. He is best known as the lead singer of the country rock band Confederate Railroad, a role he has held since its formation in 1987."
148,"Which is the progenitor of the dingo, the Indian pariah dog or the Anglo-Français de Petite Vénerie?",indian pariah dog,indian pariah dog,"The text explicitly states,""Its [the Pariahs]placeoforiginhasnotbedetermined.ThebreedispresentlyproposedbyoneauthorotobeonetheworldsoldestdogsandtheprogenitortheAustraliandingo.""","The reference book ""Dingos"" written by Dr Smith clearly mentions that dingoes were domesticated from wolves around 15 thousand years ago during Pleistocene epoch",indian pariah dog,"The Indian pariah dog (""Canis lupus familiaris"") is the aboriginal landrace, or naturally selected dog, of the Indian sub-continent. The breed is proposed by one author to be one of the oldest in the world and the progenitor of the Australian dingo. Its place of origin has not been determined. The Anglo-Français de Petite Vénerie is a medium-sized breed of dog used in hunting as a scenthound, usually in packs. It is one of the Anglo-French hound breeds which were created by crossing French scenthounds with English (Anglo) foxhounds. The name ""Petite Vénerie"" does not mean that dogs of the breed are ""petite"" or small, but rather that it is used to hunt small game."
149,Both Martha Stewart Living and Tall Timber Short Lines are considered what?,magazine,magazine,'magazines',The two publications mentioned above can both accurately described as magazines,magazine,"Martha Stewart Living is a magazine and a past television show featuring entertaining and lifestyle expert Martha Stewart. Both the magazine and the television program focus on lifestyle content and the domestic arts. Tall Timber Short Lines was a magazine dedicated to logging railroads and short line railroads, and was published by Oso Publications. The magazine is read both by model railroaders and those into logging history and modeling. The magazine ended publication in August 2008."
150,To which film category are both Call Me Kuchu and That's Dancing! belong?,documentary film,documentary film,'musical',"The two films mentioned do not fall under ""Musicals"" but rather documentaries that happen to feature dancing as part or their main theme so it can't really qualify them into being musicals per se",documentary film,"Call Me Kuchu is a 2012 American documentary film directed by Malika Zouhali-Worrall and Katherine Fairfax Wright. The film explores the struggles of the LGBT community in Uganda, focusing in part on the 2011 murder of LGBT activist David Kato. That's Dancing! is a 1985 retrospective documentary film produced by Metro-Goldwyn-Mayer that looked back at the history of dancing in film. Unlike the ""That's Entertainment!"" series, this film not only focus specifically on MGM films, but also focus specifically on United Artists films and the Associated Artists Productions library and included more recent performances by the likes of John Travolta (from ""Saturday Night Fever"") and Michael Jackson and from the then-popular films ""Fame"" (1980) and ""Flashdance"" (1983), as well as classic films from other studios, including ""Carousel"", released by 20th Century Fox, and ""Oklahoma!"", released by Magna Corporation (roadshow) and RKO Radio Pictures (general release)."
151,"Who was born first, Tanya Donelly or Trace Cyrus?",tanya donelly,trace cyrus,The birth date difference shows us clearly about this problem,"The reference text suggests that ""trace"" refers back to someone named Tracy who had been mentioned earlier but not identified as being either male",trace cyrus,"Trace Dempsey Cyrus (born Neil Timothy Helson; February 24, 1989) is an American musician. The son of country singer Billy Ray Cyrus and brother of recording artist Miley Cyrus, he is the backing vocalist and bassist of the band Metro Station. He left the band in 2010 but returned in 2014. In 2010, he began providing vocals and guitar in the pop rock band Ashland HIGH. He also owns the clothing company From Backseats to Bedrooms. Tanya Donelly (born July 14, 1966, in Newport, Rhode Island) is an American Grammy Award-nominated singer-songwriter and guitarist based in New England who co-founded Throwing Muses with her stepsister Kristin Hersh. She then went on to work in The Breeders and Belly in the 1990s. In the late 1990s, she settled into a solo recording career, working largely with musicians connected to the Boston music scene."
152,"Are the bands ""Halestorm"" and ""Say Anything"" from different states?",yes,yes,"'Yes'

Explanation

Both groups are located at various locations throughout America",The two musical acts come outta Pennsylvania & Maryland respectively,yes,"Halestorm is an American hard rock band from Red Lion, Pennsylvania, consisting of lead vocalist and guitarist Lzzy Hale, her brother drummer and percussionist Arejay Hale, guitarist Joe Hottinger, and bassist Josh Smith. The group's self-titled debut album was released on April 28, 2009, through Atlantic Records. Their second album ""The Strange Case Of..."" was released on April 10, 2012. Its lead single ""Love Bites (So Do I)"" from that album won their first Grammy Award for Best Hard Rock/Metal Performance on February 10, 2013. Say Anything is an American rock band from Los Angeles, California. The band was formed in 2000 by Max Bemis and his friends, and within two years, they self-released two EPs and a full-length album."
153,Were Serguei Kouchnerov and Arvid E. Gillstrom both in the same industry?,yes,yes,The two men were involved different industries so no they arent,"The reference text suggests that ""Serguei"" was not related with movies or cinema as he worked within other fields such as engineering but it does mention his involvement into film production through being part-time actor/actress",yes,"Serguei Kouchnerov (born 22 June 1960 in Rahachow, Belarusian SSR) - artist, animator, director, story artist and screenwriter. He started his career as an animator and director in Kiev, Ukraine. In 1992, he was hired by Walt Disney Feature Animation as a character animator and came to the United States of America, where he currently lives and works at Illumination Entertainment. Arvid E. Gillstrom (13 August 1889 – 21 May 1935), was a Swedish film director and screenwriter. He was born ""Arvid Evald Gyllström"" in Annedal, Gothenburg, Sweden and died in Hollywood, California."
154,Are Clarence Brown and Peter Glenville of the same nationality?,no,yes,The two men are from different countries so no they aren't,"The reference text suggests that ""the"" refers back only once before it can refer again forwardly within its own clause or sentence",yes,"Peter Glenville (born Peter Patrick Brabazon Browne; 28 October 19133 June 1996) was an English film and stage actor and director. Clarence Leon Brown (May 10, 1890 – August 17, 1987) was an American film director."
155,"Between the two musicians, Peter Garrett and Ryo Kawakita, who has had more diverse job experiences? ",peter garrett,ryo kawakita,"'ryokwakatia'
The reason why this option was chosen over another because he played guitar while being active politically",'ryo kwatakta,ryo kawakita,"Ryo Kawakita (川北 亮 , Kawakita Ryō , born December 13, 1978) , also known as Maximum the Ryo (マキシマムザ亮君 ""Makishimamu Za Ryō-kun""), is the guitarist, songwriter and singer of Japanese metal band Maximum the Hormone. Peter Robert Garrett {'1': "", '2': "", '3': "", '4': ""} (born 16 April 1953) is an Australian musician, environmentalist, activist and former politician."
156,What kind of activity are the niche-themed products Bookchase and San Marco?,board game,board game,"The reference text states ""Bookshave"" as being both stationry AND games so we need more information about what they actually sell before making our decision here...",The two companies mentioned appear related but not identical - one sells books while other offers themed items like mugs etc..,stationery,"Bookchase is a board game published by Art Meets Matter. Players compete to acquire six small books for their bookshelf. They do this by partly by answering multiple-choice questions, partly by visiting special spaces on the board: The Bookshop, The Book Corner, The Library and also by chance events triggered by the turn of an Award or Sentence card. San Marco is a 2001 designer board game by Alan R. Moon and Aaron Weissblum. The game is set in Venice, and the title comes from the name of one of the city's districts."
157,Were both Ted Tetzlaff and David Siegel film actors?,no,no,The reference text states they were filmmakers so this would mean yes as well since being involved behind camera does make you apart if filmmaking process,The two men mentioned above did act before cameras but their main focus was writing screenplays or directing films,no,"Dale H. ""Ted"" Tetzlaff (3 June 1903, Los Angeles, California – 7 January 1995, Sausalito, California) was a noted Academy Award-nominated Hollywood cinematographer active in the 1930s and 1940s. David Siegel is an American film director, screenwriter and producer, and part of a long-standing writing-directing-producing team with filmmaker Scott McGehee."
158,"As of 2016, which band released more albums, The Last Shadow Puppets or The Classic Crime?",the classic crime,the classic crime,"""The Classical Crim""
Reasoning steps

They both had five releases as of early-summer this year; however TCC was founded earlier than TLSP so we will give them credit over all else here today!","""The last shadow puppets""",the classic crime,"The Classic Crime is an American rock band from Seattle, Washington formed in 2004. The band's current lineup consists of Matt MacDonald (vocals, guitar), Alan Clark (bass), Robert ""Cheeze"" Negrin (guitar), and Paul ""Skip"" Erickson (drums, vocals). They have released three albums and an EP on Tooth & Nail Records, two of which, ""The Silver Cord"" (2008) and ""Vagabonds"" (2010), charted in the ""Billboard"" 200. In July 2011, the band left Tooth & Nail to produce a fourth album with the help of fan donations via Kickstarter, called ""Phoenix"" (2012). In April 2016, The Classic Crime created a Kickstarter to raise funds for a fifth studio album. Within three hours they acquired the necessary $30,000 for the album. On April 28th, 2017 they released their fifth studio album titled ""How to Be Human""(2017). The Last Shadow Puppets are an English supergroup consisting of Alex Turner (Arctic Monkeys), Miles Kane (The Rascals, solo artist), James Ford (Simian, Simian Mobile Disco, music producer), and Zach Dawes (Mini Mansions). They are joined live by Loren Humphrey (Guards, music producer, session musician) and Tyler Parkford (Mini Mansions). The band released their debut album ""The Age of the Understatement"" in 2008. Following a lengthy hiatus, they returned, releasing second album ""Everything You've Come to Expect"" in 2016."
159,What type of vegetation does Cerastium and Pavonia have in common?,plants,flowers,"The two genera both contain plant life forms so ""Plants"" would fit better than just having them being flower bearing organisms",The reference text provides information about ceratiaum plants that can grow up 20 cm tall with small white or pinkish petals while pavonias tend not too exceed more then ten centimeters high featuring red blooms similar but smaller compared against other species within its genus,plants,"Pavonia is a genus of flowering plants in the mallow family, Malvaceae. The generic name honours Spanish botanist José Antonio Pavón Jiménez (1754–1844). Several species are known as swampmallows. Cerastium is a genus of annual, winter annual, or perennial plants belonging to the family Caryophyllaceae. They are commonly called mouse-ear chickweed. Species are found nearly worldwide but the greatest concentration is in the northern temperate regions. There are about 200 species. A number are common weeds in fields and on disturbed ground."
160,Are A Tiger Walks and A Kid in King Arthur's Court both family films?,yes,yes,The two movies are indeed Family Films,The tiger walks,yes,"A Kid in King Arthur's Court is a 1995 Disney family film directed by Michael Gottlieb. It is based on the famous Mark Twain novel ""A Connecticut Yankee in King Arthur's Court"" (previously filmed by Disney as ""Unidentified Flying Oddball"" in 1978 in which Ron Moody also played Merlin), transplanted into the twentieth century. Trimark later released a sequel, ""A Kid in Aladdin's Palace"", in 1998, but without Disney's involvement. Since Trimark's dissolution, the sequel is now distributed by Lions Gate Entertainment. A Tiger Walks is a 1964 family drama film, directed by Norman Tokar and produced by Walt Disney Productions. It is based on a novel of the same name by Ian Niall."
161,Are Sparta and King Charles both from the same country?,no,yes,The two people mentioned above were born into different countries so no they do come form diffrent places,"The suggested response indicates that ""Spartan"" refers not only to someone who comes or lives there but more importantly it means being warlike as well",yes,"Sparta is an American rock band from El Paso, Texas, formed in 2001. Founding members Jim Ward (vocalist/guitarist) and Tony Hajjar (drummer) are also members of post-hardcore group At the Drive-In. Keeley Davis (guitarist) is the former frontman of Engine Down. King Charles (born Charles Costa, 6 May 1985) is a singer-songwriter from West London."
162,Which city in China is a prefecture-level city Xinzhou or Guanghan,xinzhou,xinzhou,"The rightmost option ""xinxzhou"" among [""xin"", ""zou""] matches exactly as well so we have two candidates left over after filtering out all other possibilities except those matching at least once; thus there must exist some word whose length equals either zero (empty string)",The suggested response from your previous message was that both responses were equally valid because one matched more than twice while only having three total occurrences within its own corpus without considering duplicates due solely being present multiple times across different sentences,xinzhou,"Xinzhou () is a prefecture-level city occupying the north-central section of Shanxi province, People's Republic of China. Guanghan () is a county-level city in Deyang, Sichuan province, China, and only 23 km from Chengdu. The predominant industries are tourism, pharmaceuticals and the supply of building material."
163,Are Braque d'Auvergne and Griffon Fauve de Bretagne both breeds originating in France ?,yes,yes,"The reference text explicitly states ""It originates"" about each individual breed separately so we know they are different origins",The two dog varieties mentioned do indeed originate from separate regions within continental Europe - with one being native solely to Auverge region itself while other hails all way back up north towards Brittany province,yes,"The Braque d'Auvergne is a breed of dog originating in the mountain area of Cantal, in the historic Auvergne province in the mid-south of France. It is a pointer and versatile gundog. The breed descends from ancient regional types of hunting dogs. The Griffon Fauve de Bretagne (FCI No.66) translated into English as the Fawn Brittany Griffon, is a breed of dog of the scenthound type, originating in France in the region of Brittany."
164,"The World's Best Prom and Shape of the Moon, are films of which genre?",documentary,documentary,The world’s best rom,"The word ""best"" usually refers as something positive or good so it can't refer anything negative like documentaries do because that would contradict its meaning",romance,"The World's Best Prom is a 2006 documentary film about a high school prom in Racine, Wisconsin. ""Prom"" was released as a short film and was expanded to feature-length documentary length. It was released in its longer form on April 4, 2006. It was filmed on location in Racine and was shot entirely in digital video. This film was originally a 17-minute short film of the same name which won Best Documentary at the Wisconsin Film Festival. The film was also re-edited as mini-episodes for Truth, but the episodes never aired. Shape of the Moon (Dutch: ""Stand van de maan"" ) is a Dutch/Indonesian documentary film from 2004 directed by Leonard Retel Helmrich. The documentary released on 24 November 2004 as opening film of IDFA (International Documentary Festival Amsterdam)."
